Text,Code
Qualsiasi programma di rilancio del Paese passa per la valorizzazione delle riforme dei Governi di questa legislature che ci hanno permesso di passare dalla recessione alla crescita e di ridurre la disoccupazione e la pressione fiscale.,305
Gran parte delle promesse elettorali mirabolanti e irrealistiche del Movimento Cinque Stelle e del centro-destra ci riporterebbero indietro al 2011 e cioè ad un passo dal baratro.,305
Il Paese ha bisogno di una forza politica popolare e riformista,305
che interpreti una cultura politica di saldi principi europeisti,108
rispettosa delle istituzioni,202
"e ancorata ai valori della centralità della persona, dell’impresa,",201
"dellavoro,",701
dellacoesione sociale,601
e dell’anima comunitaria della democrazia.,201
"Una forza politica che costituisca una credibile barrier, un argine contro ogni deriva populista.",305
"Civica Popolare intende essere la risposta seria e coerente della politica all’antipolitica, intende contrapporre laserietà e la concretezza d’azione alpopulismo, all’estremismo e al qualunquismo che minano le fondamenta culturali della nostra civiltà.",305
È un movimento laicamente ispirato alla tradizione del cattolicesimo democratico e del riformismo,603
"che vuole valorizzare la democrazia rappresentativa come migliore forma di democrazia possibile, ampliandone gli istituti di partecipazione e il ruolo dei corpi intermedi,",202
inradicale contrasto ad ogni ipotesi di democrazia diretta che nella storia ha sempre rappresentato l’anticamera delle tirannie.,202
"L’Italia si è avviata verso il sentiero della ripresa, ma ancora molti nodi di fondo rimangono da affrontare e forti sono le preoccupazioni in vista delle imminenti elezioni.",202
L’eventualità di uno stallo politico e di un’affermazione significativa delle forze populiste rischia di mettere in discussion la tenuta dell’Italia,305
"e di comprometterne l’autorevolezza e la credibilità in campo europeo, rendendo così vano l’impegno per la crescita di questi anni.",108
Anche in ambito europeo va condotta la battaglia per promuovere iniziative che sollecitino gli altri Paesi a riflettere sulla necessità di affrontare i populismi,202
"cogliendo la domanda di giustizia, libertà, uguaglianza e di democrazia.",202
"È la sfida del nostro tempo correggere i tratti distorsivi della globalizzazione,",403
contrastare un nuovo vento totalitario che soffia in Europa e in tutto l’Occidente.,305
"Civica Popolare crede in un’Europa più democratica, più politica e sociale",108
conistituzioni di Governo scelte dai cittadini.,202
RISOLLEVARE IL CETO MEDIO,999
"Gli ultimi dieci anni, la crisi economica, l’epocale fenomeno migratorio, il terrorismo, la globalizzazione senza regole hanno alimentato la paura e la rabbia.",202
La rottura dell’argine della responsabilità democratica fa crescere i populismi di destra e di sinistra.,202
"Razzismo, muri,",607
"dileggio dell’avversario politico,",305
"messa in discussione della democrazia rappresentativa,",202
"del metodo scientifico,",411
i capisaldi della nostra civiltà.,606
Risollevare il ceto medio,704
"significa pisalario,",701
"piimpresa,",402
"piservizi per i bambini, le mamme, gli anziani, le famiglie,",504
"meno diseguaglianze,",503
pisolidarietà.,606
Senza un ceto medio forte la democrazia è debole.,704
LAVORO,999
Si sta vivendo una stagione di radicali cambiamenti che esige un aggiornamento dei nostri paradigmi anche economici.,410
"È necessario valorizzare il capitale umano,",701
"dare centralità alla formazione e alla ricerca,",411
"riscoprire le vocazioni produttive dei territori,",401
"rilanciare le potenzialità innovative delle nostre città,",411
"insistere sullo sviluppo economico sostenibile,",416
"rendere semplice, trasparente e alleato delle imprese e dei cittadini il sistema della pubblica amministrazione,",303
ricostruire un sistema fiscale capace di sostenere l’impresa e il lavoro.,402
Obiettivo 70% di occupazione entro il 2022,701
(60% tasso di occupazione femminile).,706
Ponte fra Università e Impresa,999
"Sulla base del modello nordamericano e canadese, creare un percorso che permetta ai giovani, già durante il percorso di studio, di fare stage retribuiti in azienda,",706
"a tassazione zero per l'impresa,",402
ed essere poi assunti a tempo indeterminato nel momento in cui sarà concluso il loro percorso di studio.,706
"Formazione scuola-lavoro, rafforzando nelle scuole secondarie di secondo grado l’alternanza delle lezioni in classe con attività lavorative.",506
Industria 4.0,999
"Rendere strutturali per tre anni ammortamenti e superammortamenti con l’obiettivo di sostenere gli investimenti, far crescere l’esportazione delle merci e ridurre quella dei cervelli;",402
"Ampliamento Impresa 4.0 al turismo per la riqualificazione delle strutture e degli arredi, per gli investimenti sulle reti di imprese e sui prodotti turistici.",411
Il turismo puin cinque anni raddoppiare la sua incidenza sul PIL dal 10 al 20%.,402
Rendere strutturale il credito d’imposta per la formazione e ampliare la platea dei beneficiari;,411
Introdurre incentivi fiscali sugli utili dei primi tre anni di vita delle start-up innovative;,402
"Rafforzare il binomio agricoltura e sostenibilità ambientale potenziando le misure degli ultimi governi su aggregazione di impresa ricerca e innovazione in agricoltura, per rendere picompetitivo il nostro sistema d’impresa.",703
Imprese sociali,999
Occorre allargare la platea e sostenere i soggetti privati che operano nel welfare con una rapida e compiuta attuazione della riforma sulle imprese sociali;,402
Imprese di territorio e imprese innovative.,402
"Accanto agli obiettivi dell’innovazione e del welfare sussidiario occorre integrare le attività di interesse generale svolte dalle imprese sociali, eleggendo a possibile oggetto sociale di tali imprese, l’insediamento e lo svolgimento di attività economica in territori e zone svantaggiate (prime fra tutte le c.d. aree interne).",402
"Di conseguenza, anche a questi soggetti imprenditoriali andrebbero attribuiti gli stessi oneri (partecipazione democratica, assenza di scopo di lucro), ma anche gli stessi vantaggi amministrativi, civilistici e fiscali delle imprese sociali.",402
Semplificazione e giustizia fiscal,999
Invertire il rapporto tra cittadino e pubblica amministrazione;,304
certezza dei tempi della pubblica amministrazione per agevolare imprese e cittadini;,303
indennizzi a favore dei cittadini per i ritardi e l’inerzia della pubblica amministrazione;,303
rafforzare ed ampliare il principio del silenzio assenso.,303
"Rimodulazione del calendario fiscale per imprese e autonomi, in modo tale da spalmare trimestralmente il pagamento degli acconti d’imposta tenendo conto degli utili effettivi;",402
incentivi fiscali sulle esportazioni per le PMI che incrementano l’occupazione stabile;,402
abrogazione delle disposizioni sull’inversione dell’onere della prova;,402
lo Stato non pupretendere le imposte verso contribuenti con i quali ha un debito in arretrato;,304
le tasse non sono dovute se l’impresa non ha incassato i corrispettivi delle fatture emesse.,402
Formazione,999
Definire nuove modalità di formazione.,411
"Formare le nuove generazioni ai lavori del futuro nell’ambito, ad esempio, dei social media, del machine learning, dei big data, etc.",411
"Nuovo piano di educazione e di formazione per le sfide e i cambiamenti che ci aspettano nei prossimi anni, di fronte ad un progresso tecnologico ed informatico che si sviluppa in maniera esponenziale.",411
"I giovani, oggi, non sono preparati alla rivoluzione digitale e alla rivoluzione legata all’economia dei dati e ai nuovi lavori che diventeranno determinanti per le economie dei paesi, quali quelli legati all’ambiente, alla gestione dei big data, etc.",411
"Formazione legata al “care”, all’artigianato e a tutti i lavori ad alto valore aggiunto (“care”, artigianato, servizi alla persona, lavori ad alto contenuto artistico, difficilmente sostituibili dai robot).",411
Previdenza,999
Passerelle dolci;,000
Integrazione lavori usuranti;,701
Contratti flessibili con cambio di mansionamento all’interno delle stesse imprese o pubbliche amministrazioni;,701
Ape Social.,504
Rivedere sistema di aliquote fiscali per previdenza e sanità integrativa,504
e sistema fiscale delle casse dei professionisti.,704
SALUTE,999
"In questi anni abbiamo avuto visione e coraggio di imporre decisioni prospettiche per la salvaguardia del sistema sanitario di impronta universalistica, rimasto uno dei pochi esempi nel mondo.",504
"Occorre continuare su questa strada migliorando il sistema,",504
mettendolo in sicurezza anche economica,504
e riducendo le diseguaglianze regionali.,503
Cinque miliardi in cinque anni,999
"Per mantenere alti standard qualitativi ed eliminare le sacche di inefficienza il servizio sanitario nazionale, che deve rimanere pubblico e universale, sempre piin capo al centro delle azioni di governo (riforma del Titolo V), necessita di un incremento di risorse:",504
5 miliardi in cinque anni.,504
Ricerca,999
È necessario che la ricerca sanitaria sia considerata come un vero e proprio investimento.,411
"Il comparto salute rappresenta oggi una fonte di grande ricchezza per l’Italia, grazie proprio alla ricerca e al settore farmaceutico.",411
"Il ddl Lorenzin ha prodotto una forte potenzialità che produrrà investimenti nel settore, che il sistema Paese deve sapere capitalizzare.",411
Contratti medici,999
Necessario il rinnovo del contratto dei medici e la possibilità di assumerne di nuovi.,704
Nuove modalità per l’accesso e la formazione degli specializzandi: formazione in ospedale.,506
Abolizione super ticket,999
Attivare un piano che consenta l’abolizione del superticket da 10 euro,504
e revisione dell’intera normativa per garantire effettiva equità.,503
Liste d’attesa,999
"Azionare il contrasto alle lunghe liste di attesa, con un nuovo Piano nazionale di Governo e l’inserimento del rispetto dei tempi massimi tra i criteri di valutazione dei Direttori Generali.",504
Le nuove norme sulle nomine dei manager Asl prevedono che i direttori generali che non raggiungono gli obiettivi (tra cui il rispetto delle liste d’attesa) decadono.,303
"Sulle liste d’attesa il modello migliore è quello emiliano, dove la Regione ha messo in campo una serie di misure che hanno eliminato le liste d’attesa.",504
Commissariamento delle singole Aziende Ospedaliere,999
"Serve un modello nuovo di commissariamento e di intervento dello Stato, azienda per azienda, ospedale per ospedale,",504
invece di commissariare la Regione dove la politica di fatto la continuano a fare i presidenti scaricando le responsabilità sul governo e sui cittadini.,305
Interveniamo in modo chirurgico sulla singola azienda sanitaria che non funziona sostituendoci alla struttura regionale.,504
Nuovo modello di governance del farmaco,999
Serve un nuovo modello di governance del farmaco e di sostegno pubblico alla ricerca per stabilire nuove regole per sostenere le straordinarie scoperte del prossimo futuro.,411
In Italia è stato avviato un processo nuovo di governance del farmaco e di riforma del prezzo e dell’accessibilità che è fondamentale venga portato a termine per garantire l’accesso ai cittadini italiani ai farmaci innovativi ad alto costo.,504
Lotta alla Tossicodipendenza e a tutte le forme di dipendenza – salviamo i giovani,999
Tornare ad investire nella lotta alle tossicodipendenze.,504
È inaccettabile lasciare le periferie delle città in mano allo spaccio e alla criminalità.,605
Lo Stato torni ad investire in una campagna straordinaria contro la tossicodipendenza e la lotta alle droghe tra i giovani e non solo.,504
Va rafforzato il sistema di allerta nazionale in maniera tale da individuare precocemente la presenza delle nuove droghe.,605
Formazione specifica agli educatori per supportarli nel riconoscimento precoce dei ragazzi affetti da dipendenze.,411
FAMIGLIA,999
"È prioritario mettere al centro del dibattito politico il tema della famiglia, della natalità e delle esigenze a esse legate.",603
La famiglia è infatti non solo il soggetto promotore dello sviluppo e del benessere sociale ma anche il luogo in cui coltivare il futuro.,603
Asili Nido Gratis,999
"Misure universalistiche e non progressive: asili nido gratuiti come grandi infrastrutture a sostegno di chi ha un bisogno e di chi ha un merito, a favore di chi è pidebole,",504
delle donne che lavorano,706
e quindi a sostegno del lavoro,701
e delle imprese.,402
Raddoppio Bonus Bebè,999
Raddoppio Bonus Bebè da 0 a 6 anni.,504
Da 80 a 160 euro per tutti e da 160 a 320 euro dal secondo figlio in poi.,504
Sostegno per l’acquisto di alimenti specifici per la nutrizione dei bambini.,504
Fattore famiglia,999
Equiparazione dell’attività di assistenza in famiglia ad un’attività lavorativa (anche a fini previdenziali).,504
Fattore famiglia: configurare un sistema fiscale che tenga conto dei figli e delle famiglie numerose.,504
Impresa familiare: valorizzazione dell’impresa familiare mediante introduzione di specifici incentivi di carattere fiscale.,402
Occupazione femminile,999
"Raggiungere l’obiettivo 60% europeo, in fatto di occupazione femminile, aumenta la produttività del sistema Paese con una significativa crescita del Pil, accreditata fino a 7 punti percentuali dai piattendibili studi economici.",701
Nelle aziende: defiscalizzazione degli investimenti per gli asili e il welfare aziendale;,504
valorizzazione del ruolo della donna.,706
Abbattimento della diseguaglianza retributiva di genere.,701
Sul fronte maternità: per ogni figlio un anno di contributi reali per un massimo di tre anni di riduzione dell’età pensionabile.,504
Welfare e tutela degli anziani,999
Gli anziani rappresentano una delle principali sfide che le società moderne ed economicamente avanzate si trovano ad affrontare.,706
"Bisogna curarli, assisterli e mantenerli attivi:",504
oggi in Italia si contano 14 milioni di over 65 di cui 4 milioni di non autosufficienti e nei prossimi anni questi numeri sono destinati a moltiplicarsi;,705
si stima che entro il 2050 si invertirà il rapporto tra attivi ed inattivi.,705
Occorre realizzare una assistenza domiciliare efficace e capillare e un nuovo modello di organizzazione dei beni comuni.,504
"Pensiamo all’infermiere di condominio, a servizi alla persona messi in comune, spazi concepiti diversamente per la semi-autosufficienza.",504
Una nuova economia del terzo settore.,504
"Per questo bisogna immaginare un modo diverso di rappresentare l’assistenza alle persone, l’assistenza domiciliare integrata con l’assistenza sanitaria e anche come mantenere la socialità di una popolazione over 75.",504
Share Economy dell’HeathCare:,504
"è ormai necessario proporre un nuovo modello di welfare, un Welfare di comunità.",504
Creare un fondo vincolato per il sociale in modo che le Regioni non possano spenderli in altro modo;,504
"piano nazionale esiti, per un’analisi qualitativa dei servizi erogati e costi standard per il lavoro nel comparto.",504
"I Servizi Sociali devono entrare nella competenza del Ministero della Salute, non possono pirimanere sotto la competenza del Ministero del Lavoro.",504
FISCO,999
"È ormai fondamentale costruire un nuovo rapporto tra il Fisco ed i cittadini, basato sul rispetto reciproco e sulla ragionevolezza delle imposte e dei controlli.",201
Il sistema fiscale deve diventare il reale strumento di redistribuzione del reddito senza persoffocare l’attività libero-professionale ed imprenditoriale.,401
"Un utilizzo distorto dello strumento fiscale deprime la crescita, perché riduce i consumi e la produttività, rende il sistema nel complesso meno efficiente.",403
Contrasto d’interesse,999
Una rivoluzione nei controlli fiscali grazie alla possibilità di dedurre alcune tipologie di spese sostenute dai cittadini:,504
scontrini e fatture potranno essere richieste ai fornitori/prestatori d’opera per ottenere benefici fiscali tramite la deduzione di alcune categorie di servizi dal reddito IRPEF.,504
Sostegno a commercio e partite iva,999
Flat tax per partite Iva e professionisti con reddito fino a 70 mila euro.,402
Tassazione a 0 per i primi 3 anni di attività,402
Abbattimento Super Aliquota Irpef,999
Le Regioni che sono finalmente uscite dal Commissariamento e rientrato nel piano di risanamento del bilancio (pareggio di bilancio) devo anche abbattere le addizionali Irpef regionali che gravano sui redditi dei cittadini.,000
Incentivi per PMI e Commercio,999
Incentivi fiscali sulle esportazioni per le PMI che incrementano l’occupazione stabile;,402
-Cedolare secca per i commercianti che affittano un negozio per aprire una nuova impresa nelle periferie e nelle zone disagiate.,402
Tali misure hanno un duplice obiettivo: sviluppare la piccola imprenditoria privata,402
e al contempo riqualificare aree del territorio economicamente desertificate.,402
Primi interventi,999
"Rimodulazione del calendario fiscale per imprese e autonomi, in modo tale da spalmare trimestralmente il pagamento degli acconti d’imposta tenendo conto degli utili effettivi;",402
Abrogazione delle disposizioni sull’inversione dell’onere della prova;,605
Lo Stato non pupretendere le imposte verso contribuenti con i quali ha un debito in arretrato;,605
Le tasse non sono dovute se l’impresa non ha incassato i corrispettivi delle fatture emesse;,402
Accertamenti: No sequestro preventivo;,605
Istituzione di un Codice Tributario generale sulle garanzie del contribuente e sui poteri dello Stato. 303,303
Salario,999
"Promuovere, nella contrattazione nazionale, sanità integrativa e previdenza integrativa con la riduzione della pressione fiscale sui fondi contrattuali;",504
Sostenere la contrattazione aziendale e territoriale finalizzata alla crescita salariale e al recupero di produttività;,701
"Tassazione zero, salario accessorio e di produttività;",701
Rendere ancora piconveniente il lavoro a tempo indeterminato;,701
Decontribuzione strutturale per i neo assunti per tre anni;,706
Riduzione del cuneo fiscale e redistribuzione di una parte dell’importo risparmiato ai lavoratori;,701
Sostegno ai contratti attivi di solidarietà finalizzati alla crescita e al ricambio generazionale.,701
AMBIENTE,999
Health City,999
"Promuovere l’applicazione dell’Urban health Rome declaration, siglato tra Ministero della Salute e Anci, che riconosce il concetto di salute un elemento imprescindibile per il benessere di una società, non pisolo un “bene individuale” ma un “bene comune”.",501
"Vanno quindi considerate anche le condizioni naturali, ambientali, climatiche e abitative, così come la vita lavorativa, economica e sociale.",503
"In primo piano va inserito il ruolo delle città, dove nei prossimi decenni si concentrerà il 70% della popolazione globale.",000
Piano di riqualificazione energetica delle periferie:,501
"partire da scuole, verde pubblico, pidetrazioni per il verde privato nei condomini.",501
Blue Economy -Energia 4.0,999
Intensificare l’attività di sviluppo della blue economy strategica per il nostro Paese;,501
conferma per gli anni a venire di una politica indirizzata all’efficientamento energetico del patrimonio edilizio esistente e soprattutto a quello di futura costruzione.,501
"Super ammortamento per chi investe in ammodernamento e adeguamento energetico delle proprie case, aziende e capannoni.",501
Mobilità,999
"Efficienza energetica con il rinnovo e l’allargamento degli attuali bonus, una nuova mobilità sostenibile con divieti pistringenti alle macchine e ai bus inquinanti.",501
Nuova stagione di incentivi alla mobilità elettrica-metano-ibrida.,501
Rifiuti,999
Chiudere tutte le discariche abusive per azzerare le multe Ue avviando un rapido percorso per l’attuazione di un sistema di smaltimento che trasformi i rifiuti da problema in risorsa.,501
Economia circolare:,416
"premiare e diffondere tra i comuni le eccellenze italiane, nuove tecnologie per abbattere il carico di rifiuti e spingere su differenziata.",501
Sicurezza del territorio,999
Incentivi per l’utilizzo delle nuove tecnologie in agricoltura e il recupero dei terreni abbandonati in un piano di messa in sicurezza del territorio;,703
Lotta al Dissesto Idrogeologico;,501
Lotta all’erosione costiera partendo dalla migliore gestione dei fiumi da parte delle autorità competenti;,501
Prevenzione rischio sismico:,501
potenziamento dei fondi per il completamento della Carta Geologica d’Italia e della Microzonazione Sismica;,501
"Acqua: maggiori investimenti per rendere la rete idrica nazionale piefficiente, a livello di quelle dei migliori Paesi europei, riducendo il fenomeno della dispersione;",501
Consumo del suolo:,501
puntare alla riqualificazione di aree dismesse o degradate.,501
DISEGUAGLIANZE SOCIALI E POVERTÀ,999
In questi anni di faticosa uscita dal picco della crisi le diseguaglianze sono cresciute e la ricchezza si è ancora piconcentrata.,503
Occorre una radicale inversione di tendenza.,503
In questo quadro vanno collocate le azioni di sostegno ai redditi pibassi e le misure a favore dell’inclusione sociale.,503
E al criterio dell’equità va anche ispirato un patto tra le generazioni che sappia dare vita dignitosa agli anziani,503
e assieme prospettive di futuro ai nostri ragazzi,706
"aumentando anche la quota delle donne che lavorano, ad oggi solo la metà.",706
Alcune proposte: Scuola,999
La scuola come motore del processo di inclusione e mobilità sociale,506
Lotta contro la dispersione scolastica;,506
Seria e profonda innovazione didattica;,506
Investimenti in edilizia scolastica;,506
Miglioramento della qualità dell’insegnamento;,506
Reintroduzione dell’obbligatorietà dell’insegnamento dell’educazione civica.,506
L’immigrazione,999
L’immigrazione come potenziale di crescita Non c’è integrazione senza Legalità;,601
Ius Culturae;,607
Ripristinare un sistema regolare di flussi di ingresso;,601
Sostenere l’esperienza dei corridoi umanitari;,601
Lavorare sull’integrazione dei richiedenti asilo (corsi di lingua e di avviamento al lavoro);,607
Riformare la legge di cittadinanza come compimento di un percorso di integrazione e condivisione dei principi costituzionali.,607
EUROPA H,999
"L’integrazione europea era stata immaginata dai padri fondatori come uno strumento per garantire la pace, attraverso obiettivi di libertà e giustizia sociale.",108
Da qualche anno l’Europa è diventata quasi esclusivamente una sovrastruttura burocratica concentrata intorno a principi economici e di mercato.,108
Alcune proposte:  Recupero dell’idea dell’Europa come strumento per la pace e la piena realizzazione della persona;,108
"Coinvolgimento dell’Europa per affrontare le grandi sfide del Mediterraneo e dell’Africa,",108
per essere decisivi nella nuova economia mondiale,108
ma anche per garantire sicurezza e occupazione;,108
Maggior attenzione alle comunità locali presso le quali si custodiscono tradizioni e identità preziose.,502
SICUREZZA,999
"La sicurezza dei cittadini nelle proprie abitazioni, nei luoghi di lavoro e negli spazi pubblici è un bene prezioso che deve essere tutelato sia sul piano operativo che con una legislazione adeguata.",605
Alcune proposte: Rafforzare l’impegno e l’efficacia delle istituzioni pubbliche nelle azioni sia preventive che repressive;,605
Rafforzare le iniziative culturali e educative per far crescere nelle nuove generazioni il senso delle regole e del rispetto delle persone e degli spazi e dei beni comuni;,606
Potenziare il Piano di Azione straordinario contro la violenza sessuale e di genere;,605
Aiutare concretamente e tempestivamente le donne vittime di abusi e crimini domestici.,706
SUD,999
"L’immagine di un Meridione depresso, senza una sua identità economica industriale e imprenditoriale, è falsa.",601
Il Meridione ha risorse professionali e culturali rilevantissime.,601
"Le criticità, gli stereotipi e la rassegnazione non devono prevalere sull’attenta e reale valutazione delle forze in campo e delle vere potenzialità di un piano di sviluppo.",402
Alcune proposte: Piano per lo sviluppo turistico,402
"(iniziative per distretti turistici a burocrazia zero,",402
iniziative per accrescere la competitività del sistema turistico,402
anche sviluppando un marketing efficiente e innovativo);,402
Realizzare una governance efficiente e preparata;,410
Ricostruire la filiera dell’economia del mare.,402
