Text,Code
In Lombardia il tasso dei conducenti stranieri coinvolti in sinistri (5.6 ogni 1000 abitanti) è il doppio rispetto a quello dei conducenti italiani (non esiste alcun dato nazionale).,605
SOLUZIONI,999
Aumento di risorse per il piano nazionale di sicurezza stradale per interventi strutturali su strade,411
Giro di vite sulle patenti straniere,607
"Daspo per il cittadino che, in stato d’ebrezza o sotto effetto di sostanze stupefacenti, provoca incidenti con conseguenze mortali",605
"Prevedere, in aggiunta ai sistemi punitivi (i.e. punti patente), un sistema di premialità per chi non commette infrazioni alla guida (i.e. sconti sull’assicurazione RC, sconto sul bollo auto…)",605
"Obbligo di sensori anti abbandono sui seggiolini dei bambini in auto (già presentato emendamento, primo firmatario Gianni Melilla di Sel)",605
TERRORISMO,999
"Nell’ultimo decennio, in Italia, sono stati portati a termine poco meno di 100 attentati di matrice terroristica;",605
7.000 le intercettazioni autorizzate per indagini di terrorismo interno e internazionale.,605
"179 sono le vittime italiane, civili e militari, che hanno perso la vita perché coinvolte in attacchi compiuti in dodici paesi (fonte Demoskopika)",605
TERRORISMO ON LINE:,999
"Spazi web con contenuti illeciti (dati 2016): 13.491 (su 412.447 monitorati pari al 3,2%).",605
"Contenuti web oscurati dal gestore del servizio: 510, oscurati su segnalazione della Polpost (profili Facebook, Twitter): 13",605
Spazi web riconducibili al terrorismo: 358,605
SOLUZIONI,999
"ADEGUARE/ AGGIORNARE LA LEGGE COSSIGA: » estendere il fermo di polizia fino a 48 ore, più altre 48 a disposizione dell’autorità per giustificare il provvedimento; »",605
autorizzare perquisizioni per causa d’urgenza anche senza mandato; »,605
"estendere di un terzo, per ogni grado di giudizio, i termini della carcerazione preventiva per i reati di terrorismo;",605
i nuovi termini della carcerazione preventiva si applicano anche ai procedimenti già in corso. »,605
prevedere particolari benefici di legge e sconti di pena per i «terroristi pentiti» che forniscano informazioni utili alla conduzione delle indagini e allo smantellamento delle organizzazioni eversive (d.l. 625).,605
Introdurre il 41 BIS per le persone accusate di terrorismo,605
Vietare l’accesso ai luoghi pubblici agli individui con il volto coperto,605
Incrementare le risorse per la polizia postale,605
SU MODELLO LEGGE AUSTRIACA: » Prevedere l’obbligo di tracciabilità dei finanziamenti e dei fondi ricevuti dall’estero dalle organizzazioni religiose. »,607
Vietare agli imam di essere stipendiati da Paesi stranieri; »,607
Obbligo di utilizzo della lingua italiana nelle moschee (no lingua araba). »,607
Prevedere obbligo di percorso formativo teologico con iscrizione ad un albo per gli imam. »,607
"La legge dello Stato italiano dovrà sempre essere osservata, anche qualora entri in contrasto con le tradizioni religiose.",607
Prevedere utilizzo di metal detector nelle principali stazioni ferroviarie e nelle metropolitane;,605
"Maggiore impiego di cani antiesplosivo, anche solamente a fini preventivi;",605
"Mappatura, da parte dei Comuni, dei luoghi destinati al culto religioso equiparando i centri culturali in cui si svolge regolarmente attività di preghiera alle moschee, con obbligo di applicare le stesse norme urbanistiche.",607
"Per i centri culturali islamici preesistenti, vi si possono svolgere attività di culto solo se lo si è segnalato al Comune, che dovrà prevedere una variante al Pgt (Piano di Governo del Territorio), inserendolo nel Piano per le attrezzature religiose (vedi legge regionale n. 2, 3 febbraio 2015)",607
VIOLENZA SULLE DONNE E STALKING -VIOLENZA DI GENERE,999
"In novembre u.s. è stato varato un piano strategico nazionale sulla violenza maschile 2017-2020 che andrebbe coordinato, attuato e integrato negli eventuali aspetti che possano risultare più efficaci per la tutela e l’assistenza della vittima.",605
"Tale piano per la prima volta affronta in modo complessivo gli aspetti sulla prevenzione e sulla lotta contro la violenza nei confronti delle donne come richiesto dalla Convenzione di Istanbul del maggio 2011 con riferimento alla violenza contro le donne declinata nelle diverse forme di: violenza domestica, molestie sessuali, stupro, matrimonio forzato, mutilazioni genitali e tutela dei bambini in quanto testimoni delle violenze.",605
"Lo stalking è incluso ma non l’abuso sui minori, disciplinato da un regime giuridico differente.",605
PROBLEMI,999
"Tempi della giustizia,",605
"Provvedimento di ammonimento del questore che, allo stato attuale, non fornisce alcuna concreta tutela per le vittime degli atti persecutori.",605
Le pene previste non sono sufficientemente severe né certe (no dissuasive).,605
NUMERI:,999
In Italia viene commesso un reato ogni 3 giorni;,605
"Negli ultimi 10 anni le vittime sono state 1.740 di cui 1.251(71,9%) sono state colpite nell’ambito familiare.",605
3 milioni e 466.000 donne hanno subito stalking almeno una volta nella vita,605
SOLUZIONI,999
Prevedere un nuovo impianto normativo che: » riduca i tempi della giustizia: prevedere tempi di intervento certi e più brevi;,605
"» preveda la responsabilità del magistrato che prende in carico il fascicolo, se la denuncia viene ignorata;",605
"» preveda, nei confronti del soggetto ammonito per stalking che reitera la condotta, l’allontanamento d’urgenza dalla casa familiare quale misura precautelare ad opera delle forze di polizia, individuando una speciale procedura ed una speciale squadra antistalking che abbia un filo diretto – anche telematico – con il pm deputato ad autorizzare la misura, evitando che resti del tutto inapplicata »",605
"preveda, nelle ipotesi di stalking in cui l’indagato risulti già ammonito dal Questore, la facoltà per il PM di richiedere il giudizio immediato (in situazioni di elevata pericolosità e stress emotivo per la vittima, le lungaggini del procedimento penale possono risultare altamente lesive e in taluni casi spingere la vittima stessa a rinunciare a denunciare l’aggressore).",605
"» attribuisca al provvedimento di ammonimento del Questore un maggior peso in ambito processuale, consentendo di velocizzare i tempi procedimentali tramite il giudizio immediato (allo stato attuale non fornisce alcuna concreta tutela per la vittima dagli atti persecutori).",605
Castrazione chimica per chi abusa di minori e per chi reitera il reato di violenza sessuale.,605
"In numerosi Paesi, la castrazione chimica è prevista, fra le pene possibili (ma il soggetto deve essere pienamente informato e consenziente).",605
Rivedere i termini per la denuncia per molestie portandoli da 6 mesi ad 1 anno,605
AUTONOMIA E RIFORME ISTITUZIONALI,999
"La credibilità di uno Stato si misura nel modo in cui agisce per il bene dei cittadini, non con il numero di leggi che produce per vessarli.",999
Democrazia significa governo del popolo.,202
La sua essenza consiste nella partecipazione del popolo al governo della comunità.,202
"Questa essenza è chiaramente scolpita dall’articolo 1 della Costituzione italiana: “L’Italia è una Repubblica democratica, fondata sul lavoro.",202
"La sovranità appartiene al popolo, che la esercita nelle forme e nei limiti della Costituzione”.",202
"A parte il fuor d’opera costituito dall’inciso “fondata sul lavoro”, frutto della concessione alle istanze dei Costituenti socialisti e comunisti, è chiaro il collegamento fra democrazia, sovranità popolare e suo esercizio concreto.",202
In questo senso la democrazia costituisce uno dei principi supremi dell’ordinamento.,202
"Oggi, però, la sovranità del popolo viene messa sempre più a rischio da una serie molteplice di fattori:",202
"Da un certo modello d’Europa, basato su tecnocrati che spesso impongono le loro decisioni agli Stati membri dell’Unione.",108
Da istituzioni internazionali quali l’Onu e lo stesso WTO.,107
Da giganteschi fondi sovrani che manovrano migliaia di miliardi di dollari e che possono condizionare le economie nazionali come mai prima d’ora.,103
Dalla tendenza dei giudici a sostituirsi al legislatore.,202
"Non vi è da stupirsi se, dati questi presupposti, proprio in Italia, si tenda a restringere anche lo spazio delle Istituzioni più vicine ai territori, riducendo l’agibilità finanziaria dei Comuni e indebolendo il ruolo delle Regioni, negando così il fondamentale principio di sussidiarietà, che è complementare a quello di sovranità popolare.",301
"Occorre un nuovo equilibrio fra i poteri ed un rafforzamento degli istituti di democrazia diretta, concepiti come correttivo alle possibili storture della democrazia rappresentativa.",202
AUTONOMIA E FEDERALISMO,999
AUTONOMIA DELLE REGIONI,999
"E’ il momento di ripensare al regionalismo, che fino ad ora è stato attuato in base ad una logica di uniformità che non consente la crescita delle realtà territoriali che aspirano ad avere una maggiore autonomia dallo Stato centrale.",301
"Appare indispensabile trarre spunto dalle democrazie più avanzate e sviluppate che hanno un assetto federale o fortemente regionalizzato (Stati Uniti, Germania, Svizzera e Austria).",301
"L’impegno della Lega sarà quello di porre come questione prioritaria nell’agenda di Governo l’ottenimento, per tutte le Regioni che lo richiedono, di maggiore autonomia, in attuazione dell’art. 116, terzo comma, della Costituzione, non ultimo portando a conclusione le trattative tra Governo e Regioni attualmente aperte.",301
Oltre a questo si proporrà una modifica della Costituzione volta a rafforzare e consolidare l’autonomia delle Regioni.,301
Il riconoscimento delle ulteriori competenze dovrà essere accompagnato dal trasferimento delle risorse necessarie per un autonomo esercizio delle stesse:,301
"alla maggiore autonomia dovrà infatti accompagnarsi una maggiore responsabilità sul territorio in termini di equo soddisfacimento dei servizi a garanzia dei propri cittadini, ed in termini di efficienza ed efficacia dell’azione svolta.",301
"Questo percorso di rinnovamento dell’assetto istituzionale dovrà dare sempre più forza al regionalismo applicando, Regione per Regione, la logica del Federalismo a geometria variabile che tiene conto delle peculiarità e delle specificità delle diverse realtà territoriali e dà spazio alle energie positive ed alle spinte propulsive espresse dalle collettività locali.",301
Questo appare un nodo istituzionale decisivo al fine di consentire la ripresa di un adeguato livello di sviluppo e di competitività da parte delle aree che possono fungere da “volano” economico per l’intero Paese.,301
Garanzia dei trasferimenti necessari agli Enti Locali e contestuale cessazione delle politiche di taglio compiute dagli ultimi Governi.,301
"Razionalizzare il numero delle Province, ma garantire la rappresentanza democratica con l’elezione diretta del Presidente.",301
"Superamento del ruolo del Prefetto e delle Prefetture, le cui competenze saranno ripartite tra gli Enti Locali e i vertici delle Forze dell’Ordine.",301
Rimodellare secondo il principio di sussidiarietà territoriale tutte le competenze dello Stato.,301
Introduzione dei costi standard per le prestazioni regionali e comunali.,301
LO STATO,999
"Il Parlamento deve fare le leggi, possibilmente poche, semplici e chiare.",202
Non deve scegliere il capo dell’esecutivo.,305
"Occorre un capo dell’esecutivo forte, direttamente scelto dal popolo, che non debba passare dalla fiducia delle Camere e che possa nominare e revocare i ministri.",305
"Elezione da parte di tutti i cittadini italiani del Presidente della Repubblica, che riunisca in sè le attuali competenze del Presidente del Consiglio e del Presidente della Repubblica, tranne la presidenza del Csm.",202
"I giudici devono applicare la legge, non crearla.",202
Occorre poter consentire al Parlamento e Governo di sollevare davanti alla Corte costituzionale un conflitto di attribuzione fra poteri dello Stato ex art. 134.2 ogni qualvolta la Cassazione dia un’interpretazione della legge contrastante con la volontà del legislatore.,305
Laddove poi il giudice abbia palesemente violato la legge interpretandola in modo contrario alla volontà del legislatore deve provvedere il Csm adottando opportune sanzioni.,305
"Non sono ammesse sentenze “abrogative” di leggi vigenti, ancorché “costituzionalmente orientate”.",305
Solo la Corte costituzionale può considerare incostituzionale una legge vigente.,203
"I giudici costituzionali devono essere nominati oltreché dal Presidente della Repubblica e dal Parlamento, per il restante terzo da una Conferenza delle regioni.",203
La giurisprudenza della Corte costituzionale deve prevalere su quella della Corte di giustizia europea.,203
"I giudici ordinari non possono disapplicare leggi vigenti sulla base di una pretesa contrarietà con la giurisprudenza della Corte di giustizia europea, devono in questo caso rimettere gli atti alla Corte costituzionale.",203
Abrogare il comma 1 dell’art.117 nella parte in cui sottomette sempre e necessariamente la legislazione italiana alle norme europee.,108
È un caso pressoché unico in Europa di eccesso di zelo.,108
È bene che Camera e Senato vengano ridotti nel numero da 630 a 400 e da 315 a 200.,303
"È necessario rendere obbligatoria la pronuncia del Parlamento sui disegni di legge di iniziativa popolare, con obbligo di rapida calendarizzazione, innalzando a 200.000 il numero di sottoscrizioni necessarie per la loro proponibilità.",202
Introduzione del Vincolo di Mandato con la riforma dell’art. 67 del Costituzione.,305
Basta con i trasformismi.,305
Nell’ultima legislatura abbiamo assistito ad una vergognosa transumanza di eletti in uno schieramento passare a quello opposto.,305
Gli elettori non devono più essere traditi e devono avere la certezza che i loro rappresentanti rispettino il mandato che gli attribuiscono.,202
Ogni eletto dovrà in Parlamento perseguire il raggiungimento degli scopi con cui si è presentato agli elettori.,202
"Dal vincolo resta escluso il voto sulle persone, sui provvedimenti relativi al proprio territorio, e sulle questioni di coscienza.",202
"Eliminazione del quorum per la validità dei referendum popolari, rendendone così più facile l’esercizio.",202
Introduzione della figura del “difensore del popolo/avvocato del popolo” che difenda i cittadini davanti agli abusi delle grandi imprese private,403
"e agli abusi della pubblica amministrazione, ma non contro organi costituzionali.",304
"Sono infatti sempre di più le vessazioni o comunque gli atti che i cittadini subiscono senza possibilità di contrastarli non soltanto dall’Amministrazione pubblica,",304
"bensì da organizzazioni, spesso sovranazionali, vale a dire le multinazionali, le banche.",403
Ha inoltre la possibilità di agire direttamente per far rilevare l’incostituzionalità di una norma di legge ponendo fine al paradosso che per stabilire se una legge sia o meno costituzionale occorre prima violarne i precetti.,303
POLITICA ESTERA E DIFESA,999
La difesa dell’interesse nazionale è un diritto di ogni Stato.,999
Cooperare per il bene comune è un dovere di tutti i cittadini.,999
L’INTERESSE NAZIONALE COME PRINCIPIO CARDINALE,999
"La politica italiana deve tornare a ispirarsi, anziché a princìpi ideologici o tornaconti di fazione, all’interesse nazionale.",601
Il primo interesse nazionale è quello a preservare la propria sovranità:,107
sovranità vuol dire esser padroni a casa nostra e rivendicare il diritto a costruirci un futuro al riparo dalle ingerenze estere più ingombranti.,107
"In tal senso non si dovrebbero assecondare i progetti di “Stati Uniti d’Europa”, che porterebbero alla cancellazione dell’individualità italiana, né tutti i passi intermedi che espropriano il Parlamento nazionale (e dunque il popolo italiano) di competenze fondamentali.",108
"Il secondo fondamentale interesse nazionale è quello alla sicurezza, in particolare da minacce come il terrorismo, l’estremismo islamico, i flussi migratori incontrollati;",607
"ed anche dagli effetti destabilizzanti delle politiche troppo intraprendenti di alcuni attori regionali, alleati inclusi, che già nel recente passato hanno volutamente operato per indebolire la posizione italiana (come accaduto in Libia).",107
APRIRE ALLA RUSSIA RICONFERMANDO L’ALLEANZA PRIVILEGIATA CON GLI USA,999
"La Russia, parte della civiltà occidentale e in prima linea nella difesa di alcuni dei suoi valori, dovrebbe essere percepita quale partner anziché come minaccia, e ricoinvolta in un progetto comune secondo lo spirito del Vertice Nato di Pratica di Mare del 2002.",107
"La distensione ed apertura alla collaborazione coi Russi non dovrebbe essere visto come alternativa o compiuto a discapito del rapporto con gli Stati Uniti d’America, che rimangono l’alleato di riferimento dell’Italia.",107
"Si dovrebbe infatti rovesciare la politica di Renzi e Gentiloni, che hanno scelto di intrattenere rapporti più che con gli Usa con la sua area politica liberal, dapprima esprimendo un indebito appoggio per la candidata democratica poi uscita sconfitta, quindi allineandosi all’opposizione interna contro la Presidenza di Donald Trump.",107
"Al contrario, un governo italiano di Centro-Destra dovrebbe scommettere su un rapporto privilegiato e speciale con l’Amministrazione Trump, proprio mentre molti partner europei la guardano con sospetto;",107
numerose politiche dell’attuale Amministrazione americana (quali la difesa dall’estremismo islamico e dall’aggressiva penetrazione politico-commerciale cinese) sono in piena sintonia col programma della Lega e con gli interessi nazionali italiani.,107
IL “FRONTE SUD” È IL FOCUS PRINCIPALE PER L’ITALIA,999
"Focalizzarsi sul “fronte orientale” è errato: la Russia non costituisce una credibile minaccia militare, ma un potenziale partner per la Nato e l’Ue.",107
"È nel Mediterraneo che si addensano più fattori di instabilità: l’estremismo islamico, i massicci flussi migratori, i fallimenti statuali, le tensioni tra potenze regionali.",107
"Inoltre la regione non è più al centro dell’attenzione degli Usa, e ciò costringerà l’Italia (che nel Mediterraneo ha una posizione centrale) ad assumersi maggiori responsabilità.",107
"Nella regione l’Italia dovrebbe intensificare la cooperazione con quei Paesi, come Israele ed Egitto, maggiormente impegnati nella lotta contro l’estremismo islamico.",107
Il contenimento della minaccia jihadista andrebbe considerato un obiettivo prioritario rispetto a “cambi di regime” ed “esportazione della democrazia”.,107
"Stabilire nuove basi logistiche avanzate, mediante accordi bilaterali coi Paesi ospiti, offrirebbe vantaggi operativi, economici, diplomatici, e un positivo impatto d’immagine nella scena internazionale.",107
"Bisognerebbe tuttavia recedere dalla pratica di offrire i nostri militari a chiunque, nella speranza spesso vana di ricevere in cambio un aiuto nelle aree per noi più critiche, e cominciare a concentrare la presenza militare italiana all’estero e gli interventi di cooperazione internazionale laddove per noi più importante.",104
"Disperdere i nostri militari su un gran numero di teatri è una politica insostenibile, perché costa molto e produce scarsi risultati in termini di espansione economica e di sicurezza migratoria o contro-terroristica.",104
"Anche la cooperazione andrebbe focalizzata sui Paesi e le aree di nostro maggiore interesse, archiviando la lunga fase della distribuzione a pioggia degli aiuti.",107
L’IMMIGRAZIONE DI MASSA E INCONTROLLATA È UNA MINACCIA ALLA SICUREZZA NAZIONALE,999
"Gli attuali flussi immigratori, imponenti e incontrollati, destabilizzano il nostro Paese dal punto di vista sociale e offrono opportunità alle infiltrazioni terroristiche e alla propaganda estremista.",601
Il fenomeno può essere parzialmente arginato da accordi bilaterali coi Paesi di transito e di partenza;,601
in particolare gli accordi con questi ultimi dovrebbero prevedere politiche di contenimento della natalità per frenare il sovrappopolamento.,107
La cooperazione da sola non può fermare i migranti:,601
"infatti, dietro i grandi flussi migratori che vediamo partire dall’Africa c’è anche un fenomeno di intenso sviluppo locale (la gente che può permettersi il viaggio per l’Europa aumenta al crescere delle disponibilità economiche);",601
è perciò necessario intervenire nel campo del controllo e della dissuasione.,601
"Andrebbero implementate e sostenute in sede Ue (dove un’intesa è possibile soprattutto coi Paesi del Gruppo di Visegrad) iniziative di sorveglianza delle frontiere esterne, di repressione dei traffici di esseri umani e di rimpatrio dei clandestini (questi ultimi ben pubblicizzati per dissuadere altri dalla scelta di emigrare).",601
"Le politiche di asilo, congegnate per un’epoca di ridotta immigrazione, andrebbero ripensate in senso restrittivo e lasciando (in linea con la dichiarazione finale dell’ultimo G7) allo Stato la piena sovranità sui propri confini.",601
"Le politiche migratorie dovrebbero privilegiare gli ingressi dai Paesi culturalmente più affini, selezionando individui con qualifiche professionali più ricercate.",601
"L’acquisizione della cittadinanza dovrebbe avvenire a fronte di un’effettiva naturalizzazione, fatta di integrazione socio-economica e assimilazione culturale.",607
IL RITORNO ALLA LEVA È LA FORMA PIÙ EFFICACE DI EDUCAZIONE CIVICA,999
"La leva permetterebbe di promuovere salute fisica e formazione civica, con positive ricadute sanitarie e morali sul Paese:",104
il suo costo andrebbe dunque inteso come un investimento sociale sui giovani cittadini.,104
"In particolare lo screening medico sistematico della popolazione giovanile, reso possibile dalla coscrizione, potrebbe aiutare nella prevenzione e cura precoce di varie malattie, migliorando le condizioni di vita e generando risparmi per la sanità negli anni a venire.",104
"La leva è inoltre un’azione preventiva necessaria a garantire la preparazione dei cittadini al dovere costituzionale di difesa della Patria, nel caso (assai improbabile ma teoricamente non impossibile) di mobilitazione causata da una grave crisi internazionale.",104
"Il servizio andrebbe reso obbligatorio a tutti i cittadini di entrambi i sessi, permettendo tuttavia di scegliere tra il servizio civile e quello militare.",104
"I coscritti andrebbero ricompensati con titoli di merito per la partecipazione a concorsi pubblici, in particolare per l’ingresso nelle Forze Armate e nelle Forze dell’Ordine, e riconoscimenti per l’esercizio di professioni civili.",104
"L’impiego dei coscritti dovrebbe essere limitato alle funzioni di difesa nazionale e di protezione civile, lasciando al personale professionista le missioni di pace e stabilizzazione internazionale.",104
"L’addestramento dovrebbe essere svolto in ambito regionale, col concorso delle associazioni d’arma e, salvo l’indottrinamento iniziale, senza vincoli di alloggio in strutture specifiche, così da ridurre costi finanziari e impatto sociale.",104
IL SOSTEGNO ALL’INDUSTRIA NAZIONALE DELLA DIFESA È UN INTERESSE STRATEGICO,999
"L’industria nazionale della Difesa è un settore high-tech che offre al Paese importanti opportunità occupazionali, oltre ad avere una valenza strategica.",104
L’interesse nazionale dovrebbe essere tenuto al centro delle politiche di settore:,104
"la cooperazione europea va perseguita, ma non dovrebbe pregiudicare quella con partner privilegiati extra-Ue come gli Usa, o prossimamente tali come la Gran Bretagna.",108
"La specializzazione produttiva dei singoli Paesi europei può permettere di rimanere collettivamente competitivi sullo scenario globale, ma non dovrebbe tradursi nell’espropriazione di patrimoni nazionali tramite acquisizioni estere.",104
"Andrebbero migliorate, valorizzate e diffuse nella pubblica amministrazione (in particolare tra i delegati all’estero) le competenze in ambito Difesa affinché il Paese faccia sistema con le proprie industrie.",104
"Una strategia opportunamente aggressiva dovrebbe favorire le eccellenze, e non indulgere nell’assistenzialismo, così da sfruttare il volano delle esportazioni e offrire i migliori prodotti alle nostre Forze Armate.",104
AGRICOLTURA,999
Difendiamo la nostra terra e l’eccellenza dei nostri prodotti.,999
"Il settore agricolo italiano, al pari di tanti altri settori produttivi, è impegnato da tempo a sopravvivere nella competizione globale dei mercati dai quali spesso è escluso a causa del suo peso secondario, dalle opportunità che la dimensione “globale” del “cibo” riserva ai grandi operatori del più ampio settore agroalimentare (comprese quindi industrie e sistema di distribuzione).",703
"Gli agricoltori si muovono in un sistema governato da politiche di settore (ormai completamente europeo come competenza esclusiva, attraverso la Politica Agricola Comune), all’interno di un mercato unico europeo condizionato, sempre più spesso, da rapporti commerciali con Paesi terzi governati da FTA (free-trade agreements) penalizzanti.",108
"Storicamente – e marcatamente con gli ultimi ministri di “sinistra” - il Governo italiano è stato remissivo e rinunciatario in Europa rispetto alle esigenze del primo settore, preferendo molto spesso lasciare il campo a interessi europei opposti rispetto alle esigenze italiane.",305
"Il prossimo Governo, anche alla luce della sua collocazione “storica”, dovrà muoversi secondo due direttrici: quella europea (legata alle scelte generali e politiche, che danno all’agricoltura il quadro di regole) e quella nazionale (impostata principalmente – ma non solo – sull’efficientamento e sulla riforma della macchina amministrativa e gestionale).",305
UN NUOVO APPROCCIO IN EUROPA,999
