Text,Code
A PROMUOVERE E REALIZZARE ENTRO LA XVII LEGISLATURA I SEGUENTI PUNTI PROGRAMMATICI,999
Votare il dimezzamento degli emolumenti dei parlamentari.,303
Votare una legge che azzeri il finanziamento pubblico ai partiti.,303
Approvare la riforma della Costituzione con il dimezzamento del numero dei parlamentari.,303
PROMETTO SOLENNEMENTE DI:,999
"Non tradire il mandato degli elettori, passando ad altro gruppo parlamentare.",304
Impegnarmi alla totale trasparenza sulla mia attività e sui miei redditi.,304
"Impegnarmi al servizio del Paese per non più di due legislature, a partire da questa.",304
1 Istituzioni adeguate e moderne favoriscono lo sviluppo del paese,999
Elezione diretta e popolare del Presidente della Repubblica,203
Rafforzamento dei poteri del Governo,203
"Riforma del bicameralismo,",203
"Senato federale,",203
dimezzamento del numero dei parlamentari e delle altre rappresentanze elettive,203
"Revisione dei regolamenti parlamentari e snellimento delle procedure legislative, con tempi certi per l’approvazione delle Leggi",303
Riordino e ulteriore semplificazione della legislazione vigente,303
Abolizione delle Province tramite modifica costituzionale,203
"Con la piena entrata in vigore della riforma costituzionale sul pareggio di bilancio e della relativa Legge rafforzata, superamento del Patto di Stabilità interno per gli enti locali",301
2 Dimezzamentodei costi della politica,999
Abolire il finanziamento pubblico dei partiti (nessun fondo pubblico ai partiti),304
Dimezzare tutti i costi della politica,304
"3 Più Europa dei Popoli, meno euro-burocrazia",999
Superamento di una politica europea di sola austerità,410
"Accelerazione delle quattro unioni: politica, economica, bancaria, fiscale",108
"Attribuzione alla Bce del ruolo di prestatore di ultima istanza, sul modello della Federal Reserve americana",108
Euro-bond e project-bond per una rete europea di sicurezza e di sviluppo,108
Esclusione delle spese di investimento dai limiti del patto di stabilità europeo,410
"Elezione popolare diretta del Presidente della Commissione europea,",108
e ampliamento della potestà legislativa del Parlamento europeo,108
Costituzione di una agenzia di rating europea,108
"Centralità dell’Italia nella politica Europea, nella Alleanza atlantica, nel dialogo euro-mediterraneo, nel rapporto con l’Est",107
"L’Italia in Europa e nel mondo a difesa della libertà, della democrazia, dei diritti umani, e delle libertà religiose",201
"4 Per un’Italia federale e unita:Nord, Centro e Sud protagonisti",999
Piena attuazione della riforma federale come da Legge 42 del 2009,301
"I costi per i beni e i servizi, ivi compreso il costo per il personale, in tutte le regioni e gli enti pubblici, devono essere quelli relativi al valore più basso (costi standard)",301
Abolizione degli enti inutili,301
Entro la fine della legislatura: a) Istituzione di macroregioni attraverso le intese di cui all’art. 117 penultimo comma della Costituzione,301
"b) Attribuzione e utilizzo in ambito regionale, prevedendo la riduzione della pressione fiscale, di risorse in misura non inferiore al 75% del gettito tributario complessivo degli Enti di cui all’art. 114 della Costituzione prodotto nel singolo territorio regionale e che le risorse prodotte dal restante 25% del gettito tributario complessivo siano utilizzate dallo Stato per sostenere le spese dell’Amministrazione relative a funzioni non territorializzabili (p. es.: politica estera e interessi debito pubblico) e quelle relative alla perequazione nazionale",301
Rilancio del Piano Nazionale per il Sud voluto e implementato dal Governo Berlusconi,402
Riordinare le priorità: turismo;,408
infrastrutture,411
e ambiente;,501
università e istruzione;,506
"innovazione, ricerca e competitività",411
"Utilizzare tutti i fondi comunitari disponibili attraverso il Piano di Azione e Coesione evitando sprechi e mancati impegni delle risorse, applicando gli stessi meccanismi sanzionatori, per le amministrazioni inadempienti, già previsti nell’ambito del federalismo fiscale",303
5 Famiglia,999
a)  La persona e la famiglia sono al centro del nostro programma.,603
"La difesa e il sostegno alla famiglia, comunità naturale fondata sul matrimonio tra uomo e donna, la promozione della dignità della persona e la tutela della vita, della libertà economica, educativa e religiosa, della proprietà privata, della dignità del lavoro, la solidarietà e la sussidiarietà saranno i punti di riferimento della nostra azione legislativa",603
Un fisco favorevole alla famiglia: a parità di reddito paghino meno tasse le famiglie più numerose (quoziente familiare),504
Bonus bebè,504
Piano di sviluppo degli asili nido,504
"Buono (o credito di imposta) per scuola, università per favorire libertà di scelta educativa delle famiglie",504
Rendere totalmente detraibili dall’imponibile fiscale le spese per l’educazione e l’istruzione dei figli,504
Sostegni straordinari alle famiglie per l’assistenza ai disabili e agli anziani non autosufficienti,504
6 Riforma fiscale,999
a) Abbassare le tasse è fondamentale per lo sviluppo del paese:,402
Eliminazione dell’IMU sulla prima casa,704
No alla patrimoniale,704
No all’aumento Iva,402
"Tendenziale azzeramento (in 5 anni) dell’Irap, a partire dal lavoro, con priorità alle piccole imprese e agli artigiani",402
Diminuzione della pressione fiscale di 1 punto all’anno (5 punti in 5 anni),402
Detassazione degli utili reinvestiti in azienda,402
"Innalzamento limite uso del contante, con riferimento ai livelli medi europei",402
Fiscalità di vantaggio come politica di sviluppo economico territoriale,402
b) Fisco amico e non nemico del contribuente: Assistenza preventiva degli uffici finanziari,402
“Contrasto di interesse” i contribuenti possono scaricare dall’imponibile fatture e ricevute,402
Concordato fiscale preventivo,402
Revisione e riduzione dei poteri di Equitalia,402
Revisione radicale del redditometro,402
Costituzionalizzazione dei diritti del contribuente,402
"Compensazione tra crediti verso la PA e debiti fiscali, per le famiglie e per le imprese",402
"Generale semplificazione degli adempimenti fiscali delle PMI, degli artigiani e dei lavoratori autonomi senza struttura o con struttura di piccole dimensioni",402
"7 Le banche hanno avuto tantissimo,ora diano",999
Irrevocabilità di mutui e finanziamenti già erogati,403
"Moratoria su rate di mutuo non pagate negli ultimi 18 mesi, con adeguamento del piano di ammortamento alle capacità economiche del debitore",403
"Favorire nuovo accesso al credito per famiglie, giovani e imprese",403
"I finanziamenti della Banca Centrale Europea alle banche italiane devono essere destinati prioritariamente al credito per famiglie, giovani e imprese",403
"Separazione e/o specializzazione tra banche di credito e banche di investimento, anche attraverso opportuni incentivi e disincentivi fiscali",403
Rivedere Basilea III: parametri troppo rigidi alimentano la stretta creditizia,403
"Favorire le nuove forme di finanziamento e sostegno alle imprese: private equity, venture capital",403
Valorizzare i Confidi con relativa patrimonializzazione dei fondi di garanzia,403
Eventuali salvataggi bancari devono essere solo a tutela dei risparmiatori e non degli azionisti di controllo,403
Valorizzazione del sistema bancario a vocazione territoriale,403
"8 Dalla parte delle imprese, dalla parte del lavoro, dalla parte delle professioni",999
"Riconoscimento alle imprese, per le nuove assunzioni di giovani a tempo indeterminato, di una detrazione (sotto forma di credito d’imposta) dei contributi relativi al lavoratore assunto, per i primi 5 anni",402
Centralità delle PMI nel modello di sviluppo italiano,401
Sostituzione dell’attuale sistema dei sussidi alle imprese con contestuale ed equivalente riduzione delle tasse sul lavoro e sulla produzione,402
Passaggio dalle autorizzazioni ex ante ai controlli ex post,402
"Pagamenti più rapidi della pubblica amministrazione, in applicazione della direttiva europea sui ritardi di pagamento",303
"Utilizzo della Cassa Depositi e Prestiti, con particolare attenzione alle vocazioni territoriali degli azionisti, per finanziare l’innovazione e garantire i crediti alle esportazioni",402
Sviluppo dei distretti e delle reti d’impresa,402
"Tutela e valorizzazione delle imprese commerciali di piccola dimensione, al fine della salvaguardia e della coesione sociale delle comunità locali",402
"Apertura al mercato dei settori chiusi, in particolare dove persistono monopoli o oligopoli statali, a partire da scuola, università, poste, energia e servizi pubblici locali",401
Sviluppo di meccanismi concorrenziali e di vigilanza per contrastare accordi di cartello nel settore assicurativo,403
"Favorire le imprese di giovani imprenditori: per 3 anni, vantaggi fiscali per le imprese di under 35",402
"Valorizzare le libere professioni, riconoscendone le funzioni sussidiarie di pubblico interesse",704
Ritorno alla Legge Biagi per uno “Statuto dei Lavori”,701
Risoluzione della questione esodati,701
Sviluppo della contrattazione aziendale e territoriale (ex art. 138 D.L. 138/2011),701
Detassazione del salario di produttività,701
Sostegno all’occupazione giovanile attraverso la totale detassazione dell’apprendistato fino a 4 anni,701
Buoni dote per la formazione,701
Maggiore trasparenza per i sindacati su iscrizioni e bilanci,701
Tetto alle pensioni d’oro,503
Incoraggiamento a indirizzare quote di risparmio su pensioni integrative,503
Sviluppo del telelavoro,701
Partecipazione agli utili da parte dei lavoratori,701
"Revisione dei premi Inail, con particolare riferimento alle PMI e agli artigiani, in funzione del rischio reale, sulla base di un criterio bonus-malus",402
9 Infrastrutture,999
Uso della leva fiscale (sotto forma di credito d’imposta) per lo sviluppo delle infrastrutture e project financing,402
Piano generale per la mobilità urbana sostenibile,411
Potenziamento della logistica e del trasporto merci,411
Nuova legge obiettivo “Infrastrutture per l’Italia”: azioni mirate per snellire le procedure e approvare più velocemente le infrastrutture necessarie per il paese,411
"Progetto “Adotta una infrastruttura”: chi finanzia un progetto infrastrutturale, di un elenco stabilito dallo Stato, può detrarre dalle imposte il 90% del contributo e partecipare alle attività di controllo della realizzazione dello stesso",411
"Realizzazione, nei tempi europei, delle linee ferroviarie ad alta velocità, a partire dalla Torino-Lione e potenziamento della rete ferroviaria nazionale",411
Completamento del processo di regionalizzazione dell’ANAS,411
"Rilancio dell’iniziativa di liberalizzazione e privatizzazione delle reti infrastrutturali e dei pubblici servizi, come da D.L. 138 del 13 agosto 2011",411
10 Turismo: il nostro petrolio,999
"Abbassamento dell’IVA nel settore turistico, coerentemente con la normativa comunitaria",402
Valorizzazione e stabilizzazione delle concessioni balneari al fine di garantire il rilancio degli investimenti,402
Politica più incentivante dei visti turistici,402
"Sviluppo del turismo sociale, favorendo la destagionalizzazione",402
Strategia strutturata Stato-regioni per la promozione turistica all’estero,404
11 Agricoltura,999
Eliminazione dell’IMU sui terreni e i fabbricati funzionali ad attività agricole,703
Rilancio della imprenditoria giovanile in campo agricolo attraverso la riduzione fiscale per i giovani che aprono imprese agricole e attribuzione di appezzamenti del demanio agricolo per creare nuove imprese,703
Maggior tutela degli interessi italiani nel negoziato per la Politica Agricola Comune (PAC),703
Tutela delle produzioni italiane tipiche dalla contraffazione,703
12 Pubblica Amministrazione,999
Favorire le progressioni di carriera per merito rispetto a quelle per anzianità,303
Semplificare le procedure delle gare d’appalto e dissuadere i ricorsi immotivati,303
Incentivare la produttività nella Pubblica Amministrazione  e definire sanzioni per il mancato rispetto dei tempi di risposta a famiglie e imprese,303
"Appalti a km zero, a parità di costo, soprattutto per le PMI",303
Piena applicazione delle norme attinenti la mobilità obbligatoria nel pubblico impiego,303
"Previsione, anche per la PA, solo di mandati dirigenziali a tempo determinato rinnovabili",303
13 Energia,999
"Piano energetico nazionale: deve tenere conto dello sviluppo delle fonti rinnovabili, dello stato della rete, degli impianti previsti",411
Diminuzione delle tasse (accise) che incidono sul costo dell’energia,402
Nuove azioni per favorire la concorrenza nel settore energetico e contrastare gli oligopoli,403
Sviluppo del sistema di incentivi per le energie rinnovabili evitando di creare rendite di posizione dannose,501
Più incentivi per gli investimenti in nuove tecnologie finalizzate alla riduzione dei consumi energetici,411
"Incrementare gli investimenti per la realizzazione della smart grid, finalizzati ad aumentare l’efficienza delle reti di trasmissione di energia elettrica",411
"14 Ambiente, green economye qualità della vita",999
Nuovo piano per il riassetto idrogeologico del Paese,501
"Messa in sicurezza del patrimonio immobiliare, da realizzare attraverso benefici fiscali e finanziamenti agevolati",501
"Rifiuti: realizzare cicli integrati regionali di smaltimento, con l’obiettivo dell’autosufficienza;",501
incentivare la raccolta differenziata e la riduzione della produzione dei rifiuti,501
"Valorizzare il sistema dei parchi e delle aree protette, attraverso l’uso della leva fiscale, per favorire nuove imprese e occupazione",501
"Green economy: puntare su quattro settori strategici: eco-innovazione, fonti rinnovabili, riciclo dei rifiuti e mobilità sostenibile",501
Tutela degli animali da compagnia e affezione e cancellazione delle spese relative agli stessi dal redditometro,501
Misure contro gli abbandoni degli animali come strumento di lotta al randagismo,501
"Smart Cities: dare impulso allo sviluppo delle città “intelligenti”, coinvolgendo capitali privati e utilizzando stimoli fiscali",501
Nuovo rapporto sinergico ambiente-turismo,501
"Scuola, università e ricerca",999
Raddoppio detassazione utili reinvestiti in ricerca,402
"Credito di imposta automatico sugli investimenti relativi a innovazione di prodotti, processi, organizzazione",402
"Piena implementazione del Fondo per la concessione di un credito di imposta per la ricerca e lo sviluppo istituito con l’ultima Legge di Stabilità, con particolare riferimento alle PMI",402
Prestito d’onore - credito allo studio,506
Esenzione fiscale totale sulle borse di studio sia per il beneficiario che per chi le finanzia,506
"Autonomia delle scuole nella scelta degli insegnanti, negli organici e nella gestione efficiente dell’offerta scolastica e formativa",506
"Valutazione di scuole, docenti e università al fine di favorire la meritocrazia",506
Avvio e sviluppo dell’agenda digitale nella scuola,506
"Favorire rapporto scuola-impresa anche sostenendo i percorsi di formazione professionale, sul modello delle scuole tecniche tedesche",506
Razionalizzare la distribuzione territoriale degli istituti e degli insegnamenti universitari,506
Agganciare la distribuzione del fondo di finanziamento ordinario per le università a parametri strutturati di qualità,506
Inizio del percorso educativo a 5 anni,506
Sviluppo e valorizzazione dell’inglese come linguadi insegnamento nei corsi di laurea,506
16 Welfare,999
"Modello di welfare basato sulla tradizione sussidiaria italiana e incentrato sul valore della persona, della famiglia, del lavoro e del rapporto con il territorio",504
Buono-dote o credito di imposta per la libera scelta nei servizi del welfare,504
Stabilizzazione e raddoppio del 5 per mille,606
Misure per favorire la conciliazione dei tempi di vita e lavoro delle famiglie,504
"Revisione e potenziamento degli strumenti previsti dalla Legge 328 del 2000, tramite incremento dei fondi ad essi destinati",504
Revisione Legge 180 del 1978 (emergenza salute mentale),504
Ripristino delle opportunità di accesso ai servizi pubblici a domanda individuale per i cittadini italiani,504
Casa e edilizia,999
Favorire l’acquisto e il riscatto da parte degli inquilini delle case degli enti pubblici,401
"Nuovo piano casa: a) realizzare alloggi di edilizia convenzionata, popolare, libera, in affitto agevolato attraverso incentivi fiscali, premi volumetrici, semplificazione delle procedure per il recupero di aree già edificate o dismesse",504
b) incentivare e agevolare il recupero del patrimonio immobiliare italiano per l’adeguamento a criteri di risparmio e di efficienza energetica e messa in sicurezza antisismica,501
Ripristino delle condizioni di parità per i cittadini italiani nelle assegnazioni degli alloggi di edilizia residenziale pubblica,504
Sospensione per due anni dell’imposta di registro sulla vendita tra privati di immobili utilizzati come prima casa e dimezzamento per gli altri immobili,402
Agenda digitale 2013-2017,999
"Piena applicazione, a ogni livello della PA, del Codice dell'Amministrazione Digitale",411
Scuola: compimento progetto “Scuola 2.0”,411
Rivedere i criteri per la definizione di start up  innovative e creazione di zone franche urbane nei capoluoghi di provincia dotati di adeguate infrastrutture,411
Libero accesso alle reti,411
"Realizzare il portale “Italia intelligente: il modello italiano”, dove raccogliere le migliori esperienze italiane e straniere",411
Portare a compimento la strategia di Open government e Open data avviata dal governo Berlusconi nell'ottobre 2011,411
"Portare a compimento la realizzazione del principio generale di trasparenza assoluta della Pubblica Amministrazione, con il coinvolgimento attivo dei cittadini",411
"Promuovere l'utilizzo del cloud computing nella pubblica amministrazione, per ridurre i costi dell’ICT e avere capacità di erogare servizi online a tutti",411
Diffondere capillarmente la banda larga e larghissima,411
Fatturazione elettronica,411
19 Giustizia,999
Separazione delle carriere tra magistrati inquirenti e giudicanti,202
Vera responsabilità civile dei magistrati,202
Carriera dei magistrati basata più sul merito che sulla anzianità.,303
Norme più liberali e garantiste su intercettazioni,201
Divieto di pubblicazione delle intercettazioni,201
Inappellabilità delle sentenze di assoluzione,202
Revisione e limitazione degli incarichi extragiudiziari dei magistrati,303
"Limitazione della carcerazione preventiva, maggior dignità per i cittadini detenuti e incentivazione del lavoro nelle carceri",201
Piena e totale implementazione dell’informatizzazione della giustizia e processo telematico,303
"Riduzione dei tempi della giustizia civile, penale e tributaria",303
"Attuazione del giusto processo, con pari dignità tra accusa e difesa",202
"Potenziamento della legislazione sui reati contro il patrimonio (furti in appartamenti e ville, rapine)",605
Istituzione di una sezione distaccata del Consiglio di Stato al Nord,301
20 Sicurezza,999
Prosecuzione dell’opera del Governo Berlusconi nel contrasto totale alla criminalità organizzata e piena e totale implementazione dell’Agenzia per i beni confiscati,605
"Incremento della lotta per la legalità, per il contrasto ai fenomeni della immigrazione clandestina, della criminalità predatoria",605
"Potenziamento delle forze dell’ordine, assicurando il massimo sostegno sia economico che logistico e attuando la specificità per gli operatori della sicurezza",605
"Realizzazione di un efficace presidio del territorio, attraverso il coinvolgimento di regioni ed enti locali nei “Patti territoriali per la sicurezza”",605
Valorizzazione della risorsa tecnologica sia per le forze dell’ordine sia incentivando i privati e gli enti locali,605
Rafforzamento degli accordi bilaterali fra stati per l’attuazione di politiche di rimpatrio effettivo degli immigrati clandestini e definizione degli accordi bilaterali per scontare la pena detentiva nei paesi d’origine,605
Nuova legislazione per combattere il degrado nelle aree metropolitane e incentivazione della cooperazione tra tutte le forze di polizia presenti con programmi di prevenzione situazionale,605
Maggiore impegno dello Stato sul fronte del reintegro sociale di chi è sinceramente intenzionato a cambiare condotta e a scegliere in maniera definitiva la via della legalità,605
"Cultura, sport e spettacolo",999
"Non può esserci un taglio indiscriminato delle risorse pubbliche, ancora essenziali nel settore, ma neppure una irragionevole chiusura all’apporto dei privati",502
Finalizzare gli introiti prodotti dai beni culturali agli investimenti sulla cultura,502
Valorizzare “l’esistente invisibile”: i musei italiani svuotino le cantine,502
Avviare la sperimentazione dell’affidamento in concessione ai privati dei musei più in difficoltà,502
Riforma organica della fiscalità delle associazioni sportive dilettantistiche per la promozione dello sport di base,502
Agevolazioni fiscali per investimenti di privati nella costruzione di impianti sportivi di riconosciuto interesse generale,502
Separazione tra cultura e spettacolo nell’assegnazione di risorse pubbliche,502
"In 5 anni, rapporto debito-Pil sotto quota 100%",414
"Attacco complessivo al debito pubblico da 400 miliardi, basato su: vendita di immobili pubblici; messa sul mercato anche di partecipazioni azionarie pubbliche sia statali che locali; valorizzazione delle concessioni demaniali;",401
convenzioni fiscali con la Svizzera per le attività finanziarie detenute in quel Paese,414
Tendenziale dimezzamento degli oneri del servizio del debito in 5 anni,414
Costituzione di un grande fondo obbligazionario a cui lo Stato conferisca parte del suo patrimonio pubblico,401
"A tutela degli interessi nazionali, rigoroso criterio di reciprocità con gli altri Paesi, per evitare attacchi a danno delle aziende strategiche; privatizzare sì, svendere no",403
23 Piano di attacco alla spesa pubblicaeccessiva e improduttiva,999
"Intervento di forte riduzione della spesa pubblica, per unrisparmio di almeno 16 miliardi all’anno",303
Riduzione di una quota pari al 3% delle attualiTax expenditures,303
Ogni legge di spesa deve avere una scadenza(Sunset legislation),303
"Questo programma è il nostro impegno nella legislatura2013-2018 per promuovere lo sviluppo,la crescita e la modernizzazione del Paese.",305
