Text,Code
ELEZIONI 2018 · PROGRAMMA DI GOVERNO,999
TASSE,999
"Pagare tutti, pagare meno.",999
E l’Italia riparte.,999
FLAT TAX,999
"Riforma del Testo Unico delle Imposte sul Reddito per superare il sistema ad aliquote multiple, scaglioni, detrazioni, deduzioni e bonus e introdurre un’unica aliquota fiscale coerente con la necessità di portare ristoro tributario alla maggior parte dei contribuenti a partire dai ceti meno abbienti, rispettando le esigenze di finanza pubblica previste dalla Legge.",503
L’aliquota più congeniale a tale scopo è stata individuata al 15% e si applicherà al reddito famigliare.,704
Soltanto due saranno gli scaglioni per l’ottenimento di una deduzione fissa di 3.000 euro.,303
Il primo scaglione è formato da tutti i redditi famigliari fino a 35.000 euro entro il quale ad ogni componente il nucleo famigliare spetta la deduzione,704
e il secondo scaglione invece da 35.000 a 50.000 euro che prevede la deduzione fissa solo per i famigliari a carico.,704
"Sono aboliti tutti gli obblighi di mantenimento della documentazione fiscale ai fini dell’ottenimento di detrazioni, deduzioni e bonus a vario titolo.",303
"Niente più scartoffie, scontrini e ricevute da portare al commercialista.",303
"La deduzione fissa di 3.000 euro per i due scaglioni di reddito garantisce il rispetto del criterio costituzionale della progressività,",303
che viene altresì rafforzato dal mantenimento di una No Tax Area fino a 7.000 euro,704
e di una clausola di Salvaguardia per tutti i redditi famigliari fino a 15.000 euro i quali potranno continuare ad essere assoggettati al regime di imposta vigente nel caso il nuovo non fosse migliorativo.,704
L’aliquota al 15% e l’intera riforma del sistema tributario è la soluzione più efficace in considerazione della tipologia dei contribuenti italiani e delle loro aliquote effettive d’imposta.,303
"Un’aliquota superiore potrebbe infatti lasciare esclusi dal beneficio fiscale molti milioni di contribuenti che oggi godono dell’aliquota minima del 23% che può scendere sino al 15,13% di aliquota effettiva in presenza di particolari detrazioni e deduzioni.",704
"Per tutte le informazioni sulla nostra proposta di Flat Tax, sulle coperture, la Costituzionalità e i vantaggi, è disponibile il sito www.tassaunica.it",000
ABOLIZIONE DELL’INVERSIONE DELL’ONERE DELLA PROVA IN MATERIA TRIBUTARIA.,999
Oggi il contribuente è in una condizione di forte svantaggio nei confronti dello Stato che gli contesta un’infedeltà fiscale.,403
"Tant’è che ogni contribuente che riceve una contestazione in merito a mancati pagamenti di imposta, può impugnare di fronte alla Commissione Tributaria il provvedimento dell’Agenzia delle Entrate ma solo a patto che versi a titolo di cauzione almeno un terzo della cifra contestata.",403
Successivamente se il contribuente dovesse ottenere l’annullamento del provvedimento lo Stato non rimborserà la cifra versata a titolo di cauzione ma la manterrà come anticipo per le imposte successive.,403
Questo sistema sarà abolito.,403
Non sarà più il contribuente a dover dimostrare a proprie spese la sua innocenza davanti allo Stato ma al contrario sarà lo Stato a SUE spese a dover eventualmente dimostrare la colpevolezza del contribuente e quindi pretendere il pagamento del dovuto.,403
PACE FISCALE,999
Equitalia ha accumulato crediti per 1058 miliardi di euro verso quasi 21 milioni di contribuenti.,503
"138 miliardi di euro sono dovuti da soggetti falliti, 78 miliardi di euro da persone decedute e imprese cessate.",503
E per altri 28 miliardi di euro “la riscossione è sospesa per forme di autotutela”.,503
314 miliardi sono richiesti a soggetti nullatenenti.,503
"Il risultato, se si vuole escludere totalmente i cosiddetti nullatenenti, è che restano 650 miliardi di euro che potrebbero essere riscossi a condizione che le modalità siano effettivamente percorribili.",503
Noi proponiamo per tutti coloro che si trovano in situazioni di disagio economico di poter comunque chiudere per sempre la loro posizione con il Fisco e poter tornare così ad essere attivi nella società.,503
Questi contribuenti potranno pagare a seconda della situazione in cui si trovano da un minimo del 6% ad un massimo del 25% del dovuto con un’aliquota intermedia del 10%.,503
Un provvedimento che potrebbe portare nelle casse dello Stato 60 miliardi di Extragettito in 2 anni.,503
Denaro che con le procedure attuali resterebbe irrecuperabile.,503
Il saldo e stralcio non è un regalo agli evasori.,503
"Il provvedimento esclude i “grandi” contribuenti, ma sarà efficace solo per coloro che a causa della pesante recessione economica non hanno potuto pagare in tutto o in parte le imposte fino ad un tetto massimo di 200.000 euro comprensivo di sanzioni, interessi e more.",503
Esempio: L’ex commerciante che negli ultimi anni di attività incassava a malapena per far sopravvivere la sua famiglia.,503
Poi ha chiuso l’attività e gli sono arrivate tutte le cartelle.,503
È ovvio che quando a fine anno (nonostante la dichiarazione regolare) lo Stato gli ha chiesto di pagare lui non sapeva dove prendere i soldi.,503
Ora lavora in nero perché se avesse entrate in bianco gli verrebbero portate via dallo Stato e non saprebbe come sfamare la famiglia e quindi non solo non paga il passato ma non contribuisce neppure al presente.,503
Ed è il primo a non essere contento di questa situazione ma non vede nessuna via d’uscita.,503
STUDI DI SETTORE,999
Abolizione di ogni forma di “pagella” fiscale volta a voler pre-determinare il reddito imponibile e quindi l’imposta per gli autonomi.,401
La dichiarazione del contribuente deve essere sempre ritenuta fedele da parte dello Stato che non ha il diritto di entrare nel merito dell’andamento dell’attività economica.,401
L’Agenzia delle Entrate potrà sempre contestare condotte in danno all’erario che debbono però essere diligentemente e oggettivamente dimostrate in sede di verifica fiscale.,401
CONTENZIOSO TRIBUTARIO,999
Revisione della procedura e struttura di giustizia tributaria (Commissioni Tributarie Provinciali e Regionali).,303
"Rispettando il principio del “giusto” processo (art. 111 Cost.), si vuole garantire e valorizzare le competenze professionali specifiche dei collegi giudicanti istituendo un Ruolo Autonomo con l’obiettivo di aumentare la coerenza nei giudizi e raggiungere un giusto adeguamento dei compensi per i magistrati tributari.",303
I nuovi organi della giustizia tributaria potranno cambiare denominazione in “Tribunali Tributari e Corti d’Appello Tributarie”.,303
"I Tribunali Tributari dovranno avere sede presso le attuali circoscrizioni dei Tribunali ordinari articolandosi in sezioni, specializzate anche per materia.",303
Le Corti d’Appello Tributarie dovranno avere sede presso gli attuali distretti di Corte d’Appello.,303
"Inoltre deve essere tolto il potere di organizzare e gestire le Commissioni Tributarie e le nomine dei giudici al MEF,",303
"conferendolo alla Presidenza del Consiglio dei Ministri, più terza ed imparziale rispetto al MEF;",303
EVASIONE FISCALE,999
Con l’entrata in vigore del nuovo sistema fiscale (Flat Tax) aumenteranno le sanzioni relative all’infedeltà fiscale.,605
Introduzione di sanzioni amministrative che prevedono tra le altre il ritiro della patente di guida e del passaporto fino a 3 anni.,605
VERIFICA TRIBUTARIA,999
Tempi certi di durata a pena di decadenza;,303
contraddittorio preventivo sempre;,303
maggiore tutela del segreto professionale.,704
Autorizzazione alle verifiche fiscali amministrative concesse dal magistrato giudicante e non dal magistrato inquirente.,303
Eliminazione di eventuali incentivi (bonus) legati ai valori accertati.,605
"Sanzione all’Agenzia delle Entrate in caso di successivo annullamento in contenzioso di accertamento palesemente infondato, applicata dal giudice.",605
Modifica dello split payment rendendo neutra l’applicazione dell’IVA su tutta la filiera di produzione.,303
PENSIONI,999
La pensione è un diritto non negoziabile per chi ha lavorato una vita.,999
E’ dovere dello Stato garantirla senza cambi in corsa.,999
Reintroduzione delle PENSIONI di ANZIANITA’ (accesso alla pensione con più di 40 anni di contribuzione a prescindere dall’età anagrafica),504
QUOTA 100 senza penalizzazioni (accesso alla pensione al raggiungimento di quota 100 quale somma di età anagrafica + età contributiva) + QUOTA 41 (accesso alla pensione con solo l’anzianità contributiva),701
PENSIONI di VECCHIAIA  ante Fornero,504
Si propone quindi di: 1) Cristallizzare l’adeguamento dei requisiti pensionistici alla speranza di vita;,504
2) ripristinare i 41 anni di anzianità contributiva massima con non più di 3 anni di contribuzione figurativa;,701
"3) Equiparazione delle aliquote di versamento per i parasubordinati a quelle di artigiani, commercianti e agricoli che devono essere bloccate al 23%;",701
"4) Riduzione del parametro di 2,8 volte l’assegno sociale a 1,8 volte;",701
5) Per le donne madri riduzione della età di pensionamento o dell’anzianità contributiva di 9 mesi per ogni figlio con un massimo di 3.,701
6) Reintroduzione del cosiddetto super bonus.,701
7) Revisione degli importi delle pensioni di invalidità equiparati alle pensioni e assegni sociali,503
accelerando di pari passo i controlli e le verifiche sulle concessioni non giustificate da situazione sanitarie.,503
8) Revisione tabella F pensioni di invalidità.,503
9) Ultima salvaguardia per la platea di esodati esclusi dai precedenti otto provvedimenti.,701
10) Opzione donna: proroga per tutto il 2018.,504
Ovviamente questi provvedimenti implicano oneri strutturali e quindi richiedono coperture finanziarie strutturali che potranno essere reperite con i seguenti provvedimenti:,303
"Eliminazione dell’Agenzia Nazionale dell’Ispettorato nella quale sono confluiti gli ispettori del Lavoro, dell’Inps e parte dell’Inail;",303
"con provvedimento del Governo Renzi, l’Agenzia oggi è una entità autonoma vigilata dal Ministero del Lavoro da cui provengono personale e ispettori.",303
L’agenzia confluisce in Inps con risparmi notevoli sui costi di gestione ma soprattutto sull’efficacia dei controlli che per gran parte riguardano la regolarità contrattuale e contributiva.,303
"Unificazione di tutto il corpo medico attualmente in Inps, nell’Inail alla quale è affidato il compito di accertare le invalidità civili e gli assegni di accompagnamento nonché tutte le “cause di servizio” di tutto il personale pubblico comprese le forze armate.",303
E’ contestualmente abolita la possibilità di assegnare le pensioni di invalidità a commissioni regionali.,302
Istituzione di una anagrafe generale dell’assistenza nella quale inserire tutte le prestazioni erogate da organismi centrali e territoriali;,303
da solo questo provvedimento può far risparmiare circa 5 miliardi l’anno.,303
Anticipo pensione/ flessibilità: rivedere i meccanismi relativi all’Anticipo pensione (APE) e all’anticipo sui fondi pensione chiamato RITA;,701
revisione dei fondi di solidarietà.,504
Questi provvedimenti 3possono favorire la flessibilità in uscita senza aggravi per la finanza pubblica.,701
"Decontribuzione: eliminare qualsiasi forma di decontribuzione ai fini previdenziali che oltre ad essere fortemente diseducativa, non genera nuovi posti di lavoro se non nell’immediato da sostituire con “credito d’imposta” che evita il rischio di finanziare attività di comodo o decotte.",701
TESTO UNICO PER LE PENSIONI,999
Per una semplice questione di civiltà sarebbe utile la realizzazione di un Testo Unico semplificato che raccoglie tutte le norme pensionistiche.,303
IMMIGRAZIONE,999
Nessuno deve sentirsi costretto a lasciare il proprio Paese e le proprie radici per ragioni economiche.,999
"Possiamo davvero aiutare le aree del pianeta più svantaggiate sostenendo progetti in loco,",999
non certo accogliendo tutti.,999
L’Africa in Italia non ci sta!,999
REGOLAMENTAZIONE DELL’IMMIGRAZIONE E RIMPATRI,999
Rifondare e implementare il numero dei Centri di Identificazione ed Espulsione (CIE) in non meno di uno per ogni Regione,601
"e, contestualmente, prolungare il termine per il trattenimento almeno sino a 6 mesi, al fine di rendere eseguibile l’espulsione;",601
Prevedere che la circostanza dell’assenza di documenti per i richiedenti asilo comporti il trattenimento presso il CIE ai fini dell’identificazione in osservanza delle direttive comunitarie,601
e chiedere che lo Stato italiano si faccia portavoce in ambito Europeo per estendere la possibilità di trattenimento sino al completamento della procedura di richiesta di asilo.,601
"Trasferire le competenze per il controllo e la gestione dei CIE alle Regioni con il coordinamento delle forze dell’ordine sul territorio, come avviene attualmente nella regione Sicilia.",301
Prevedere la condivisione delle banche dati (AFIS e SDI) con la Polizia locale.,605
Gestione dei centri di accoglienza da parte delle Regioni e non con affidamento a privati in specie cooperative.,301
"In ogni caso trasparenza nella gestione dei centri di accoglienza, rendicontazione delle spese e controllo rigoroso degli ospitati, con la tenuta aggiornata dei registri degli ospiti.",303
"Le Regioni, mantenendo per sé ampi poteri di controllo e revoca delle convenzioni, potranno affidarsi nella gestione dei richiedenti asilo solo a soggetti di esperienza certificata e consolidata nel campo dell’accoglienza che saranno raccolti in un apposito albo.",303
"Spingere i paesi di origine a sottoscrivere gli accordi bilaterali per i rimpatri, a fronte di accordi economici;",601
(Denuncia degli accordi internazioni di aiuto per i Paesi non collaborativi),107
Valutare di avanzare esposto contro il Governo per omissione reiterata nell’applicazione della legge che regolamenta l’immigrazione,601
e per mancato controllo delle frontiere.,601
PROTEZIONE INTERNAZIONALE,999
Revoca dell’accordo Renzi-Alfano sulle regole d’ingaggio nel progetto “Triton”;,107
"Valutare la possibilità di fare dei centri di accoglienza nei Paesi sicuri vicini alla Libia sotto l’egida dell’ONU, con cui l’Italia deve farsi parte proponente",601
"(in subordine, valutare anche la possibilità di fare centri di accoglienza in Tunisia, come già sviluppato dall’imprenditore Ernesto Vita con ricollocazione dei migranti a Djerba negli alberghi svuotati dai timori degli attentati.",601
Progetto che prevede la ricollocazione di almeno 500.000 persone con spesa per migrante con tutti i confort di € 24 al giorno).,601
"Il costo di entrambe le proposte è posto a carico di un fondo europeo, sul modello di quello utilizzato per sostenere l’accoglienza in Turchia.",601
Diniego allo sbarco per le ONG che si pongono ai margini del mare territoriale libico per procurato allarme su naufragio autoindotto e che prelude allo sfruttamento dell’immigrazione clandestina.,601
Divieto comunque di sbarco dalle navi ONG per i passeggeri che non sono muniti di documenti identificativi.,601
"Approvare il DDL 3657/2016 proposto dalla Lega Nord (primo firmatario On. Fedriga) sulle modifiche alla procedura per il riconoscimento o la revoca dello status di rifugiato che prevede la cancellazione delle commissioni territoriali e la competenza del Giudice Onorario di Pace, a fini di una maggiore economicità e velocizzazione delle procedure, in osservanza dei diritti costituzionalmente garantiti;",303
"Prevedere la perdita di diritto alla domanda di protezione internazionale e la revoca, qualora già concessa, nel caso di commissione di reati come reati in materia di terrorismo, spaccio di sostanze stupefacenti, rapina, violenza, danneggiamento, occupazione di edifici e terreni,",601
nonchè revoca dei benefici anche in caso di inosservanza delle regole del centro di accoglienza.,601
Predisporre una lista dei Paesi ritenuti sicuri come limite all’accoglimento alle domande di protezione internazionale.,601
Sulla scorta della recente decisione della Corte di Giustizia UE indirizzare le nuove domande di asilo ad altri Paesi stante il numero eccezionale che determina “il rischio concreto di non poter far fronte alla situazione”.,601
"Effettuare accordi anche con le Tribù del sud della Libia, e chiedere la collaborazione della Russia per eventuali accordi con il generale Khalif Haftar.",601
"Applicazione del protocollo spagnolo per il controllo rigoroso delle frontiere sul mare, con strumenti tecnologici e conseguente esternalizzazione delle frontiere.",601
Prevedere un vincolo di bilancio secondo il quale per il  “rifugiato” lo Stato non potrà impegnare risorse superiori a quelle destinate ad una pensione d’invalidità al 100% di un cittadino italiano.,601
"Non sarà inoltre possibile stabilire maggiori contributi per l’accoglienza degli stranieri rispetto a quelli rivolti alle politiche a sostegno degli italiani in povertà che, secondo l’Istat, sono circa 8 milioni, di cui 1 milione e 600.000 famiglie in povertà assoluta (che corrispondono a quattro milioni e mezzo di cittadini).",601
Soprattutto famiglie con 3 o più figli che dovrebbero essere al contrario tutelate più delle altre ai fini di una politica demografica positiva.,601
"Revocare la delibera dell’ex Ministro Alfano che concede la facoltà di rilasciare la carta di identità ai migranti, per farli accedere all’assistenza dei singoli Comuni.",601
Impegno ad ospitare in Italia una conferenza di pace permanente sulla Libia coinvolgendo tutte le forze coinvolte nella guerra civile.,601
REATI DI IMMIGRAZIONE IRREGOLARE,999
"Prevedere una nuova fattispecie di reato specifica finalizzata a sventare le organizzazioni internazionali per la tratta degli esseri umani e ampliare la facoltà di utilizzo di prove anche al di fuori di quelle raccolte dalla polizia giudiziaria, includendo anche quelle della polizia giudiziaria di altri paesi europei,",605
per il contrasto all’immigrazione clandestina stante la natura extranazionale del comportamento commissivo e la necessità di prevenire atti terroristici.,601
Stabilire la facoltà per la polizia giudiziaria di raccogliere prove sul contrasto all’immigrazione clandestina attraverso la presenza di personale sulle navi ONG,601
e vietare lo sbarco a quelle che la rifiutano.,601
Espulsione dei carcerati extracomunitari con facoltà di fare accordo con i Paesi di origine nel periodo di detenzione ed espulsione con accompagnamento.,601
PERMESSO DI SOGGIORNO,999
"Rivedere il sistema delle quote per adottare meccanismi di mercato, subordinando le richieste alla verifica della disponibilità dei cittadini italiani, come la chiamata diretta e nominativa, lasciando le quote agli stagionali.",601
"Affidare ai Comuni, con il coordinamento delle Regioni e non alle Questure, la competenza a rilasciare il permesso di soggiorno di breve periodo al fine di velocizzare le procedure e garantire un maggiore controllo delle polizie locali sul fenomeno dell’immigrazione e della permanenza regolare di cittadini di paesi terzi, in analogia a quanto accade in Germania, dove il rilascio dell’Aufenthaltserlaubnis (permesso di soggiorno di breve periodo) è di competenza dell’Ufficio immigrazione locale (Einwohnermeldeamt);",301
"Affidare alla Direzioni provinciali del Ministero del Lavoro (o all’assessorato scuola, formazione professionale, università e ricerca e lavoro delle Regioni) e non alle Prefetture le funzioni di disbrigo delle pratiche di prima assunzione dei lavoratori stranieri, di ricongiungimento familiare e di conversione del permesso di soggiorno;",301
"Prevedere che le Questure rilascino le informative ai Comuni (Casellario, rilievi A.F.I.S., riscontri S.D.I.) finalizzati al rilascio del permesso di soggiorno.",303
SOGGIORNO E CITTADINANZA,999
"Prevedere il divieto della possibilità di ottenere l’accesso ai benefici assistenziali (richiesta case popolari, sgravi contributivi ecc.) per gli immigrati extracomunitari attraverso semplici autodichiarazioni ed uniformare la normativa con quella in vigore per i cittadini italiani.",601
"Mantenimento dell’attuale Legge 91/1992, ma inserire nel procedimento di naturalizzazione, ai fini della cittadinanza, non solo la residenza di 10 anni, ma anche un esame di conoscenza della lingua, della cultura e tradizioni italiane, ai fini della valutazione di integrazione complessiva",607
"e prevedere la revoca della cittadinanza italiana per i soggetti responsabili di terrorismo islamico o apologia del terrorismo islamico, quale strumento di sicurezza sociale.",605
RAPPORTO CON L’ISLAM,999
La radicalizzazione si combatte ribadendo che nello Stato italiano la libertà di professare il proprio culto va esercitata nel pieno rispetto di tutti gli altri principi costituzionali.,607
La legge italiana non può essere disattesa abusando del concetto di libertà religiosa o di democrazia:,607
quest’ultima si fonda prima di tutto sul rispetto delle leggi che devono essere uguali per tutti.,202
"Deve esserci perciò l’osservanza e applicazione rigida della legge ai musulmani per quanto vietato anche ai cittadini italiani, e quindi:",607
divieto della poligamia;,607
bocciatura per gli studenti che rifiutano di partecipare a determinate materie obbligatorie o che rifiutano il dovuto rispetto per i superiori di sesso femminile;,607
"divieto di occupare il suolo pubblico per pregare,",607
"chiusura dei circoli culturali abusivi,",607
"divieto di prevedere trattamenti diversi in ragione di assunte regole religiose nei servizi pubblici, come ospedali, pubbliche amministrazioni, mense ecc.;",607
divieto di regole finanziarie o fiscali diverse da quelle del Paese:,607
"revoca, quindi, dell’accordo tra Coreis (Comunità religiosa islamica italiana) ed Ente Nazionale per il Microcredito, che prevede uno stanziamento di fondi pubblici per incoraggiare l’impresa islamica in Italia e aiutare gli immigrati per l’acquisto della casa (si parla di 10.000 a 25.000 euro per ogni impresa).",607
"Obbligo di trasparenza degli investimenti provenienti da alcuni Paesi come Qatar, Arabia Saudita, ecc.",607
"Divieto dell’istituzione di partiti che si caratterizzano per essere rivolti solo a mussulmani e a tutelare solo tale categoria di soggetti, in quanto incostituzionali e contrari alla legge italiana.",607
"In sintesi, vera integrazione che può attuarsi solo attraverso il rigoroso rispetto della legge italiana ed il rapporto paritario con i cittadini italiani.",607
EUROPA,999
"Sì all’Europa dei popoli, della pace e della libertà.",999
No all’Europa dei burocrati e degli speculatori.,999
RITORNARE ALLO STATO PRE-MAASTRICHT,999
L’Italia non può uscire dall’Europa.,108
"L’Italia appartiene al continente europeo per sua stessa natura geografica e, anzi, la sua posizione è assolutamente strategica all’interno del bacino del Mediterraneo.",108
Altra cosa è invece l’Unione Europea.,108
"Ossia un gigantesco ente sovranazionale, privo di una vera legittimazione democratica",108
e strutturato attraverso una tentacolare struttura burocratica che detta l’agenda ai nostri Governi anche a scapito della tutela fisica ed economica dei cittadini dei singoli Stati membri.,108
"Noi vogliamo restare all’interno dell’Unione Europea solo a condizione di ridiscutere tutti i Trattati che pongono vincoli all’esercizio della nostra piena e legittima sovranità,",108
tornando di fatto alla Comunità Economia Europea precedente al Trattato di Maastrich.,108
"L’euro è la principale causa del nostro declino economico, una moneta disegnata su misura per Germania e multinazionali e contraria alla necessità dell’Italia e della piccola impresa.",108
Abbiamo sempre cercato partner in Europa per avviare un percorso condiviso di uscita concordata.,108
"Continueremo a farlo e, nel frattempo, faremo ogni cosa per essere preparati e in sicurezza in modo da gestire da un punto di forza le nostre autonome richieste per un recupero di sovranità.",108
LA COSTITUZIONE COME GARANZIA DI SOVRANITÀ,999
La nostra Costituzione definisce chiaramente nei suoi Principi Fondamentali (art. 11) che l’Italia può rinunciare a spazi di sovranità in favore di organizzazioni internazionali che abbiano quale obiettivo il raggiungimento della pace e della giustizia fra le nazioni.,108
La Ue non rientra tra queste organizzazioni.,108
"Per questo motivo anche la Corte Costituzionale tedesca, che pure ha una Costituzione che mette dei paletti alla cessione di sovranità, ha chiarito che qualunque norma o Trattato Europeo sia in contrasto con la Costituzione deve essere respinto.",108
INVERTIRE IL MODELLO BASATO SULLA COMPRESSIONE DEI SALARI,999
"Il nostro modello di sviluppo parte dal recupero della DOMANDA INTERNA,",406
"contrastando l’idea tedesca di cercare la competitività pagando sempre meno i lavoratori,",701
"azzerando i diritti con il jobs act,",701
"riforme Hartz,",701
o importando milioni di lavoratori disposti ad accontentarsi un salario sempre minore.,406
Vogliamo incentivare il rientro delle aziende che hanno delocalizzato negli ultimi 10 anni attraverso una profonda rivoluzione del sistema fiscale con la Flat Tax al 15%,402
"e INVESTIMENTI PUBBLICI PRODUTTIVI in particolare per il Sud,",402
"mediante costruzione di infrastrutture (vedi rilancio porti),",411
"manutenzione del territorio,",411
"reindustrializzazione ma anche dando impulso alle attività immateriali a forte moltiplicatore come ad esempio la ricerca scientifica, la cultura, l’arte e il turismo.",411
REVISIONE DEI TRATTATI EUROPEI,999
"Ritorno quantomeno allo status pre-Maastricht, ovvero a una forma di libera e pacifica cooperazione tra Stati di natura prettamente economica;",108
"è indispensabile una profonda correzione del funzionamento del mercato interno, tesa a:",108
debellare i fenomeni di dumping interno all’Unione;,108
