Text,Code
"FONDO VITTIME: aumentare in modo considerevole l’indennizzo delle vittime di reati violenti, oggi previsto in modo assai esiguo, e conseguentemente incrementare le risorse a disposizione, modificando la legge 122 istitutiva del fondo medesimo (il fondo diventerà autonomo) prevedendo criteri di equo indennizzo più ampi a beneficio delle vittime di reati;",706
CERTEZZA DELLA PENA,999
Eliminare gli effetti dei diversi provvedimenti dei Governi di Sinistra precedenti “svuotacarceri” e “salvadelinquenti” che hanno prodotto solo la scarcerazione di diversi detenuti causando un grave allarme sociale tra i cittadini;,605
"Modificare la legge n. 67 del 2014 e precisamente abrogare i decreti legislativi nn. 7 e 8 del 2016 che hanno depenalizzato una lunga serie di reati che destano invece grave allarme sociale e rendono precaria la sicurezza dei cittadini, così consentendo tra l’altro di ripristinare reati come atti osceni in luogo pubblico, danneggiamento semplice, falso in atti privati, etc.;",605
"Modificare il D.lgs. n. 28 del 2015 abrogando le ipotesi previste di non punibilità per particolare tenuità del fatto, frutto sempre della legge n. 67 del 2014;",605
"Abrogare gli articoli del codice penale e di procedura penale che hanno introdotto l’istituto della messa alla prova, affinché si eviti che reati gravi punti con pene edittali (4 anni più quelli di cui all’art. 550, comma 2, c.p.p.) possano essere dichiarati estinti con un semplice lavoro di pubblica utilità;",605
Abrogare l’articolo 162-ter del codice penale in tema di estinzione del reato per condotte riparatorie in modo che per i reati punti a querela non si possa ottenere l’estinzione pagando una certa somma anche se la parte offesa non risulta essere d’accordo.,605
CORRUZIONE,999
Aumentare le pene in relazione ai reati corruttivi e prevedere un sistema che non consenta di accedere per questi reati ai riti alternativi (patteggiamento e abbreviato) e quindi l’applicazione automatica di sconti di pena;,304
Interdizione da pubblici uffici per i corrotti (politici e funzionari) a vita;,304
Divieto di finanziamento o contributi da cooperative sociali ai politici;,304
Maggiore trasparenza e tracciabilità dei flussi finanziari di fondazione politiche e delle cooperative sociali;,304
Riportare l’affidamento in prova ai tre anni e quindi galera certa per i corrotti;,304
Introduzione della figura dell’agente provocatore in materia dei reati corruttivi;,304
Modifica della legge Severino sia sulla parte della prevenzione sia sulla parte della repressione.,304
Non ha prodotto nessun effetto di contrasto alla corruzione auspicato.,203
Inefficace.,203
"CIVILE, PROCEDURA CIVILE E COSTI GIUSTIZIA",999
"Riforma del codice di procedura civile al fine di snellire il processo anche improntando il rito ordinario alle norme del rito del lavoro, rito quest’ultimo già applicato da molti anni e che ha sempre assicurato tempi veloci di risposta della giustizia;",303
Valorizzazione ed obbligatorietà dell’istituto di conciliazione davanti al giudice il quale deve formulare una proposta conciliativa alle parti;,303
"Riforma dei riti cautelari e dei riti speciali, uniformando il sistema a norme snelle e improntate alla semplificazione, pur sempre garantendo il diritto di difesa;",303
Uniformare i riti della procedura di separazione e di divorzio;,303
Riforma dell’intero sistema sull’esecuzione forzata oggi farraginoso e lento con svalutazione enorme dei valori dei beni pignorati;,303
Impignorabilità della prima casa;,201
"Modificare il sistema attuale che consente alle banche di aggiudicarsi direttamente gli immobili pignorati ai clienti che non sono riusciti a pagare il mutuo nel caso di aste deserte diventando, nei fatti, anche delle agenzie immobiliari;",403
Sviluppare ulteriormente l’istituto della “class action” in modo da tutelare maggiormente i consumatori;,403
Rideterminazione dei valori dei contributi unificati (che sono quelli che si versano per poter iniziare una causa) oggi molto elevati e che nei fatti provocano per le persone meno agiate una desistenza economica.,403
"Modifica dell’articolo 2043 del codice civile al fine di precludere la possibilità per i malviventi e per i loro familiari di chiedere i danni in un processo civile, ma anche di costituirsi parte civile nel processo che veda indagato chi si è difeso.",605
"In altre parole, se il danno è cagionato in occasione della condotta dolosa illecita del danneggiato contro la persona del danneggiante o dei suoi familiari o ausiliari, nonché contro i suoi beni o il suo domicilio, o il suo lavoro, non è dovuto alcun risarcimento per il danneggiato e per i suoi eredi, che, conseguentemente, non potranno né proporre azione civile, né costituirsi parte civile in sede penale.",605
FAMIGLIA,999
Rivisitazione e riforma degli istituti di diritto di famiglia in sede di separazione e divorzio in merito all’affidamento condiviso dei figli nel senso di renderlo effettivo e di assicurare la valorizzazione delle figure genitoriale anche paterna.,603
Introdurre parametri oggettivi al fine di eliminare una eventuale discrezionalità nella decisione da parte del magistrato.,603
"Assicurare la permanenza del figlio con tempi paritari tra i genitori, rivalutando anche il mantenimento in forma diretta (ognuno provvederà al mantenimento del figlio senza corrispondere all’altro alcun sostentamento).",603
"Su questo, come è risaputo, esiste un grave problema sociale di padri separati ridotti in povertà;",706
"Premesso che vi sono molti matrimoni con cittadini stranieri, occorre prevedere effettive misure sanzionatorie efficaci ed effettive che condannino la sottrazione internazionale del minorenne, poiché abbiamo assistito a molti casi di figli minori rapiti dai genitori stranieri e portati in un paese straniero.",706
ORDINAMENTO PENITENZIARIO E PERSONALE,999
Completa e piena attuazione di un “piano straordinario per le carceri” con investimenti straordinari sull’edilizia penitenziaria (sia nuove strutture che ampliamento padiglioni esistenti) e messa in sicurezza o in funzione delle (38) “carceri fantasma” strutture esistenti che potrebbero essere utilizzate come istituti di pena al fine di aumentare la capienza dei posti;,605
"prevedere, anche con normative emergenziali, un piano di nuove assunzioni di agenti di polizia penitenziaria, tenuto conto che l’organico risulta scoperto di almeno 8.000 unità;",605
porre in essere in relazione al personale di polizia penitenziaria tutte le azioni necessarie affinché si proceda al rinnovo del contratto di lavoro ormai scaduto da quasi 10 anni oltre ad una corretta rimodulazione del provvedimento di “riordino delle carriere”;,605
"rivedere il sistema di vigilanza dinamica (rivedere l’apertura delle celle per 8 ore al giorno) all’interno delle carceri (tenuto conto che la stessa consente la radicalizzazione) e il regime penitenziario aperto al fine di prevederne l’eliminazione, oltre a ripristinare il servizio di sentinelle di sorveglianza dalle mura del carcere,",605
nonché revocare l’accordo con l’UCOII in relazione agli Imam che entrano nelle carceri tenuto conto che detti Imam non possano essere considerati Imam “moderati”;,607
"attuare accordi bilaterali in essere ed un deciso impegno nella stipula di nuovi accordi bilaterali con altri Stati, affinché i detenuti stranieri scontino la pena nei Paesi di origine, tenuto conto che attualmente circa il 35% dei detenuti sono stranieri, con punte, nelle case di reclusione del Nord anche oltre il 50 per cento, e ciò anche al fine di evitare eventuali radicalizzazioni;",607
"rivedere ed implementare il piano di attività lavorative all’interno delle carceri con funzione rieducativa del reo e scomputare, come avviene in Germania, dalla busta paga del detenuto il costo di mantenimento dello stesso in carcere partecipando quindi alle spese di vitto e alloggio;",605
cancellazione del “reato di Tortura” penalizzante per l’attività delle forze dell’ordine;,605
revisione totale nel nuovo progetto di modifica dell’ordinamento penitenziario in via di approvazione in sede legislativa previsto dalla legge delega della riforma del processo penale ivi compreso il regime del 41 bis oggi reso più favorevole ai criminali.,605
AMBIENTE,999
Uomo e ambiente sono facce della stessa medaglia.,999
Chi non rispetta l’ambiente non rispetta se stesso.,999
"Per troppi anni l’ambientalismo si è rivolto soltanto ad una parte limitata e schierata della popolazione, dimenticando colpevolmente che le tematiche ambientali sono universali e trasversali.",501
"C’è bisogno di una maggior coinvolgimento e conoscenza dei temi ambientali, che sappia parlare a 360 gradi a tutti i cittadini, capace anche di costruire alleanze e di portare la questione ecologica al centro della politica.",501
"Partendo da questa convinzione, il nostro compito è di sostenere la “green-economy”, sostenendo la ricerca, l’innovazione e la formazione per lo sviluppo del lavoro ecologico e per la rinascita della competitività del nostro sistema industriale.",501
Vanno ribaditi e rinnovati i limiti indicati dal principio di sostenibilità:,501
"per una risorsa rinnovabile (suoli, acqua, foreste,), la percentuale sostenibile di impiego non può essere maggiore di quella di rigenerazione;",501
"per una risorsa non rinnovabile (combustibili fossili, giacimenti minerari, acque sotterranee), la percentuale sostenibile di impiego non può essere maggiore di quella con la quale è possibile rimpiazzarla con una risorsa rinnovabile (ad esempio: investire parte dei profitti per l’adozione di tecnologie produttive con risorse rinnovabili).",501
I temi principali sono:,501
GREEN ECONOMY,999
"Nelle strategie nazionali di sviluppo economico deve considerarsi prioritaria l’adozione di strumenti normativi efficaci atti a promuovere una sempre maggior diffusione di modelli di sviluppo sostenibili, della Green Economy e dell’Economia circolare.",501
"A tal fine le PA dovrebbero essere coinvolte a tutti i livelli nella promozione di questo cambiamento e diventare un riferimento per l’adozione di buone pratiche, migliori tecniche e standard.",301
"È necessario armonizzare i rapporti tra lo Stato e le PA, rafforzando le autonomie ed i presidi territoriali più efficienti, valorizzandone le professionalità e le risorse migliori.",301
È necessario che siano adottate iniziative sfidanti a tutti i livelli e comunicate al cittadino in maniera efficace;,301
"in particolare si considera importante l’introduzione di una quota obbligatoria di acquisti verdi per tutte le PA (G.P.P. Green public procurement), nonché di una accurata valutazione dei costi e benefici ambientali per ogni acquisto effettuato.",501
ECONOMIA CIRCOLARE,999
"L’economia circolare è una grande sfida e nasce con l’obiettivo di disegnare un futuro più sostenibile, in cui ridurre gli sprechi e utilizzare al meglio le risorse di cui disponiamo.",501
"L’obiettivo principale è quello di affrontare gli interessi economici e ambientali massimizzando l’efficienza nell’uso delle risorse, prendendo in considerazione l’intera catena del valore (compreso il consumo sostenibile, la produzione, la gestione dei rifiuti) anche attraverso l’innovazione, quindi favorendo lo sviluppo di nuovi mercati e nuovi modelli di business.",501
"Un modello circolare che pone al centro la sostenibilità del sistema, in cui non ci sono prodotti di scarto e in cui le materie vengono costantemente riutilizzate, un sistema in cui tutte le attività, a partire dall’estrazione e dalla produzione, sono organizzate in modo che i rifiuti di qualcuno diventino risorse per qualcun altro.",501
"I temi su cui puntare sono l’innovazione dei modelli di business favorendo lo spostamento delle preferenze dei consumatori verso l’accesso ai servizi come alternativa al possesso dei beni, l’innovazione di prodotto e l’innovazione di processo:",501
"queste sono le linee di sviluppo strategico che si devono perseguire, con meccanismi non solo di incentivazione finanziaria ma anche e soprattutto meccanismi premianti, facilitati e agevolati.",501
"È necessaria una maggiore certezza delle regole di contesto, e quindi di un auspicabile incremento dei tassi di raccolta, riciclaggio e riutilizzo, a beneficio del risparmio complessivo di risorse, nonché dell’incremento dell’occupazione nei comparti interessati.",501
"Tali temi sono rilevanti non solo in chiave ambientale, ma rappresentano uno stimolo alla creazione di valore economico ed occupazionale, in quanto consentono di estendere le filiere produttive e di servizio e di crearne di nuove, in linea con quanto ha cominciato a fare la green economy anche a livello locale.",501
"È bene sintetizzare le esperienze già attive, consentire e prevedere una autonomia a livello regionale di pianificazione ed individuazione delle misure di implementazione dell’economia circolare a partire dalla attribuzione delle competenze nella disciplina del recupero di specifiche categorie di rifiuti.",301
"A livello nazionale vanno adottate norme chiare che consentano di attribuire la qualifica di non rifiuto a specifici prodotti, che consenta e promuova un loro diffuso riutilizzo, e per la definizione di nuovi combustibili ammissibili nei cicli produttivi.",501
GESTIONE RIFIUTI,999
Vogliamo ridurre la Tassa dei rifiuti di almeno 50% per ogni famiglia entro il 2020.,999
Per ridurre del 50% la tassa dei rifiuti per ogni famiglia occorre fare due cose:,501
"Rivedere completamente il significato delle raccolte differenziate, attivando solamente quelle che hanno, attraverso la tracciabilità del rifiuto, un effettivo e certo utilizzo nel mercato delle materie seconde.",501
"Occorre quindi una maggiore flessibilità sulle raccolte differenziate, anche in base alle diverse richieste del mercato stesso.",501
"I cittadini sono stanchi di vedere che i loro sforzi, nel separare in casa i rifiuti non vengono adeguatamente ricompensati e, contestualmente, si vedono aumentare, ogni anno, la tariffa comunale per lo smaltimento dei rifiuti urbani.",501
No alle raccolte differenziate che non sono destinate al reale recupero.,501
"Sostituire parzialmente il carbone che utilizziamo in Italia con i nostri rifiuti trasformati e selezionati, proibire l’esportazione degli stessi all’estero, favorire l’utilizzo del Combustibile Solido Secondario (combustibile generato dalla trasformazione dei rifiuti) cioè combustibile di qualità presso tutte le centrali di produzione energetica che utilizzano il carbone e tutte le cementerie, come previsto dal D.M. n.22/13 del Ministero dell’Ambiente.",501
"Ciò permetterebbe di abbassare il livello dell’inquinamento atmosferico, di non “regalare” oltre 5 milioni di tonnellate all’anno di risorse ai paese europei e di diminuire la bilancia economica energica a sfavore dovuto all’importazione dei combustibili fossili.",501
"Calcolando il potere calorico di questo Combustibile Solido Secondario prodotto dai nostri rifiuti che sarà utilizzato per la parziale sostituzione del Carbone, sommando il mancato acquisto dello stesso, ogni anno andremmo a guadagnare almeno un miliardo e mezzo di euro, con un risparmio di più di 100 euro a famiglia.",501
"È necessario sviluppare politiche integrate che consentano di preparare al meglio il rifiuto per tutte le successive fasi di trattamento e cioè alla filiera del riciclo, ai trattamenti biologici, ai trattamenti termici;",501
consentendo così di inviare a discarica solo i quantitativi minimi di scarti che non possono essere trattati in altro modo.,501
"Per raggiungere una riduzione nella produzione dei rifiuti sono necessarie azioni di prevenzione, che vanno necessariamente incentivate, tra le quali trovano spazio: la tariffazione puntuale, le azioni contro lo spreco alimentare e la diffusione di centri del riuso.",501
Tra le azioni per promuovere le corrette pratiche di raccolta differenziata: la promozione di una buona raccolta degli olii esausti ed una sempre più puntuale gestione dei RAEE.,501
"Le azioni di prevenzione e le buone pratiche di gestione dei rifiuti, in un’ottica di economia circolare, permettono di ridurre gli sprechi, attraverso il riciclo ed il riuso ma intervenendo anche alla fonte attraverso la riduzione dei rifiuti prodotti.",501
"È necessario che le norme statali consentano il consolidamento degli esempi virtuosi di gestione dei rifiuti già esistenti in diverse realtà territoriali del nostro paese,",501
"favorendo un principio di autosufficienza regionale nella gestione dei rifiuti, al fine di rendere diffusi e minimi gli impatti ambientali sul territorio della rete attualmente esistente di impianti di trattamento dei rifiuti.",301
Devono essere introdotti nuovi strumenti normativi a correzione degli esistenti (revisione art. 35 sblocca italia) che consentano un maggior controllo e una maggior autonomia a livello regionale nella pianificazione della gestione dei rifiuti.,301
"Si deve consentire in particolare un’autonomia normativa nella definizione delle prestazioni tecnologiche degli impianti di recupero, trattamento e smaltimento dei rifiuti, nonché un’autonomia nella regolamentazione degli strumenti fiscali da utilizzare come leva per implementare le politiche territoriali in materia di rifiuti (aliquote ecotassa per disincentivare il conferimento dei rifiuti in discarica).",301
"Superamento delle criticità derivate dalle disposizioni riportate all’art. 35 del D.L. 12 settembre 2014, n. 133 e relativo DPCM del 10 agosto 2016 ed elaborazione un intervento deliberativo che chiarisca l’ordine di priorità al trattamento dei rifiuti urbani e decadenti dal trattamento degli urbani in virtù delle disposizioni nazionali, delle esigenze emergenti di pianificazione regionale e del ruolo di impianti di piano di pubblica utilità che gli inceneritori rivestono.",501
Amianto: si deve prevedere un nuovo censimento su base regionale degli edifici a rischio e concedere incentivi che ne permettano la rimozione e lo smaltimento.,501
"Devono essere previsti interventi normativi che consentano di tutelare maggiormente il territorio, quale l’approvazione di un criterio localizzativo, sulla scorta del modello lombardo, per regolare a livello territoriale le volumetrie delle discariche e controllare la complessiva distribuzione di tali impianti e dei relativi impatti sul territorio.",301
Devono essere incrementati i fondi a disposizione delle Regioni per incentivare e semplificare l’avvio di iniziative imprenditoriali legate al recupero ed al riciclo.,301
Incremento delle azioni contro lo spreco alimentare.,501
"Le politiche nazionali devono necessariamente fissare degli standard di qualità nella pianificazione regionale nella gestione dei rifiuti che consentano di raggiungere obiettivi sfidanti, che vanno definiti in modo chiaro prevedendo sanzioni per il mancato raggiungimento degli stessi, che includano un intervento sostitutivo dello stato per il superamento di criticità non gestite ed il commissariamento delle stesse regioni.",301
"Gli obbiettivi da fissare devono concentrarsi sul rafforzamento della prevenzione, del riutilizzo e del riciclo chiaramente al di sopra del collocamento in discarica e dell’incenerimento, favorendo l’autosufficienza su base regionale e prevedendo di concerto con gli Enti Locali l’emanazione di linee guida nazionali che favoriscano una efficace ed uniforme raccolta e gestione dei rifiuti.",501
"Sottoscrizione di protocolli d’intesa con ANCE per la gestione di particolari tipologie di rifiuti, quali ad esempio i rifiuti da demolizione, ai fini di agevolare il riutilizzo di tali materiali.",501
Interventi normativi per semplificare e tutelare maggiormente la gestione dei fanghi di depurazione delle acque reflue di impianti civili ed industriali.,501
Promozione dell’educazione Ambientale.,501
"SFIDA CLIMATICA, QUALITÀ DELL’ARIA E MOBILITÀ SOSTENIBILE",999
È necessario potenziare le azioni attualmente considerate a livello nazionale per il contrasto al cambiamento climatico e per la transizione verso modelli più sostenibili di economia e gestione delle risorse rinnovabili.,501
È necessario avviare azioni mirate per aumentare l’efficienza energetica in tutti i settori e tornare a far salire la produzione da fonti rinnovabili prevedendo una pianificazione nazionale che rafforzi le misure per il risparmio e l’efficienza energetica riducendo i consumi attuali.,501
"Il consolidamento di politiche di sostegno alle FER deve necessariamente collegarsi alle azioni per affrontare i cambiamenti climatici, che hanno effetti diretti sulle rinnovabili quali ad esempio la riduzione della disponibilità idrica per la produzione idroelettrica.",501
"Si considera prioritaria l’istituzione di un fondo nazionale per la transizione energetica, che sostenga cambiamenti concreti attraverso meccanismi premiali ed incentivi.",501
"È necessario individuare ed attivare azioni forti di coordinamento su vasta scala, istituendo ad esempio una cabina di regia nazionale sull’aria costituita dai presidenti di Regione, così come la stesura di un documento di azione nazionale sull’adattamento al cambiamento climatico, che consenta di riconoscere e definire gli ambiti prioritari di intervento rispetto agli effetti prodotti dal cambiamento climatico.",501
"Stesura di un piano nazionale di interventi da adottare per ottenere la riduzione dell’inquinamento atmosferico sulla scorta dell’accordo del bacino padano, già operativo e assolutamente efficace.",501
"Adozione di norme specifiche che pianifichino il divieto di circolazione (2030 è la data considerata da tutti come necessaria per evitare di arrivare troppo tardi ad affrontare un problema già oggi particolarmente complesso) per le auto maggiormente inquinanti (diesel e benzina) sul territorio nazionale, fissando una scadenza precisa per l’interruzione di una commercializzazione nel nostro paese di tali veicoli, e prevedendo un incremento del carico fiscale volto a penalizzare la circolazione delle vetture inquinanti.",501
Incentivi per le immatricolazioni di nuove auto elettriche ed ibride volti a favorire lo sviluppo di reti infrastrutturali adeguate a sostenere tale cambiamento così come un potenziamento del trasporto pubblico specialmente nei centri abitati a maggior densità abitativa.,501
"I vantaggi attesi dalle azioni descritte sono fondamentali per un miglioramento della tutela ambientale del paese intero così come delle condizioni di vita ed in particolare di salute dei cittadini, un elemento che va considerato con la massima attenzione e messo al centro delle future strategie nazionali.",501
"Interventi normativi per affrontare il tema della riduzione di emissioni dannose in atmosfera dovute alla combustione delle biomasse, prevedendo una classificazione ambientale e regolamentazione a livello nazionale dei generatori di calore alimentati a biomassa.",501
"Implementazione a livello nazionale di una rete di monitoraggio in continuo delle emissioni degli impianti maggiormente a rischio, che necessitano di un controllo frequente ai fini di garantire la corretta tutela ambientale e della salute dei cittadini.",501
BONIFICHE E RIGENERAZIONE URBANA,999
"È necessario superare le criticità legate alla complessità e la lentezza della gestione dei processi multi-attori a livello Regionale, locale, ministeriale delle procedure di bonifica:",301
"vanno adottate misure di semplificazione che consentano interventi rapidi ed efficaci,",303
"concedendo alle Regioni una autonomia decisionale e rispettive risorse per effettuare gli interventi più critici ed urgenti, individuati sulla base di un Piano Nazionale delle Bonifiche.",301
"Si sottolinea la necessità di utilizzare incentivi di carattere economico-fiscale al fine di favorire la realizzazione degli interventi di bonifica in capo a soggetti privati, per limitare il ricorso a risorse pubbliche.",411
"Servono investimenti inoltre per supportare la ricerca e l’utilizzo di nuove tecnologie, la formazione di personale preparato e la valorizzazione delle figure professionali già operative presso le Regioni e gli Enti Locali a tutti i livelli.",411
Gli enti locali interessati dalla gestione di procedure complesse di bonifiche devono essere supportati adeguatamente.,301
"Occorre adottare delle linee guida che favoriscano gli enti locali, limitando la dispersione di costi e risorse, e favoriscano il coordinamento delle procedure di bonifica con quelle di riqualificazione urbanistica.",301
"È necessario prevedere incentivi per gli enti locali che affrontano le fasi più delicate delle procedure di bonifica, quali la caratterizzazione delle aree e, in particolare, la concessione di finanziamenti che aiutino i comuni ad affrontare le spese legali per le azioni di rivalsa nei confronti dei soggetti responsabili della contaminazione.",301
"Si è favorevoli alla realizzazione di un piano nazionale per la rigenerazione urbana, che attivi percorsi che impediscano il consumo di suolo e favoriscano il recupero e la riqualificazione del patrimonio edilizio esistente, così come il riutilizzo delle aree dismesse ed inquinate.",501
CONSUMO DI SUOLO E VALORIZZAZIONE CAPITALE NATURALE,999
"Sviluppare il concetto di consumo di suolo al concetto di spreco di suolo, il quale va completamente eliminato attraverso un’adeguata politica di sostegno che promuova la rigenerazione urbana.",501
"Azioni concrete e sostegno alle iniziative per rilanciare il patrimonio edilizio esistente, favorendo la rigenerazione urbana e il retrofit degli edifici.",501
"Sviluppare il tema del bilancio ecologico zero, ovvero positivo, e favorire quelle iniziative che permettono un incremento di valore aggiunto della qualità ambientale e paesaggistica anche degli spazi urbani.",501
