Text,Code
"In un momento di crisi economica come questo l’Unione Europea non può pensare di prendersela con la debole categoria dei pescatori, mettendo fine peraltro a una centenaria tradizione di pesca.",108
"Il nostro Governo chiederà con forza e determinazione all’UE di modificare e/o cancellare qualsiasi direttiva volta a penalizzare la pesca italiana, come quella che impone “fermi pesca” ponderati su base burocratica e non scientifica (insensati come quello sulla pesca del bianchetto, delle vongole e altre specie ittiche dei nostri mari), oppure l’ingiusta ripartizione delle quote riservate alla pesca del tonno rosso.",108
"È bene che l’UE sappia che le nostre marinerie, da quella siciliana e ligure fino a quelle dell’Adriatico, sono le prime ad avere l’interesse a lavorare nel rispetto dell’ambiente e dell’equilibrio della fauna marina, che rappresenta la loro sopravvivenza professionale ed economica.",108
POLITICHE SOCIALI: DISABILITÀ,999
"Uno Stato civile deve proteggere, tutelare, assistere e integrare chiunque abbia una disabilità.",999
"Il senso di comunità è un valore da difendere e promuovere perché la comunità è la dimensione entro la quale i rapporti interpersonali assumono spontaneamente la forma e la forza di un legame solidarista, alimentando tra i membri della comunità un profondo e naturale bisogno di altruismo e coesione sociale.",606
"Entro questo orizzonte di senso e valori, il welfare rappresenta l’espressione più tangibile e stabile del senso di comunità e della naturale propensione della comunità a prendersi cura di tutti i suoi membri, a partire da quelli più fragili e svantaggiati.",504
"Da qui, l’impegno per la disabilità, che è, al contempo, “impegno per i deboli” e “impegno per una società che, nell’essere vicina ai deboli, ritrova e preserva il suo essere comunità ed agire come comunità”.",606
"Il tutto, a fronte di un processo di globalizzazione e liquefazione della società, che la vorrebbe sempre più individualista e disgregata, e pertanto insofferente verso le politiche e le spese di welfare.",606
È per noi fondamentale consolidare e rinnovare le politiche di protezione e inclusione dedicate alle persone con disabilità e finalizzate a garantirne un concreto ed efficace sostegno durante tutte le fasi della vita.,504
TUTELE,999
CONSOLIDARE FONDI E SOSTEGNI ECONOMICI,999
Le politiche per la disabilità e gli strumenti di cui beneficiano le persone con disabilità risultano spesso inadeguati sotto il profilo economico.,504
"Allo scopo di rendere più incisiva la protezione delle persone con disabilità si prevede un generale rafforzamento dei fondi sulla disabilità e la non autosufficienza, prestando particolare attenzione al “dopo di noi”.",504
"Per non depotenziarne la già ridotta dotazione economica (e dunque, anche l’effettiva efficacia) si dovranno inoltre svincolare dal computo di alcuni indicatori gli strumenti di protezione di cui beneficiano le persone con disabilità.",504
"In particolare, si prevede di escludere “tassativamente” l’indennità dal calcolo dell’ISEE (Indicatore della Soglia Economica Equivalente),",504
"così come, con riferimento al Reddito di Inclusione si valuterà l’opportunità di escludere dal calcolo dell’ISR (indicatore situazione reddituale) i trattamenti assistenziali, previdenziali ed indennitari, incluse carte di debito, a qualunque titolo percepiti da amministrazioni pubbliche qualora attinenti a condizione di disabilità.",504
COSTRUIRE UNA GOVERNANCE COORDINATA E CONDIVISA DEGLI INTERVENTI,999
"Il livello nazionale e quello locale spesso “non dialogano” ed il quadro dei diversi interventi sulle persone con disabilità (ed in particolare sulle disabilità più gravi) risulta “frammentato”, con il rischio di rendere meno universale l’intervento della Pubblica Amministrazione sul bisogno di protezione e inclusione.",301
"Serve una governance coordinata e condivisa degli interventi, per superarne l’eccessiva frammentazione ed arrivare ad una maggiore equità nell’attivazione degli stessi, nonché nella distribuzione delle risorse.",301
"Solo costruendo una “piattaforma condivisa dei sistemi di protezione”, che metta in rete gli erogatori degli interventi e consenta di avere sempre un quadro chiaro ed aggiornato sul singolo utente, si creeranno le condizioni perché tutta l’utenza fragile ed avente diritto possa accedervi, senza eccessi o dimenticanze, senza che vi siano talvolta dei “grandi beneficiari” (capaci di chiedere / attivare tutti i canali e tutte le risorse) e talvolta dei “grandi esclusi” (che hanno vergogna di chiedere e/o non sanno dove rivolgersi e cosa chiedere).",504
"RIFORMARE LE PENSIONI DI INVALIDITA’ CIVILE, CONSOLIDANDO/SEMPLIFICANDO IL SISTEMA",999
"Seppur diversi e modulati in funzione della tipologia e della gravità, tutti gli strumenti di natura pensionistica, oltre a essere soggetti a limiti reddituali, prevedono oggi importi così ridotti da non adempiere “in concreto” a quanto previsto dall’art 38 della Costituzione italiana:",504
parliamo infatti di circa 300 Euro al mese per la disabilità visiva;,504
ancor meno per le altre forme di disabilità.,504
"Serve una riforma delle pensioni che riduca i tipi di prestazioni e che, soprattutto, faccia della pensione lo “strumento cardine” con cui garantire alle persone con disabilità importante una vita dignitosa.",504
"Allo scopo, si procederà a una preliminare ridefinizione dei quadri per cui la disabilità è da ritenersi un “significativo e potenziale” ostacolo al lavoro.",705
"In tal senso, potranno essere valutate come “condizioni potenzialmente ostative al lavoro” anche forme di disabilità oggi quantificate al di sotto del grado massimo d’invalidità, ovvero al di sotto del 100%.",705
"Con l’individuazione della “soglia d’inabilità” si definiranno dunque due sole fasce (superiore, cioè dalla soglia di inabilità in su, fino al 100%) e inferiore (cioè dalla soglia di inabilità in giù, fino al 74%) entro cui inquadrare le diverse forme di disabilità e, soprattutto, entro cui modulare il trattamento pensionistico.",705
A tutte le persone con un grado d’invalidità superiore alla soglia d’inabilità sarà riconosciuta la “pensione d’inabilità”.,504
Questa pensione dovrà assumere una consistenza economica tale da poter di per sé garantire (anche indipendentemente dall’indennità) una vita dignitosa.,504
"In concreto, tale pensione dovrà ampiamente superare alcuni parametri limite, come la soglia di povertà assoluta.",504
"D’altra parte, la pensione d’inabilità non dovrà essere un fattore assolutamente disincentivante rispetto al lavoro.",705
Si dovranno dunque prevedere dei limiti reddituali tali da stimolarne la ricerca.,705
"Limiti, questi, entro cui la persona potrà anche accumulare reddito da lavoro e, a scalare, reddito da pensione, fino al raggiungimento di una soglia massima oltre la quale l’erogazione della pensione d’inabilità verrà totalmente sospesa.",705
Al di sotto della soglia d’inabilità le persone beneficeranno invece di una “pensione d’invalidità” il cui obiettivo sarà solo  la compensazione del deficit e non il sostentamento della persona.,705
"Per le pensioni d’invalidità si potrà dunque confermare l’attuale impianto, che appare congruo sia sotto il profilo degli importi, sia sotto il profilo dei limiti reddituali.",705
RIVISITARE IL MECCANISMO DI RIVALUTAZIONE DELLE RENDITE INAIL,999
Le rendite Inail corrisposte ai mutilati e agli invalidi del lavoro vengono rivalutate annualmente sulla base di un meccanismo di calcolo che si prefigge di garantire l’adeguatezza delle prestazioni nel tempo.,705
"Ma da qualche anno, a causa dello stallo dei salari e dei prezzi al consumo, tale meccanismo risulta di fatto penalizzante.",705
"Attualmente è infatti prevista una rivalutazione delle rendite, con decorrenza 1° gennaio, che scatta quando si verifica una variazione retributiva minima del 10%.",705
"Fino a qualche anno fa questa rivalutazione scattava mediamente ogni 3 o 4 anni, ma oggi l’andamento dei salari rende molto difficile raggiungere la percentuale del 10% richiesta dalla legge.",705
"In via di anticipo è attualmente prevista anche una rivalutazione annuale, con decorrenza 1° luglio, basata sull’indice ISTAT dei prezzi al consumo.",705
"Anche in questo caso, però, la bassa inflazione impedisce da alcuni anni di ottenere aumenti.",705
"Se con la nuova legge di stabilità, il Parlamento non recepirà le proposte emendative delle associazioni di categoria, si provvederà a farlo con la prossima legislatura.",705
"In particolare, si provvederà ad eliminare la soglia di aumento minimo dei salari del 10%, prevedendo un’unica rivalutazione annuale con decorrenza 1° luglio, e razionalizzando il meccanismo in un’unica cadenza annuale.",705
GARANTIRE UN SISTEMA DI AGEVOLAZIONI AGGIORNATO PER L’ACQUISTO DI BENI E AUSILI,999
Le persone con disabilità godono di alcune agevolazioni fiscali nell’acquisto di beni e/o ausili che ne facilitano l’autonomia personale.,705
"Già in passato, l’aggiornamento dell’elenco di tali beni e/o ausili è avvenuto con gravi ritardi, non assecondando l’evoluzione tecnologica e penalizzando di conseguenza l’accesso agevolato a nuove ed importanti opportunità.",705
"Allo scopo di cogliere “per tempo” le opportunità della tecnologia, si prevede di coinvolgere le associazioni nelle Commissioni preposte.",705
"A titolo esemplificativo, e per colmare un evidente e nuovo gap, si prevede l’inserimento delle autovetture elettriche tra quelle soggette ai benefici fiscali in favore delle persone con disabilità:",705
ciò si rende necessario in quanto la potenza di queste auto non si esprime in centimetri cubici come previsto dalla L. 97/86.,705
SCUOLA,999
RAFFORZARE LE COMPETENZE DEI DOCENTI E DI TUTTO IL PERSONALE SCOLASTICO,999
Gli studenti con disabilità si relazionano con docenti curricolari o per il sostegno che non hanno sufficienti competenze nella gestione dell’alunno con disabilità.,705
"Nonostante l’inclusione scolastica fosse uno degli obiettivi della Buona Scuola, di fatto i cambiamenti introdotti non garantiranno un salto di qualità nella formazione dei docenti né nella continuità didattica.",305
Si dovrà lavorare per garantire una “reale specializzazione” degli insegnanti per il sostegno e consolidarne l’effettiva presenza in aula.,705
"Parimenti, andranno altresì individuati dei percorsi di aggiornamento anche per i docenti curricolari, nonché indirizzati a tutte le figure che della scuola sono parte.",705
"Infatti l’inclusione non può essere “affare” del sostegno, ma deve coinvolgere tutta la comunità scolastica.",705
RICONOSCERE E NORMARE ALCUNE FIGURE PROFESSIONALI,999
"Per quanto prezioso, l’inserimento scolastico degli studenti con disabilità sensoriale non dipende solo dal lavoro dei docenti curricolari e per il sostegno.",705
"Al processo educativo/formativo degli alunni sordi, ciechi e ipovedenti, concorrono infatti anche altre figure, di cui manca però un riconoscimento giuridico che faccia finalmente chiarezza sugli skills necessari.",705
"A livello territoriale, ciò si traduce in una grave confusione nell’attivazione dei servizi d’inclusione scolastica.",705
Si prevede quindi di riconoscere / normare a livello nazionale talune figure professionali.,705
"In particolare, si ritiene opportuno istituzionalizzare la figura dell’educatore alla comunicazione per gli alunni con disabilità sensoriale (visiva o uditiva), e la figura dell’esperto in scienze tiflologiche.",705
PORTARE A SCUOLA LA DISABILITA’ E FARE CULTURA SULLA DISABILITA’,999
L’integrazione delle persone con disabilità passa attraverso una cultura ed una accettazione della disabilità.,705
"Di fatto, verso le persone con disabilità, vi sono ancora molti pregiudizi.",705
È allora dalla scuola che si deve iniziare a costruire una società inclusiva e capace di comprendere/relazionarsi con  la disabilità.,705
"Da qui l’opportunità di fare cultura e inserire nel percorso didattico dei momenti di ascolto / incontro con la disabilità, anche grazie al coinvolgimento delle associazioni dei disabili.",705
LAVORO,999
RIDURRE LO SCOPERTO,999
"La legge 68/99 sul collocamento mirato prevede che esistano delle quote riservate alle categorie protette, ma tanto nel pubblico, quanto nel privato, si registrano degli scoperti.",705
Si dovrà innanzitutto procedere ad un’accurata ricognizione degli scoperti nel settore pubblico.,705
Che lo Stato sia il primo a non adempiere agli obblighi di legge rappresenta infatti un dato inaccettabile.,705
Tanto più se si considera che lo Stato (non soggetto a sanzioni) è però erogatore di sanzioni (anche elevate) per le aziende inadempienti.,705
"Di contro, pensare di evitare le elusioni da parte delle aziende facendo leva solo ed esclusivamente sulle sanzioni, costituisce un approccio miope.",705
"Serve invece dare spazio anche alla prevenzione, facendo cultura presso le aziende.",705
"Allo scopo s’intende riattivare/ potenziare le commissioni provinciali per il lavoro, coinvolgendo le rappresentanze di categoria: tanto degli imprenditori, quanto delle persone con disabilità.",705
"Le Commissioni, infatti, non sono solo organi preposti al controllo, ma anche momenti di coordinamento e  di reciproca comprensione.",705
"Il che risulta prezioso per ridurre le resistenze, abbattere i pregiudizi sull’effettiva produttività delle persone con disabilità e rafforzare la conoscenza delle possibili agevolazioni e/o delle diverse modalità di attuazione/adempimento della L.68/99, ivi compresa la convenzione ex art 14 dlgs 276/2003 (legge Biagi).",705
Si renderà necessario porre in essere percorsi lavorativi specifici per disabilità fisiche o psichiche.,705
BILANCIARE GLI “EFFETTI INDESIDERATI” DEL COLLOCAMENTO MIRATO,999
"Se pur condivisibile, la filosofia del “collocamento mirato” (adottata con legge 68/99 ed ulteriormente consolidata col Jobs Act) tende, per certi versi, a penalizzare le disabilità gravi:",705
"attraverso la chiamata nominativa, i datori di lavoro tendono a orientarsi verso forme di disabilità apparentemente più gestibili.",705
"Da qui, le maggiori difficoltà di collocamento per specifiche categorie, affette per es, da disabilità visiva o psichica.",705
"Si dovranno pertanto confermare (e possibilmente consolidare) gli incentivi al privato, prevedendo agevolazioni “commisurate” alla capacità lavorativa della persona disabile.",705
"Ad esempio, si potranno prolungare nel tempo le agevolazioni sull’imponibile previdenziale già previsti dal bonus assunzione disabili.",705
"Sempre per bilanciare gli effetti indesiderati del collocamento mirato, si dovrà inoltre prevedere che nell’ambito pubblico parte delle quote destinate alle categorie protette siano specificamente riservate alle disabilità gravi.",705
"È infatti solo attraverso il pubblico, e non attraverso il privato, che la comunità può ragionevolmente pensare di farsi carico delle persone più fragili, assumendosi dei precisi impegni anche nei confronti delle situazioni più complesse.",705
"Infatti, il settore pubblico, non solo è il frutto del comune impegno, ma costituisce anche un contesto lavorativo tendenzialmente più adatto ad accogliere persone con disabilità grave, favorendo modelli di lavoro e di comportamento più affini alla cooperazione che non alla competizione.",705
INDIVIDUARE E NORMARE NUOVE PROFESSIONI,999
"Per alcune disabilità particolarmente svantaggiate, agli indesiderati effetti del collocamento mirato, si sono aggiunte anche le indesiderate conseguenze di alcune evoluzioni di scenario.",705
"Lo sviluppo tecnologico, unitamente al mutamento della domanda, hanno di fatto cancellato alcune figure professionali e quindi svuotato di senso alcune leggi, come la legge sul collocamento dei centralinisti ciechi (L.113 del 1985) piuttosto che la legge per i massaggiatori e massofisoterapisti ciechi (L.686 del 1961).",705
"Si dovranno quindi sperimentare e definire nuove figure professionali che (specie in ambito pubblico) potranno, per legge, essere riservate a specifiche disabilità.",705
"Punto di partenza saranno le figure equipollenti già individuate dal DM 10 gennaio 2010 (addetto alle relazioni col pubblico, alla gestione di banche dati, al telemarketing-telesoccorso) che, proprio nel settore pubblico, possono trovare riscontro e garantire l’inserimento di molte persone con disabilità visiva.",705
Si pensi per es. agli URP comunali.,705
Parimenti si potranno riconoscere anche altre e nuove professioni.,705
"In tal senso, s’investirà sulla figura del “perito fonico trascrittore” che, una volta normata, potrà dare importanti risultati (per le trascrizioni delle assemblee pubbliche, piuttosto che in ambito forense o presso le forze dell’ordine per la trascrizione di deposizioni e intercettazioni).",705
"Analogamente, l’individuazione ed il riconoscimento di alcune professioni da riservarsi a specifiche categorie, potrà essere la “via maestra” attraverso cui tentare di ampliare le opportunità di lavoro anche per altre categorie, come per esempio i sordi.",705
"ACCESSIBILITA’ DI LUOGHI, BENI E SERVIZI",999
PROMUOVERE L’AUDIT CIVICO IN TEMA DI BARRIERE ARCHITETTONICHE,999
"Nonostante esista una precisa normativa che disciplina l’abbattimento delle barriere architettoniche, di fatto, la traduzione pratica della normativa si rivela spesso deficitaria e/o viziata da imperizia.",705
"E ciò, appare evidente anche nella realizzazione di opere pubbliche.",705
"L’idea è quella di prevedere un audit civico per cui, da norma, la Pubblica Amministrazione sia tenuta a verificare, in concreto, e con il coinvolgimento delle persone con disabilità e/o loro associazioni, l’effettiva accessibilità delle opere pubbliche.",606
"Se fosse ad esempio prevista nelle procedure dei Comuni, la valutazione civica potrebbe non solo testarne “ex post” la fattiva usabilità, ma anche ottimizzarne “a monte” la progettazione:",606
"valutandone preventivamente la fruibilità per le diverse forme di disabilità, e soprattutto adottando/declinando  accorgimenti che la normativa non specifica in dettaglio.",705
SVILUPPARE UNA POLITICA PER L’ABITARE,999
Le difficoltà d’inserimento al lavoro delle persone con disabilità si accompagnano a livelli reddituali tendenzialmente bassi.,705
"Da qui, anche una maggiore difficoltà per chi ha particolari esigenze di autonomia ad accedere ad abitazioni moderne e pienamente accessibili.",705
Occorre implementare una politica per l’abitare che favorisca l’accesso delle persone con disabilità ad abitazioni di recente concezione / costruzione.,705
"Al di là delle agevolazioni previste per l’accesso all’edilizia residenziale pubblica, servono politiche di housing sociale che coinvolgano il privato e introducano negli oneri di urbanizzazione delle quote da riservarsi alle persone con disabilità.",705
Ovviamente la policy di assegnazione di queste abitazioni potrà essere gestita in collaborazione con i servizi territoriali.,705
RENDERE ACCESSIBILI I CONTENUTI DELLA PUBBLICA AMMINISTRAZIONE,999
"Sebbene la legge 4/2004 preveda la completa accessibilità dei contenuti della PA, di fatto molti siti della pubblica amministrazione continuano a risultare inaccessibili, penalizzando chi, proprio da un accesso autonomo ed in remoto, potrebbe trarre più beneficio.",303
"Allo scopo di dare concreta attuazione alla Legge Stanca, si prevede dunque di rendere accessibili tutti i documenti, partendo da quelli della Presidenza del Consiglio, fino ad arrivare a quelli degli Enti Locali.",303
"A tal fine, si prevede di dare un input chiaro a tutte le amministrazioni, stabilendo meccanismi incentivanti che “motivino” l’ente pubblico ad adempiere a quanto previsto per legge.",303
"Sul tema, costituirà punto di riferimento la più recente ed aggiornata Direttiva UE 2016/2102 del Parlamento Europeo e del Consiglio del 26 ottobre 2016 relativa all’accessibilità dei siti web e delle applicazioni mobili degli enti pubblici, per cui ci si adopererà per un efficace ed effettivo recepimento della stessa.",303
RAPPRESENTANZA,999
PORTARE LA DISABILITA’“AL GOVERNO”,999
"Talvolta strumentalizzata, la disabilità si ritrova spesso ai margini del processo decisionale, con il rischio di non acquisire sufficiente rilevanza nell’agenda politica.",705
Allo scopo si propone un Sottosegretario alla Presidenza del Consiglio con delega alla disabilità che possa farsi interlocutore privilegiato e punto di raccordo fra i vari Ministeri al fine di coordinare le politiche sulla disabilità.,705
AMPLIARE LA PARTECIPAZIONE DELLE ASSOCIAZIONI,999
"Vi sono Commissioni di fondamentale rilevanza, che incidono sulla qualità di vita delle persone con disabilità, ma che non prevedono la partecipazione delle associazioni di categoria.",606
"Allo scopo di “ascoltare la voce” delle persone con disabilità, tutelandone gli interessi e ottimizzando le politiche sulla disabilità, verrà promossa ad ogni livello la partecipazione delle associazioni, a partire da quelle a cui la legge affida la rappresentanza e la tutela degli interessi morali e materiali di alcune categorie.",606
TURISMO,999
"Quando si dà per scontato qualcosa, per quanto bello, alla fine perde di fascino.",999
Per questo oggi non è più sufficiente dire che l’Italia è il Paese più bello del mondo.,999
"L’Italia è una nazione a vocazione turistica grazie al patrimonio storico, culturale, paesaggistico e naturale e ad eccellenze quali, ad esempio, l’enogastronomia, la moda, il design, unici al mondo.",402
"Il Turismo è un settore fondamentale dell’economia, non solo per la sua valenza sul PIL nazionale e sull’occupazione, ma anche per la capacità naturale di raccordo con altri settori cruciali della società, come ad esempio i Trasporti, le Infrastrutture, l’Agricoltura, lo Sviluppo Economico, Comunicazioni, Cultura, ecc. Attualmente in Italia le questioni centrali per il futuro del turismo sono:",402
"l’incremento della competitività delle imprese turistiche,",402
l’innalzamento della qualità dei servizi e della “vita” in generale,402
"e fenomeni come lo sviluppo del digitale o l’”overtourism”, quest’ultimo fonte di grande disagio per le città più importanti e famose in Italia per il turismo, come ad esempio Venezia.",000
"Il nostro programma sul Turismo si sviluppa in 12 punti, che costituiscono la base di un lavoro che inizia definitivamente ora, in maniera condivisa e partecipata con tutti gli stakeholders coinvolti.",402
MINISTERO DEL TURISMO,999
"Un paese a vocazione turistica come l’Italia non può non avere un Ministro del Turismo, con portafoglio, propedeutico all’organizzazione e allo sviluppo di questo settore economico così importante per il PIL (circa il 10%) e per l’occupazione (circa l’11%) e con grandi potenzialità di crescita.",303
"Il Ministro sarà una persona (tecnico o politico) con conoscenza o esperienza nel settore, ma senza conflitti di interesse palesi (non potrà essere un imprenditore importante ancora in attività).",303
"La nuova struttura, però, non dovrà avere un impatto economico negativo per le casse statali, pertanto verranno individuati elementi di ottimizzazione e risparmio (come ad esempio maggiori introiti dal Tax Free Shopping, punto 6)",303
"e saranno valutate tutte le possibili azioni di integrazione con altri enti che si occupano di turismo a vari livelli (tra cui quella dell’Enit, che potrebbe essere controllata direttamente dal Ministero del Turismo).",303
LOTTA ALL’ABUSIVISMO E ALLA CONCORRENZA SLEALE,999
Abusivismo e concorrenza sleale creano danni enormi agli operatori del settore turistico e alle casse dello Stato.,403
"I controlli a campione sono costosi ed inefficienti e le sanzioni sono tardive, lievi e spesso inesigibili.",403
Per combattere l’abusivismo di molte strutture e la concorrenza sleale delle OLTA (OnLine Travel Agency) straniere proponiamo:,406
"Creazione di un codice identificativo univoco obbligatorio per le strutture ricettive (ID Struttura attribuito dalle Regioni) da inserire online in ogni scheda anagrafica di una struttura ricettiva, obbligando anche i portali di vendita (ad es. Booking.com, Airbnb, ecc.) a rimuovere le strutture prive di codice identificativo.",403
"Introduzione della “Web Tax turistica” per le OLTA straniere che non pagano tasse in Italia, vendendo spesso prodotti turistici italiani a clienti italiani a prezzi inferiori degli operatori italiani.",406
RIDUZIONE DELL’IVA E DEL CUNEO FISCALE PER IL SETTORE TURISTICO,999
"Si propone di: introdurre una Flat Tax al 15% e una riduzione dell’IVA sui servizi turistici e sui “pacchetti di viaggio”, per consentire agli operatori turistici italiani di recuperare competitività nei confronti dei competitori stranieri;",403
ridurre il Cuneo Fiscale sui contratti turistici per tutelare l’occupazione;,403
"abolire gli Studi di Settore, ormai sempre più senza senso anche nel settore turistico.",403
RECUPERO IVA SU SERVIZI E PACCHETTI TURISTICI ITALIANI ACQUISTATI IN AGENZIE VIAGGI ITALIANE,999
Si propone di far recuperare l’IVA (deduzione o detrazione) agli italiani che acquistano una vacanza in Italia tramite un’Agenzia di Viaggi italiana.,406
"Questo permetterebbe di trattenere tutta la fiscalità in Italia, consentendo alle aziende italiane coinvolte (Agenzie, Tour Operator, Hotel ed eventuale compagnia aerea, ferroviaria o di pullman e guide turistiche) di sostenere l’occupazione in Italia, garantire una qualità elevata,",406
