"content","cmp_code","eu_code"
"Atualizar as regras de direitos do autor e de seus sucessores.","502",NA
"Reduzir a burocracia.","303",NA
"Propor normas simplificadas para convênios e mudar o foco da prestação de contas,  que passará a priorizar os resultados artísticos-culturais.","303",NA
"Aprimorar o Sistema de Indicadores Culturais.","502",NA
"Reestruturar o setor responsável por Economia da Cultura,  permitindo o planejamento de estudos e pesquisas de maneira comple-mentar e articulada,","502",NA
"bem como a construção de indicadores comuns,  a serem disponibilizados em uma plataforma digital de fácil acesso.","502",NA
"Estabelecer,  de forma participativa,  um Índice de Custos da Cultura,  para balizar todas essas mudanças e também auxiliar na avaliação de iniciativas culturais submetidas à aprovação dos órgãos públicos.","202.1",NA
"Duas leis carecem de atualização.","502",NA
"A primeira é a de direitos autorais, de 1998, que não atende às condições da produção contemporânea, pautada no compartilhamento e na digitalização.","502",NA
"Embora anunciada repetidas vezes, a reforma do direito autoral brasileiro atravessou gestões sem ser levada a cabo.","305.1",NA
"Apenas uma primeira mudança obteve êxito: a aprovação da Lei da Gestão Coletiva (8.666), no final de 2013, redesenhando as formas de arrecadar e de distribuir os direitos autorais, o que devolveu aos artistas algum controle sobre os direitos autorais.","305.1",NA
"É preciso também avançar mais na proteção contratual dos verdadeiros criadores, que acabam tendo seus direitos suprimidos por intermediários em algumas modalidades, como e-books, considerados pela legislação como software regulado por licenciamento.","502",NA
"Nesse cenário, urge acelerar a aprovação de mudanças na legislação de direitos autorais, já bastante discutidas pela sociedade.","502",NA
"Outro ponto controvertido é a Lei Federal de Incentivo à Cultura (Lei Rouanet), apenas parcialmente reformada após constatar-se que não atendia ao propósito de democratizar produtos culturais.","305.1",NA
"Mesmo assim, as críticas persistem.","305.1",NA
"Grandes empresas, concentradas regionalmente, escolhem os projetos, associam suas marcas a eles, mas não investem de fato, já que deixam de pagar impostos ao governo.","304",NA
"Está parada no Congresso uma proposta de modificação mais radical, que prevê, entre outras alterações, o uso de obras incentivadas para fins educativos, sem pagamento de direitos autorais, e a análise de relevância cultural.","502",NA
"Falta, porém, discutir aspectos muito relevantes, tais como critérios de avaliação dos projetos, participação de pessoas físicas no sistema e projetos de financiamento coletivo.","502",NA
"Alterar a Lei Rouanet é tarefa delicada.","502",NA
"As principais instituições culturais brasileiras dependem de leis de incentivo fiscal para consolidar suas agendas.","502",NA
"Daí a necessidade de discussões robustas, ao mesmo tempo em que é preciso preparar o MinC para atender à demanda de projetos.","502",NA
"No que concerne ao financiamento, temos de considerar ainda que o universo da cultura é heterogêneo, composto por alguns setores lucrativos e outros necessariamente deficitários; alguns agentes aptos a competir  no  mercado  e  outros  sem  chances  de inserção  comercial.","502",NA
"Há  que  combinar  diferentes  mecanismos  de  financiamento,  evitando  que  as  leis  de  incentivo  fiscal sejam a maior fonte de recursos do  setor.","502",NA
"Apenas 985 município s têm legislação própria para o p a trim ô n io cultural, o que e quiva le a 18,3% do total.","502",NA
"Apenas 17,47% das cidades brasileiras possuem Conselhos Municipais de Cultura.","502",NA
"ESPORTES","H",NA
"O esporte é um direito por ser importante instrumento para o desenvolvimento humano e social, capaz de causar impacto profundo tanto na vida pessoal, melhorando a saúde e o desempenho escolar, como na vida comunitária, reduzindo a violência e promovendo a inclusão.","502",NA
"Em  1979,  o  esporte  foi  considera-do  um  direito  humano  pela  Organização das  Nações  Unidas  (ONU).","502",NA
"Alguns  anos depois,  em  1988,  a  Constituição  Brasilei-ra  declarou  dever  do  Estado  fomentar  as  práticas  desportivas  no  país  como  direito  de  cada  um  de  nós.","203",NA
"Os  benefícios  do  esporte  para  a  saú-de  já  são  comprovados.","502",NA
"O  sedentarismo  e a  obesidade  são  problemas  contundentes  de  saúde  pública,  uma  epidemia  mundial.","504",NA
"Mais  da  metade  da  população  brasilei-ra  está  acima  do  peso,  e  17%  são  obesos.","504",NA
"Hoje,  o  Brasil  gasta  mais  de  R$  12  bilhões por  ano  no  tratamento  dessa  doença  e suas  consequências.","504",NA
"Os  poucos  e  frágeis dados  sobre  atividade  física  nas  capitais brasileiras  indicam  que  somente  33%  dos cidadãos  fazem  atividade  física  suficiente, e  15%  são  totalmente  inativos.","502",NA
"E  na  escola  o  número  de  horas  de  atividade  física e  esporte  para  crianças  e  jovens  também não  é  animador.","502",NA
"Prevê-se  que  esta  será  a primeira  geração  no  mundo  que  viverá menos  que  seus  pais.","502",NA
"Por  isso,  pensar  em políticas  públicas  de  fomento  ao  esporte  e à  atividade  física  passou  a  ser  primordial para  os  governos.","502",NA
"CONSTITUIÇÃO  BRASILEIRA","H",NA
"Art. 217. É dever do Estado fomentar práticas desportivas formais e não-formais, como direito de cada um,observados:","203",NA
"I - a autonomia das entidades desportivas dirigentes e associações, quanto a sua organização e funcionamento;","203",NA
"II - a destinação de recursos públicos para a promoção prioritária do desporto educacional e, em casos específicos, para a do desporto de alto rendimento;","203",NA
"III - o tratamento diferenciado para o desporto profissional e o não- profissional;","203",NA
"IV - a proteção e o incentivo às manifestações desportivas de criação nacional.","203",NA
"§ 1º - O Poder Judiciário só admitirá ações relativas à disciplina e às competições desportivas após esgotaremse as instâncias da justiça desportiva, regulada em lei.","203",NA
"§ 2º - A justiça desportiva terá o prazo máximo de sessenta dias, contados da instauração do processo, para proferir decisão final.","203",NA
"§ 3º - O Poder Público incentivará o lazer, como forma de promoção social.","203",NA
"O  esporte  vem  trazendo  resultados  surpreendentes  também  para  a  educação.","502",NA
"O  esporte  e  a  atividade  física  resultam  em menos  faltas  a  aulas  e  em  mais  pontuação em  testes  cognitivos.","502",NA
"Projeto  esportivo  implementado  na  Inglaterra  em  450  escolas depois  das  Olimpíadas  de  2012  mostrou melhoria  no  aprendizado  de  disciplinas como  inglês  e  matemática  e  maior  desenvoltura  pessoal  e  social  dos  alunos,  que desenvolveram  autoestima,  capacidade de  trabalho  em  equipe,  cooperação,  responsabilidade,  entre  outras  habilidades.","502",NA
"No  entanto,  no  Brasil,  a  prática  desportiva não  é  prioridade.","502",NA
"Somente  30%  das  escolas de  educação  básica  têm  quadras,","502",NA
"e  não  há professores  de  educação  física  em  todas  as instituições,  o  que  faz  o  país  não  aproveitar  da  forma  adequada  o  enorme  potencial do  esporte  na  educação.","502",NA
"O  esporte,  no  entanto,  deve  ser  incorporado  ao  contexto  pedagógico  da  escola,  pois  é  um  facilitador  do  aprendizado.","504",NA
"Quando  o  profissional  de  educação  física é  qualificado  e  realiza  bons  projetos,  o  resultado  é  sempre  positivo.","502",NA
"Todavia,  hoje,  o desempenho  dos  alunos  depende  do  empenho  pessoal  do  bom  profissional,","502",NA
"uma vez  que  não  há  estímulos  e  programas  para desenvolver  o  esporte  nas  escolas  públicas.","305.1",NA
"Infelizmente,  impera  no  Brasil  uma  visão  limitada  e  acessória  da  atividade  esportiva,  com  ênfase  no  esporte  de  alto  rendimento,  concebido  como  entretenimento,","305.1",NA
"em prejuízo  da  prática  esportiva  como  direito, notadamente  na  dimensão  educacional.","502",NA
"No  caso  do  alto  rendimento,  a  situação  não  é  animadora  tampouco.","305.1",NA
"Faltam gestão  e  transparência  das  organizações que  administram  o  esporte  nacional. A  aprovação  da  Lei  12.868/2013  foi um  marco.","305.1",NA
"O  Artigo  19  determinou  limite  de  mandatos  para  dirigentes  esportivos,  participação dos atletas e técnicos na gestão das entidades e nas eleições para dirigentes das federações e confederações,","305.1",NA
"além de divulgação integral dos resultados financeiros e dos contratos de patrocínio.","305.1",NA
"O governo, contudo, precisa fiscalizar melhor o cumprimento da lei,","305.3",NA
"regulamentando a participação dos atletas na gestão das entidades.","202.1",NA
"Além disso, fazem-se necessárias uma legislação que defina o Sistema Nacional de Esporte – hoje regida pela Lei Pelé, de limitada abrangência –","502",NA
"e a implementação de uma política nacional de longo prazo para o esporte.","502",NA
"Infelizmente, não há tampouco linhas de financiamento público regular para iniciativas de esporte de participação e esporte educacional nos municípios.","305.1",NA
"As secretarias de esporte têm orçamentos limitados e não conseguem realizar ações em quantidade e qualidade.","305.1",NA
"Os recursos são usados para financiar torneios de futebol de várzea, que beneficiam um número pequeno de pessoas,","502",NA
"ou para construir estádios e ginásios que acabam se deteriorando porque falta à população a cultura da prática desportiva","502",NA
"As ONGs, associações e clubes realizam trabalhos isolados e dependem de financiamento privado,","502",NA
"e o esporte das pessoas comuns desperta pouco interesse nas empresas públicas e privadas.","502",NA
"O simples fato de realizar grandes eventos esportivos não modificará a oferta de prática esportiva à população, se não tivermos metas e um plano integrado para tal finalidade.","502",NA
"Acreditamos que o Brasil tem de buscar atletas de alto rendimento,","502",NA
"mas também pode oferecer atividades esportivas a toda a população.","502",NA
"Para isso, é preciso não concentrar todos os investimentos na ponta da pirâmide, mas estimular também a base.","502",NA
"É assim que poderemos usufruir dos benefícios sociais do esporte além de criar as condições de nos tornarmos uma potência olímpica no futuro.","502",NA
"Some n te 30°% das escolas de educação básica no Brasil têm quadras para a prática de esportes.","502",NA
"Apenas 33% dos cidadãos fazem a tividade física su ficiente, e % são to ta lme n te inativos.","502",NA
"O  ESPORTE  COMO  DIREITO  DE  TODOS  OS  BRASILEIROS","H",NA
"Estabelecer  metas  quantitativas  e  de  resultado  para  me-lhorar  a  atividade  física  e  o  esporte  nas  escolas.","502",NA
"Coletar  periodicamente  e  tornar  disponíveis  publica-mente  dados  sobre  atividade  física  e  prática  de  esportes no  Brasil.","502",NA
"Criar um comitê interministerial para articulação de programas e projetos voltados ao Esporte que envolva, no mínimo, os ministérios do Esporte, do Planejamento, da Educação, da Saúde e de Cidades","202.1",NA
"e conte com a participa-ção da sociedade civil.","606.1",NA
"Preparar o país para as Olimpíadas criando programas para apoiar municípios na disseminação das modalidades de esportes e as habilidades e valores que criam em diferentes espaços públicos (praças, parques e clubes).","502",NA
"Oferecer esporte de qualidade em todas as escolas brasileiras, valorizando a importância da disciplina","502",NA
"e promovendo atividades inclusivas, que incentivem a diversidade, o trabalho em equipe e a criação de valores.","502",NA
"Ter uma legislação que defina o Sistema Nacional de Esporte","502",NA
"e estabeleça competências, responsabilidades dos entes federativos e meios de financiamento do esporte.","502",NA
"Regulamentar o artigo da Lei 12.868/2013, que dispõe sobre a participação dos atletas nas eleições dos dirigentes das entidades que administram o esporte.","502",NA
"Fiscalizar o cumprimento da legislação esportiva.","305.3",NA
"Renovar e desburocratizar a Lei de Incentivo ao Esporte.","303",NA
"CIÊNCIA, TECNOLOGIA E INOVAÇÃO","H",NA
"Conhecimento e inovação, apoiados em dispositivos digitais, não são só dimensões setoriais da vida contemporânea, mas condição básica para atender a desejos e demandas sociais usando cada vez menos recursos.","411",NA
"Os  principais  motores  da  economia  nos países  industrializados  são  a  educação,","506",NA
"o  conhecimento  científico  e  tecnológico,","506",NA
"e  a  inovação  nas  diferentes  dimensões  da  vida  do país.","506",NA
"Nesses  países,  a  Educação  Básica  é  universal  e  de  boa  qualidade,","506",NA
"e  grande  parcela da  população  tem  possibilidade  de  acesso ao  ensino  superior.","503",NA
"As  melhores  universidades  disputam  os  professores  e  pesquisadores mais  qualificados  e,  em  consequência,  são  disputadas  pelos  melhores  estudantes.","506",NA
"Além  de  preparar  profissionais  de  nívelsuperior  para  o  mercado  de  trabalho,","411",NA
"formam  pesquisadores  nos  cursos  de  pós-graduação  e  realizam  atividades  de  pesquisa.","411",NA
"São  os  conhecimentos  gerados  nas  universidades,  nos  institutos  de  pesquisa  e  nas  empresas  que  propulsionam  o  desenvolvimento econômico","410",NA
"e  social  desses  países","202.1",NA
"e  mantêm  a competitividade  de  sua  economia.","410",NA
"A  formação  pós-graduada  e  a  pesquisa científica  e  tecnológica  em  tempo  integral  nas  universidades  são  muito  recentes  no  Brasil,  tendo  sido  implementadas  somente  na  década  de  1960.","506",NA
"Desde  então,  nosso sistema  de  Ciência,  Tecnologia  e  Inovação  (CTI)  −  composto  por  universidades,  centros  de  pesquisa,  institutos  tecnológicos  e agências  de  fomento  federais  e  estaduais  −  cresceu  e  sofisticou-se.","506",NA
"Porém,  isso  ocorreu  de  maneira  desordenada,  sem  continuidade e  sem  articulação  das  políticas  públicas,","303",NA
"com  irregularidade  e  insuficiência  de  recursos, resultando  em  grandes  disparidades  regionais  e  pouca  inserção  no  sistema  produtivo.","411",NA
"A  comunidade  científica  nacional  e  internacional  reconhece  o  período  de  2003  a 2004  teve  o  maior  avanço  na  gestão  do  Ministério  da  Ciência,  Tecnologia  e  Inovação (MCTI).","411",NA
"Duas  iniciativas  se  mostraram  essenciais  para  alavancar  CTI  no  país:  a  de finição  de  uma  política  nacional  para  a  área,  em  2004,","305.1",NA
"e  a  implementação  do  Plano  de  Ação  de  CTI  (Pacti),  em  2007.","305.1",NA
"As  duas  resultaram de  amplos  debates,  tan to  no  âmbito  do  próprio governo  como  deste  com  entidades  representativas,  com  a  participação  do  Conselho Nacional  de  Ciência  e  Tecnologia  (CCT).","202.1",NA
"Esse  movimento  acabou  por  gerar  aumento dos  recursos  financeiros  federais  para  o  setor,  com  destaque  para  o  Fundo  Nacional  de  Desenvolvimento  Científico  e  Tecnológico (FNDCT),  formado  pelos  fundos  setoriais  de CT,  que  deixaram  de  ser  contingenciados, alavancando  recursos  de  governos  estaduais.","402",NA
"Somados  os  recursos  públicos  e  os  das  empresas,  os  investimentos  em  pesquisa  e desenvolvimento  alcançaram,  em  2010,  cer- ca  de  1,2%  do  Produto  Interno  Bruto,  um  recorde  histórico,  embora  ainda  bem  inferior  à media  de  3%  que  prevalece  nos  países  industrializados.","411",NA
"As  ações  do  MCTI  sob  a  gestão do  PSB  também  resultaram  em  grande  avanço  no  marco  legal  de  CTI.","305.1",NA
"Leis  aprovadas pelo  Congresso  Nacional  e  por  Assembleias Legislativas,  decretos  presidenciais  e  portarias  de  ministérios,  juntamente  com  a  forte  articulação  entre  o  governo  federal  e  os  governos  estaduais,  contribuíram  para  a  consolidação  do  Sistema  Nacional  de  CTI.","305.1",NA
"Dentre  os  avanços  no  cenário  de  CTI no  período  2003-2010,  cabe  destacar  os mais  importantes,  correspondentes  às  quatro  prioridades  do  Pacti.","305.1",NA
"O primeiro avanço foi  ampliar  e  melhorar  os  programas  de  pós-graduação","506",NA
"e  de  financiamento da  pesquisa  básica,  aplicada  em  todas  as  áreas  do  conhecimento  em  todos os  níveis  da  estrutura  do  Sistema  Nacional de  CTI,  desde  projetos  de  pesquisadores individuais  e  de  grupos  de  pesquisa  até  programas  de  redes  de  pesquisa  e  de  grandes  instituições,  como  os  Institutos  Nacionais de  Ciência  e  Tecnologia  (INCT).","506",NA
"Esses  esforços  produziram  aumento  significativo  da infraestrutura  e  do  pessoal  dos  institutos  de pesquisa  do  MCTI","411",NA
"e  conferiram  à  produção  científica  brasileira  um  indicador  significativo,  que  é  o  número  de  artigos  científicos  publicados  em  revistas  indexadas.","506",NA
"Entre  2000  e 2010,  publicamos  205%  mais,  atingindo  cerca de  32  mil  artigos  indexados  na  base  de  dados  National  Science  Indicators,  da  Thomson Reuters  Scientific.","506",NA
"Alcançamos,  assim,  a  13ª colocação  no  ranking  mundial  da  produção científica,  ultrapassando  Rússia  e  Holanda, países  com  grande  tradição  em  ciência.","506",NA
"O  segundo  foi  ampliar  o  ambiente  de inovação  tecnológica  nas  empresas,  o  que  foi  proporcionado  pela  Lei  de  Inovação,","411",NA
"pela criação  de  um  amplo  leque  de  instrumentos para  financiar  projetos  de  empresas  operados  pela  Financiadora  de  Estudos  e  Projetos (Finep)  e  pelo  BNDES,","402",NA
"por  novos  incentivos fiscais,","402",NA
"pela  criação  do  Sistema  Brasileiro de  Tecnologia  (Sibratec)","411",NA
"e  pela  mobilização de  empresas  e  entidades  empresariais  nesse propósito.","408",NA
"Programas  como  o  Inova  Brasil, com  subvenção  econômica  para  inovação nas  empresas;","402",NA
"o  Programa  de  Apoio  à  Pesquisa  em  Empresas  (Pappe),  para  aportar  recursos  financeiros  não-reembolsáveis para  as  pequenas  e  as  médias  empresas,","402",NA
"e o  Programa  Primeira  Empresa  Inovadora (Prime),  voltado  para  start-ups  em  incubadoras  de  empresas,  são  outros  exemplos  de iniciativas  que  deram  frutos.","402",NA
"Em  terceiro  lugar,  avançamos  na  implementação  de  programas  de  pesquisa,  desenvolvimento  e  inovação  em  áreas  consideradas  estratégicas,  dentre  elas  biotecnologia, nanotecnologia,  tecnologia  da  informação e  comunicação, insumos  para  a  saúde,  biocombustíveis,  energia  elétrica,  hidrogênio  e energias  renováveis,  biodiversidade  e  recursos  naturais,  Amazônia  e  semiárido,  meteorologia  e  mudanças  climáticas.","411",NA
"Por  fim,  as  inúmeras  iniciativas  para  o desenvolvimento  social  e  a  divulgação  da ciência,  tais  como  o  programa  de  centros vocacionais  tecnológicos,","506",NA
"a  Olimpíada  Brasileira  de  Matemática  das  Escolas  Públicas","506",NA
"e  a  Semana  Nacional  de  CT,  contribuíram para  fomentar  a  inovação  no  país.","506",NA
"Apesar  das  importantes  conquistas  da década  de  2000,  o  atual  governo  deixou  de priorizar  as  áreas  de  CTI.","305.1",NA
"Os  últimos  anos foram  caracterizados  pela  redução  dos  orçamentos  do  MCTI,","305.1",NA
"pela  volta  do  contingenciamento  dos  fundos  setoriais  de  CT,","305.1",NA
"pela descontinuidade  de  programas","305.1",NA
"e  pelo  lançamento  de  iniciativas  erráticas,  levando  ao enorme  descontentamento  da  comunidade científica  e  tecnológica  e  à  desconfiança  da classe  empresarial.","305.1",NA
"Neste  momento  de  definir  os  rumos futuros  do  país,  torna-se  imperativo  retomar  e  aprofundar  a  política  de  CTI  e  as iniciativas  do  MCTI  entre  2003  e  2010.","305.1",NA
"As 40  propostas  que  pretendemos  implementar −  agrupadas  em  duas  categorias:  aperfeiçoamento  do  sistema  nacional  de  CTI","411",NA
"e  novas oportunidades  e  desafios  para  o  Brasil  em CTI  −  têm  o  objetivo  de  reforçar  a  centralidade  e  a  transversalidade  dos  setores  de  Ciência,  Tecnologia  e  Inovação","411",NA
"em  um  projeto ousado  e  transformador,  que  contribua  para de¬senvolver  a  economia","410",NA
"e  para  reduzir  as desigualdades,","503",NA
"melhorando  o  nível  de  vida da  população","504",NA
"e  colocando  o  país  em  lugar  de destaque  no  cenário  internacional.","408",NA
"O Brasil ocupa 649 posição n uma lista de 142 países no Índice Global de Inovação. 6 milhões de e s tudantes em todo o planeta fre q u e n tam cursos à distância.","506",NA
"A necessidade de uma política de Estado para CT&I.","411",NA
"A ampliação de recursos federais destinados à área.","411",NA
"A importância de fixar meta para elevar a parcela do PIB investida em P&D.","408",NA
"Aprimorar a governança do sistema é essencial para que a CTI realmente passe a ter uma política de Estado.","411",NA
"É preciso que o governo federal adote medidas para aperfeiçoar a institucionalidade do Sistema Nacional de CTI,","411",NA
"atuando em estreita articulação com os estados, com as entidades representativas da comunidade científica e tecnológica e com as organizações empresariais.","411",NA
"Esse processo requer ampliação dos recursos federais para CTI, a fim de alavancar recursos dos estados e das empresas, para que a parcela do PIB investida em PD cresça substancialmente.","411",NA
"É preciso investir mais na formação de mestres e doutores, dando prioridade à concessão de bolsas de estudos nas áreas consideradas mais estratégicas para o país, como, por exemplo, engenharia, oceanografia, biologia marinha e ciências exatas.","506",NA
"Devemos ainda intensificar a pesquisa científica e tecnológica com a ampliação do contingente de pesquisadores e técnicos e com expansão do sistema universitário, dos institutos de pesquisa e dos laboratórios, inclusive os de grande porte.","411",NA
"Planejamos ainda destinar recursos às atividades de cooperação científica internacional","411",NA
"e ampliar a interação universidade-empresa-governo a fim de tornar a inovação um dos motores da economia do país,","411",NA
"estimulando os investimentos privados em P&D.","411",NA
"O  CAMINHO  PARA  UM  PAÍS  INOVADOR","H",NA
"Ampliar os investimentos públicos","409",NA
"e estimular os investimentos de empresas em P&D (que, juntos, correspondiam a 1,2% do PIB em 2010 e hoje apenas 1,1%), de modo que o investimento total alcance, nos próximos anos, cerca de 2% do PIB, ficando próximo do padrão dos países líderes mundiais.","408",NA
"Aumentar o orçamento do CNPq","506",NA
"e fazer com que o Fundo Setorial do Petróleo volte a ser alocado no FNDCT (como era até 2012) e não seja contingenciado.","411",NA
"• Sustentar, como política de Estado, o notável avanço da ciência brasileira,","411",NA
"sobretudo a ciência básica, acelerando vigorosamente, em qualidade e quantidade, a produção científica","411",NA
"e a formação de pesquisadores","411",NA
"e estabelecendo prioridade para as áreas mais estratégicas","408",NA
"ou carentes no país.","503",NA
"• Recuperar os programas do MCTI","411",NA
"e suas agências de apoio à pesquisa básica e aplicada em todas as áreas do conhecimento e em todos os níveis da estrutura do Sistema Nacional de CT&I, com recursos ampliados e com calendário regular − como se faz hoje com o Edital Universal e o INCTs do CNPq, além do Programa de Apoio a Núcleos de Excelência (Pronex), este executado em parceria com as fundações estaduais de amparo à pesquisa.","411",NA
"• Promover substancial acréscimo de investimentos em infraestrutura,","411",NA
"com a expansão qualificada do sistema universitário,","506",NA
"dos institutos de pesquisa e dos laboratórios, inclusive de grande porte,","506",NA
"e de escolas e programas de formação de técnicos para operá-los.","411",NA
"Tal esforço deve procurar reduzir o desequilíbrio regional.","503",NA
"Tudo isso deve ser feito por meio de programas que se complementem.","408",NA
"Um dos mais importantes, cujos recursos devem ser ampliados e dotados de calendário regular, é o Pró-Reitoria de Infraestrutura (Proinfra),","411",NA
"que foi criado pelo MCTI em 2004, mas perdeu protagonismo nos últimos anos.","305.1",NA
"• Fortalecer os institutos de pesquisa do governo federal","506",NA
"e criar outros em áreas e regiões estratégicas, com ações concertadas, observando as políticas nacionais em seus respectivos setores e tendo orçamento e ações condizentes com sua missão.","506",NA
"Os modelos de gestão e processos de avaliação precisam ser repen¬sados, a fim de contemplar abordagens integradas e possibilitar o desenvolvimento das ações com qualidade e participação no diálogo internacional.","303",NA
"• Aperfeiçoar o Programa Ciência sem Fronteiras de tal modo que se aproveitem os jovens que voltam do exterior e também se promova substancial aumento da cooperação internacional","506",NA
"que tenha por objetivo a produção científica nacional na fronteira do conhecimento","506",NA
"e a forte presença de nossa ciência nas principais instituições e organismos internacionais de C&T.","411",NA
