Text,Code
"Para superar o modelo vigente, os principais desafios são: garantia de eqüidade e universalização do acesso;",503
responsabilidade estatal pelo financiamento da Política de Assistência Social na gestão e execução;,504
"construção de uma relação qualificada entre estados e municípios, fortalecendo o sistema descentralizado e participativo;",301
unidade da política social por meio de um esforço permanente de articulação dos programas;,504
"ampliação da capacidade do Estado,",303
entendendo que as entidades de assistência e ONGs são complementares e não substitutas das ações estatais.,606
"Quanto ao financiamento da política de assistência social, é necessário garantir o orçamento fiscal definido em lei.",504
"Em resumo, o sistema único de assistência social descentralizado e participativo é uma conquista de cidadania.",202
"Na prática, ele quebra a política patrimonialista expressa pelo favor, pelas subvenções parlamentares, entre outros tantos desvios,",304
e institui o direito de cidadania e o controle social.,202
"O caráter público da assistência social será assegurado nas parcerias,",504
"mantendo relação qualificada e transparente de transferência de recursos entre estados e municípios,",304
observado o pacto federativo.,301
"Como protagonista da política de inclusão social, a assistência social é parceira na vigilância das exclusões e na atenção à criança e ao adolescente, e aos adultos em risco social e pessoal.",504
Infra-estrutura e Desenvolvimento Sustentável,H
"O esforço fundamental do nosso projeto é a busca de elaboração e implementação de políticas de médio e longo prazo voltadas para o assentamento dos alicerces de um Brasil sustentável, mais justo e ambientalmente equilibrado",416
e sem as desigualdades que vêm marcando nossa história de exclusão.,503
"Nesse sentido, o novo governo terá no centro de suas preocupações a construção e implementação de estratégias que melhorem a distribuição de renda",503
"e reforcem a conservação da diversidade ambiental,",501
a pluralidade e a singularidade das nossas diferentes culturas.,607
O programa que ora apresentamos procura estabelecer as linhas estratégicas do futuro governo para recuperar a infra-estrutura produtiva do País.,411
"Nesse sentido, o novo governo buscará consolidar e ampliar os pilares de sustentação do parque produtivo brasileiro,",410
"tendo como eixo o planejamento integrado nacionalmente,",404
combinado a uma perspectiva regional flexível e descentralizada.,301
"Nosso governo manterá distância tanto do velho nacionaldesenvolvimentismo das décadas de 1950, 1960 e 1970",401
quanto do novo liberalismo que marcou os anos 90.,403
"No primeiro caso, apesar do sucesso obtido com a industrialização do País, o modelo implantado",401
"estimulou práticas clientelistas,",304
"às custas de subsídios e benefícios distribuídos às empresas,",401
sem preocupação com a competitividade e sem a definição de cronogramas e metas.,410
"Em uma palavra, sem claras políticas de reciprocidade entre o setor público e o privado.",401
"O resultado foi a distorção das estruturas de mercado,",401
a geração de ineficiências econômicas,410
e um quadro de má distribuição de renda.,503
"De seu lado, a experiência liberalizante dos anos 90 provocou corrosão do tecido industrial,",403
"com perdas de elos importantes das cadeias produtivas, enfraquecendo a capacitação interna",410
e ampliando a vulnerabilidade externa do País.,103
"Ao longo dos últimos anos, as políticas do atual governo aprofundaram a fragmentação da estrutura econômica e industrial,",410
as desigualdades regionais e a concentração de renda.,503
"Um novo modelo de desenvolvimento exigirá a superação efetiva de importantes estrangulamentos na infra-estrutura existente hoje no País,",411
cuja insuficiência e desgaste tem se revelado como um obstáculo decisivo ao crescimento sustentado.,410
As bases programáticas do nosso governo apontam para um País diferente.,416
Um Brasil capaz de construir seu próprio futuro e de sustentar seu desenvolvimento econômico e social.,416
Diretrizes Gerais,H
O plano do novo governo para os setores de infra-estrutura está sustentado por três pilares básicos:,411
a) Uma nova concepção de Planejamento e Desen-volvimento.,H
O planejamento público é ação precípua e intransferível do Estado.,404
"O novo governo retomará a prática do planejamento estratégico, tanto nacional como regional,",404
como instrumento para a definição de ações práticas em todos os setores da infra-estrutura.,411
"O debate com a sociedade será determinante nas relações entre estados e União,",202
de modo a permitir um lugar de destaque para a atuação regional voltada para o desenvolvimento.,301
"O novo governo fixará macroprioridades nacionais para revitalizar a Federação, integrando União, estados e municípios, dando origem a um novo modelo de descentralização coordenada.",301
Será possível planejar,411
"e ao mesmo tempo descentralizar a partir da recuperação do papel indutor do governo federal,",301
aliado a um maior controle e participação social nas ações de desenvolvimento regional e local.,202
b) Reconstrução das Cidades e Desenvolvimento Urbano.,H
"O novo governo enfrentará os principais problemas urbanos acumulados ao longo dos últimos anos, como a: (1) ausência de moradia e saneamento adequado (acessibilidade a água potável, sistemas de esgotos, destinação e tratamento de resíduos sólidos);",411
(2) a baixa mobilidade urbana (transportes ágeis,411
e não poluidores);,501
"(3) a falta de ação coordenada entre os executivos municipais, estaduais e federal de modo a dar forma a uma efetiva Política de Desenvolvimento Urbano, com propostas específicas para as regiões metropolitanas e os demais centros urbanos do País, inclusive os pequenos municípios.",404
c) Energia para o desenvolvimento.,H
A política econômica do nosso governo visa promover um novo ciclo de expansão da economia e atender demandas reprimidas existentes.,410
"Para isso, novos projetos de reestruturação da base produtiva serão necessários, de modo a viabilizar, a médio e longo prazos, uma articulação entre o local, o regional e o nacional,",404
com o objetivo de dar forma ou restaurar cadeias produtivas,410
"e melhor identificar e controlar os impactos socioambientais,",416
integrando nesse esforço lideranças da sociedade civil.,606
"O novo governo trabalhará com um planejamento energético integrado,",404
"de maneira a viabilizar novas dinâmicas para os setores de hidroeletricidade, petróleo e gás natural, carvão, de geração nuclear, fontes alternativas (eólica, solar e biomassa), de eficiência energética e co-geração e geração distribuída,",410
devolvendo ao Ministério das Minas e Energia as atribuições de principal gestor do sistema.,412
Fontes de Financiamento,H
"O montante global dos recursos a serem despendidos pelo nosso governo com os diferentes programas propostos está vinculado às suas perspectivas de captação de recursos,",414
ao grau de racionalização das despesas do Estado,303
e à articulação com os setores público e privado.,403
"Assim, o alcance dos programas propostos será tanto maior quanto melhor for o desempenho da economia",410
e da gestão fiscal.,303
"Para a realização dos programas do novo governo, além da reorientação dos fundos atualmente disponíveis (como o FGTS e o FAT) e de instrumentos como o BNDES, a Caixa Econômica Federal e a Financiadora de Estudos e Projetos (Finep), serão considerados os seguintes determinantes básicos: (1) Crescimento econômico;",410
(2) Melhoria na gestão das receitas;,303
(3) Racionalização das despesas administráveis;,303
(4) Redução gradual dos encargos financeiros;,414
(5) Adoção de parcerias com o setor privado;,403
(6) Parcerias com outros níveis de governo;,303
(7) Substituição e integração de programas governamentais.,303
§ Crescimento Econômico.,H
O determinante mais importante do volume dos recursos públicos é o nível da atividade econômica.,410
"Quanto mais cresce a economia, mais recursos públicos são gerados.",410
"Na realidade, esses recursos crescem acima do nível da própria atividade econômica, pois as empresas e os demais contribuintes passam a ter maiores condições de pagar os impostos e contribuições.",410
Um crescimento econômico de 4% do PIB ao ano permite uma expansão da receita pública de 5% a 7% ao ano.,410
"Como a política econômica do novo governo será sustentada pelo crescimento econômico, significativo volume de recursos será carreado aos cofres e fundos públicos para dar sustentação financeira aos programas propostos.",410
§ Melhoria na gestão das receitas.,H
"O alto nível de sonegação e inadimplência existente em nosso país está relacionado, em boa medida, às dificuldades financeiras pelas quais passam os agentes econômicos,",410
"e também à precariedade da gestão das receitas públicas, pelo insuficiente nível de informatização e integração dos diferentes sistemas de arrecadação existentes.",303
"Historicamente, as receitas vêm crescendo com as melhorias constantes e crescentes das gestões fazendárias em todos os níveis de governo.",303
"Nos últimos dez anos, esta eficiência tem representado um crescimento de cerca de 2% ao ano.",303
"A ampliação da informatização a ser desenvolvida pelo novo governo,",303
o cruzamento de cadastros dos diversos sistemas de arrecadação inter e intragovernamentais,303
"e o aperfeiçoamento da máquina fazendária com a ampliação e a valorização dos profissionais do setor, permitirão que novos recursos sejam obtidos para o financiamento de novos programas.",303
§ Racionalização das despesas administráveis.,H
"Entre 1995 e 2001, segundo o Tesouro Nacional, as despesas com pessoal representaram 24% das despesas correntes, os encargos financeiros 17% e as outras despesas correntes 59%.",303
"Este último item poderá ser reduzido via compras efetivadas por meio de novos sistemas eletrônicos,",303
"de pagamento pontual dos compromissos (estimulando a concorrência no fornecimento de bens, serviços e obras)",303
e de maior controle sobre a execução dos programas.,303
§Redução gradual dos encargos financeiros.,H
"Com o refinanciamento das dívidas de estados e municípios, quase toda a dívida mobiliária do país pertence ao governo federal.",414
"Essa dívida vem sendo diretamente afetada pelas altas taxas de juros e pelas bruscas oscilações da moeda, dado que boa parte da dívida (em torno de 30%) é corrigida pela variação do dólar.",414
"A nova política econômica irá reduzir gradualmente as taxas de juros e o estoque de títulos da dívida com vinculação cambial, liberando importantes recursos para os diversos programas.",414
§ Adoção de parcerias com o setor privado.,H
"O novo governo impulsionará um movimento nacional pela retomada do crescimento do País, democratização cujo pressuposto é a democratização das relações entre o governo e a sociedade civil.",410
"O esforço pela melhoria da competitividade da economia está ligado à criação de um ambiente ativo, com a valorização dos empreendedores e da capacidade de iniciativa no meio empresarial brasileiro.",410
"Nesse sentido, o governo buscará intensamente compartilhar investimentos com o setor privado de modo a viabilizar o novo Compromisso pela Produção.",410
"Ganha todo sentido, para tanto, a utilização do mercado de capitais, seja pelo uso de recebíveis e lançamento de debêntures, seja pela abertura do capital das empresas.",414
"Essa alternativa pode permitir a mobilização de capitais, não só do grande investidor como, se bem articulado e com segurança, do pequeno poupador, hoje sem opções fora da caderneta de poupança.",414
"Tal mobilização, via Bolsa de Valores,",414
"pode levar ao aumento da poupança nacional voltada para o investimento produtivo, resultando na revitalização do hoje minguado mercado de capitais brasileiro.",410
§ Parcerias com outros níveis de governo.,H
"O nosso governo implementará novos programas em parceria com estados e municípios, ampliando substancialmente o alcance da ação governamental e otimizando ativos e investimentos.",410
§ Integração de Programas.,H
"Com a definição de novas prioridades, alguns programas poderão ser substituídos, anulando-se despesas existentes para a criação de novas, conforme exigência da Lei de Responsabilidade Fiscal.",303
"O novo governo diminuirá a excessiva pulverização dos programas atuais, integrando-os em programas articulados e de maior alcance, economizando e racionalizando recursos.",303
Nova Política Nacional de Desenvolvimento Regional,H
Nosso governo implementará uma nova política regional capaz de equacionar a herança de desigualdades que caracteriza a realidade espacial do País.,503
"Ela combina regiões desenvolvidas e industrializadas com áreas de imensa pobreza e atraso econômico, social e cultural.",503
"O novo governo estimulará a discussão sobre uma Política Nacional de Desenvolvimento Regional, que seja um instrumento de avanço do conjunto das regiões e de apoio à sua inserção ativa no mundo globalizado.",503
"Caberá a essa nova política a abertura de diálogo com estados e municípios, a partir do reconhecimento de suas potencialidades e dos obstáculos ao seu pleno desenvolvimento e inserção na economia internacional.",301
"Sustentada na base produtiva regional já instalada, a nova política trabalhará pela sua ampliação a partir de:",503
§ Redução sistemática das desigualdades regionais.,H
O novo governo terá a eqüidade como princípio estratégico.,503
"Isso se traduzirá em uma luta incansável por redução das desigualdades de renda, ampliação das oportunidades e melhoria das condições de trabalho em todas as regiões do País.",503
§ Investimento em eficiência e competitividade.,H
Esse investimento será estratégico para o planejamento regional,404
e para a montagem de uma estrutura produtiva que objetive ganhar os mercados interno e externo num contexto cada vez mais competitivo;,410
§ Enfrentamento das tendências à fragmentação.,H
"Economias continentais, como a brasileira, exigem cada vez mais políticas capazes de combinar o esforço de integração ao mercado mundial, que algumas regiões e sub-regiões já desenvolvem, com uma atuação no sentido de se evitar que determinadas regiões fiquem à margem, condenadas ao atraso permanente.",503
Políticas de complementaridade serão implementadas de modo a não duplicar esforços,303
e a otimizar a capacidade produtiva de toda a economia brasileira.,410
"Nesse sentido, o respeito à heterogeneidade e à diversidade que caracterizam o País, tanto em termos de indicadores pessoais",607
"como espaciais, será fundamental;",303
§ Combate à disputa predatória entre estados e municípios.,H
"O Brasil está maduro para implantar um modelo descentralizado-coordenado, distinto da atual competição predatória entre estados e municípios.",301
"De fato, a “guerra fiscal” só persiste dada a ausência de verdadeiras políticas de desenvolvimento regional, de investimentos da União e da falta de incentivo à qualificação das agências regionais",301
e ao planejamento de médio e longo prazo.,404
"O novo governo buscará eliminar o desamparo atual de governadores e prefeitos, que buscam trazer o progresso às suas regiões, hoje esquecidas pela União.",301
"A coordenação responsável e flexível do esforço dos estados e municípios será capaz de corrigir o que há de predatório na atual disputa,",301
"sem eliminar um certo grau de competição saudável para agilizar a ação pública, revigorar o corpo técnico e os equipamentos públicos estaduais e municipais;",303
§ Desconcentração das bases produtivas.,H
"O novo governo estimulará a desconcentração das bases produtivas, fortalecendo especializações regionais a partir da classificação das regiões em: (1) Áreas dinâmicas (modernas e competitivas); (2) Em processo de reestruturação (áreas com potencial de competitividade); (3) Estagnadas (áreas de baixo dinamismo econômico); (4) De potencial pouco utilizado (marginalizadas como as áreas estagnadas, que demandam maior esforço de reconhecimento de suas potencialidades); (5) Faixas de fronteira (a oeste e ao norte, elas apresentam especificidades que precisam ser trabalhadas).",301
§ Criação de um Conselho Nacional de Políticas Regionais.,H
"O novo governo proporá a criação de um Conselho Nacional de Políticas Regionais, assim como a criação de um Fundo Nacional de Desenvolvimento Regional,",301
estruturado como um instrumento capaz de implantar os objetivos e metas destinados a diminuir as desigualdades regionais.,503
"Caberia também ao Conselho, acima referido, analisar e aprovar propostas de regionalização, obrigatoriamente explicitadas nas políticas setoriais, uma vez que elas têm impactos regionais diferenciados num país heterogênio como o Brasil e portanto precisam ser conciderados a priori.",301
"A política regional do novo governo será sustentada pelo Fundo Nacional e por fundos específicos que, quando existentes, terão sua gestão democratizada.",202
"Historicamente, o investimento público foi concentrado nos pólos dinâmicos e nas áreas mais competitivas, produzindo desequilíbrios regionais crescentes.",503
"É para as áreas com maiores carências e onde os desafios são maiores, que será destinado tratamento suplementar em apoio aos esforços de seus habitantes e lideranças locais.",301
"Das ações prioritárias no plano regional, nosso governo dará ênfase a duas macrorregiões: a Amazônia, pela sua importância estratégica, e o Nordeste, pelo enorme déficit social.",301
"Nestas regiões, o novo governo buscará recuperar e restaurar toda a capacidade de planejamento e articulação das extintas Superintendência de Desenvolvimento do Nordeste (Sudene) e Superintendência de Desenvolvimento da Amazônia (Sudam).",404
Reconstrução das Cidades e Desenvolvimento Urbano,H
"O município é o espaço preferencial da política de desenvolvimento urbano, onde a sociedade se organiza social e economicamente.",301
É no município que se situam as atividades produtivas que contribuem de forma decisiva para a formação do PIB,301
e onde o cidadão se reconhece como agente político no sistema democrático.,202
"No entanto, os municípios brasileiros enfrentam enormes desafios.",301
"Num mundo de crescente competitividade e complexidade, ficaram delegadas aos governos municipais responsabilidades para as quais não possuem a respectiva autonomia institucional e financeira que lhes permita responder às demandas criadas e tratar dos problemas urbanos.",301
"O governo federal não pode se eximir de sua responsabilidade e deve participar do esforço das administrações municipais na busca das condições que viabilizem: o aumento da produção, do fluxo de bens e serviços",410
e da qualidade de vida da população urbana e a superação das atuais condições de exclusão territorial em que se encontra a maior parte da população urbana.,503
"Os impactos ambientais decorrentes da velocidade do processo de urbanização, aliados à implementação de políticas urbanas que jamais dialogaram com a dinâmica da cidade real,",416
"geraram uma incapacidade crônica do poder público de garantir o efetivo acesso a saneamento, habitação, transporte,",411
"segurança, educação e saúde, revelando os riscos a que significativas parcelas da população urbana estão submetidas: deslizamento de encostas, inundações, contaminações do solo e de cursos d’água, proliferação de lixões a céu aberto.",504
"Com o crescimento das aglomerações urbanas ampliou-se a pobreza urbana, tornando cada vez mais complexa a resolução dos problemas que afligem as cidades.",503
"Entre os fatores que contribuíram para essa situação, destacam-se a dificuldade de acesso à terra e a inadequação da política urbana às necessidades da população, que acentuaram a proliferação de assentamentos urbanos informais.",503
"Em pouco mais de 50 anos, a taxa de urbanização passou de 31,4% para mais de 80%.",503
"No entanto, esse crescimento não foi acompanhado da oferta de bens e serviços urbanos capazes de atender ao contingente populacional que se dirigiu às cidades, onde grande parcela da população se reagrupou em assentamentos humanos informais ou ilegais, em favelas, mocambos e palafitas.",503
"Diante desse quadro, o nosso governo se dispõe a: § Articular a política nacional de desenvolvimento com as políticas urbanas, de modo a revelar, construir e potencializar as identidades e vocações dos municípios.",410
"Para isso, é fundamental que todas as vantagens competitivas locais sejam exploradas;",410
§ Escolher as características diferenciadas das cidades de modo a orientar os investimentos estratégicos;,410
"§ Incentivar a participação dos governos estaduais na definição das políticas urbanas, de forma a promover redes regionais com funções complementares;",301
"§ Construir efetivamente a gestão cooperativa nas regiões metropolitanas, incentivando consórcios e outras formas de associativismo comprometidas com o desenvolvimento das regiões;",301
"§ Estimular a implementação do Estatuto da Cidade, apoiando os municípios no esforço de manejar o uso e a ocupação do solo.",301
"Diante da gravidade da situação urbana, o novo governo vai desenvolver em caráter de urgência ações no âmbito institucional e operacional, como:",303
a) Reforço da capacidade de gestão municipal.,H
"Desenvolver e executar, em parceria com os estados, programas de desenvolvimento institucional que contribuam para a modernização da gestão urbana",303
"e para a capacitação técnica e gerencial dos agentes públicos, particularmente das administrações municipais;",303
b) Combate à exclusão por meio de ações de emergência social.,H
"A União deverá ampliar a oferta de alternativas de produção de habitações, incluindo a regularização fundiária e a urbanização de assentamentos informais, aliada à ampliação da oferta no mercado formal para as faixas de baixa renda familiar;",503
c) Investimento em Infra-Estrutura.,H
"O novo governo dará prioridade aos investimentos em saneamento ambiental (água, esgoto, drenagem, lixo) e sistemas de transporte coletivo para os municípios.",411
Projeto Moradia,H
O novo governo mobilizará a sociedade civil,606
"pelo direito à moradia digna, buscando assentar as bases para a superação do enorme déficit habitacional que atinge principalmente os mais necessitados e suas famílias.",504
"De 1995 a 1999, foram construídas no Brasil 4,4 milhões de unidades habitacionais.",504
"Desse total, apenas 700 mil foram produzidas pelo mercado.",504
"Isto é, nada menos de 3,7 milhões de moradias foram construídas, em condições precárias, pelas próprias famílias excluídas.",504
"Essa tragédia permanente, em vez de diminuir, cresce constantemente.",504
"Em 1970, apenas 1% da população da Grande São Paulo vivia em favelas.",504
"Em 1995, esse índice saltou para 20%.",504
"Em Belo Horizonte, 25% dos habitantes moram em favelas.",504
"No Rio de Janeiro, 28%.",504
"Em Salvador, 33%.",504
"Em Belém, 50%.",504
"O Brasil demanda 600 mil novas casas por ano, que devem ser somadas ao déficit habitacional já existente de 5,5 milhões de moradias.",504
"Para superar essa situação, o novo governo vai: § Priorizar o estímulo à construção de moradias, aquecendo a indústria da construção civil;",504
"§ Orientar sua atuação pela Constituição Federal,",203
"que define a Função Social da Propriedade, de modo a racionalizar o uso de milhões de imóveis urbanos vagos em todo o País;",413
"§ Implantar o Projeto Moradia do Instituto Cidadania, de modo a coordenar as ações de política urbana e habitacional, articulando suas principais agências responsáveis;",303
"§ Impulsionar o barateamento dos materiais de construção, por meio da implantação de políticas específicas para este setor, com ênfase em critérios de padronização e fixação de normas para os produtos;",403
"§ Incentivar ações das Prefeituras no sentido de elaborar Planos de Ação e Planos de Moradia integrados, que especificarão os investimentos e as obras destinadas às diversas regiões da cidade,",404
com o duplo objetivo de racionalizar a ocupação do solo,503
e assegurar a oferta de serviços essenciais à população;,504
"§ Concentrar o financiamento da habitação nos Fundos de Moradia (nacional, estaduais e municipais), articulando as diferentes fontes de recursos e uniformizando os critérios de financiamento.",303
A Caixa Econômica Federal será a gestora operacional do sistema de financiamento.,303
"Para assegurar a oferta de crédito em escala ampla e diversificada será adotado um sistema altamente descentralizado, com a utilização de agentes e promotores de financiamento de diversos portes, distribuídos pelos estados e municípios.",301
"§ Financiar, prioritariamente, a população com renda familiar de até 12 salários mínimos e as regiões onde o déficit habitacional é maior.",503
A solução do problema da moradia digna não depende somente da existência de recursos e sim da criação de condições que garantam o acesso das famílias de baixa renda ao financiamento disponível.,504
"Para isso, o novo governo implementará uma política maciça de concessão de subsídio, possibilitando que as famílias beneficiárias paguem o financiamento, a partir de mecanismos que ajustem o valor da prestação à sua renda mensal.",504
