"content","cmp_code","eu_code"
"PLANO DE ACÃO PARA MUDAR O BRASIL","H",NA
"PROGRAMA DE GOVERNO","H",NA
"PLANO DE ACÃO PARA MUDAR O BRASIL","H",NA
"Eleições Presidenciais 2014","H",NA
"Não vamos desistir do Brasil Apresentamos este Programa de Governo num momento de grande dor, em que nossa coligação Unidos pelo Brasil, formada pelo PSB, Rede Sustentabilidade, PPS, PPL, PRP, PHS, E PSL perde seu líder e candidato a Presidente da República, Eduardo Campos, morto tragicamente em cidente aéreo junto com outros valorosos companheiros.","601.1",NA
"Mal tivemos tempo de retornar do luto à luta, mas o fazemos em honra aos que partiram.","601.1",NA
"Apesar da tristeza, o velório e o sepultamento de Eduardo Campos, no dia 17 de agosto, em Recife, mostraram algo surpreendente, que contraria o senso comum formado na sociedade brasileira ultimamente, de que a população tem repulsa à política e aos políticos.","601.1",NA
"A despedida a Eduardo foi inequívoca e emocionante demonstração de amor e de respeito a um político.","601.1",NA
"No sentimento dos pernambucanos, que se estendeu aos brasileiros de todos os estados e regiões, revelou-se o reconhecimento íntimo que o povo cultiva pelos que, ao representá-lo, sabem interpretar os seus sonhos e despertar suas esperanças.","305.2",NA
"Esse reconhecimento nos traz a responsabilidade redobrada de corresponder às expectativas da sociedade brasileira, não apenas do ponto de vista da prática política, mas também do conteúdo e da densidade de nossas propostas.","601.1",NA
"Temos a missão de estabelecer uma inﬂexão conceitual e operacional nos rumos do Brasil: no modelo de desenvolvimento, na gestão do Estado e no funcionamento do sistema político.","303",NA
"Esse sentido de mudança e essa coerência entre palavras e atos, encontramos no líder que nos reuniu.","305.2",NA
"Eduardo revelou-se em sua morte.","305.2",NA
"Conhecendo-o, os brasileiros admiraram o quanto foi autêntico e competente em sua vida política e o quanto isso espelhava o homem íntegro, carinhoso, aberto e alegre, que gostava de gente e se realizava ao melhorar a vida das pessoas.","305.2",NA
"Viram que o Eduardo candidato era o mesmo que, juntamente com Renata, criou uma família que enterneceu a todos com seu afeto, orgulho, despojamento e coragem.","305.2",NA
"Essa família deu um testemunho de que a política e a vida são a mesma coisa e ambas devem ser intensas e coerentes, o que foi muito bem sintetizado por seu ﬁlho Pedro, no pequeno vídeo em que ele e os irmãos homenagearam Eduardo no Dia dos Pais: “Ser seu ﬁlho é ser sempre um cidadão”.","305.2",NA
"A despedida de Eduardo foi a aﬁrmação da dignidade da política.","305.2",NA
"Esta é a bandeira que partilhamos e que deve estar presente em todos os nossos atos, especialmente neste programa, que é a expressão maior da nossa aliança e que foi pessoalmente revisado por ele antes de sua partida//.","305.2",NA
"Entendemos que está encerrado, no Brasil, um ciclo em que tivemos conquistas,","601.1",NA
"mas em que os agentes políticos – da forma como se organizam e se relacionam entre si e com a população – já não respondem aos anseios da sociedade diante do Estado.","303",NA
"Já não conseguem renovar a política nem melhorar os serviços públicos.","303",NA
"A cristalização de uma política destrutiva, polarizada e em bases patrimonialistas tirou a vitalidade de nosso desenvolvimento,","601.1",NA
"fazendo-o girar em falso, pela ausência de reformas estruturais essenciais","303",NA
"e pela falta de um investimento histórico e revolucionário na Educação, plataforma básica sem a qual todos os nossos castelos serão de areia.","506",NA
"O programa que agora apresentamos, ao constatar esse momento de estagnação, aponta para o início de um novo ciclo.","410",NA
"Ainda é – e pretende continuar sendo, durante sua execução – uma construção aberta às novas contribuições e à participação da sociedade.","202.1",NA
"Sua proposta central é uma mudança geral na qual se integrem ações estratégicas em muitas áreas e setores.","404",NA
"Em cada uma delas e em seu conjunto, revela-se a trilha que nossa coligação percorre para chegar às melhores soluções, aﬁnadas com os sonhos do povo brasileiro.","303",NA
"Nenhuma mudança acontecerá, contudo, sem uma ressigniﬁcação da política e","304",NA
"uma nova sintonia da população com as virtudes democráticas.","202.1",NA
"A crise de representação na qual o sistema político imergiu é um grave fator limitante do desenvolvimento com justiça e sustentabilidade, pois fragiliza e deturpa os canais de participação no processo de tomada de decisão, fazendo com que o interesse público se perca em meio a uma enxurrada de interesses particularistas que se imiscuem na esfera do Estado.","304",NA
"Nosso programa, em seu Eixo 1, propõe uma concepção de Estado pautada pela participação,","202.1",NA
"gestão competente e","303",NA
"governabilidade fundada na transparência.","304",NA
"Partimos da necessidade de devolver à sociedade a conﬁança na democracia e,","202.1",NA
"para tanto, o primeiro desaﬁo é superar a crise de representação por meio de um novo modo de fazer política.","304",NA
"Para isso, propomos uma reforma na maneira de conduzir a administração pública, conectando-a com as necessidades de um Estado que se destine a servir a sociedade, e não dela se servir.","304",NA
"O Eixo 2 trata da economia para o desenvolvimento sustentável, cuja pujança potencial é desperdiçada pela ausência de políticas à altura da disponibilidade de recursos naturais e da existência de uma sociedade criativa e empreendedora.","416.2",NA
"Planejamento, visão estratégica e condução rigorosa da política econômica podem criar o ambiente necessário a um novo ciclo de desenvolvimento, em novas bases e com novos horizontes.","404",NA
"Com esse objetivo, nosso programa apresenta uma série de propostas de reformas microeconômicas capazes de trazer produtividade a todos os setores da sociedade brasileira.","410",NA
"No Eixo 3, concebemos educação, cultura, ciência e tecnologia e inovação como um único corpo estratégico, indissociável da cidadania plena e fundamento do desenvolvimento sustentável.","404",NA
"A ênfase na educação pública de qualidade vai permear todas as políticas públicas do futuro governo.","506",NA
"O Eixo 4 trata de um compromisso sem o qual nenhum programa de governo faria sentido, por mais bem sucedido que pudesse ser nos indicadores econômicos: o bem estar da população.","504",NA
"As políticas sociais são o motor de uma visão de justiça e redução das desigualdades, pela garantia de acesso universal e digno a bens e serviços públicos relevantes, direito inalienável de cada cidadão.","503",NA
"O compromisso com o fortalecimento do SUS, inclusive assumindo bandeiras da sociedade como o Saúde+10, está materializado em propostas que vão enfrentar o desaﬁo de proporcionar ao povo brasileiro uma saúde de qualidade.","504",NA
"No Eixo 5 estão as propostas voltadas para um setor crítico e sensível da vida em nosso país: o meio urbano, onde estão 85% dos brasileiros.","301",NA
"Aí está o painel mais doloroso de nossa exclusão social, da violência, de todas as assimetrias históricas do país","503",NA
"e também da omissão do Estado,","303",NA
"da falta de planejamento e","404",NA
"do descaso com a qualidade de vida da população.","504",NA
"O Eixo 6, ﬁnalmente, trata do direito à cidadania plena, garantida pela Constituição a todos os brasileiros, porém, negada na prática, sobretudo a grupos e indivíduos mais vulneráveis e aqueles submetidos a injustiças históricas.","503",NA
"É preciso aproximar cada vez mais o ideal constitucional do dia a dia do povo,","203",NA
"até porque é do exercício ativo da cidadania, por todos, que advêm o aperfeiçoamento democrático e o funcionamento das instituições para o bem comum.","202.1",NA
"Nesse eixo, nosso programa apresenta um conjunto de políticas públicas que vão reduzir as discriminações e estimular uma maior tolerância diante da pluralidade do povo brasileiro.","607.1",NA
"Este é nosso esforço, este é nosso caminho.","000",NA
"Queremos compartilhá-lo com a sociedade brasileira e expressamos este desejo com sinceridade e emoção.","000",NA
"Tivemos a ousadia de sair do roteiro da política tradicional para recriar, com novos elementos e novos métodos, a luta pela justiça social e","305.1",NA
"pelo desenvolvimento com sustentabilidade como um de nossos principais objetivos.","416.2",NA
"Tivemos o atrevimento de propor, num país marcado pela política patrimonialista e destrutiva, uma prática de reconhecimento às realizações de outras forças políticas.","305.1",NA
"Estamos apresentando um roteiro para a superação de uma velha polarização que já não dá conta dos novos anseios da população.","305.1",NA
"Ao convocar o nosso povo a percorrer um novo caminho, vamos unir o país com o olhar para o futuro.","305.1",NA
"Vamos juntar todas as forças políticas que tenham o desejo e a coragem de mudar o Brasil e fazer as reformas estruturais há tanto adiadas.","305.1",NA
"Vamos inaugurar uma nova era de gestão competente e transparente do Estado e da economia, guiados pela missão de servir.","305.1",NA
"Nosso programa procura expressar esses propósitos.","305.1",NA
"Ele é também uma homenagem a Eduardo Campos, que tanto se empenhou para que estivéssemos juntos nesta aliança e compreendeu profundamente que isso só seria possível por meio de propostas verdadeiras para o Brasil, não de uma conjunção de interesses meramente eleitorais.","305.2",NA
"Sem Eduardo, temos hoje o que sempre nos uniu: a consciência clara de onde queremos chegar juntos e a articulação política feita por ele para dar sustentação ao nosso programa comum.","305.2",NA
"O programa é, em si mesmo, o pacto selado, o acordo maior que une PSB, Rede Sustentabilidade, PPS, PPL, PRP, PHS, e PSL e que há de unir todo o Brasil.","305.1",NA
"Para ele, trouxemos o acúmulo de nossa experiência passada, de nossas diretrizes, de nossos projetos partidários, de nossos compromissos com o povo brasileiro, tudo submetido ao crivo da competência técnica, da inovação metodológica e política e da busca do que de melhor se pensa e se faz no mundo em termos de avanços democráticos.","305.1",NA
"Somos, agora, os principais responsáveis por ampliar e fazer ecoar na História a exortação de Eduardo Campos: “NÃO VAMOS DESISTIR DO BRASIL! Marina Silva e Beto Albuquerque","601.1",NA
"Eixo 1 Estado e damocracia de alta intensidade","H",NA
"Um novo modelo de desenvolvimento exige uma concepção do Estado diferente da atual,","303",NA
"que contemple participação,","202.1",NA
"gestão competente e","303",NA
"governabilidade pautada pela transparência.","304",NA
"São muitas as frentes a exigir transformação, para devolver à sociedade a conﬁança na democracia.","202.1",NA
"O desaﬁo é também superar a crise de representação atual, por meio de várias mudanças, mobilizando de forma perene as melhores forças do país para a construção de um futuro com justiça e prosperidade.","202.3",NA
"REFORMA POLÍTICA","H",NA
"Os debates sobre a necessária mudança de visão de Estado, não raro, levam a um receituário reduzido do famoso “choque de gestão”, pautado por um único eixo, o da “eﬁciência gerencial”.","303",NA
"É insuﬁciente.","303",NA
"Nossas escolhas são políticas e envolvem participação social em todas as fases dos processos públicos.","202.1",NA
"Com a Constituição Federal de 1988, refundamos o Estado brasileiro.","203",NA
"Resgatamos os valores da cidadania e da dignidade humana, solapados pelo autoritarismo de governantes ilegítimos.","202.1",NA
"Anos depois, conseguimos encontrar os rumos da estabilidade econômica","414",NA
"e da inclusão social de parte da população mais carente.","503",NA
"Houve também algum ganho em aspectos pontuais da participação social em processos de escolha de prioridades e de decisão política.","202.1",NA
"Estamos, entretanto, bem longe dos níveis desejáveis de solidariedade, emancipação social, convivência pacífica e desenvolvimento justo e ambientalmente sustentável.","602.1",NA
"Democracia de alta intensidade envolve da escolha de prioridades à tomada de decisões e à transformação delas em ação pública.","202.1",NA
"Eleições são apenas o ponto de partida do processo.","202.1",NA
"Trata-se de fazer avançar no Brasil a experiência democrática.","202.1",NA
"A mudança passa por elevar progressivamente a responsabilidade dos atores da política — mandatários, legisladores e cidadãos.","202.1",NA
"Uma aliança que busca a democracia de alta intensidade deve reconhecer que o Estado não pode ser o garantidor único desses valores.","202.1",NA
"Sem ampla participação da sociedade, dificilmente sairemos dos sérios impasses em que estamos, entre outras coisas, porque, na direção oposta, o atual governo trabalha para substituir o cidadão, com seu consentimento a cada quatro anos, na tomada de decisões e na gestão das políticas.","202.4",NA
"As instituições envelhecidas e a democracia de baixa qualidade.","202.1",NA
"A sinergia dos movimentos sociais com as novas formas de militância.","606.2",NA
"A democratização da democracia.","202.1",NA
"Pelo ﬁm da corrupção e do loteamento do Estado.","304",NA
"Com tantas mudanças em curso, as instituições políticas estão envelhecidas e tomadas de práticas de clientelismo, nepotismo, populismo e outras formas de patrimonialismo e de perpetuação no poder a qualquer custo.","304",NA
"Sob o pretexto de buscar condições estáveis para a governabilidade e a gestão da máquina pública, desde a redemocratização o presidencialismo de coalizão esconde uma lógica viciosa de acordos de bastidores e distribuição de cargos e vantagens.","304",NA
"Pratica-se o loteamento do Estado em troca de apoio parlamentar e tempo de propaganda eleitoral.","304",NA
"O dinheiro do contribuinte é, assim, recorrentemente desperdiçado em políticas públicas inconclusas, por negligência ou por falta de planejamento, de integração e de visão de longo prazo.","303",NA
"A transparência dá lugar à cultura da obscuridade e da corrupção.","304",NA
"A democracia brasileira é de baixa qualidade porque pouco receptiva à participação e","202.1",NA
"marcada pelo desapreço dos ocupantes de cargos públicos por práticas de accountability e transparência.","304",NA
"Não bastasse isso, a legislação eleitoral opera em favor da concentração do poder, o debate é delimitado por estreitas orientações de marketing, e o sistema político confunde-se com o mercado: só tem valor o que tem preço.","304",NA
"Privilegiam-se os interesses de segmentos econômicos, sociais e culturais hegemônicos em detrimento da distribuição equitativa dos recursos públicos e do acesso universal às instituições e aos serviços do Estado.","503",NA
"Inevitavelmente, o cidadão se afasta das pautas públicas e de seus representantes eleitos e dá sinais de já não tolerar a apatia dos governantes e dos partidos, bem como a impotência dos movimentos sociais organizados diante da exclusão social e da exploração econômica.","202.1",NA
"Assim é o atual modelo brasileiro de democracia, em evidente crise.","202.1",NA
"Tornou-se o véu sob o qual se realiza a privatização dos recursos públicos.","304",NA
"Muitos caminhos têm surgido, porém, apontando para outra direção.","202.1",NA
"Uma militância ativa trouxe para o centro do debate novas formas de exercer a democracia e interferir nas tomadas de decisão.","202.1",NA
"Para isso, vale-se da evolução das mídias alternativas, capazes de potencializar participação e formas inovadoras de mobilização.","202.1",NA
"Além dos movimentos sociais consolidados, muitas mobilizações sociais surgem para defender pautas de inclusão, apoiando-se tanto nos mecanismos usuais quanto nas redes sociais.","202.1",NA
"As tecnologias da informação e comunicação são, portanto, potenciais aliadas em um processo de mudança.","202.1",NA
"Por meio da democracia digital, podemos radicalizar a transparência e o controle da ação governamental, missão para o curto prazo.","202.1",NA
"O amadurecimento do uso intensivo de tecnologia e a participação social poderão tornar, gradativamente, a vida pública mais aberta e dinâmica.","202.1",NA
"Nossa proposta é fundar uma prática política diferenciada, de compromisso com a nação, de “democratização da democracia”.","202.1",NA
"Em linha com tudo isso está a coligação Unidos pelo Brasil, cujo núcleo é sua dimensão programática.","000",NA
"Nossa proposta é fundar uma prática política diferenciada, de compromisso com a nação, de “democratização da democracia”.","202.1",NA
"Democratização da democracia pressupõe combinar os movimentos sociais históricos com as mobilizações que surgem por meio das novas tecnologias.","202.1",NA
"O coração pulsante dessa ideia é a participação plural e popular permanente, norteada por valores como solidariedade, emancipação, justiça social, criatividade e sustentabilidade.","202.1",NA
"Isso implica o engajamento na luta por igualdade qualificada, que reconheça a diversidade étnica, de gênero, de orientação sexual e de credo religioso, combatendo toda forma de discriminação.","503",NA
"Valoriza ainda a participação de populações vulneráveis, pessoas portadoras de necessidades especiais, indígenas e comunidades tradicionais, idosos, crianças e adolescentes.","706",NA
"A meta é atingir um desenvolvimento sustentável, porta de acesso a condições civilizatórias básicas.","416.2",NA
"A crise de representação.","202.1",NA
"A lógica perversa do ﬁnanciamento de campanha.","304",NA
"A apropriação da poltica por interesses econômicos como matriz dos escândalos.","304",NA
"Reorganizar o Estado e reformar a política.","204",NA
"Democratizar a democracia pressupõe, então, uma reorganização do Estado.","202.1",NA
"Inaugurar um espaço político democrático exige rever as ações em, pelo menos, quatro âmbitos de relacionamento com a sociedade: as instituições políticas, a administração pública, as relações federativas e a soberania democrática.","202.1",NA
"Das 513 campanhas mais caras para uma vaga na Câmara em 2010, 390 tiveram sucesso.","304",NA
"A política brasileira vive, atualmente, uma das crises de legitimidade mais agudas da redemocratização.","602.1",NA
"Tornou-se comum a ocupação dos espaços públicos por cidadãos que não pretendem mais delegar tudo a seus governantes.","202.4",NA
"Trata-se de uma crise nacional de representação, derivada de regras eleitorais estimuladoras de um presidencialismo de coalizão que leva à oligarquização da política.","202.1",NA
"Trata-se de uma crise de valores e, de todas as que vivemos, essa assume papel central, porque necessariamente condiciona nossas escolhas.","602.1",NA
"Resolvê-la é tão difícil quanto fundamental: não basta substituir a representação pela participação simplesmente; trata-se de procurar uma articulação nova e profunda entre as duas coisas.","202.1",NA
"Uma das causas profundas da crise de valores é a reprodução da velha política.","602.1",NA
"Seus efeitos mais visíveis são a distribuição de pedaços do Estado.","602.1",NA
"Os agentes dessa lógica são o presidente eleito e os líderes partidários.","602.1",NA
"Estes, em troca de mais recursos públicos, concedem àquele apoio político.","602.1",NA
"Essa situação impede que o chefe de Estado realize o programa para o qual foi eleito e se desdobra em escândalos como o mensalão e os relativos à emenda da reeleição.","602.1",NA
"O primeiro passo de uma reforma implica exigir comportamento republicano de todos os agentes políticos e dos demais ocupantes de cargos públicos.","602.1",NA
"O presidente da República não pode ser mero distribuidor de recursos públicos.","602.1",NA
"Deve ser um representante da vontade popular.","202.1",NA
"As instituições públicas não podem se afastar dos princípios constitucionais de legalidade, impessoalidade, moralidade, publicidade e eficiência.","204",NA
"Para além da busca de melhor qualidade individual e ética do governante,","304",NA
"é preciso desfazer uma série de nós antidemocráticos.","202.1",NA
"Um deles é a falta de isonomia, transparência e controle na competição entre os partidos políticos, notadamente em razão dos modos de financiamento de campanhas.","304",NA
"A crise política atual é, em boa parte, uma crise dos instrumentos de mediação entre eleitos e eleitores, principalmente os partidos.","304",NA
"As eleições têm-se tornado um desafio cada vez mais custoso.","304",NA
"As campanhas são baseadas no apelo publicitário à imagem e às emoções, sintoma claro de atraso.","304",NA
"Coalizões de ocasião resultam em adição de segundos de exposição televisiva.","304",NA
"O marketing transforma a cena política em espetáculo.","304",NA
"O show eleitoral de grandes partidos é um empreendimento milionário.","304",NA
"Isso se reflete na composição atual do Parlamento: segundo registros do Tribunal Superior Eleitoral, em 2010, das 513 campanhas mais caras, para uma vaga na Câmara dos Deputados, 390 garantiram sucesso nas eleições.","503",NA
"Com isso, a representação não se dá de forma equilibrada, excluindo grupos inteiros de cidadãos, como indígenas, negros, quilombolas e mulheres.","503",NA
"Doar fundos a um partido constitui livre exercício de um direito político, mas é preciso atentar para o princípio da equidade entre os cidadãos, dada a grande diferença entre a capacidade contributiva de cada um.","503",NA
"No Brasil, há uma liberdade quase ilimitada no financiamento privado dos partidos, o que resulta em competição com base em condições absolutamente desiguais.","503",NA
"Evidentemente, grandes partidos têm maior capacidade de arrecadação.","503",NA
"Mas nada se compara ao poder de atração do partido que controla a máquina pública.","503",NA
"Nunca, na nossa história, um partido ocupante do poder recebeu tanto em doações privadas num ano sem eleições como em 2013.","503",NA
"O montante arrecadado chega a quase o dobro do que receberam todos os demais juntos.","503",NA
"PARA DEFLAGRAR A REFORMA POLÍTICA","H",NA
"Propor a unificação do calendário geral das eleições, o fim da reeleição e a adoção do mandato de cinco anos.","204",NA
"Propor a adoção de novos critérios na definição da orden dos eleitos para cargos proporcionais buscando aproximação da Verdade Eleitoral, conceito segundo o qual os candidatos mais votados são os eleitos.","204",NA
"Propor a inscrição de candidaturas avulsas aos cargos proporcionais mediante atendimento de requisitos a definir.","204",NA
"Propor a redefinição da distribuição do tempo de propaganda eleitoral gratuita com base em novos critérios visando a melhorar a representatividade da sociedade brasileira nos parlamentos.","503",NA
"Permitir a convocação de plebiscitos e referendos pelo povo e facilitar a iniciativa popular de leis, mediante redução das assinaturas necessárias e da possibilidade de registro de assinaturas eletrônicas.","202.4",NA
"Propor o fortalecimento dos mecanismos de transparencia nas doações para campanhas eleitorais.","304",NA
"O primeiro passo de uma reforma implica exigir comportamento republicano dos agentes políticos e dos ocupantes de cargos públicos.","304",NA
"Se os partidos não revelam sua própria gestão, como acreditar que realizarão uma administração transparente do Estado ou que terão independência para punir desvios?","304",NA
"A falta de limites e controles, internos e externos, permaneceu depois da aprovação, em 2013, da Minirreforma Eleitoral,","304",NA
"que privilegia os grandes partidos","503",NA
"A lei provocou ainda o inimaginável: vários retrocessos em relação às regras de transparência, financiamento e tempo de propaganda televisiva.","204",NA
"Se os partidos não revelam sua própria gestão, nenhuma razão haverá para acreditar que realizarão uma administração transparente do Estado ou, no mínimo, que terão independência para punir desvios.","304",NA
"Reformar o sistema de financiamento político-partidário requer, enfim, devolver ao cidadão sua capacidade de exercer influência nas instâncias de escolha política dos representantes, de forma equânime.","503",NA
"Torna-se, ao lado da ampliação da participação popular, questão prioritária para democratizar a democracia.","202.1",NA
"Para deflagrar o processo de reforma política, vamos sugerir medidas iniciais que levarão à reconfiguração integral do sistema político e eleitoral do país.","204",NA
"Estamos propondo os caminhos para que a democracia brasileira seja participativa e capaz de promover a inclusão de toda a população na formulação das políticas públicas.","202.1",NA
"Vamos ampliar a participação,","202.1",NA
"a transparência e a ética e","304",NA
"ao mesmo tempo, tornar mais eficiente o funcionamento das instituições republicanas,","303",NA
"livrando-as do patrimonialismo, do clientelismo e da corrupção.","304",NA
"As manifestações e a urgência de reconectar eleitos e eleitores.","202.1",NA
"O conceito de “aplicativos” para uma democracia revitalizada e colaborativa.","202.1",NA
"Por um governo aberto, participativo e em rede.","202.1",NA
"É necessário criar mecanismos de participação que revigorem a democracia representativa, aumentando sua legitimidade.","202.3",NA
