Text,Code
"Pior, o monopólio do poder de decisão dos proprietários é exercido com o objetivo de maximizar o lucro, sem necessidade de considerar os interesses dos consumidores dos produtos nem dos trabalhadores que os produzem.",409
"As intenções de quem dirige as empresas são mantidas em segredo dos que executam o trabalho e dos que lhe vendem matérias-primas, enérgia e serviços, impedindo por definição qualquer coordenação dos planos das empresas.",403
"A demanda que o mercado revela, e à qual os agentes econômicos devem adaptar-se, não é idêntica às necessidades sociais ou ecológicas, mas depende da distribuição de renda e da produção de capital já existentes;",409
só quem detém renda e capital é reconhecido como demandante legítimo e toma-se capaz de estimular a alocação mercantil de recursos.,415
"Desta forma, desconhecem-se tanto custos quanto necessidades sociais e ambientais.",504
"Além disso, o mercado depende de decisões atomizadas, em geral presas a horizontes de curto prazo.",404
"Muitas ações perfeitamente justificadas tendo em vista as necessidades de conjunto de um país, ou de toda a humanidade a longo prazo, não são percebidas.",404
O mercado favorece a concentração de renda e a ampliação das desigualdades sociais.,503
E o seu controle por setores oligopolizados amplia estas distorções.,415
"Para evitar que a concorrência irrestrita e o subjetivismo na tomada de decisões pelos empresários faça a economia global oscilar entre crescimento insustentável e crise, o govemo executa a política econômica.",416
"Embora ela seja de responsabilidade de governos eleitos, na prática é concebida e executada por uma reduzida equipe de economistas, que age em segredo e dispara, em geral de surpresa, medidas destinadas a unificar expectativas e estabilizar preços, salários e demais valores nominais.",409
O autoritarismo nas empresas e o autoritarismo na política econômica condicionam-se mutuamente e estão na raiz do fracasso em estabilizar os valores nominais no Brasil e fazer a economia retomar o desenvolvimento.,409
"Trataremos de criar instituições que permitam a participação da sociedade civil na política econômica, através das entidades de classe e dos consumidores",409
"e que permitam que trabalhadores e consumidores possam tomar parte em decisões empresariais estratégicas, em nível geral e setorial, além de tomarem conhecimento do desempenho das empresas e de suas margens de lucro.",409
"A democratização da vida econômica, além de ser um valor em si, criará condições para superar a crise.",202
"Serão convocados fóruns por cadeia produtiva em que estarão representados empresas, trabalhadores, consumidores e governo.",202
As atuais câmaras setoriais são um dos modelos possíveis para estes fóruns.,202
Serão confeccionadas planilhas de custo confiáveis para os principais produtos de cada cadeia produtiva.,409
"Como as informações contidas nestas planilhas são fundamentais para negociar os conflitos de interesses entre empresas, entre patrões e empregados e entre fornecedores e consumidores, será necessário estabelecer como norma o direito de representantes credenciados de trabalhadores e consumidores examinarem a contabilidade de empresas.",405
"As negociações para alinhar preços, salários e tributos deverão se pautar pelo pleno reconhecimento dos direitos de:",405
"os consumidores serem protegidos contra produtos nocivos, inócuos e de qualidade inferior à prometida pelos fornecedores, e de pagarem preços que correspondam aos custos reais mais uma margem de lucro que possibilite os investimentos necessários na expansão da produção e na melhoria dos produtos;",403
"os trabalhadores receberem salários que lhes possibilitem manter seu padrão de vida habitual, obterem a reposição de perdas salariais comprovadas e aumento dos salários, à medida que o crescimento da produção e da produtividade o permitirem sem necessidade de repasse aos preços dos produtos;",701
as empresas auferirem margens de lucro compatíveis com o montante de capital investido e que sirvam para realizar as inversões que também as outras duas partes consideram necessárias;,405
"elas deverão ter o direito de repassar aos preços aumentos de custos “externos” aos fóruns por cadeia produtiva, como o encarecimento de produtos importados.",409
"Uma preocupação específica deverá ser a de reduzir a predominância dos oligopólios, além dos mecanismos de compartilhar decisões citados anteriormente, o govemo adotará também políticas que introduzam uma pressão do mercado que hoje não existe, inclusive com a liberação coordenada de algumas importações.",403
"A formação da política industrial e agrícola, da política de comércio exterior, da política tecnocientífica, deverá se basear em contribuições dos fóruns por cadeia produtiva, que são a unidade mais adequada para analisar a inserção do Brasil no mercado mundial e a maior ou menor abertura do mercado brasileiro à competição extema.",402
"As políticas industrial e agrícola, de comércio externo e tecnocientífica visam adequar o nosso desenvolvimento aos anseios do povo dentro das possibilidades e limitações do mercado internacional.",416
"Portanto, sua implementação pressupõe eficaz coordenação de empresas complementares e participação interessada de consumidores e de trabalhadores.",409
"Por isso, os fóruns por cadeia produtiva terão papel importante no detalhamento e na implementação destas políticas.",409
"Pela primeira vez, as tecnocracias govemamentais e empresariais terão oportunidade de ter como interlocutores representantes qualificados de consumidores e trabalhadores.",405
"Em pequena escala, algo desta natureza já vem sendo feito em algumas câmaras setoriais.",405
"Com sua generalização, e pela presença de representantes de consumidores e de trabalhadores em todos os níveis de negociação, será evitado o risco do corporativismo.",405
"Este novo tipo de condução do desenvolvimento não pressupõe a eliminação dos mecanismos de mercado, através dos quais continuarão se realizando todas as transações: compra e venda de mercadorias,",403
"admissão e demissão de trabalhadores,",701
aplicações financeiras,701
e concessão de crédito.,409
"Mas a evolução futura do mercado será melhor conhecida, as políticas públicas serão formuladas transparentemente e implementadas com a participação de todos os interessados, assim, as decisões básicas da economia serão mais congruentes e melhorará o seu desempenho.",202
Os proprietários ou seus representantes passarão a dividir progressivamente o poder de decisão com consumidores e trabalhadores.,202
O desenvolvimento como qualidade de vida,999
"O terceiro elemento distintivo do novo ciclo de desenvolvimento será a adoção de uma visão da economia baseada em outros pressupostos, para além, unicamente, do conceito de crescimento.",416
"O desenvolvimento não pode ter como objetivo último a busca da qualidade produtiva, mas sim a da qualidade de vida.",416
Esta concepção de desenvolvimento parte das referências que estabelecemos nos capítulos anteriores dêste programa.,416
"Conseqüentemente, buscaremos como indicadores do desenvolvimento, entre outros, os parâmetros já equacionados por fóruns internacionais para o cálculo do Índice de Desenvolvimento Humano (IDH).",416
"40 - Salário, emprego e distribuição de renda",999
As formas mais dramáticas da crise: inflação e pobreza,999
"Apesar das vantagens dinâmicas, reais ou potenciais, anteriormente apontadas, das potencialidades nacionais em termos de território, recursos naturais e população, o Brasil está extenuado pela crise estrutural da economia, que já se arrasta há mais de uma década e produziu problemas cumulativos, cujo equacionamento é imprescindível para que haja retomada firme do crescimento.",305
"A falta de investimento público e privado, bem como de financiamentos de longo prazo, aliadas a sucessivas políticas recessivas, implicaram um atraso considerável em vários setores produtivos, na deterioração da infra-estrutura e no colapso dos serviço sociais em geral, de responsabilidade do Estado.",305
As formas mais dramáticas da crise são: o aumento galopante da pobreza absoluta,504
"e uma instabilidade monetária crônica, por muitos chamada “superinflação”.",305
"Optar entre a necessidade de estabilização macroeconômica e a retomada prioritária do crescimento, visando combater o desemprego e a miséria, é uma falsa questão.",409
"Ao contrário, a solidez das propostas que visam um novo ciclo de crescimento econômico é que ajudará a difundir na sociedade o estado de confiança necessário para que se possa atingir um horizonte de rentabilidade de longo prazo a partir de projetos estruturantes que articulem os mercados interno e externo e retirem os capitais privados da rota especulativa.",404
"Os agentes que atualmente se beneficiam do lucro inflacionário e têm resistido a todas as políticas de estabilização, como o setor financeiro, terão que sofrer as perdas inerentes a esse processo, para abrir novas perspectivas de ganhos aos que não se opuserem aos interesses gerais do país.",409
"É imperioso reverter um quadro em que cada vez mais gente—idosos, adultos jovens, adolescentes e crianças—transpõe o limiar das condições mínimas de sustentação da vida.",504
"A participação dos salários na renda nacional urbana caiu sistema basicamente, como resultado de políticas que trouxeram o arrocho salarial e o desemprego em massa.",504
"Sociedades com níveis médios de renda muito inferiores aos nossos não vivem esse drama, vergonha nacional.",504
"A primeira frente da questão distributiva, como veremos adiante, é a distribuição da riqueza propriamente dita, especialmente no caso da terra, acompanhada pelo barateamento do custo real da cesta básica alimentar.",504
A segunda é uma política de rendas — a partir da recuperação do nível de emprego e da defesa do valor real dos salários -,701
"e a criação de um quadro econômico e institucional que reforce as condições de participação popular, de controle social sobre a economia, e aumente o poder de barganha dos trabalhadores.",202
A terceira são transferências diretas para os grupos mais fragilizados.,504
"Finalmente, mas não menos importante, deveremos enfrentar com coragem o problema do desemprego e do subemprego.",701
O desenvolvimento de um novo modelo de sociedade que opere mudanças radicais no terreno econômico e retome o crescimento com distribuição de renda exige uma ampla mobilização nacional pelo direito ao trabalho para todos.,503
O objetivo de uma cidadania plena para as grandes maiorias nacionais não pode se limitar à adoção de medidas de política social de caráter compensatório.,305
"São medidas paliativas, necessárias mas insuficientes.",305
É fundamental articular o novo modelo de desenvolvimento econômico e social a um projeto de sociedade capaz de garantir o direito ao emprego para todos.,503
"Isso exige uma complexa articulação de políticas públicas e de iniciativas da própria sociedade, desde a adoção de um audacioso programa de investimentos do poder público para a geração de emprego,",701
"até a redução da jornada de trabalho nos principais setores da economia,",701
passando pela aplicação de recursos públicos e privados na formação profissional,411
e na reciclagem dos trabalhadores visando otimizar sua integração ao mercado de trabalho.,701
"Serão privilegiadas ações com resultados diretos, como por exemplo:",701
"criação de empregos na ampliação de serviços sociais como saúde e educação, abrangendo sobretudo áreas urbanas, trabalhadores com um mínimo de qualificação e escolaridade e esferas estaduais e municipais de govemo;",701
"programas de emprego vinculados à ampliação da infra-estrutura econômica e social, inclusive como programas emer- genciais destinados a áreas de baixa renda e com tecnologia de baixo custo, possibilitando a incorporação de trabalhadores sem qualificação.",411
"Ainda relativamente ao problema doemprego, o Estado, em parceria com os trabalhadores e com os empresários, deverá articular diferentes políticas visando desenvolver um programa intensivo de formação e reciclagem profissional, além de um programa ofensivo de redução da jornada de trabalho, na perspectiva de uma jornada de 40 horas, sem redução de salário.",411
"No mesmo sentido, o Estado adotará os seguintes mecanismos na área da política de crédito:",999
a manutenção e aumento do nível de emprego nas empresas passará a ser um critério de financiamento público das empresas;,701
"a definição de políticas para o financiamento público de empresas cooperativas, autogestionárias, familiares, microem- presas.",403
O ataque à pobreza deve ser feito em várias frentes -1,999
"Não há desenvolvimento rural possível com os níveis atuais, que são crescentes, de miséria a que estão submetidos os trabalhadores do campo.",703
"Estudo recente da Organização das Nações Unidas para a Agricultura e a Alimentação (FAO) fez uma rápida avaliação dos três programas considerados mais importantes — Plano Nacional de Reforma Agrária (PNRA), Programa de Apoio ao Pequeno Produtor Rural (PAPP) e Programa Integrado de Desenvolvimento do Noroeste (Pólo-Noroeste) — e mostrou que as políticas do govemo brasileiro de combate à pobreza rural ficaram muito distantes dos propósitos e metas estabelecidas.",703
"Para ficar apenas no exemplo do PNRA, a FAO estima que apenas entre 1% e 1,5% das 6,5 milhões de famílias de trabalhadores rurais sem terra foram efetivamente beneficiadas, decorridos mais de cinco anos de seu início.",703
"Como vimos, o ataque à pobreza terá que ser feito em várias frentes, sendo uma delas a distribuição de propriedade propriamente dita, especialmente no caso da terra.",504
Outra é uma política de rendas.,504
"Ela deverá ser gradual (para permitir a melhor articulação possível com as outras políticas econômicas e com a esfera jurídico-institucional), ofensiva (para que os trabalhadores e os até hoje excluídos tenham suas condições de vida efetivamente melhoradas) e transparente (para que possam ocorrer alterações democraticamente definidas e todos os agentes econômicos possam se preparar para seus efeitos).",504
"Entre seus mecanismos, encontra- se em primeiro lugar a elevação gradual e permanente do salário mínimo real, tendo como meta dobrar seu valor atual no menor prazo possível",412
"e, no período subseqüente, atingir o nível apontado pelo Departamento Intersindical de Estatística e Estudos Sócio- Econômicos (Dieese).",408
"Deve-se atentar que a concretização desta política de aumento do poder aquisitivo do salário mínimo, exige a implementação de um conjunto coordenado de medidas de política industrial, agrícola e de desenvolvimento da infra-estrutura de serviços, de modo que a economia possa responder a esta pretendida e desejada elevação do nível da demanda efetiva interna.",411
"Além da política para o salário mínimo, pretende-se elevar os valores do salário família, desde que garantida a fonte de recursos necessária e eliminado o seu caráter universal, dirigindo-o apenas à população mais carente",504
"Em segundo lugar, está prevista uma política de preservação dos salários reais, de reposição negociada das perdas salariais e de estímulo à implantação do Contrato Coletivo de Trabalho, articulado em nível nacional, setorial e das empresas.",701
"O objetivo do Contrato Coletivo, com unificação das datas base, não será simplesmente redefinir uma nova política salarial,",701
"mas, sobretudo, negociar democraticamente as novas relações de trabalho e garantir a participação dos trabalhadores nas definições gerais de política econômica, aumentando também o compromisso dos sindicatos com a política macroeconômica.",202
"Em terceiro, o govemo deverá ampliar medidas de controle da rotatividade de mão- de-obra e do abuso de horas extras, estratégia patronal de elevado poder de corrosão sobre qualquer política de rendas e que tende a inibir investimentos em treinamento e qualificação, reduzindo assim o potencial aumento da produtividade do trabalho.",701
"Em quarto, dever-se-á considerar a necessidade de estender a cobertura e elevar os atuais valores do seguro-desemprego, de forma associada a um programa intensivo de formação e reciclagem profissional.",504
O ataque à pobreza deve ser feito em várias frentes - II,999
"O Governo Democrático e Popular implementará um conjunto de programas emer- genciais que não deverão ter um caráter meramente assistencial ou beneficente, mas deverão procurar promover a integração social e econômica dos excluídos do mercado interno de consumo e do acesso aos direitos sociais.",504
"Para o financiamento destes programas, além da destinação de uma parcela de recursos orçamentários, será constituído um Fundo Nacional de Solidariedade (FNS), cuja principal fonte de recursos seria formada por tributação específica sobre grandes fortunas, a ser regulamentada pela Congresso Nacional, ou de tributação emergencial sobre o patrimônio das grandes empresas e das pessoas físicas de elevado nível de riqueza, tal como foi feito na maioria dos países da Europa no segundo após-guerra.",504
"Neste caso, ressalte-se que o patrimônio é, entre nós, ainda mais concentrado que a renda, estando 53% da riqueza do Brasil (terras, imóveis rurais e urbanos, ativos financeiros) em mãos de apenas 1 % de sua população.",504
"O conjunto potencial de contribuintes para esse fundo seria relativamente pequeno, não atingindo 150 mil famílias, ou menos de 1% da PEA, detentores de patrimônio superior a US$ 1 milhão.",504
"Para minimizar os riscos de clientelismos e evitar manipulação política, o FNS deverá ter transparência institucional e ser gerido de forma autônoma por um Conselho Diretor com a efetiva representatividade na sociedade civil.",504
"Os recursos do FNS deverão se destinar a financiamento de projetos sociais apresentados por comunidades e associações de moradores, instituições religiosas, estados, municípios e organizações não- governamentais, a serem executados tanto na área urbana como no meio rural.",504
"Desta forma, os recursos do Fundo deverão ser encaminhados preferencialmente para apoio de programas de abastecimento alimentar, saneamento básico e expansão da rede de energia, habitação, melhoria da rede hospitalar e de ensino.",504
"Além disso, cabe dar a devida atenção aos trabalhadores do setor informal, tanto no meio urbano quanto na agricultura, entendendo-se que a situação de subemprego não legal, em que a maioria destes se encontra, não é uma solução temporária para a crise, mas um fator de superexploração do conjunto da força de trabalho.",701
"Neste sentido, deverão ser implementados programas de treinamento de mão-de-obra, distribuição de documentos e de ensino do uso destes, de apoio e legalização de microempresas, assim como dos profissionais autônomos.",411
Renda Mínima e cidadania,999
"Com o objetivo de promover a cidadania, melhorar a distribuição de renda, combater a fome e erradicar a miséria, será instituído um programa de renda mínima, definido em lei, compatível com o grau de desenvolvimento do país.",504
"Procurar-se-á garantir a todos os cidadãos adultos um nível mínimo de rendimentos, seja quando a remuneração por seu trabalho for insuficiente para livrá-los da miséria, seja quando estiverem desempregados ou incapacitados, parcial ou totalmente, para o trabalho.",504
"O rendimento mínimo será também fundamental para que os pais possam garantir que seus filhos freqüentem a escola, em vez de serem forçados ao trabalho, à mendicância ou à marginalidade desde a infância.",504
"Os níveis de pobreza chegaram a tal ponto, que uma porcentagem significativa das famílias pobres tem no trabalho de suas crianças uma fonte fundamental de renda.",504
"Tendo o trabalho como prioridade, a escola toma-se secundária, o que —junto com deficiências do próprio aparato educacional brasileiro—está na raiz de elevados índices de repetência e evasão.",506
É preciso estimular e possibilitar a substituição do trabalho infantil pela escola.,506
"O Programa de Garantia de Renda Mínima (PGRM) poderá tomar a forma de um imposto de renda negativo que estimule as pessoas a trabalhar,",504
"a formalizar sua condição de emprego,",504
"a superar suas condições de pobreza,",504
a aperfeiçoar sua formação.,504
"O PGRM poderá ser introduzido gradualmente, de forma compatível com as finanças públicas, das regiões mais pobres para as mais ricas, iniciando-se pelos cidadãos que detêm pátrio poder sobre menores em idade escolar.",504
"Este programa será financiado com recursos orçamentários especialmente definidos, não será introduzido como contrapartida ou como compensação à redução ou não ampliação dos gastos públicos com os serviços sociais básico sese constituirá em apenas um dos mecanismos a ser utilizado pelo nosso govemo para o combate à miséria e num instrumento suplementar de promoção da universalização do ensino fundamental, condição necessária para o exercício da cidadania e para o desenvolvimento econômico do Brasil.",504
Reestruturar a produção,999
É necessária uma nova estrutura produtiva,999
"A formação do mercado de massas não se dará apenas a partir de políticas redistri- butivas, mas, principalmente, de uma reestruturação gradativa na própria estrutura produtiva, com elevação dos padrões de produtividade, especialmente naqueles setores que tenham maiores efeitos multiplicadores sobre o emprego e o resto da economia.",409
"Além de investimentos em infra-estrutura (transportes de longa distância, habitação popular, eletrificação rural),",411
"o projeto exige políticas específicas, que priorizem a elevação da produtividade média do trabalho em nossa sociedade,",409
"sem perder de vista os objetivos estratégicos de preservação e criação de empregos,",701
da qualificação da mão-de-obra,411
"e de novas relações de trabalho, que nos permitam avançar sem contratempos na direção da chamada Terceira Revolução Industrial.",411
"Isso significa, por exemplo:",999
"difundir tecnologias já dominadas, principalmente em apoio à base industrial e agrícola voltada para atender esse mercado interno em ascensão;",411
dominar tecnologias-chave da reorganização da base produtiva material contemporânea e da moderna organização social da produção;,411
"melhorar a inserção do Brasil no comércio internacional, através da diversificação e enobrecimento da pauta de exportações brasileira;",410
"capacitar o país a explorar melhor seus próprios recursos (como o potencial dos seus ecossistemas específicos, as grandes massas de água doce interiores, as hidrovias, a energia solar, a expansão da agricultura e assim por diante)",411
"e enfrentar seus próprios problemas (como o das doenças parasitárias, secundárias ou mesmo inexistentes nos países desenvolvidos).",408
"Outra face do mesmo projeto é identificar e avaliar os nossos recursos bioambien- tais, bem como as respectivas potencialidades de uso econômico não predatório, com o objetivo de transformá-los, no longo prazo, num conjunto articulado de vantagens comparativas dinâmicas, integradas ao novo modelo de desenvolvimento.",411
"Isso faz com que, de imediato, seja fundamental regulamentar instrumentos de controle ecológico como regra condicionante da política de utilização dos fatores de produção, o que demandará a formulação de um novo aparato institucional e executivo para a implementação de políticas de defesa do meio ambiente.",501
Defendemos uma política industrial clara e estável,999
É necessário o desenvolvimento quantitativo e qualitativo da indústria brasileira.,411
"Quantitativo de modo a elevar os padrões de vida da população, gerando ao mesmo tempo mais empregos;",504
"e qualitativo no sentido de aumentar a competitividade, maior geração de valor agregado e melhor adequação daestruturaprodutiva às necessidades de um sólido mercado interno de massas e às potencialidades do país.",411
"Em harmonia com os objetivos do programa econômico, o modelo de desenvolvimento industrial deve ser capaz de compatibilizar a incorporação progressiva aos mercados de trabalho e de consumo de parcelas da população, hoje alijadas, com a evolução da base produtiva necessária a uma inserção mais valorizada do país no cenário internacional.",411
"Como elemento importante de uma política mais ampla de desenvolvimento econômico e social do país, é indispensável que a política industrial esteja articulada à política educacional, de transportes, fiscal e demais políticas nacionais.",411
"A eficácia destas condicionará, em parte, o sucesso da política industrial.",411
"Por outro lado, esta política é instrumento relevante da política de rendas e da viabilização da política de estabilização, na medida em que estabeleça um horizonte de planejamento para os agentes privados e oriente investimentos de forma a adequar a oferta à evolução da demanda.",409
"A política neoliberal implementou uma abertura unilateral desordenada, sem contrapartidas, na contramão dos modernos meea- nismos de proteção efetiva adotados nos países desenvolvidos.",415
