Text,Code
A prioridade da política de segurança deve ser a redução expressiva de mortes violentas.,605
"Refazer as bases para um Plano Nacional de Redução de Homicídios é urgente, tendo como referência os diagnósticos e o fortalecimento de sistemas de informação criados nos governos Lula e Dilma, como o Sistema Nacional de Informações sobre Segurança Pública - SINESP.",605
"Assim, serão adotadas políticas intersetoriais que deem qualidade aos serviços públicos nos territórios vulneráveis e tragam atenção à situação de crianças, jovens, negros, mulheres e população LGBTI+, com prioridade para a juventude negra, que vive nas periferias, que são vítimas de um verdadeiro extermínio.",503
"Associadas a isso, novas medidas serão adotadas para diminuir os índices de feminicídio e conferir proteção às mulheres vítimas de violência doméstica, com ações preventivas, delegacias funcionando 24 horas por dia, disponibilização de tecnologia com “botão do pânico” e acolhimento em casas abrigo.",503
"Além disso, nas investigações policiais e nos processos judiciais, é preciso perseguir incansavelmente a meta de aumentar o esclarecimento da autoria dos casos de homicídios e latrocínios.",605
"Hoje, a taxa de solução desses crimes é muito baixa – menos de 10% dos homicídios investigados tem a autoria descoberta.",605
"Nesse contexto, a política de controle de armas e munições deve ser aprimorada, reforçando seu rastreamento, por meio de rigorosa marcação, nos termos do estatuto do desarmamento.",605
A redução da violência causada pelo uso de arma de fogo passa por utilizar inteligência acumulada para retirar armas ilegais de circulação e represar o tráfico nacional e internacional.,605
"Perseguiremos a meta de tirar a arma da mão do criminoso e equipar melhor a polícia, para que o Estado cumpra seu dever de oferecer segurança pública.",605
A modernização do sistema institucional de segurança não pode mais ser adiada.,605
"Nesse contexto, é preciso fortalecer a polícia científica e valorizar o profissional da segurança, com melhores salários, capacitação adequada, seguro de vida, habitação, assistência e previdência dignas.",605
Para dar segurança o policial precisa ter segurança.,605
Quanto maior a confiança da população na polícia maior a eficiência.,605
"O policiamento ostensivo deve guardar isonomia de tratamento dos cidadãos, em especial nas periferias, estruturando-se um controle externo efetivo com maior transparência.",605
"Essas mudanças devem se dar a partir de debate nacional, estimulado pelo governo federal e envolvendo o conjunto da sociedade civil, visando rever a distribuição de responsabilidades entre os entes federados e o modelo policial (art. 144 da CF) e nos adaptarmos às exigências de uma sociedade complexa e democrática, que enfrenta os desafios do século XXI.",605
"A redução dos alarmantes índices de mortes violentas no país e de segurança nas ruas passa também pela construção de um sistema de inteligência fundado em alta tecnologia,",605
"monitoramento de nossas fronteiras,",104
"qualificação dos profissionais de segurança,",605
bem como pelo combate implacável à tortura.,201
"A capacidade de apuração de crimes e, portanto, de redução de impunidade, está diretamente ligada ao sucesso de uma Política Nacional de Redução de Homicídios.",605
3.4.2 Nova política sobre drogas,999
"A atual política de repressão às drogas é equivocada, injusta e ineficaz, no Brasil e o no mundo.",605
É o grande nó a ser desatado em favor do presente e do futuro de nossas crianças e jovens.,605
"Hoje, o país prende mais pessoas não violentas, não organizadas e desarmadas, do que homicidas, traficantes de armas e lideranças do crime organizado, que já se transnacionalizou.",605
"Com isso, agrava a já desumana condição dos presídios, que funciona como recrutamento em massa de mão-de-obra para facções criminosas.",605
"É premente alterar a política de drogas, para combater o que de fato é prioritário: o poder local armado despótico exercido sobre territórios e comunidades vulneráveis.",605
É preciso enfrentar a rede que o tráfico internacional promove.,605
"O dinheiro decorrente do tráfico alimenta várias esferas da economia, viabiliza o acesso a armas em grande quantidade – que favorecem a violência letal – e financia a corrupção e outras atividades criminosas.",605
"Precisamos priorizar o rastreamento do dinheiro sujo, para suprimir o financiamento do tráfico.",605
O país precisa olhar atentamente para as experiências internacionais de política sobre drogas.,605
"É urgente promover medidas consistentes de prevenção da violência, evitando o recrutamento de jovens vulneráveis pelo crime.",605
"O Brasil possui um contingente de 11 milhões de jovens entre 15 e 24 anos, e 1,5 milhão entre 15 e 17 anos que não trabalham nem estudam.",605
Evidentemente esses jovens estão em situação de alta vulnerabilidade.,605
"Por isso, é fundamental que o Poder Público possa assegurar perspectivas de futuro  para as juventudes, oferecendo-lhes educação, cultura, valorização e alternativas atraentes de integração à vida pacífica e ao mercado de trabalho.",605
"Em paralelo, o governo federal deve assumir suas responsabilidades no enfrentamento da criminalidade que, tendo origem transnacional, afeta a segurança dos estados e dos municípios.",605
Isso permitirá uma experiência inovadora de atuação da Polícia Federal no ciclo completo na cadeia do crime.,605
"A Polícia Federal já atua na cooperação internacional, no controle de fronteiras e armas, e na repressão interestadual, o que a habilita a atuar no enfrentamento do crime organizado, do financiamento associado, em todas as modalidades criminosas de grande vulto que incidem sobre os centros urbanos, mas cujas dinâmicas extrapolam seus limites.",605
A proposta na área de segurança pública deve estar vinculada a medidas de prevenção ao uso de drogas nas áreas de saúde e educação.,504
"No âmbito da saúde, é preciso incentivar a abordagem científica e atualizada à luz dos protocolos reconhecidos internacionalmente como mais avançados e eficazes, fortalecer a rede de atenção psicossocial, permitir políticas de redução de danos e atuar com sensibilidade para abordar de diferentes e flexíveis formas a prevenção em relação a grupos sociais distintos.",504
"Na educação, é preciso garantir que a comunicação com os adolescentes e jovens seja eficiente e não geradora de mitos e mentiras.",506
"Priorizar a dimensão do ensino que dialoga com a vida real do estudante é fundamental, de modo que a abordagem científica deve partir dos problemas experimentados no cotidiano.",506
"A prevenção passa pelo estabelecimento de políticas voltadas à primeira infância – de modo a garantir educação, saúde e cuidados para nossas crianças -  e de formação continuada",504
", para profissionais de educação nos três níveis de ensino, além de projetos pedagógicos de prevenção do uso indevido de drogas alinhados às diretrizes curriculares nacionais e aos conhecimentos relacionados a drogas.",506
3.4.3 Coibir a incidência de roubos e furtos,999
"O roubo é um dos crimes que ocorrem em larga escala no país, sendo uma das maiores causas de prisões.",605
O número de roubos e furtos no país reclama providências urgentes para assegurar que cidadãs e cidadãos caminhem pelas ruas do país sem medo de serem assaltados.,605
"O policiamento deve chegar antes, para evitar o crime; estar presente durante, para atender na emergência, diminuir os danos e proteger a vítima; e se manter atuante depois, para investigar e responsabilizar os criminosos.",605
É preciso dar condições para que a polícia estadual reforce o patrulhamento ostensivo e garanta a paz nas ruas e praças das cidades.,605
"O aumento da presença policial pode ser garantido com a coordenação de atribuições liderada pelo governo federal junto aos Estados e Municípios, em especial com o aumento dos quadros da Polícia Federal para que reforce o combate às organizações criminosas e as milícias.",605
3.4.4 Plano Nacional de Política Criminal e Penitenciária,999
"Em conjunto com o sistema de justiça criminal, será preciso investir na gestão penitenciária para torná-la capaz de promover reintegração social e não mais a retroalimentação de mão de obra das organizações criminosas.",605
"As prisões devem, prioritariamente, tirar o criminoso violento de circulação.",605
"É preciso investir na implantação de um Plano Nacional de Política Criminal e Penitenciária que assegure a responsabilização dos criminosos, aplicando penas proporcionais aos crimes cometidos, combatendo a impunidade.",605
"O Plano conterá ações para o fortalecimento do sistema nacional de gestão penitenciária e preverá a criação de uma Escola Penitenciária Nacional para capacitação de gestores desse Sistema, de modo a qualificar a atuação estatal para um modelo que substitua o domínio das organizações criminosas.",605
"O governo Haddad enfrentará o grande problema do encarceramento em massa, sobretudo o da juventude negra e da periferia, diminuindo a pressão sobre o sistema carcerário, trazendo ganhos globais  de economia de recursos.",605
"Abrirá espaço para que as polícias civil e militar se concentrem na repressão a crimes violentos, com foco na redução de homicídios e para evitar roubos e furtos.",605
"Em complemento, o governo implementará políticas de geração de trabalho e renda para jovens de baixa renda expostos ao ciclo de violência e à exploração dos mercados ilegais.",605
"No governo Haddad o trabalho do preso será uma exigência, bem como o investimento nos estudos, para evitar que seja cooptado para as organizações criminosas, que se formam dentro dos presídios.",605
3.4.5 Sistema Único de Segurança Pública – SUSP,999
"Na gestão da política nacional, o governo federal vai promover a integração com governos estaduais e municipais, com foco em inteligência, priorização da vida, controle de armas, repactuação das relações entre polícias e comunidades, prevenção e valorização profissional dos policiais.",605
"É preciso ajudar os estados a ter aparato tecnológico nas delegacias de polícia, permitindo o maior acesso por parte das pessoas e o aprimoramento da investigação.",605
"O governo Haddad vai liderar o combate à criminalidade e coordenar ações de segurança pública no país, evitando o bate-cabeças entre as polícias.",605
"Para isso, é fundamental implementar plenamente o Sistema Único de Segurança Pública – SUSP.",605
"A legislação recém-aprovada é, ademais de problemática, meramente indicativa.",605
"Exige, portanto, correção para que seja adequada ao paradigma da segurança cidadã e de participação social.",605
"O governo federal se empenhará junto ao Congresso Nacional para que, com base em grande debate nacional, e com envolvimento da sociedade e dos profissionais da área – cujas condições de trabalho merecem ser valorizadas -  promovam essas alterações.",605
"Ao ser posto em prática, o SUSP precisa definir protocolos de organização e atuação, fontes de financiamento vinculadas a contrapartidas de prevenção e redução de crimes violentos e formação de gestores na área.",605
"3.5 CULTURA PARA GARANTIR A DEMOCRACIA, A LIBERDADE E A DIVERSIDADE",999
"Nesses dois anos de governo ilegítimo, artistas e fazedores de cultura foram criminalizados, instituições culturais foram censuradas, segmentos culturais foram abandonados ou perseguidos.",201
"Nesse período, cresceu a intolerância dos que não aceitam e suportam a liberdade e a diversidade de expressões artísticas e culturais.",201
A cultura é um dos elementos constitutivos da própria democracia e da identidade nacional.,502
Sem a realização da liberdade de expressão e da diversidade e sem o respeito a esses valores perdem-se as condições constituintes de uma sociedade democrática.,201
"Para garantir esse novo ciclo democrático de que o Brasil precisa, nosso programa para cultura tem o foco na retomada de políticas construídas entre 2003 e 2016, além da formulação de novos programas que possam atender as atuais demandas do setor e garantir o desenvolvimento cultural para toda a sociedade.",502
"No governo Haddad, a cultura inscrever-se-á em um novo modelo de desenvolvimento que proporcione consolidação da democracia em nosso país, mais qualidade de vida para todos os brasileiros e brasileiras e mais justiça social para o Brasil.",502
Um novo ciclo de políticas públicas será construído por meio dos mecanismos de participação desenvolvidos pelo MinC.,502
"Para esse fim, é fundamental o diálogo com toda a comunidade cultural, tendo um olhar atencioso para todos os criadores, artistas e realizadores que foram beneficiados pelas políticas  efetivadas em nossos governos e foram responsáveis pela criação de estéticas inovadoras e de formas originais de organização do fazer cultural.",502
"Os governos de Lula e Dilma deram prioridade para a área da cultura, com a ampliação da atuação do Ministério, a criação de políticas públicas como o Cultura Viva e o Fundo Setorial do Audiovisual, e o crescimento real do orçamento para cultura em mais de três vezes.",502
"Esse legado nos dá condições de enfrentar um dos principais desafios da construção desse novo ciclo de políticas públicas, que é a elaboração de um novo sistema de fomento: mais democrático, desconcentrado, territorializado e adequado à complexidade do campo.",502
"Além disso, para ativar toda a cadeia produtiva do setor, o Brasil precisa cumprir a recomendação da UNESCO e aumentar progressivamente os recursos para o MinC, visando alcançar a meta 1% do orçamento da União, assim como fortalecer o papel e ampliar os recursos do Fundo Nacional de Cultura (FNC).",502
Consideramos o acesso pleno aos bens e serviços culturais como uma garantia de cidadania.,502
"Para efetivar esse direito, construiremos novos mecanismos de circulação dos bens culturais, enfrentando o monopólio das empresas que atuam no setor pela lógica estrita do mercado.",502
"As políticas culturais devem ser políticas de Estado e, por isso, iremos observar as Conferências e o Plano Nacional de Cultura e consolidar o Sistema Nacional de Cultura, garantindo repasses, fundo a fundo, para estados e municípios, além da desburocratização dos mecanismos de fomento para o setor.",502
"Implementaremos a Lei Cultura Viva, com um conjunto inovador de políticas nos territórios.",502
"O programa, que chegou a investir mais de R$ 100 milhões por ano, foi praticamente extinto pela gestão atual do Ministério da Cultura.",502
"Reorganizaremos as políticas setoriais com programas que apoiem e atendam as demandas específicas que atravessam todas as dimensões, expressões e processos culturais e artísticos, abarcando desde os agentes das culturas tradicionais, populares e regionais, até os realizadores da cultura digital.",502
"Fortaleceremos a FUNARTE, construindo uma Política Nacional para as Artes vigorosa e abrangente, em articulação com estados e municípios, tomando para a música, teatro, dança, circo e artes visuais o exemplo positivo da política do audiovisual.",502
"Também investiremos na consolidação de uma Política Nacional para o Livro, Leitura e Literatura.",502
"Aprofundaremos a política de desenvolvimento audiovisual conduzida pela Ancine, uma das mais robustas do mundo, garantindo que os investimentos do Fundo Setorial do Audiovisual promovam a diversificação dos produtores, com políticas afirmativas para mulheres e negros/as.",502
"Em diálogo com o setor, construiremos uma política para o vídeo sob demanda (VOD) que deverá garantir espaço e fomento para produção brasileira e independente, seguindo o exemplo bem-sucedido da política para TV por assinatura.",502
"Ao mesmo tempo, o governo Haddad irá democratizar o acesso do público brasileiro à produção fomentada com recursos públicos.",502
Retomaremos de forma ativa as políticas para o patrimônio e museus através do IPHAN e do IBRAM.,502
Essas duas instituições serão dotadas das condições para que conduzam iniciativas amplas e diversificadas de proteção e promoção do patrimônio cultural e de fortalecimento da política nacional de museus.,502
"Também a Biblioteca Nacional, a Fundação Cultural Palmares e a Casa de Rui Barbosa devem receber investimentos proporcionais à sua imensa importância para memória, pesquisa e acervo da cultura brasileira.",502
"Reafirmaremos nosso compromisso com a Convenção da UNESCO sobre a Proteção e Promoção da Diversidade Cultural, construindo um ciclo de políticas que respondam aos direitos culturais dos povos indígenas, quilombolas e ribeirinhos.",502
"O ambiente digital também requer políticas inovadoras de direito autoral, já que, hoje, plataformas online e gravadoras absorvem recursos que deveriam remunerar artistas e criadores brasileiros.",502
"Além disso, é preciso fortalecer e ampliar o acesso da população brasileira a bens e serviços culturais online.",502
O governo Haddad irá afirmar também o caráter transversal da cultura como  forma de ampliar a compreensão da sociedade brasileira sobre o papel da cultura e da arte tanto na construção de uma sociedade mais democrática quanto como um dispositivo para o desenvolvimento econômico e social do país.,502
"Para isso, assume o compromisso em intensificar o diálogo da cultura com  outros campos, como a educação, a ciência e tecnologia, a comunicação, o esporte, a saúde, a economia e o turismo.",502
"No cenário global, fortaleceremos os mecanismos de inserção da cultura brasileira em sintonia com a presença altiva, ativa e soberana do Brasil no contexto das relações internacionais.",502
"Nosso programa compreende a cultura como um direito de todas e todos e como um campo de luta pelas liberdades individuais e contra o racismo, o machismo, a LGBTIfobia, a intolerância religiosa e o avanço do conservadorismo no Brasil.",503
A defesa do livre pensar e da nossa diversidade irá orientar todas as políticas do governo Haddad para a cultura.,502
3.6 AGENDA DE FUTURO PARA O ESPORTE BRASILEIRO,999
O esporte é um direito social previsto em nossa Constituição.,502
"Como instrumento de formação educacional e integração social, que contribui para a convivência em comunidade e para a vida saudável, o esporte constrói a cidadania.",502
Como manifestação cultural é um dos pilares constituintes da identidade brasileira.,502
"É também uma potente âncora econômica, com força para gerar riquezas e empregos, sendo historicamente um importante fator de desenvolvimento social e inserção das minorias.",502
"Sua capacidade de mobilizar crianças, adolescentes e jovens permite a implementação de ações transversais nas áreas de educação, saúde e segurança cidadã.",502
Os governos Lula e Dilma investiram muito no esporte.,502
"Destacam-se a criação da Bolsa Atleta (auxílio financeiro para o jovem atleta estudar e treinar), a aprovação da Lei de Incentivo ao Esporte, induzindo a uma maior participação das empresas no patrocínio esportivo, a recuperação da vocação esportiva das Forças Armadas e dos Clubes Esportivos Sociais, instituições que estão na base da tradição esportiva brasileira, construção e requalificação de milhares de quadras esportivas, a recuperação dos equipamentos esportivos da maioria das modalidades esportivas, com a aquisição de equipamentos que permitiram um grande salto de qualidade na preparação dos atletas nacionais, além da organização dos grandes eventos esportivos.",502
"Por decisão do Presidente Lula, o esporte paralímpico passou a ser valorizado, recebendo a mesma atenção que os esportes olímpicos.",502
"Como resultado, milhares de jovens com deficiência acharam uma oportunidade de vida no esporte, transformando o Brasil em uma potência no esporte paralímpico, revelando valorosos exemplos de sucesso e criando uma geração de novos ídolos, que assombram a todos com suas histórias de superação e dedicação.",503
"Na mesma linha, a Presidente Dilma apoiou a construção do Centro Paralímpico Brasileiro, um dos mais modernos do mundo, além de garantir a ampliação do financiamento ao esporte paralímpico.",503
"Esses novos recursos permitiram ao Comitê Paralímpico Brasileiro a gestão do Centro em altíssima qualidade, criando um dos maiores casos de sucesso na gestão do Legado dos Jogos Olímpicos e Paralímpicos Rio 2016.",503
"A Copa do Mundo FIFA 2014 e os Jogos Olímpicos e Paralímpicos Rio 2016, para citar apenas dois exemplos, induziram investimentos urbanos, modernizaram nossa infraestrutura esportiva, geraram investimentos em aeroportos e na economia do turismo.",503
Em um período de pouco mais de uma década superamos o atraso da nossa infraestrutura esportiva e criamos um dos mais importantes conjunto de equipamentos esportivos do mundo.,502
"Projetos como o Metrô do Rio que se arrastavam a décadas foram entregues em prazo recorde, trazendo qualidade de vida à população.",411
"Mostramos ao planeta que, fora de campo, somos capazes de receber povos do mundo todo.",606
"Lembramos com orgulho e nostalgia das imagens da convivência dos brasileiros com torcedores de todas as partes do planeta, em um ambiente de festa e com absoluta segurança.",606
Os grandes eventos deixaram lições.,606
É preciso continuar atraindo eventos internacionais para aproveitar a vantagem competitiva gerada pela qualidade das novas instalações esportivas.,502
Avaliar os erros e acertos é um imperativo para que o país possa continuar competitivo nesse segmento econômico tão relevante.,502
"É tarefa urgente reverter o sucateamento de parte das estruturas criadas e retomar os investimentos em manutenção, operação e construção, abandonados em grande parte pelo governo golpista, bem como recuperar o projeto original de Legado dos Parques Olímpicos do Rio, articulando a Rede Nacional de Treinamento é tarefa de curto prazo.",502
Nosso programa de governo entende que o desenvolvimento do esporte deve ser tratado como política de Estado.,502
"Por essa razão, proporemos ao país um grande debate para a criação do Sistema Único do Esporte, definindo o papel da União, Estados, DF, Municípios e das entidades esportivas na oferta de políticas de esporte (sistema quadripartite), a exemplo do que ocorre na saúde, com o SUS.",502
A governança desse Sistema deve assegurar a participação e controle social e a otimização dos recursos públicos.,502
"Para promover um grande salto na gestão do esporte brasileiro, o governo vai implementar a Universidade do Esporte, articulando ensino, pesquisa e extensão, visando a formação de profissionais de nível internacional voltados para toda a cadeia produtiva do esporte (gestão esportiva, saúde, pesquisa e políticas públicas.",502
"O futebol expressa a própria identidade nacional e será foco de importantes políticas públicas voltadas para a transparência, a boa gestão e o fortalecimento do mercado brasileiro.",502
"Por meio do BNDES, o governo implementará o Programa de Modernização da Gestão do Futebol, além de apoiar a construção de um calendário unificado que garanta atividade anual permanente para todas as séries e campeonatos.",502
Apoiará também a estruturação a nível nacional do futebol feminino.,502
"O governo federal vai contribuir para a viabilização das Arenas da Copa nos Estados, estimulando a promoção de eventos",409
"e gerando, no curto prazo, milhares de empregos.",701
O futebol se tornará vetor de desenvolvimento e promoção das capacidades do país.,502
"O governo Haddad investirá em todas as práticas esportivas, tais como vôlei, basquete, natação e esportes radicais, tanto no esporte amador quanto no de alto rendimento.",502
"O Plano Brasil Medalhas será relançado e aperfeiçoado, bem como os investimentos na Rede Nacional de Treinamento.",502
"Serão retomados os investimentos na infraestrutura de equipamentos esportivos, sobretudo reforma e requalificação de quadras nas escolas.",502
O foco será nos equipamentos voltados às juventudes e na acessibilidade para pessoas idosas e com deficiência.,502
"Além disso, serão promovidos o esporte escolar e a integração da política de esporte com as demais políticas públicas, o que inclui o apoio aos municípios na criação de espaços livres para prática espontânea de esporte pela população.",502
4. PROMOVER UM NOVO PROJETO NACIONAL DE DESENVOLVIMENTO,999
"Após mais de uma década de crescimento econômico com inclusão social nos governos Lula e Dilma, o país voltou a conhecer a fome, a miséria e o desemprego em massa.",305
"Os golpistas retiraram do povo condições de cidadania e atacaram nossa soberania, vendendo riquezas e empresas aos estrangeiros.",103
A interrupção arbitrária do governo Dilma pôs fim à estratégia exitosa de combinar o aprofundamento do regime democrático com inserção externa soberana.,103
"A expansão econômica, geradora de finanças públicas ordenadas, pleno emprego e massiva inclusão social, também foi interrompida.",409
"Com isso, o país passou a regredir consideravelmente, ficando aprisionado em uma armadilha recessiva que excluiu mais de 30 milhões de brasileiros do padrão de produção e consumo.",409
"De um lado, quase 28 milhões de brasileiros estão com a força de trabalho subutilizada, dos quais 13 milhões estão desempregados (PNADC/IBGE).",701
