Text,Code
"São elas que geram mais da metade das vagas com carteira assinada e que abrigam boa parte dos desempregados que buscam alternativas de ocupação e renda, portanto fortalecer o empreendedorismo é uma prioridade do governo Haddad.",402
"É fundamental conservar o tratamento diferenciado aos pequenos negócios, como determina a Constituição, conquistado em 2006 com a aprovação da Lei Geral da MPE e do Simples Nacional durante o governo do Presidente Lula.",402
"O sistema avançou com a criação do MEI, em 2009, e a ampliação dos limites de faturamento e inclusão de novas categorias nos anos seguintes.",402
"Graças a isso, em uma década o Brasil passou de 2,8 milhões de pequenos negócios para 12,1 milhões (sendo 7,2 milhões de MEI) no que talvez seja o maior movimento de formalização no mundo com benefícios para milhares de brasileiros e brasileiras que se incluíram na economia.",701
O Simples representa desburocratização e sobrevivência no mercado.,402
Ele pode e deverá ser aperfeiçoado.,402
O governo Haddad implantará um forte política de incentivo ao crédito para MPE.,402
"O aumento da oferta de crédito passa por uma política diferenciada das instituições públicas, como BNDES e FINEP, atualmente voltados às grandes empresas, quando as pequenas representam 27% do PIB e não recebem a mesma atenção.",402
"Sem esquecer da importância do microcrédito e do cooperativismo, que precisam voltar a serem incentivados para aumentar a competitividade de um setor financeiro hoje altamente concentrado.",402
"As compras públicas, nas três esferas de poder, são outro instrumento previsto na Lei Geral que serão fomentados no governo Haddad.",409
"Outro foco será realização de parcerias estratégicas como o Sistema S, em especial com o SEBRAE.",411
"O governo Haddad vai incentivar a capacitação técnica dos empresários nestas parcerias, para que os empreendedores possam ter uma gestão profissional e inovadora em seus negócios.",411
"O ambiente das startups crescerá no Brasil se a cultura empreendedora for trabalhada desde o ensino fundamental, passando pelas universidades e cursos profissionalizantes.",411
"Jovens das periferias, mulheres principalmente, são os quemais crescem entre os donos de pequenos negócios e precisam se preparar para desenvolver suas empresas e transformar suas vidas e suas comunidades.",706
"Para nós, fortalecer o empreendedorismo de pequeno porte é um grande mecanismo de combate às desigualdades, com inclusão socioeconômica.",503
4.3.3 Ampliação e requalificação da infraestrutura,999
"Para ampliar os investimentos em infraestrutura, o governo federal também irá expandir a parceria com o setor privado por meio de concessões e outras parcerias público-privadas, garantindo contratos que propiciem investimentos com o menor custo ao usuário, assegurando os investimentos necessários à infraestrutura nacional.",504
"Além disso, será necessário renegociar contratos de concessão que apresentem problemas para viabilizá-los.",504
"Para isso, aperfeiçoará os diversos marcos regulatórios, visando criar um ambiente cada vez mais competitivo na prestação de serviços eficientes e de qualidade e promovendo a modernização das operações e profissionalização dos operadores.",403
"Avançará, ainda, no estímulo ao mercado privado de crédito de longo prazo e no desenvolvimento de instrumentos de garantias para financiamento de projetos de grande vulto.",504
"Para além do orçamento de investimentos, o governo criará o fundo de financiamento da infraestrutura, composto por pequena parcela redirecionada das reservas internacionais, recursos do BNDES e recursos privados.",504
"O fundo estimulará a alavancagem do mercado de títulos privados, a busca por financiamento em bancos internacionais e o envolvimento do setor financeiro privado no financiamento de longo prazo.",504
"4.3.4 Investimentos em Ciência, Tecnologia e Inovação",999
Ciência e tecnologia aplicadas em inovações promovem transformações disruptivas dos paradigmas do sistema produtivo de bens e serviços para uma economia do conhecimento e para a transição ecológica.,411
As desigualdades de padrão tecnológico rapidamente se transformam em defasagens que isolam ou excluem as estruturas produtivas nacionais frente à dinâmica de concorrência.,411
"Para adentrar nessa nova onda de inovações, o Brasil deverá investir significativamente em educação, ciência, tecnologia e inovação.",411
"Além disso, existe a necessidade de rearticulação das políticas e instituições voltadas para a ciência, tecnologia e inovação, capazes de ampliar distâncias com as fronteiras tecnológicas em expansão.",411
"Nesse sentido, o Brasil deverá se integrar à nova onda produtiva e tecnológica mundial, contendo as seguintes orientações:",411
"Remontagem do Sistema Nacional de Ciência, Tecnologia e Inovação (CT&I): em pouco mais de dois anos, o governo Temer afundou o sistema nacional de Ciência, Tecnologia e Inovação na maior crise da sua história.",411
O governo Haddad promoverá a remontagem desse sistema – alavanca fundamental para o desenvolvimento do país – conectando as políticas públicas com o curso da expansão da fronteira de conhecimento aplicada em todas as áreas do sistema produtivo.,411
"O Sistema Nacional de Ciência, Tecnologia e Inovação deve associar universidades e centros de excelência em pesquisas públicas e privadas, capazes de operar em redes colaborativas e em coordenação com a estruturação de ecossistemas de inovação em áreas estratégicas (como manufatura avançada, biotecnologia, nanotecnologia, fármacos, energia e defesa nacional).",411
"Recomposição e ampliação do Sistema Nacional de Fomento de CT&I: para alavancar o sistema nacional de Ciência, Tecnologia e Inovação será necessário recompor e ampliar os investimentos na área.",506
"Os orçamentos das agências de fomento federais, destacadamente os do CNPq e da CAPES serão recuperados e ampliados a partir dos patamares mais elevados alcançados nos governos Lula e Dilma.",506
"A exemplo do que ocorreu no governo Lula, os recursos do Fundo Nacional de Desenvolvimento Científico e Tecnológico (FNDCT), operado pela FINEP, serão progressivamente liberados na sua totalidade para investimento.",506
"Os recursos disponíveis no FNDCT serão ampliados com a destinação de parcela dos recursos do Fundo Social do Pré-Sal, em substituição aos recursos anteriormente destinados ao Fundo Setorial do Petróleo.",506
"Serão aprofundadas e ampliadas as parcerias com as instituições e agências dos governos estaduais e municipais, para alavancar a integração, complementariedade, eficiência e eficácia do Sistema Nacional de CT&I.",411
"Recriação do Ministério da Ciência, Tecnologia e Inovação (MCTI): o MCTI será recriado para garantir a prioridade estratégica da área no novo projeto nacional de desenvolvimento, e articular iniciativas nacionais estruturantes a partir do núcleo central do Governo Federal.",411
"Plano Decenal de Ampliação dos Investimentos em CT&I: o governo implementará um plano decenal de aumento dos investimentos nacionais em CTI, tanto governamentais quanto empresariais, visando atingir o patamar de 2% do PIB em investimentos em Pesquisa e Desenvolvimento (P&D) no país até 2030 – patamar necessário para garantir a nossa competitividade internacional face às mudanças nos paradigmas tecnológico-produtivos em curso no mundo.",506
TURISMO E DESENVOLVIMENTO: MAIS BRASIL PARA O MUNDO E PARA OS BRASILEIROS,999
Um em cada dez empregos no mundo vem da atividade turística.,502
"Além de gerar renda e atrair investimentos, a indústria de viagens e turismo valoriza a cultura e o patrimônio histórico do Brasil.",502
"O turismo desenvolvido de forma sustentável, com o uso de tecnologias avançadas e uma gestão compartilhada pode garantir também a entrada de divisas e o crescimento do Brasil no setor, ainda pouco conhecido e estruturado.",416
O turismo precisa voltar a ser prioridade de governo como aconteceu durante o governo Lula.,502
É uma atividade intensiva em empregos.,701
"Está baseado em pequenas empresas e tem grande poder de inserção e de ascensão social, porque não abrange somente os grandes centros, mas todo o seu entorno, inclusive nos setores associados, como o artesanato, a produção de alimentos na agricultura familiar e o entretenimento, entre outros.",701
"Somos 207 milhões de brasileiros, mas hoje somente 60 milhões viajam pelo Brasil.",502
"O potencial do mercado interno é enorme e pode multiplicar os 6,5 milhões de empregos desse segmento.",701
"Para tornar os preços mais acessíveis, deve-se fomentar a concorrência e melhorar a infraestrutura de nossas estradas, aeroportos e portos, como foi realizado nos governos Lula e Dilma com o PAC.",411
"A Copa e as Olimpíadas ampliaram a infraestrutura hoteleira e aeroportuária do país, que hoje encontra-se em parte ociosa.",411
É preciso aumentar os recursos para promoção do Brasil no exterior.,406
A queda brutal dos investimentos públicos em promoção fez o Brasil perder espaço no mercado internacional.,406
"O marketing digital deve ser uma ferramenta importante, por ser mais barato e ágil.",502
"É preciso recuperar a imagem do país, combater o turismo sexual, oferecer segurança e demonstrar toda a nossa diversidade.",502
"Temos turismo de sol e praia, de eventos culturais, religiosos, de negócios, de aventura, rural, ecoturismo e LGBTI+.",502
"Somos o primeiro lugar em recursos naturais no Ranking Mundial de Competitividade no Turismo, mas não basta; precisamos de produtos turísticos para atender ao novo perfil do viajante 100% conectado.",502
O governo Haddad vai recuperar a capacidade do Estado como indutor do turismo no Brasil.,502
"A qualificação dos trabalhadores nesse segmento é essencial, ao lado da formulação de políticas públicas, do monitoramento para sustentar a tomada de decisão e da busca de parcerias - inclusive para obter financiamentos externos para o segmento.",502
"A União, através do Ministério do Turismo terá papel indutor, mas a melhora só virá com planejamento e ações compartilhadas com Estados, municípios e iniciativa privada.",502
O governo Haddad vai recuperar a participação das lideranças empresariais e de trabalhadores que fazem essa atividade no país.,502
5. TRANSIÇÃO ECOLÓGICA PARA A NOVA SOCIEDADE DO SÉCULO XXI,999
A transição ecológica representa nossa visão sobre o Brasil e a nova sociedade do século XXI.,416
"Um país em que as práticas, tecnologias e inovações verdes vão ajudar a criar mais e melhores empregos e serão novos motores de crescimento inclusivo.",416
O Brasil precisa pensar no longo prazo e criar políticas de adaptação às mudanças climáticas.,416
"O governo Haddad dará os sinais decisivos para a construção de uma economia justa e de baixo carbono, contribuindo decisivamente para conter aquecimento global.",416
Temos que transformar a crise ambiental em oportunidades para o viver bem do povo brasileiro e de toda humanidade.,416
"Os investimentos em agroecologia e na mudança da estrutura produtiva vão garantir um futuro moderno e sustentável em que todos possam respirar ar limpo, beber água potável, comer alimentos saudáveis, usufruir de mares e rios salubres, viver com saúde, ter empregos dignos e se orgulhar de suas raízes, sejam elas da cidade ou do campo.",416
Os investimentos de baixo carbono ajudarão a modernizar e a dinamizar a nossa economia urbana e rural.,416
"Eles contribuirão para construir novas capacidades tecnológicas e inovativas, agregando valor à sua vasta sociobiodiversidade, tornando a economia brasileira mais competitiva, aumentando a renda das brasileiras e brasileiros e promovendo a inclusão social.",416
"A transição ecológica é uma dimensão estratégica deste Plano, porque mobiliza temas estruturais de um país que se prepara para a nova sociedade do século XXI, prezando pela garantia e soberania dos bens compartilhados pelo povo brasileiro: natureza, ar, água, cultura e os espaços públicos.",416
Os ataques do golpe aos bens naturais,999
"Com os governos Lula e Dilma, o Brasil teve crescimento econômico inclusivo, com redução do desmatamento e das emissões de gases do efeito estufa (GEE).",416
O governo ilegítimo introduziu medidas e reformas que colocam os custos da crise sobre os mais pobres,503
"e que liberam a exploração desenfreada da nossa vasta riqueza natural, inclusive vendendo nossas terras e ativos ambientais aos estrangeiros.",413
"Com Temer, o meio ambiente e os povos do campo, das florestas e das águas são tratados como moeda de barganha política, ao flexibilizar licenciamento ambiental, suspender demarcação de terras indígenas, reduzir as unidades de conservação, facilitar a grilagem, dentre outros tantos retrocessos.",501
Haddad e a transição ecológica no Brasil,999
"No nosso próximo governo, o Brasil tornar-se-á um protagonista da transição ecológica.",416
"A atual geração é a primeira a ter informações suficientes para agir sobre os riscos ambientais e aproveitar as oportunidades da transição ecológica, mas pode ser a última a ter tempo hábil para agir e evitar os piores danos da crise ambiental.",416
"Vamos introduzir uma agenda estratégica de transição ecológica, que colocará as políticas ambientais, territoriais, regionais, produtivas, tecnológicas, científicas e educacionais como aliadas e como instrumentos para construir as bases para um Brasil do futuro mais próspero, mais inovador e sem pobreza.",416
As profundas mudanças que são necessárias para manter as emissões de GEE dentro de níveis seguros também podem ser uma alavanca para o desenvolvimento econômico com inclusão produtiva.,416
"Esta transição ecológica só será plena se estiver ancorada na democracia, na soberania nacional e na efetividade dos direitos civis, políticos, econômicos, sociais, culturais e ambientais de todos, sobretudo dos povos do campo, das florestas e das águas, e na igualdade plena das mulheres, da juventude e das negras e negros em todos os aspectos da vida.",416
5.1 ECONOMIA DE BAIXO IMPACTO AMBIENTAL E ALTO VALOR AGREGADO,999
A transição ecológica traz uma oportunidade única para o Brasil dar um salto de desenvolvimento definitivo para uma economia de baixo impacto ambiental e alto valor agregado com inclusão produtiva e superação da pobreza.,416
"Nosso Plano de Governo propõe uma mudança na matriz produtiva liderada pela adoção de tecnologias verdes modernas, flexíveis e inteligentes, capazes de responder às crescentes demandas por sustentabilidade e inovação.",416
"As tecnologias verdes incluem as tecnologias de informação e comunicação, biotecnologia, nano- tecnologia, agricultura de baixo carbono, tecnologias da economia circular (eficiência energética e do uso de materiais, reciclagem etc.).",416
A vasta biodiversidade e os conhecimentos tradicionais que o país abriga serão inspiração e bases para inovação verde e agregação de valor.,416
"As tecnologias verdes perpassarão todos os setores da economia, fortalecendo o tecido produtivo e aumentando a capacidade de aprendizado e inovação.",416
"Além de reduzir a poluição, elas também modernizarão a matriz produtiva brasileira, preparando a economia do país para competir com base nas novas tecnologias que definirão as economias avançadas do século XXI, gerando mais e melhores empregos e integrando cada vez mais o campo e a cidade.",416
5.1.1 Acumulando competências e aprendizados para inovar,999
"Para que os benefícios da transição ecológica ao desenvolvimento do país sejam plenamente aproveitados, vamos fortalecer os sistemas nacionais e locais de inovação orientados para essa transição.",416
"Serão feitos fortes investimento no fortalecimento das competências verdes já acumuladas (agroecologia, biocombustíveis, energia eólica, química verde etc.) e na construção de novas capacidades produtivas, tecnológicas e inovativas que garantam competitividade e geração de soluções sustentáveis adequadas às especificidades brasileiras.",411
5.1.2 Políticas de financiamento e Reforma Fiscal verde,999
"Para promover a economia de baixo impacto ambiental e alto valor agregado, o governo Haddad mobilizará recursos por meio de um conjunto de políticas de financiamento público de baixo custo, que ajudará a reduzir os custos e os riscos da transição.",416
Será composto por uma combinação de financiamentos reembolsáveis e não-reembolsáveis para investimentos verdes de maior risco e incerteza.,416
"O financiamento não-reembolsável terá como foco os projetos de empresas em parceria com universidades, institutos e centros de pesquisa, e concentrar-se-á nos primeiros anos do ciclo de investimento, ajudando a dar o pontapé inicial da transição ecológica e apoiando os setores produtivos a superar os altos custos de capital inicial, o “vale da morte” do processo inovativo, e os riscos de investir e adotar novas tecnologias verdes.",416
"Para mobilizar ainda mais recursos, será realizada uma reforma fiscal verde, que progressivamente aumentará o custo da poluição e premiará investimentos e inovação de baixo carbono.",416
"A reforma incluirá a desoneração de tributos sobre investimentos verdes (isenção de IPI, dedução de tributos embutidos em bens de capital e recuperação imediata de ICMS e PIS/COFINS), reduzindo o custo tributário do investimento verde em 46,5%.",416
"Sem elevar a carga tributária, a reforma também criará um tributo sobre carbono, que já foi adotado em vários países para aumentar o custo das emissões de gases de efeito estufa.",416
"Orientado pelo princípio da neutralidade tributária, a receita será utilizada para reduzir tributos distorcivos e regressivos.",503
5.1.3 Infraestrutura sustentável para o desenvolvimento,999
"A oferta eficiente de infraestrutura é um dos pilares do desenvolvimento, pois afeta positivamente a produtividade e a competitividade do sistema econômico, ao mesmo tempo em que melhora o bem-estar social.",411
"Em um país continental como o Brasil, é fator fundamental de integração, equilíbrio ambiental e diminuição de desigualdades regionais e sociais.",411
"Para o Brasil crescer e se desenvolver, é preciso priorizar os investimentos em infraestrutura – que geram empregos e dinamizam a economia – orientados pela busca da sustentabilidade.",411
5.1.4 Sustentabilidade e soberania energética,999
"O governo Lula investirá no aperfeiçoamento do modelo energético, orientado pelas seguintes diretrizes",416
"(1) a retomada do controle público, interrompendo as privatizações;",413
"(2) a diversificação da matriz elétrica, direcionando investimentos para expandir a geração com energias renováveis (solar, eólica e biomassa);",416
(3) tarifas justas;,403
e (4)participação social.,202
"A Eletrobras retomará seu papel estratégico no sistema energético brasileiro, contribuindo para a expansão da geração e transmissão de energia no país.",413
As mudanças terão como meta zerar as emissões de GEE da matriz elétrica brasileira até 2050.,416
Também será perseguida a meta de instalar kits fotovoltaicos em 500 mil residências por ano.,416
"A micro e mini-geração de energia renovável será impulsionada pela venda do excedente de energia gerada por residências, comércio e indústria.",411
"Nos empreendimentos energéticos, os povos do campo, das florestas e das águas, especialmente indígenas, quilombolas e ribeirinhos, afetados pelas obras não apenas serão compensados pelo dano ambiental, como também poderão se tornar sócios dos empreendimentos, recebendo, por exemplo, royalties.",705
"O governo federal investirá na modernização do sistema elétrico existente, sobretudo das usinas geradoras, com incorporação das tecnologias de futuro nas redes de transmissão, como redes elétricas inteligentes.",411
"Além disso, perseguirá o aumento da eficiência energética, fortalecerá o Programa Reluz e agilizará a expansão do Programa Luz para Todos para as localidades isoladas na Amazônia.",411
"O governo Haddad devolverá à Petrobras sua função de agente estratégico do desenvolvimento brasileiro,",413
"garantindo-a como empresa petrolífera verticalizada – atuando em exploração, produção, transporte, refino, distribuição e revenda de combustíveis –",413
"e como empresa integrada de energia, presente no ramo de petróleo e em biocombustíveis, energia elétrica, fertilizantes, gás natural e, sobretudo, petroquímica.",413
"Especial atenção terá a ampliação do parque de refino, sobretudo acabando com a ociosidade atual das refinarias da Petrobras, para que seja garantido o fornecimento de derivados de petróleo em todo o território nacional.",413
"Será interrompida a alienação em curso de ativos estratégicos da empresa, ao tempo em que a política de conteúdo local será retomada e aprimorada.",413
A política de preços de combustíveis da Petrobras será reorientada.,412
"O mercado brasileiro é aberto a importações, mas isso não significa que o petróleo retirado no Brasil, aqui transportado e refinado, com custo bem menor que o internacional, seja vendido aos brasileiros segundo a Nova Política de Preços da Petrobras do governo Temer, a PPI (Paridade de Preços Internacionais), enormemente mais caro que o produto nacional.",412
Essa mudança tem por objetivo garantir um preço estável e acessível para os combustíveis.,412
O gás é um produto que não pode faltar na casa das famílias.,412
"O governo Haddad vai criar o Programa Gás a Preço Justo, que garantirá que o preço do gás caiba no bolso das famílias para que todos possam cozinhar e comer com dignidade e segurança novamente.",412
5.1.5 Diversificando a matriz de transporte,999
"O crescimento econômico em bases consistentes exige a retomada de investimentos em infraestrutura de transporte limpa, que garanta diversificação dos modais de cargas e passageiros, incluindo ferrovias, hidrovias e meios menos poluentes, melhorando a eficiência operacional no escoamento da produção ao mercado interno e exportação.",411
"Exige também a redução de custos logísticos, aumentando a  competitividade das exportações brasileiras e a redução do custo dos bens para o consumo interno.",411
A política de infraestrutura de transportes do governo Haddad será orientada por três diretrizes:,411
"(1) recuperar, modernizar e expandir a infraestrutura de transportes, promovendo a progressiva racionalização dessa matriz;",411
"(2) expandir a parceria com o setor privado com foco no usuário, por meio de medidas como o aperfeiçoamento dos marcos regulatórios da área de transporte e do mercado privado de crédito de longo prazo, para ampliar a infraestrutura com modicidade tarifária;",403
"(3) fortalecer as instituições federais para retomar as funções de planejamento e de regulação, aperfeiçoando o aparato de gestão na área de transporte que compõe o Sistema Nacional de Transporte (DNIT, VALEC, EPL etc.) e construindo um novo modelo para a INFRAERO, as Companhias de Docas e o setor aquaviário.",413
5.1.6 Novo modelo de mineração,999
O Brasil possui uma imensa riqueza mineral.,416
"O país, porém, exporta minérios brutos, sem valor agregado, gerando empregos em outros países.",411
"Por outro lado, crimes ambientais como o de Mariana (MG) e de Barbacena (PA) ligaram o sinal de alerta máximo pelos impactos ambientais e sociais que produziram.",416
"Além de exigir a punição dos responsáveis, o governo Haddad vai criar um novo marco regulatório da mineração, a ser construído de forma participativa, prevendo medidas para que a atividade mineradora produza com maior valor agregado e responsabilidade social e ambiental.",403
O marco ainda conterá previsão para a responsabilização das empresas e pessoas físicas quanto aos impactos ambientais e sociais por práticas que desrespeitem a legislação;,403
a criação de órgão de fiscalização e regulação da atividade mineradora;,403
estímulo ao desenvolvimento tecnológico e inovação das empresas do setor;,411
"e a instituição de políticas para as comunidades atingidas pela mineração,",416
inclusive compensação financeira.,705
A agregação de valor à cadeia da mineração e a produção sustentável contribuem para o desenvolvimento do país e para a proteção da sociobiodiversidade brasileira.,416
"Além do marco regulatório, é preciso investir em pesquisa e mitigação de impactos para o setor.",416
5.2 PROMOÇÃO DO DIREITO HUMANO À ÁGUA E AO SANEAMENTO,999
Reconhecemos o acesso universal à água e ao saneamento como um direito fundamental que deve pautar todas as políticas públicas referentes à segurança hídrica.,411
"Por isso, atuaremos fortemente para garantir a oferta de água para todos e todas com qualidade e regularidade, em sintonia com as metas do Objetivo do Desenvolvimento Sustentável (ODS) de Água e Saneamento da ONU.",411
"Para isso, serão retomadas as ações iniciadas nos governos Lula e Dilma e adotadas novas medidas para ampliar a infraestrutura de oferta de água, com o fim de reduzir a vulnerabilidade às secas em regiões com balanço hídrico crítico.",416
"Isso ocorrerá por meio da retomada ou início de obras de adutoras, canais e barragens, priorizando o consumo humano e a dessedentação animal.",411
"Será também desenvolvida a política de reuso e reciclagem da água, de promoção da eficiência hídrica e de busca de fontes não-convencionais, como a dessalinização de água do mar.",416
