"content","cmp_code","eu_code"
"A promulgação da Lei 12.305/2010, que instituiu a Política Nacional de Resíduos Sólidos (PNRS), definiu caminhos importantes, como a obrigatoriedade de formulação de Plano de Gestão de Resíduos Sólidos pelos municípios e pelos estados,","501",NA
"a eliminação dos lixões,","501",NA
"a implementação da logística reversa","501",NA
"e a inclusão social dos catadores de materiais recicláveis.","501",NA
"Os Centros de Triagem e Reciclagem de Resíduos Sólidos Urbanos (CTRRSU) são uma linha de recepção do lixo urbano para a obtenção de resíduos recicláveis com capacidade de processamento entre 10 e 50 toneladas/dia para um consórcio de municípios com população entre 10 mil e 20 mil habitantes em média.","411",NA
"Seu custo de implementação para pequenos municípios − para uma linha de 10 toneladas/dia como módulo básico − exige um investimento que varia de R$ 724 mil a R$ 1 milhão, fora  os custos do terreno.","411",NA
"As prefeituras, no entanto, não têm sido capazes de prover esses equipamentos.","504",NA
"Por isso, a coligação Unidos pelo Brasil vai garantir apoio específico do governo federal para tornar efetiva a Política Nacional de Resíduos Sólidos.","501",NA
"O levantamento do Ipea Cadernos de Diagnóstico − Catadores, de agosto de 2011, estima que existam, atualmente, entre 400 mil e 600 mil catadores de materiais recicláveis no Brasil, sendo autônomos ou organizados em associações ou cooperativas.","501",NA
"Sua importância é enorme, pois são eles que realizam a coleta seletiva dos resíduos em 72% dos municípios em que ela é praticada, normalmente sem qualquer apoio do poder público.","504",NA
"Vamos favorecer essas organizações.","504",NA
"Segundo o Política Nacional de Resíduos Sólidos, predomina no país o chamado lixo úmido (51%), que contém matéria orgânica.","501",NA
"Encaminhada para disposição final inadequada, ela gera despesas e problemas como contaminação do ar e da água que poderiam ser evitados.","501",NA
"Em termos de logística reversa, porém, graças à PNRS, o país avançou em alguns setores como pneus, baterias, lâmpadas fluorescentes, embalagens de agrotóxicos e óleos lubrificantes.","501",NA
"A PNRS obriga os fabricantes a cuidar da disposição final de suas mercadorias.","501",NA
"Embora algumas boas experiências estejam ocorrendo, ainda existem áreas críticas que precisam ser despertadas para a questão, como eletroeletrônicos, medicamentos, construção civil e embalagens em geral.","501",NA
"Para mudar o panorama da gestão de resíduos sólidos no Brasil, é fundamental, além do apoio aos municípios, dialogar com as empresas.","501",NA
"O setor privado também precisa reformular seus padrões de ofertas e serviços e assumir os custos da implementação de sistemas capazes de recuperar as embalagens e materiais produzidos pelas empresas na mesma proporção em que são consumidos.","501",NA
"COLETAR RESÍDUOS, RECICLAR, INCLUIR OS CATADORES","H",NA
"• Desenvolver programas de apoio a estados, municípios e empresas para implementar integralmente a Política Nacional de Resíduos Sólidos.","504",NA
"• Apoiar estados, municípios e consórcios de regiões metropolitanas no desenvolvimento de sistemas de geração de energia a partir da coleta e do tratamento de resíduos sólidos.","411",NA
"• Atingir a meta de implementar a coleta seletiva em 100% dos municípios brasileiros.","411",NA
"• Alcançar a meta de reciclar 10% do lixo domiciliar coletado.","501",NA
"• Promover a inclusão socioprodutiva dos catadores de material reciclável no Brasil, associada a um programa de melhoria de suas condições de trabalho, previdência e seguridade social.","411",NA
"• Incentivar a criação de cooperativas e outras formas de empreendimentos de catadores, oferecendo-lhes financiamento e assistência técnica.","411",NA
"• Estabelecer padrões para os Centros de Triagem e Reciclagem de Resíduos Sólidos Urbanos nos municípios","411",NA
"e um programa de treinamento e capacitação dos catadores.","411",NA
"• Desenvolver campanhas educacionais de consumo responsável e valorização dos reciclados, criando incentivos para que a população pratique a coleta seletiva e para que a indústria desenvolva novas tecnologias de reciclagem.","501",NA
"• Promover campanha para redução do desperdício de alimentos visando à redução do volume de lixo orgânico e da pressão por mais terras agricultáveis.","501",NA
"Incentivar a participação do setor privado no sistema de reciclagem","501",NA
"e logística reversa e estimular a inovação na fabricação de produtos e embalagens que facilitem a reciclagem e o reúso.","501",NA
"MOBILIDADE URBANA","H",NA
"O problema da falta de mobilidade é reconhecido como tema-chave para os grandes centros, a exigir soluções imediatas, mas também um desenho alternativo para o futuro, baseado em planejamento urbano.","411",NA
"As grandes cidades entraram em colapso do ponto de vista da mobilidade.","411",NA
"Por essa razão, a bandeira dos transportes foi uma das mais levantadas em protestos e manifestações recentes.","411",NA
"Usuários do sistema coletivo sofrem com a superlotação,","411",NA
"com a falta de alternativas","411",NA
"e − juntamente com detentores de veículos individuais − com o trânsito e a perda diária de tempo, saúde e produtividade.","411",NA
"A qualidade do transporte público urbano é baixa,","411",NA
"e o nível de tarifa bastante elevado,","411",NA
"tendo impacto direto sobre a renda e a mobilidade dos mais pobres","411",NA
"e também dos jovens e estudantes.","411",NA
"É um desafio para os governantes melhorar os meios de  transporte","411",NA
"e  reduzir  o  preço  das  passagens.","411",NA
"Assim,  discutem-se  formas  para  diminuir  o  estresse  do  sistema,  quase  todas  pontuais,  ainda  que  algumas  sejam  necessárias  para  aliviar  a  população  de  tamanho  mal-estar.","411",NA
"Sabe-se,  porém,  que  a  situação é  muito  complexa  e  que  as  saídas  supõem  iniciativas  como  construir  novos  corredores  de  transporte  ou  viadutos,","411",NA
"regularizar as  calçadas","411",NA
"e  estimular  o  uso  de  bicicletas e  outros  meios  alternativos.","411",NA
"A  crise  dos  transportes  está  ligada  ao modelo  de  desenvolvimento  não  planejado das  cidades,  que  estão divididas.","411",NA
"De  um  lado, os  centros  e  seus  entornos,  com  grande  presença  do  Estado.","411",NA
"E,  de  outro,  as  periferias  distantes  e  apartadas  dessa  dinâmica  urbana,  mal  providas  de  serviços públicos  e  de  dinamismo  econômico.","504",NA
"Esse crescimento  desordenado  gera  movimentos  pendulares  diários  de  pessoas,  que  se deslocam  para  trabalhar  e  voltar  para  casa.","411",NA
"Mobilidade, no sentido amplo, porém, é uma preocupação relativamente nova nas instâncias da administração pública.","411",NA
"Só recentemente começou a ser discutida não mais sob a ótica exclusiva da resolução das demandas por transporte, mas como parte do conjunto de políticas urbanas.","411",NA
"Assim, a abordagem do tema passou a incluir as decisões acerca de uso do solo e os debates sobre reforma urbana.","411",NA
"A  evolução  das  ações  dos  governos  desde  a  década  de  1950  mostra  que elas  quase  sempre  privilegiaram  o  transporte  individual,  até  a  criação  da  Lei 12.587/2012,  que  instituiu  as  diretrizes  para  uma  política  nacional  de  mobilidade.","411",NA
"O longo tempo de deslocamento nas grandes cidades resultam em perda de saúde e produtividade.","504",NA
"Priorizar a mobilidade não motorizada","411",NA
"e o transporte público.","411",NA
"Melhorar a  qualidade do transporte coletivo.","411",NA
"Mudar valores e hábitos.","606.1",NA
"O imperativo de adotar políticas públicas em direção contrária à atual, pelo bem comum.","504",NA
"A  Constituição  de  1988,  em  seu  Artigo 182,  garantiu  aos  brasileiros  a  função  social das  cidades,  na  qual  se  insere  a  mobilidade.","203",NA
"Melhorar  a  qualidade  de  vida  em  nossas  cidades,  portanto,  requer  que  unamos os  poderes  públicos,  as  organizações  da sociedade  civil  e  o  setor  privado  para  atuar conjuntamente  a  fim  de  reorientar  profundamente  as  políticas  de  transporte.","504",NA
"O transporte  público  é  um  direito constitucional,  assegurado  a  todos.","203",NA
"Em  contraste  com  o  espírito  da  lei,  há  um  esforço  contínuo  do  governo  federal  de  promover  ações  para  reduzir  o  preço  dos  automóveis.","411",NA
"O investimento  é  maciço,  na  forma de  renúncia  fiscal,  e vem casado com  ampla facilitação  do  acesso  ao  crédito.","411",NA
"Redução  do  IPI  para  aquisição  de  carros  particulares  e  subsídios  para  compra  de  combustíveis  contribuíram  para  o  agravamento  do  quadro.","411",NA
"Levantamento  de  2013  do Instituto  de  Pesquisa  Econômica  Aplicada (Ipea)  revela  que  os  carros  de  passeio  recebem  90%  dos  subsídios  para  os  transportes no  país.","411",NA
"A  opção  é  pautada  por  preocupações  com  o  emprego  e  o  ritmo  de  crescimento  da  economia,  e  não  com  a  mobilidade.","411",NA
"Nos  últimos  15  anos  a  frota  de  automóveis  quase  triplicou,","411",NA
"e  a  frota  de  motocicletas  cresceu  cinco  vezes,  sem  que  o  sistema viário  urbano  aumentasse  significativamente  −  mesmo  porque  é  impossível  que  cresça na  mesma  velocidade.","411",NA
"Ao  mesmo  tempo,  a  demanda  por transporte  público  nas  maiores  metrópoles brasileiras  diminuiu  cerca  de  20%.","411",NA
"O  preço  das  tarifas  é  desmotivador.","411",NA
"De  janeiro  de  2002  a  março  de  2014,  por  exemplo,  os dados  do  IPCA  mostram  que  as  passagens de  ônibus  subiram  25,9  pontos  percentuais  acima  da  inflação,  enquanto  o  preço  de veículos,  da  gasolina  e  de  outros  insumos  de  automóveis  e  motocicletas  aumentaram menos  que  a  inflação.","411",NA
"Nos  estados  e  municípios,  por  sua  vez, são  mais  e  mais  pesados  os  gastos  com  ampliação  das  malhas  viárias  para  tentar  dar  fluidez  ao  transporte  individual,  incentivado em  nível  federal.","411",NA
"O  aumento  do  transporte privado  satura  as  vias  urbanas  sobrecarregando  as  estruturas  de  gestão  e  operação  de trânsito.","411",NA
"As  obras  −  caras  −  muitas  vezes  se mostram  ineficazes  com  o  passar  do  tempo.","411",NA
"Além  disso,  os  congestionamentos  acarretam  custos  adicionais  à  sociedade,  especialmente  para  o  próprio  sistema  de  transporte público,  que  fica  mais  caro  em  razão  do  aumento  dos  tempos  de  viagem.","411",NA
"As esforços  para  mudar  esse  quadro já  começam  a  produzir  resultados.","411",NA
"A  Lei 12.587/2012  definiu  diretrizes  para  a  Política Nacional  de  Mobilidade  Urbana  (PNMU).","411",NA
"Seu  texto  prevê  instrumentos  para  enfrentar o  desafio,  tais  como  a  definição  de  regras  para a  circulação  e  o  estacionamento  de  transporte  motorizado  individual  em  áreas  de  tráfego intenso,","411",NA
"a  descentralização  e  o  adensamento de  atividades  ao  longo  dos  eixos  de  transportes  coletivos,","411",NA
"a  busca  de  eficiência  energética de  veículos  coletivos,","411",NA
"a  melhoria  de  qualidade  das  viagens  nos  sistemas  públicos","411",NA
"e  a redução  do  preço  das  passagens.","411",NA
"Para reverter o trânsito caótico de nossas cidades, discutem-se alternativas como novos mecanismos e fontes de financiamento para a mobilidade.","411",NA
"O uso de recursos ainda subutilizados é uma delas.","411",NA
"O Código de Trânsito de 1998 criou o Fundo Nacional de Segurança e Educação para o Trânsito (Funset) e o seguro de Danos Pessoais Causados por Veículos Automotores de Via Terrestre (DPVAT), que juntos já arrecadaram cerca de R$ 3,1 bilhões.","411",NA
"A maioria dos recursos, no entanto, foi contingenciada pelo Ministério da Fazenda.","411",NA
"Por fim, em linha com o que prevê a  Lei  12.587,  consideram-se  ações  de  desestímulo  ao  uso  do  carro.","411",NA
"Esse  último  ponto  já  é  uma  realidade  desde  a  implementação  do rodízio  em  São  Paulo,  na década  de  90.","411",NA
"Cogitam-se  ainda  outras  possibilidades,  como  a  imposição  de  taxas","411",NA
"e  a  restrição  ao  estacionamento  de  veículos.","411",NA
"O  número  de  automóveis  não  deixa  dúvida  em  relação  à  necessidade  de  enfrentar  o  problema.","411",NA
"Em  2014,  chegou-se  à  marca  de  45  milhões de  automóveis  no  país,  segundo  o  Departamento  Nacional  de  Trânsito  (Denatran),  um para  cada  quatro  habitantes.","411",NA
"O  Relatório  Geral  2011  da  Associação Nacional  de  Transportes  Públicos  (ANTP) revela  as  formas  de  deslocamento  das  populações  em  municípios  acima  de  60  mil habitantes  que  participam  do  Sistema  de Informações  da  Mobilidade  Urbana.","411",NA
"Incentivar  a  mobilidade  não  motorizada  (a  pé  e  de  bicicleta)  é  o  modo  mais sustentável  de  começar  a  mudar  a  realidade  nas  cidades,  em  especial  no  sistema  de intermodalidade,  o  que  traz  à  tona  a  discussão  sobre  a  qualidade  das  calçadas,  a segurança  no  trânsito  e  a  prioridade  dada aos  modos  não  motorizados,  definida  pelo  Código  de  Trânsito  Brasileiro  (CTB).","411",NA
"De  acordo  com  o  Plano  de  Mudanças Climáticas  do  Setor  de  Transportes,  mais de  70%  das  emissões  de  CO geradas  pelo 2 setor  de  transportes  no  Brasil  advêm  do transporte  individual.","411",NA
"O  Estado  é  o  maior incentivador  dos  meios  de  transporte  rodoviários.","411",NA
"Estudo  de  2011  do  Ipea  identificou que,  para  cada  R$  1  aplicado  em  transporte público  pelo  governo  federal,  por  meio  de subsídios,  outros  R$  12  foram  investidos em  transportes  individuais.","411",NA
"As  consequências  todos  conhecem:  insatisfação  de  todas as  camadas  da  sociedade,  como  demonstraram  as  recentes  manifestações,  em  especial  da  população  de  baixa  renda,  que  faz viagens,  em  média,  20%  mais  longas  do  que os  mais  ricos,  de  acordo  com  o  Ipea.","503",NA
"A  PNMU,  por  meio  do  planejamento  e da  gestão  democrática  do  Sistema  Nacional de  Mobilidade  Urbana  (SNMU),  estabelece  que  a  mobilidade  não  motorizada  e  os meios  de  transporte  público  coletivos  são  prioridades  nas  áreas  urbanas.","411",NA
"Se  isso  fosse cumprido,  haveria  redução  de  gastos  públicos,  de  poluição,  de  tarifas,  de  emissões  de CO e  de  violência  no  trânsito.","504",NA
"E,  claro,  teríamos  mais  saúde  e  qualidade  de  vida.","504",NA
"O  quadro  geral  dos  acidentes  de  trânsito  urbano  no  Brasil  é  alarmante.","504",NA
"De  acordo como  SNMU,  nada  menos  que  77  mil  motociclistas  acidentam-se  por  ano.","504",NA
"Há  43  mil óbitos  anuais  decorrentes  de  problemas  no trânsito,  o  que  põe  o  país  na  quarta  colocação  em  número  de  mortes  provocadas  por veículos,  atrás  apenas  da  China,  da  Índia e  da  Nigéria.","504",NA
"A  cada  dez  leitos  de  UTI  em São  Paulo,  seis  são  ocupados  por  vítimas  do trânsito;  quatro  deles,  por  motociclistas.","504",NA
"As  campanhas  de  educação  para  o  trânsito  devem  ser  intensificadas.","504",NA
"O SNMU foi criado em 2013 com o objetivo central de formar uma rede nacional de coleta periódica de dados, já que a falta de informações agregadas em um sistema único é um dos obstáculos à construção de sistemas eficientes de mobilidade.","411",NA
"O desafio é garantir a efetiva implementação dessa proposta, sua atualização e capilaridade na recepção de informações e em sua disseminação de forma articulada para estados e municípios.","504",NA
"Para  enfrentar  tantos  desafios,  propõem-se  estratégias  e  objetivos  para  curto, médio  e  longo  prazos.","504",NA
"Toma-se  como  ponto  de  partida  a  integração  e  a  articulação  da cidade  territorialmente,  facilitando  o  acesso  aos  equipamentos  existentes,  inclusive os  destinados  a  cultura,  esporte  e  lazer.","502",NA
"Mesmo  não  sendo  responsável  diretamente  pelo  setor,  a  União  tem  de  assumir o  papel  de  fomentar  o  desenvolvimento  de sistemas  de  mobilidade  mais  sustentáveis  e qualificados.","411",NA
"A  coligação  Unidos  pelo  Brasil não  cogita  políticas  restritivas  de  aquisição de  veículos  privados  pela  população,  principalmente  agora  que  as  famílias  de  baixa renda  estão  tendo  acesso  a  esse  bem  durável.","504",NA
"Mas,  ao  mesmo  tempo,  considera  necessárias  políticas  claras  de  estímulo  ao  uso do  transporte  público  e  do  transporte  não motorizado  por  meio  de  oferta  de  vantagens para  que  os  proprietários  de  veículos  privados  substituam  viagens  individuais  por  coletivas  ou  optem  por  meios  não  motorizados.","411",NA
"O  governo  federal  pode  formar  um  pacto  federativo  com  municípios  e  estados  a  fim  de  melhorar  a  gestão  dos  sistemas  de  mobilidade,","411",NA
"prover  investimentos  na  infraestrutura  de  transporte  público e  não  motorizado,","411",NA
"financiar  a  operação  do  transporte  para  reduzir  o  preço  das  passagens","411",NA
"e  conceder  benefícios  a  grupos  específicos,  como  estudantes de  baixa  renda.","504",NA
"O  financiamento  e  a  capacitação  dos  municípios  para  o  desenvolvimento  dos  planos  diretores  de  mobilidade  urbana  é  outra preocupação  da  coligação  Unidos  pelo  Brasil.","411",NA
"A lei  estabeleceu  prazo  até  o ano  que  vem  para  a  apresentação  dos  projetos,  mas  muitos  municípios  ainda  não  os  estão  desenvolvendo.","411",NA
"O  governo federal  deve  oferecer  às  prefeituras  as  condições  para  que  cumpram  o  cronograma.","411",NA
"É  fundamental  ainda  capacitar  os  agentes  públicos  nos  processos  de  contratação,  licitação  e  acesso  aos  programas  federais.","411",NA
"Qualquer benefício que a União oferecer, porém, deve prever contrapartidas em termos de melhoria da gestão ou redução dos custos dos serviços e, consequentemente, do barateamento das tarifas.","411",NA
"O passe livre para estudantes, por exemplo, é um passo para se chegar a políticas mais abrangentes, como o atendimento à demanda por tarifa zero.","411",NA
"Na  busca  de  soluções  para  mobilidade, devemos  ainda  dialogar  com  a  indústria  automobilística,  pois  ela  fabrica  os  veículos  de transporte  coletivo  e  deve  adaptar  seus  investimentos  às  exigências  de  nossos  tempos.","411",NA
"É  preciso  encarar  as  cidades  como  ambiente  de  vivência  social  e  planejá-las  de forma  mais  circular  e  menos  radial.","411",NA
"A  mobilidade  urbana,  por  sua  vez,  deve  ser  pensada  com  diferentes  soluções,  enfrentando  a lógica  dominante  do  transporte  individual.","411",NA
"NOVAS  PRIORIDADES  PARA  O  TRANSPORTE  URBANO","H",NA
"oImplantar um programa de forte apoio da União a estados e municípios para que construam, em quatro anos, um total de no mínimo 1 mil quilômetros de vias para veículos leves sobre trilhos (VLTs) e de corredores de ônibus integrados (BRT) em todas as cidades brasileiras com mais de 200 mil habitantes.","411",NA
"oExpandir as malhas metroviária e ferroviária de cada uma das regiões metropolitanas em 150 quilômetros ao longo de quatro anos.","411",NA
"oCriar um programa federal para financiar os custos de deslocamentos de todos os estudantes brasileiros e implementar a proposta do “passe livre” gradualmente, beneficiando, em primeiro lugar, os alunos de baixa renda não atendidos pelo transporte escolar gratuito e matriculados em escolas públicas de Educação Básica ou em cursos superiores por meio de programas como o Prouni e o Fies.","411",NA
"A gratuidade será provida com programa de apoio financeiro a estados e municípios.","411",NA
"oFormar pacto federativo com estados e municípios para criar fundos voltados ao financiamento da operação e da infraestrutura de transporte público e transporte não motorizado e à desoneração de tarifas.","411",NA
"oCriar um programa federal de capacitação e melhoria da gestão pública da mobilidade com foco nas diretrizes na nova lei da mobilidade urbana, na gestão metropolitana compartilhada e no financiamentoaos municípios para que desenvolvam os planos diretores de mobilidade urbana.","411",NA
"oImplementar no Ministério das Cidades programas que estimulem boas condições de mobilidade não motorizada.","411",NA
"Oferecer incentivos a projetos urbanos que sigam padrões de referência na articulação de diferentes meios de transportes e assegurem a qualidade de acesso para pedestres.","411",NA
"oCriar um programa federal de investimento, financiamento e desoneração da frota de ônibus urbanos acessíveis e de veículos movidos com combustíveis limpos, beneficiando-os nas políticas de isenção e de desoneração de impostos.","411",NA
"oExigir investimentos em transportes não motorizados como contrapartidas ambientais em iniciativas do setor privado.","501",NA
"oCriar mecanismos transparentes para que os cidadãos monitorem, em tempo real, a efetividade dos investimentos federais e o avanço das obras de infraestrutura para mobilidade urbana.","411",NA
"oInstituir programas para conscientizar a população sobre a necessidade de mudar hábitos e comportamentos, já que o problema da mobilidade está fortemente associado à conveniência do uso de veículos motorizados individuais.","606.1",NA
"oCriar um programa federal de educação a fim de reduzir acidentes de trânsito, com foco especial nos motociclistas e uso total do Funset, além de recursos do Orçamento Geral da União.","411",NA
"oInvestir no desenvolvimento científico e tecnológico de matrizes energéticas mais limpas e eficientes para o transporte público coletivo.","411",NA
"oRealizar levantamento de tecnologias existentes e apoiar o desenvolvimento de aplicativos para monitoramento de tempo de deslocamento e percurso dos transportes públicos.","411",NA
"oFomentar pesquisas sobre transportes e monitorar impactos de medidas de melhoraria da mobilidade urbana.","411",NA
"oUnificar o cadastro de automóveis no Brasil.","605.1",NA
"oApoiar a elaboração, na implementação e no financiamento de planos de mobilidade, aumentando a transparência e a participação da sociedade.","411",NA
"REGIÕES METROPOLITANAS","H",NA
"A mobilidade e a falência de sistemas e gestões de transporte.","411",NA
"A explosão demográﬁca nas manchas urbanas.","504",NA
"A ausência de poder regional e de fontes de ﬁnanciamento para projetos integrados. Como começar a mudar.","411",NA
"As regiões metropolitanas brasileiras enfrentam todos os percalços inerentes aos grandes conglomerados urbanos dos países em crescimento: explosão demográfica desacompanhada da necessária oferta de serviços,","504",NA
"insuficiência de equipamentos públicos e de moradias adequadas","504",NA
"e processo de urbanização sem planejamento.","504",NA
"Tudo isso obriga o poder público a resolver de forma quase sempre emergencial os problemas dramáticos já existentes.","504",NA
"A questão da complexa governança dessas metrópoles e a escassez de mecanismos de cooperação interfederativos tornam-se, assim, o principal desafio da administração dos grandes espaços urbanos.","303",NA
"A  legislação  atual  delega  aos  estados o  papel  de  criar  novas  regiões  metropolitanas.","303",NA
"Oficialmente,  são  60.","303",NA
"Segundo  o Instituto  Nacional  de  Ciência  e  Tecnologia −  Observatório  das  Metrópoles,  da  Universidade  Federal  do  Rio  de  Janeiro,  15  delas foram  identificadas  como  metropolitanas: São  Paulo,  Rio  de  Janeiro,  Belo  Horizonte, Porto  Alegre,  Brasília,  Curitiba,  Salvador, Recife,  Fortaleza,  Campinas,  Manaus,  Vitória,  Goiânia,  Belém  e  Florianópolis.","303",NA
"Desses, apenas nove (São Paulo, Rio de Janeiro, Belo Horizonte, Porto Alegre, Recife, Fortaleza, Salvador, Recife e Belém) concentravam, em 2011, segundo dados do IBGE, mais de 58 milhões de habitantes e respondiam por cerca de 30% do PIB brasileiro.","303",NA
"É preciso aperfeiçoar a definição jurídico-institucional das regiões metropolitanas como instâncias administrativas dotadas de autonomia e de recursos financeiros para o enfrentamento dos desafios do transporte coletivo e da mobilidade nas grandes manchas urbanas.","411",NA
"A questão da região metropolitana indica a dificuldade de articulação interinstitucional.","303",NA
"Por outro lado, a complexidade da articulação dos diferentes modais de transporte coletivo remete às dificuldades de gestão dos estados e municípios diante do desafio da explosão demográfica urbana.","303",NA
"É clara a escassez de sistemas que combinem de forma eficiente os diversos modais.","303",NA
"O modelo centrado no transporte individual motorizado foi desconstruindo aos poucos a estrutura de transporte coletivo e direcionando a imensa parcela dos recursos para a malha viária.","411",NA
"Deteriorou, assim, os sistemas coletivos e sua gestão.","303",NA
"Não parece haver maiores controvérsias quanto à importância de dotar as  instituições de caráter e abrangência metropolitanos com recursos e autoridade para tratar de seus problemas de forma integrada e autônoma.","303",NA
