Text,Code
INTRODUÇÃO,999
O Brasil é um país viável desde que o povo decida sobre seu destino.,202
É justamente isto que o povo brasileiro fará em 1994.,202
"Em meio ao caos econômico e social,",202
"à decomposição do sistema político,",303
"à corrupção,",304
"à desconstrução nacional,",202
"surge uma alternativa política capaz de reacender a esperança do povo, reconstruir o sonho brasileiro e iniciar a marcha para um futuro tantas vezes anunciado e nunca alcançado.",305
"Esgotado pela crise de um modelo de desenvolvimento—perverso, concentrador de renda e autoritário — o país encontra-se no limiar de uma grande transformação.",416
"Diferentemente de outras situações históricas, e talvez pela primeira vez na República, hoje estão reunidas fòrças sociais e políticas com vocação de poder, capacitadas para dar a solução aos impasses que vivemos.",305
Pela primeira vez estas soluções se darão em proveito das maiorias tradicionalmente excluídas das decisões econômicas e políticas.,202
"Em primeiro de maio de 1994, o 9o Encontro Nacional do Partido dos Trabalhadores , em Brasília, aprovou estas bases do Programa de Governo com o qual Luiz Inácio Lula da Silva disputará a Presidência da República nas próximas eleições.",305
O programa que entregamos ao povo brasileiro é o resultado de um ano de discussões envolvendo dezenas de milhares de militantes do partido e amplos setores da sociedade civil.,305
"Ele é o produto de uma reflexão sobre os grandes problemas nacionais, um conjunto de propostas para vencer a grave crise que o país atravessa, refletindo a vontade de mudança que anima milhões de brasileiros.",305
"As idéias e propostas aqui expressas são t ambém nossa contribuição aos demais partidos que integram a Frente, para a elaboração de uma plataforma eleitoral comum.",305
"Longe de ser um diagnóstico acadêmico da crise brasileira, um receituário de propostas formuladas em gabinetes fechados ou uma peça retórica de vagas declarações de intenções, este programa quer ser antes de tudo um compromisso.",305
Queremos afirmar claramente nossa disposição de inverter radicalmente as prioridades que nortearam até agora os governos deste país.,305
Este é o programa de um governo que submeterá todos seus objetivos à meta central de combater a pobreza e a indigência que atingem metade da população brasileira.,504
"Para atacar a exclusão social, concentraremos nossas iniciativas no combate à fome, ao desemprego,",504
"ao abandono dos menores,",504
ao descalabro da educação,506
"e da saúde,",504
a ausência de moradia e de saneamento.,411
"É a partir destes objetivos de combate à exclusão social que se organizará o conjunto da ação governamental, especialmente sua política econômica.",504
"Por estas razões queremos constituir um governo de reformas, que, pela primeira vez em nossa história, impulsionará uma reforma agrária e políticas agrícolas capazes de entregar terra a quem necessita, democratizar a propriedade e sustentar nossa meta de alimentar todos os brasileiros.",703
Defendemos uma nova concepção de desenvolvimento que seja plenamente compatível com a preservação do meio ambiente.,501
"Implantaremos uma nova política de rendas, que combinará o combate indispensável à inflação com um programa audacioso de emprego e de elevação dos salários.",701
É preciso pôr fim à concentração de renda rompendo com os projetos que anunciam uma recuperação econômica que nunca chega ou que só beneficia aos ricos.,305
"Afirmamos nosso compromisso com a democratização da vida econômica do país, democratizando as relações de trabalho",202
e impulsionando as formas cooperativas de produção e distribuição.,415
"Estamos comprometidos com uma profunda reforma do Estado, com sua democratização e controle pela sociedade, através da participação popular, que permita desencravar de seu interior interesses privados, corporativos e burocráticos.",415
"O Estado não pode continuar sendo identificado pela sociedade — como é hoje — como uma entidade distante, indiferente e hostil que submete os cidadãos comuns à humilhação das filas, à arrogância ou desinteresse de burocratas que não se sentem comprometidos com a coisa pública e se revelam servis para com os poderosos.",415
O programa é de um governo que se empenhará na radicalização da democracia política através da expansão da democracia econômica e social do país.,202
"Esta meta—em realidade um processo — será atingida por meio da universalização da cidadania,",606
"do respeito aos direitos humanos,",201
"da constituição de um espaço público em que se criem novos direitos, garantidos a igualdade e respeito às diferenças de idéias, religiões, etnias, gênero, idade, orientação sexual e opções de vida.",201
"Nosso governo combaterá todas as formas de preconceito, ao mesmo tempo em que lutará pela defesa e preservação da vida de milhões de homens e mulheres que sofrem a violência e assistem perplexos o espetáculo cotidiano da impunidade, sobretudo dos poderosos.",605
"Seremos um governo comprometido com a cultura, que valorizará todas as formas de produção, distribuição e de acesso aos bens culturais.",502
"Comprometido com a liberdade de criação artística, científica e de idéias, o governo se empenhará na democratização das instituições culturais em geral",502
e dos meios de comunicação em particular.,502
Não há democracia se os cidadãos não têm acesso livre às informações.,502
"O progama, lutando contra a desagregação social, aponta para a reconstrução de nossa economia através da constituição de um grande mercado interno de consumo de massas, criando condições de um país livre e soberano.",406
Faremos da soberania nacional um valor tão caro quanto o da soberania popular.,202
"Buscaremos uma integração soberana do Brasil no mundo para enfrentar as grandes transformações políticas, econômicas e sociais hoje em curso.",107
"O Brasil afirmará sua vocação universal, em suas relações internacionais, defenderá o meio ambiente",501
"e os direitos humanos,",201
"lutará pela democratização das relações internacionais,",202
"propugnará por uma reestruturação econômica internacional em proveito dos países do Sul, na defesa do emprego e de uma cooperação científica e tecnológica.",107
"O Brasil enfatizará as relações com a América Latina, em especial a América do Sul,",107
"fortalecerá políticas de integração continental, dentre as quais o Mercosul reformulado,",108
e fará de sua política externa um componente essencial do seu projeto nacional de desenvolvimento.,107
"Este é um programa de um partido que se foijou na luta contra a ditadura, pela democracia política e social, que soube romper desde sua fundação com velhas heranças dogmáticas sem renegar as lutas de seu povo e daqueles que deram a vida por ele.",202
Este programa transformou-se no ponto de encontro do que de melhor produziu a sociedade brasileira.,305
Para ele contribuíram os operários que não se curvaram diante da exploração e da opressão e constituíram um dos mais importantes movimentos sindicais do mundo de hoje.,202
Nele estão as marcas de camponeses e trabalhadores rurais que livram suas lutas em meio à violência do latifúndio.,703
"Nele colaboraram intelectuais e artistas comprometidos com os problemas sociais, religiosos que lutam pela libertação aqui na terra,",502
"mulheres que enfrentam a dupla opressão na esfera pública e privada,",706
"negros e índios empurrados pelos poderosos para as margens da sociedade mas reivindicando, orgulhosos, seu lugar na construção nacional.",705
Este é o programa dos jovens que não querem ser apenas o “futuro do país” mas reivindicam sua participação aqui e agora.,706
Este é o programa dos excluídos que não sucumbiram à submissão e ao conformismo.,202
"Neste programa confluem muitas ideologias, tradições culturais, experiências sociais e de vida.",502
"O que une todos é o compromisso intransigente com a democracia,",202
com o respeito aos direitos humanos,201
e com a necessidade de profundas reformas econômicas e sociais em proveitos das maiorias.,202
"Este é finalmente o programa de um partido que se mostrou, em toda sua trajetória, incorruptível nas administrações que dirigiu ou dirige, nos parlamentos em que esteve ou está presente.",304
"Intransigente a ponto de ficar por vezes isolado, mas sempre ressurgindo como uma referência ética e moral, dentre outras, na sociedade brasileira.",305
"Este programa quer construir pontes com outras forças políticas e sociais, não só com aqueles que nos acompanham desde há muito, e que hoje estão conosco, mas também com aqueles eom os quais queremos compartilhar no futuro a construção de um país de liberdade e igualdade.",305
Este país está ao alcance de nossas mãos.,202
"Neste programa estão contidas as alternativas para mudaras grandes estruturas, sociais e políticas do Brasil.",305
"Ele busca ser a expressão de um movimento cultural, que interpela cada um dos indivíduos, propondo-lhe nada mais do que mudar a vida.",305
"Reflete nossa disposição de desencadear um grande movimento de idéias, uma verdadeira renovação da cultura política brasileira, parte integrante da revolução democrática que pretendemos impulsionar no país.",202
A CRISE BRASILEIRA E A ALTERNATIVA DEMOCRÁTICA E POPULAR,999
"As eleições gerais de 1994, especialmente a escolha do novo presidente da República, se darão em meio à maior crise que a história do Brasil já conheceu.",305
"Esta crise é complexa, sendo, ao mesmo tempo, econôínica, política, social, ambiental, cultural e ética.",305
"Há mais de uma década, as classes dominantes revelam-se incapazes de um acordo para implementar um projeto qualquer de desenvolvimento, fazendo com que o país pareça uma nau sem rumo.",305
"O atual estado de coisas impõe a dezenas de milhões de brasileiros a humilhação do desemprego, do viver faminto, doente, sem teto ou em moradias insalubres, da ausência de educação, cultura e lazer.",504
"Este quadro gera uma violência social sem precedentes, à qual se soma a violência cada vez maior do Estado.",504
A marginalidade econômica e social é agravada pela exclusão política.,504
"Afastados da produção e do consumo, dezenas de milhões de brasileiros encontram- se, ao mesmo tempo, excluídos de fato da cidadania, sem acesso real à justiça, à rede escolar, ao sistema de saúde ou a qualquer forma de proteção social.",504
"Prisioneiros desta gigantesca armadilha social, esses irmãos são manipulados por políticos inescrapulosos ou por colossais máquinas de propaganda que semeiam ilusões e/ ou incutem o conformismo, contribuindo para a manutenção e reprodução do status quo.",305
É a partir deste quadro sombrio da sociedade brasileira que se pode falar na existência de uma imensa exclusão social neste país.,504
"Possuindo o décimo PIB mundial, o Brasil situa-se nos últimos lugares em termos de distribuição de renda e de todos indicadores de bem-estar social.",504
"O país aparece aos olhos do mundo como um lugar onde a existência humana foi rebaixada aos níveis mais abjetos: a terra da prostituição infantil, dos menores abandonados nas ruas, dos homens-gabirus ou dos massacres de crianças, presos, favelados ou índios.",504
"Para assegurar e reproduzir seus privilégios, responsáveis pela exclusão social ou marginalidade, as classes dominantes valem- se hoje, como historicamente o fizeram, de todos os poderosos instrumentos que lhes oferece um Estado gigante, burocratizado, autoritário na sua essência, mas, sobretudo, fortemente privatizado pelos interesses destes setores sociais.",415
"O fenômeno da corrupção generalizada, que tem ocupado nos últimos anos o centro das preocupações da opinião pública, só pode ser entendido a partir deste perverso fenômeno de utilização do Estado para o atendimento dos interesses de ínfimas e privilegiadas minorias.",304
O PT nasceu para lutar contra este estado de coisas.,305
Exclusão: fenômeno recorrente em nossa história,999
"A exclusão não é apenas um problema recente, mas um fenômeno recorrente na história do Brasil.",504
"Ela é a expressão de um Estado autoritário que revelou enorme eficácia na construção da dominação, pois consegue fazer com que o autoritarismo transforme-se em fenômeno socialmente implantado.",305
Diferentemente de muitos países — inclusive da América Latina — a unidade da Nação e a construção do Estado Nacional não foram acompanhadas de um processo de universalização da cidadania.,606
"País cuja história não registra revoluções nacionais, o Brasil realizou todas suas grandes transformações políticas e sociais através de processos conservadores de conciliação das elites, que uniram seus interesses para impedir a presença dos “de baixo” na consecução das transformações necessárias.",305
"A Independência, em 1822, não significou uma ruptura com a metrópole.",305
Desdobrou-se numa monarquia conservadora e criou novos laços de dependência.,305
A Abolição frustrou os sentimentos de reforma social que animaram os líderes do movimento e as aspirações da grande maioria que dele participou.,305
A abolição não contribuiu para uma efetiva emancipação dos negros.,705
"Foi acompanhada por uma política oficial que trouxe o trabalhador imigrante não apenas para, literalmente, substituir o ex-trabalhador escravizado, mas, sobretudo, para “fundar” a Nação brasileira, embranquecendo-a, conforme debates parlamentares da época.",607
"Significou ainda uma redefinição do racismo, como suporte da estrutura social brasileira, excluindo a população negra das oportunidades econômicas e submetendo-a à condição de subcidadã.",705
"A República, alterando formalmente as instituições, não foi capaz de operar uma significativa troca de grupos no poder, constituindo-se em uma sucessão de frustrações populares.",305
"Por duas vezes na história republicana colocou-se de forma aguda a necessidade de reformas sociais profundas para superar graves impasses econômicos e políticos, mas, tanto em 1930 quanto em 1964, as classes dominantes lançaram mão de soluções autoritárias para resolver a crise de dominação em que se encontravam.",305
"É sintomático que tenham chamado seus movimentos de “Revolução”, talvez para tentar legitimar junto ao imaginário popular a ruptura conservadora que fizeram com o Estado de direito existente.",305
"O discurso sobre a “modernidade” das elites não oculta o caráter profundamente arcaico de suas concepções e, sobretudo, de sua prática.",305
"Como falar em modernidade, quando dezenas de milhões são excluídos dos frutos do extraordinário crescimento econômico que o Brasil viveu no século XX?",305
"Como falar em modernidade, quando subsistem, incrustrados no Estado, interesses corporativos de setores que representam o atraso dos grotões rurais?",415
Como falar em modernidade quando se constata a dificuldade para a construção de um espaço público e da própria República?,305
"Ao contrário, o que tem ocorrido é o as- senhoramento do Estado pelas elites em proveito de seus interesses particulares.",415
"É neste processo de privatização do Estado, hoje generalizado, que se encontra a explicação última do colossal mecanismo de corrupção que vem sendo desvendado nos últimos anos.",304
"A privatização do Estado não se resume, no entanto, na utilização pelas elites de seus poderosos instrumentos (diretos ou indiretos) de intervenção na atividade econômica em proveito de seus interesses particulares.",305
Tampouco esgota-se na corrupção.,304
Nas duas últimas décadas assistiu-se igualmente ao fenômeno de desmantelamento da máquina estatal e do pouco que existia em termos de serviços públicos que não chegava a constituir um Estado de bem-estar social,504
"Como parte do processo de concentração de renda, acelerado durante a ditadura militar, verificou-se uma forte privatização das políticas públicas.",415
"As classes altas e um pequeno segmento das classes médias passaram a ter suas alternativas privadas em matéria de saúde, educação, transporte, previdência, enquanto se deixava para a imensa maioria da população serviços públicos sucateados,",504
"uma burocracia ineficiente,",303
"mal paga e desmotivada, que aparece não só distante mas até como inimiga dos que a ela acorrem.",303
"O Estado revelou-se extremamente funcional ao perverso modelo de concentração de renda e assim um agente reprodutor da desigualdade, da exclusão social.",503
"Queremos uma modernidade ética, uma modernidade dos fins",999
Eis os objetivos principais que norteiam o novo projeto que propomos:,504
"consolidar as instituições democráticas, num sistema político cada vez mais aberto direitos emergentes e a uma crescente participação popular em todos os níveis;",202
acabar com a fome;,504
"garantir a todas as crianças uma educação de qualidade, com criatividade e adequada à moderna sociedade da informação, de modo que a sociedade compartilhe de um crescente acúmulo de conhe cimentos e de atividades culturais;",506
"eliminar as doenças endêmicas e aquelas decorrentes da má qualidade de vida, constituindo em paralelo um sistema de saúde moderno e efetivamente universal;",504
"dar a cada família habitação digna, saneamento e serviços sociais básicos;",504
pôr fim à espiral de violência social nas cidades e no campo;,605
"criar uma infra-estrutura eficiente, entendendo-se por eficiência a capacidade de dominar os recursos nacionais e pô-los a serviço da sociedade;",411
"buscar uma nova racionalidade econômica e social que concilie produção, distribuição e proteção ao ambiente e ao patrimônio natural;",501
"construir uma nação aberta à cultura e às técnicas internacionais, procurando integrar-se ao resto do mundo.",502
"Queremos, enfim, uma modernidade ética, uma modernidade dos fins, aquela baseada em soluções originais e num contrato social verdadeiramente novo, e não aquela definida com base num conceito supostamente técnico, alheio às necessidades reais de uma maioria de deserdados.",504
"Daí a importância dos bens e equipamentos coletivos,",504
"dos serviços gerais de infra-estrutura,",411
"bem como daquelas instituições voltadas a oferecer, a todos os cidadãos, igualdade básica de oportunidades.",503
"Destacam-se, no primeiro caso, os transportes de massa, especialmente nas grandes e médias cidades;",411
"no segundo, as redes de energia, transportes de longa distância, portos e comunicações;",411
"no terceiro, os serviços públicos de saúde e educação.",504
A crise e a possibilidade de um programa de caráter transformador,999
"Retirar o Brasil da crise e iniciar um novo ciclo de crescimento econômico sustentado e de qualidade distinta dos anteriores — baseado na distribuição de riqueza, renda e poder",416
e com equilíbrio ecológico,501
"—é nossa meta principal, que se articula com o objetivo estratégico de construção de uma sociedade socialista e democrática.",202
A crise na qual o Brasil está imerso tem dimensões históricas.,410
"Não se trata de um mero interregno, entre outros, na vida de uma economia que retoma seu fôlego para voltar a crescer.",410
"Nossa sociedade experimentou grandes mutações entre 1930-80, industrializando-se, urbanizando-se e constituindo-se como um sistema nacionalmente integrado.",410
"Esgotado o dinamismo decorrente destes três grandes processos, bem como o sistema de financiamento a ele associado — baseado na expropriação de parte do excedente agrícola,",305
no arrocho salarial,305
e em financiamentos externos,305
"— a Nação perdeu sua própria imagem de futuro, sem que esses mesmos processos a tivessem levado a ajustar completamente suas contas com o passado.",305
"Inaceitável concentração de renda e riqueza, bolsões de pobreza e uma estrutura agrária excludente—características típicas de sociedades atrasadas —, presentes neste fim de ciclo industrial, agravaram-se durante a grande estagnação que a ele se segue.",503
"Isto denuncia a predominância de um modelo de crescimento baseado na grande exploração da força de trabalho, desigualdades regionais ampliadas, dependência externa, distorções na estrutura produtiva e agressões ao meio ambiente.",416
"Operando com um mercado restrito, abastecido com bens de luxo produzidos com tecnologias intensivas por grandes oligopólios nacionais e estrangeiros, foi um desenvolvimento para poucos, incapaz de explorar plenamente as potencialidades do Brasil.",305
"Ao esgotamento desse ciclo de cinqüenta anos, pressões externas derivadas da constituição de uma nova (des)ordem mundial, fortemente excludente,",107
"e internas, derivadas de centros de poder da velha ordem, combinaram-se para dar lugar a uma crise marcada por uma aparente ausência de projeto, que se prolonga até hoje.",305
Este tempo precisa chegar ao fim e as elites são incapazes de encaminhar sua superação.,305
"Em primeiro lugar, porque arranjam-se para lucrar com esta situação, parasitando o Estado e ã sociedade.",305
"Em segundo lugar, porque não conseguem articular um bloco de forças sociais e políticas capaz de apontar as características básicas de um novo modelo.",305
"Quando não pura e simplesmente corruptas, insistem em um neoliberalismo que não tem potencial estruturante da sociedade brasileira.",415
"Não sendo um projeto nacional, o neoliberalismo constitui-se em uma operação ideológica que tende a consagrar uma estruturação perversa e fragilizadora de nossa economia.",415
"Perversa porque exclui a grande maioria: a base produtiva passa a atrelar-se cada vez mais ao padrão de consumo que prevalece entre os detentores do poder, ou seja, os brasileiros ricos e os consumidores do Primeiro Mundo, com todas as conseqüências que daí advêm para a renda e o emprego.",503
"Fragilizadora porque rompe com nossa tradição, pelo menos desde 1930, de reagir ativamente às dificuldades internacionais.",107
"Frente a este quadro, colocamos a necessidade de um programa de transformação da economia e da sociedade, que ao mesmo tempo reconstrua-a Nação.",305
"Este programa de governo não se confunde com a descrição de uma sociedade ideal, nem é obra de invenção.",305
"Ao contrário, é uma tentativa de identificar um desdobramento possível e desejável para uma situação estratégica dada, recuperando processos históricos,",305
recombinando tendências presentes,305
"e estimulando elementos potenciais, portadores de futuro,",305
de modo a constituir um projeto que tenha aderência a interesses de grandes grupos sociais,202
e ofereça uma alternativa de desenvolvimento à base produtiva construída com o esforço das gerações passadas.,416
"Nosso programa deve ser viável e possuir um componente de radicalidade necessário que não nos aprisione apenas à margem de possibilidades abertas pela situação atual, resultado de uma longa hegemonia conservadora.",305
"A viabilidade de um programa está vinculada a seu caráter transformador, para que a luta política se dê num campo de possibilidades transformado, em que o governo e o povo ajam juntos no sentido das mudanças, a cada passo conquistadas e consolidadas.",202
"A campanha, a vitória, a posse e o exercício do governo só têm sentido para nós como parte de um processo social mais amplo, em que a sociedade brasileira como um todo altere relações de poder antigas e cristalizadas, abrindo caminho para que os trabalhadores e as grandes maiorias nacionais assumam a direção da Nação.",202
"Hoje estão em grande parte reunidas as condições sociais para que um novo projeto de organização econômica, social e política do país possa se materializar e oferecer uma saída distinta para o Brasil.",305
"Desde fins dos anos 70 — quando se evidenciaram os limites internos e externos do modelo econômico dos militares contribuindo para a crise da forma ditatorial de dominação —, o Brasil assiste a formação de um novo bloco histórico de forças sociais e políticas.",305
"Estas forças, ainda que desde o início não tenham sido capazes de oferecer um programa absolutamente coerente e articulado, tiveram a capacidade de impedir que a dupla crise dos anos 70/80 se resolvesse uma vez mais pela conciliação das elites.",305
"Novos personagens entraram em cena, sobretudo os trabalhadores, deixando profundas marcas no processo de democratização política do país",305
"e, pelo menos, frustrando o ajuste neolibcral que as elites puderam realizar em outros países da América Latina.",415
"A democracia ganhou novos conteúdos e passou a ser entendida não só como a vigência do estado de direito, mas também como o espaço para a construção de novos direitos, das mulheres, dos negros, das minorias, dos diferentes.",201
"Apesar de mais de uma década de recessão e inflação, apesar do sucateamento do Estado, o Brasil revela ainda um enorme potencial de recuperação.",410
"Este potencial não se resume às suas riquezas minerais,",410
"às perspectivas de sua agricultura,",703
"à extensão de seu território,",410
"ao dinamismo de seu comércio exterior,",410
"às possibilidades de seu mercado intemo,",406
à produtividade de seus trabalhadores.,701
