"content","cmp_code","eu_code"
"UNIÃO DO POVO – MUDA BRASIL Diretrizes do Programa de Governo","H",NA
"Só a união do povo e uma nova maioria podem formar um governo capaz de tirar o país da crise e prepará-lo para o século XXI.","601.1",NA
"A UNIÃO FEZ A FORÇA","305.1",NA
"Pela primeira vez em nossa história as esquerdas se uniram para disputar a presidência da República.","305.1",NA
"A União do Povo - Muda Brasil é uma efetiva opção de poder.","305.1",NA
"Seu Programa aponta para uma mudança profunda da economia, da sociedade e da política brasileiras em proveito das grandes maiorias, em especial dos trabalhadores.","305.1",NA
"A união das esquerdas se amplia conquistando importantes setores comprometidos com o progresso, a soberania nacional, a democracia e a ética na política.","305.1",NA
"Ela expressa o sentimento de todos aqueles que condenam o atual estado de coisas e que querem superar os problemas que afligem nosso país há séculos, sumamente agravados pelo governo FHC.","305.1",NA
"Os brasileiros dão-se conta de que o mundo está mudando.","601.1",NA
"Soluções conservadoras copiadas por nossas elites são repudiadas por eleitores de muitos países que nas urnas derrotam governos insensíveis aos grandes problemas sociais.","202.1",NA
"Chegou a vez de os brasileiros fazerem escutar sua voz e afirmar uma proposta alternativa.","601.1",NA
"Essa proposta é representada pela União do Povo -Muda Brasil, integrada pelos partidos populares e por todas as forças comprometidas em reconstruir a Nação.","601.1",NA
"A vitória das oposições, no entanto, depende da capacidade de mobilização de milhões de homens e mulheres.","601.1",NA
"E preciso ganhar as eleições para mudar o país.","202.1",NA
"Mas é preciso mobilizar o povo para ganhar as eleições.","202.1",NA
"A união é nossa força.","601.1",NA
"A HERANÇA DE FHC O POVO ESTÁ INQUIETO, INTRANQÜILO E INSEGURO","H",NA
"Os jovens não encontram trabalho,","701",NA
"os desempregados não retornam ao mercado formal e","701",NA
"a maioria dos brasileiros teme por seus empregos.","701",NA
"Salários, aposentadorias e pensões são congelados ou reduzidos.","701",NA
"O sistema de saúde está em crise, enquanto crescem as endemias.","504",NA
"O povo não pode enviar seus filhos para escolas de qualidade.","504",NA
"Grande parte da juventude é obrigada a pagar seus estudos.","504",NA
"Aumenta a violência nas ruas com a crise social.","503",NA
"Micro, pequenas e médias empresas fecham suas portas.","410",NA
"Nossos irmãos nordestinos sofrem as conseqüências de uma seca anunciada, sem que o governo tenha adotado qualquer providência,","703.1",NA
"a não ser reunir secretários de segurança para reprimir saques, transformando um grave problema social em ""questão de polícia"".","605.2",NA
"Antes, parte da Amazônia ardeu em chamas diante do olhar indiferente do governo.","501",NA
"O PAÍS SOFRE COM A ARROGÂNCIA, O AUTORITARISMO E A IRRESPONSABILIDADE DE FHC","H",NA
"Um presidente arrogante - que não hesita em chamar milhões de brasileiros de ""vagabundos"" - dirige um governo sem preocupações sociais, mais ocupado com sua imagem internacional do que com o sofrimento do povo.","503",NA
"O governo ofendeu o Congresso Nacional, com sucessivas compras de votos.","304",NA
"Denúncias de corrupção têm sua investigação bloqueada pela maioria governista.","304",NA
"FHC abusa das Medidas Provisórias, superando o regime militar no uso dos Decretos-lei.","202.1",NA
"Agora, insufla campanha de terror econômico, transformando o ""caos"" por ele próprio provocado em responsabilidade das oposições.","305.1",NA
"Busca com isso, e com uma campanha milionária de TV, impedir o voto nos candidatos populares.","201.1",NA
"Os servidores públicos foram humilhados e submetidos a um arrocho salarial de mais de três anos.","701",NA
"As privatizações torraram o patrimônio do povo brasileiro e para efetivá-las o governo não hesita em usar recursos públicos,","413",NA
"que deveriam ser destinados para o aumento da produção e a geração de empregos.","410",NA
"A política econômica do governo FHC está baseada na valorização artificial da moeda, na abertura irresponsável da economia, na manutenção de altos juros e nas privatizações.","409",NA
"A estabilização obtida assentou-se sobre pés-de-barro.","409",NA
"A NAÇÃO VIVE CRESCENTE DEPENDÊNCIA EXTERNA, INSTABILIDADE E CRISE","H",NA
"Comprometeu a estabilidade social do país.","305.1",NA
"Ficamos cada vez mais dependentes e ameaçados pelos especuladores internacionais.","109",NA
"Vivemos sobressaltados com os movimentos das bolsas de valores pelo mundo afora e com a instabilidade financeira.","103.2",NA
"O governo federal desestruturou e desnacionalizou nossa indústria e nossa agricultura, provocando desemprego e exclusão social.","413",NA
"As elites rejeitam um projeto nacional de desenvolvimento e se recusam a adotar políticas agrícola, industrial e de ciência e tecnologia.","404",NA
"Com isso, o Estado perde instrumentos estratégicos de defesa dos interesses nacionais.","404",NA
"O governo das forças populares reverterá essa situação, levando em conta a evolução do quadro internacional e a herança do governo FHC.","404",NA
"A estabilidade da moeda -por todos desejada -pode ser conseguida sem desemprego e insegurança social.","701",NA
"Graves distorções ameaçam o país:","409",NA
"a dívida externa atingirá em 1998 US$ 220 bilhões;","409",NA
"a dívida interna mobiliária ultrapassará os US$300 bilhões, o que equivale a quase metade da riqueza criada pelo país neste ano;","409",NA
"o Governo gastou R$ 46 bilhões apenas com o pagamento de juros da dívida, em 1997.","409",NA
"O investimento e os gastos sociais são sacrificados em benefício dos especuladores;","504",NA
"o crescimento da economia tem sido medíocre e este ano ficará abaixo dos 2%;","410",NA
"a balança comercial, que apresentava em 1994 um superávit de US$10,4 bilhões, teve em 1997 um déficit de US$ 8,4 bilhões, o que explica em parte o saldo negativo.de US$ 33,4 bilhões de nossas contas externas no mesmo ano;","410",NA
"falências ou concordatas fecharam milhares de empresas, especialmente micro, pequenas e médias;","403",NA
"liquidaram-se culturas tradicionais como as do cacau e do algodão.","703.1",NA
"Caiu o cultivo de feijão, arroz e trigo, produtos da cesta básica.","703.1",NA
"O país importa até arroz, feijão e...côco.","703.1",NA
"Como conseqüência dessa política cresceu o desemprego e aumentou a precariedade das relações de trabalho.","701",NA
"Na região metropolitana de São Paulo o desemprego alcança 19% da força de trabalho.","701",NA
"Pára cada trabalhador com carteira assinada há mais de um sem carteira e sem proteção social.","701",NA
"Essa política foi e é aplicada por tecnocratas arrogantes e autoritários, muitos deles sobreviventes do regime militar ou da aventura collorida.","305.5",NA
"O novo governo construirá o novo Brasil.","305.1",NA
"PROMOVER O DESENVOLVIMENTO COM ESTABILIDADE E DISTRIBUIÇÃO DE RENDA","409",NA
"O Brasil pode e deve ter um caminho próprio.","109",NA
"Novas prioridades substituirão as atuais.","408",NA
"A dimensão humana e social e","409",NA
"a defesa do meio ambiente são inseparáveis de um verdadeiro desenvolvimento.","416.2",NA
"Um novo projeto de desenvolvimento:","410",NA
"fortalecerá a autonomia nacional,","406",NA
"tendo por objetivo a defesa da produção e","406",NA
"do emprego;","701",NA
"fará da educação dos brasileiros prioridade nacional;","506",NA
"assegurará aos cidadãos uma saúde digna;","504",NA
"defenderá e renovará a produção industrial e agrícola;","406",NA
"apoiará a criação e o desenvolvimento de micros e pequenas empresas;","402",NA
"ampliará a competitividade e","403",NA
"incrementará a pesquisa científica e tecnológica;","411",NA
"estimulará as exportações, sobretudo de produtos industrializados,","402",NA
"e restringirá as importações predatórias;","406",NA
"redefinirá o sistema financeiro, garantindo crédito com juros acessíveis;","402",NA
"dirigirá a política de crédito das agências públicas de financiamento – notadamente BNDES, BNB, BB e CEF - para c fortalecimento da economia e o desenvolvimento social;","402",NA
"promoverá formação de Bancos do Povo.","503",NA
"desenvolverá programas de habitação popular, saneamento e","504",NA
"transporte urbano;","411",NA
"reformará os sistemas tributário e previdenciário;","406",NA
"favorecerá negociações transparentes com trabalhadores e;","405",NA
"aumentará a participação dos salários na renda nacional por meio da elevação dos salários mais baixos.","701",NA
"O novo governo conduzirá com mão segura a transição pari uma nova organização da economia,","305.1",NA
"na qual a estabilidade & moeda será realizada com crescimento e","410",NA
"distribuição de renda.","503",NA
"ENFRENTAR COM URGÊNCIA A CRISE SOCIAL","H",NA
"O novo governo enfrentará com urgência a crise social, sinalizando claramente para o país e o mundo quais serão as novas prioridades:","305.1",NA
"-concentrará os recursos necessários para o enfrentamento imediato de quatro problemas emergenciais:","305.1",NA
"combate ao desemprego;","701",NA
"recuperação dos salários mais baixos;","701",NA
"adoção de programas de renda mínima;","504",NA
"enfrentamento do grave problema da fome e","504",NA
"combate à violência urbana..","605.1",NA
"começará efetiva reforma agrária;","703.1",NA
"adotará medidas urgentes de política agrícola que permitam no curto prazo um","703.1",NA
"crescimento da oferta de alimentos essenciais para a cesta básica.","703.1",NA
"MUDAR O DIA-A-DIA DOS BRASILEIROS","H",NA
"As mudanças que queremos e faremos vão melhorar o dia-a-dia dos homens e mulheres deste país.","703.1",NA
"Para milhões de brasileiros os grandes temas macroeconômicos são abstrações que escondem justificativas de políticos e tecnocratas para manter a desigualdade e a opressão.","503",NA
"O cotidiano dos brasileiros é marcado pelo desemprego e os baixos salários,","701",NA
"a falta de escolas,","506",NA
"as filas dos hospitais,","504",NA
"as habitações precárias,","504",NA
"o transporte demorado, caro, sem segurança e conforto.","504",NA
"O dia-a-dia de cada um começará a mudar já no início do novo governo.","305.1",NA
"O novo governo se empenhará na humanização das condições de vida nas grandes e médias cidades, cenários do drama cotidiano dos brasileiros.","305.1",NA
"O novo governo articulará o combate à violência e ao crime organizado.","605.1",NA
"Serão combatidas a corrupção e.","304",NA
"a impunidade, que agridem material e moralmente milhões de brasileiros e que acabam por minar sua confiança na democracia","605.1",NA
"Os cidadãos têm direito de viverem uma sociedade decente, na qual impere a ética, como um valor republicano, e","304",NA
"onde ninguém possa colocar-se acima da lei.","605.1",NA
"O dia-a-dia da vida do povo brasileiro será substancialmente alterado.","305.1",NA
"As pessoas encontrarão instrumentos para libertar-se do sentimento de impotência e fatalismo e para romper com todas as formas de opressão.","503",NA
"O novo governo procura vestir a todos com o manto da cidadania para promover respeito à dignidade do ser humano, em especial no local de trabalho.","503",NA
"Nossa meta é acabar com o apartheid social que mantêm fora da produção, do consumo e da cidadania milhões de brasileiros.","503",NA
"O novo governo fortalecerá a participação dos cidadãos o controle do Estado pela sociedade.","202.1",NA
"Queremos um Brasil para as imensas maiorias.","503",NA
"Um Brasil para os brasileiros.","109",NA
"Os grandes compromissos programáticos","H",NA
"1. Mais e melhores empregos","H",NA
"Para absorver 1,5 milhão de brasileiros que ingressam anualmente no mercado de trabalho é necessário crescer um mínimo de 6% ao ano.","410",NA
"Crescer só não basta, por isso o novo governo: proporá redução da jornada de trabalho para 40 horas e","701",NA
"promoverá negociações coletivas para diminuí-la ainda mais;","405",NA
"desestimulará o uso de horas-extras;","701",NA
"assentará 1 milhão de famílias, criando 3 milhões de empregos;","703.1",NA
"criará programas emergenciais para jovens (""primeiro emprego"") em serviços à comunidade;","706",NA
"dará crédito público e apoio técnico para a criação de Bancos do Povo e para cooperativas, micros, pequenas e médias empresas;","402",NA
"criará, emergencialmente, frentes de trabalho para incorporar mão-de-obra sem qualificação;","701",NA
"articulará políticas de apoio aos desempregados (reformulando o seguro desemprego), intermediação de mão-de-obra, formação e treinamento.","701",NA
"proibirá efetivamente o trabalho infantil.","605.1",NA
"2. Melhor distribuição de renda","H",NA
"recuperará substancialmente o poder aquisitivo do salário mínimo com o compromisso de, pelo menos, dobrar seu valor real;","701",NA
"criará 4 milhões de Bolsas-Escola, assegurando às famílias de baixa renda enviar ou manter seus filhos na escola;","506",NA
"implantará progressivamente o Programa de Renda Mínima para os brasileiros de baixa-renda não contemplados em outros programas;","503",NA
"fará reforma tributária: quem ganha mais pagará mais impostos.","503",NA
"Tributação das grandes fortunas, grandes heranças e da grande propriedade rural improdutiva.","503",NA
"3. Nenhuma criança fora da escola","H",NA
"nenhuma criança fora da escola;","506",NA
"implantação progressiva da escola de tempo integral;","506",NA
"bolsa-escola para filhos de famílias pobres;","506",NA
"mutirão, com participação da sociedade, para acabar com o analfabetismo adulto;","506",NA
"ampliação de cursos noturnos nas universidades públicas;","506",NA
"programas especiais para ampliar o ingresso de estudantes carentes nas universidades públicas;","506",NA
"garantirá o crédito-educativo para estudantes carentes;","506",NA
"assegurará a efetiva autonomia universitária, com recursos para a pesquisa e docência e mecanismos sociais de avaliação;","506",NA
"expansão e fortalecimento da rede de ensino profissionalizante.","411",NA
"4. Saúde","H",NA
"assegurar a destinação contínua de recursos à saúde para atingir R$ 250,00 anuais por habitante, conforme recomenda a Organização Mundial da Saúde;","504",NA
"implantar efetivamente o SUS (Sistema Único de Saúde) com descentralização, eficiência, qualidade,","303",NA
"sem fraudes e","304",NA
"com valorização dos servidores;","701",NA
"adoção do médico de família, em parceria com estados e municípios, para colocar a saúde perto de casa;","504",NA
"combater as endemias;","504",NA
"promover ações atendimento integral à mulher e aos trabalhadores.","504",NA
"5. Programa de combate à fome","H",NA
"Para assegurar aos brasileiros o pleno acesso aos alimentos básicos, o novo governo:","503",NA
"manterá estoques reguladores de alimentos básicos, de cerca de 15% da demanda corrente, especialmente de feijão e arroz;","703.1",NA
"comprará esses produtos preferencialmente de produtores familiares;","703.1",NA
"garantirá preços para os produtos da cesta básica ;","703.1",NA
"implantará um Programa Emergencial de Combate à Fome,","504",NA
"para responder à situação calamitosa da produção agrícola e","703.1",NA
"da fome que atinge milhões de brasileiros.","504",NA
"6. Reforma agrária e política agrícola","H",NA
"assentamento de 1 milhão de famílias.","703.1",NA
"A reforma agrária e a política agrícola serão regionalizadas;","703.1",NA
"estímulo à elevação da produção e da produtividade de 4 milhões de propriedades familiares, com crédito favorecido, garantia de preços, seguro e apoio tecnológico;","703.1",NA
"programas de irrigação especialmente voltados para as pequenas e médias propriedades;","703.1",NA
"estímulo à criação de cooperativas e de 100 mil pequenas e médias agro-indústrias;","703.1",NA
"combate às importações predatórias de produtos agrícolas;","703.1",NA
"combate à violência no campo e fim da impunidade;","605.1",NA
"demarcação imediata das terras indígenas e solução negociada dos conflitos pendentes.","607.3",NA
"7. Habitação, urbanização, saneamento e transporte","H",NA
"O novo governo formulará um Plano Nacional de Política Urbana (PLANUR), com base em propostas desenvolvidas por centrais sindicais, universidades, movimentos sociais, empresários e executivos municipais e estaduais.","202.1",NA
"O PLANUR dará prioridades para uma reforma financeira e fundiária de modo a viabilizar a produção de moradia para a população de baixa renda;","504",NA
"O PLANUR fixará como meta na área de saneamento a universalização do serviço de água para a população;","504",NA
"a política urbana será integrada às políticas ambiental, de saúde, econômica (geração de renda), social, educacional (bolsa - escola), visando a inclusão social, principalmente, nas regiões de concentração de miséria e violência.","503",NA
"cesta-básica de materiais de construção para famílias de baixa renda;","504",NA
"participação do governo federal, através de suas agências de financiamento, na melhoria do transporte coletivo de massas.","402",NA
"8. Direito ao direito","H",NA
"proteção ativa aos direitos humanos para os que estão excluídos - em função da fome e do desemprego - da cidadania e","201.2",NA
"para outros segmentos duramente atingidos por sua violação: negros, mulheres, jovens,","706",NA
"índios.","705",NA
"reforma e democratização do Judiciário: justiça ágil, acessível aos pobres e excluídos, capaz de punir os crimes de colarinho-branco;","503",NA
"apoio à criação de tribunais de pequenas causas,","503",NA
"da justiça agrária itinerante e","703.1",NA
"à reformulação da Justiça do Trabalho, como instrumento de proteção dos trabalhadores;","701",NA
"gestão social das empresas públicas, com a participação de trabalhadores, usuários e organismos da sociedade civil;","202.1",NA
"combate à corrupção,","304",NA
"ao crime organizado e à violência;","605.1",NA
"os meios de comunicação devem ser instrumentos de educação,","506",NA
"da cultura,","502",NA
"valorização do ser humano e da vida civil solidária.","201.2",NA
"Estabelecer conselhos sociais de acompanhamento.","201.2",NA
"9. Reforma agrária, descentralização e controle social do Estado","H",NA
"reforma política visando a restauração da democracia representativa, a proteção do voto e da soberania popular, combatendo a intervenção das máquinas administrativas públicas, do poder econômico e dos monopólios da informação no processo eleitoral e na vida parlamentar;","202.1",NA
"a reforma política e tributária fará do município sede da cidadania, assegurando um desenvolvimento econômico e social equilibrado.","301",NA
"A recuperação da federação promoverá a distribuição do poder e participação popular;","301",NA
"adotar o orçamento participativo em nível federal e apoio a essa iniciativa nos níveis estadual e municipal, o que permitirá ampliar o controle social do Estado;","202.1",NA
"a criação de um organismo central para o Desenvolvimento Municipal, que terá a função de planejar e promover as unidades administrativas, realizar políticas de desenvolvimento, racionalizar os recursos e dar apoio aos municípios, integrando as agências que hoje atuam desordenadamente.","301",NA
"10. Cultura","H",NA
"a cultura será um direito da cidadania;","502",NA
"a política cultural do novo governo respeitará a diversidade e o pluralismo, estará aberta às manifestações culturais do mundo,","607.1",NA
"valorizará e protegerá a cultura","502",NA
"nacional e o patrimônio histórico e ambiental.","502",NA
"Apoiará fortemente a produção e socialização dos bens culturais nacionais;","502",NA
"orçamento do Ministério da Cultura dobrará; a produção cultural brasileira não pode ficar na dependência dos critérios das empresas beneficiadas por renúncia fiscal;","502",NA
"Itamaraty será instrumento de difusão da cultura brasileira no exterior e de intercâmbio cultural;","502",NA
"a sociedade e os produtores culturais contribuirão para a formulação da política cultural do novo governo.","202.1",NA
"11. Meio ambiente","H",NA
"a preservação do meio ambiente e a busca do desenvolvimento sustentado serão princípios do novo governo e estarão presentes no planejamento e na execução de todas suas iniciativas, especialmente nas políticas de infra-estrutura, industrial, agrícola, de ciência e tecnologia;","416.2",NA
"trabalho permanente de conservação de espécies e ecossistemas;","501",NA
"política florestal de conservação, reposição e uso múltiplo;","501",NA
"fortalecimento das funções reguladoras, da fiscalização, do controle e da aplicação da legislação ambiental;","501",NA
"programa nacional de educação ambiental.","501",NA
"12. Presença soberana no mundo","H",NA
"A política externa, fundada nos princípios da autodeterminação, expressará nosso desejo de convivência pacífica com todos os povos.","106",NA
"Mas o Brasil atuará com decisão visando alterar as relações desiguais e injustas que se estabeleceram internacionalmente'","107",NA
"Lutaremos por mudanças profundas nos organismos políticos e econômicos mundiais, sobretudo a ONU, o FMI e a OMC, combatendo o Acordo Multilateral de Investimentos, atentatório à soberania nacional.","103.2",NA
"Fortaleceremos nossas relações com os países do Sul, em especial com os da América Latina, da África meridional e aos de expressão portuguesa.","107",NA
"Defenderemos uma ampliação e reforma do Mercosul que reforce sua capacidade de implementar políticas ativas comuns de desenvolvimento e de solução dos graves problemas sociais da região.","108",NA
"O Legislativo e a sociedade devem exercer maior controle sobre a política externa e os processos de integração regional.","202.1",NA
