"content","cmp_code","eu_code"
"Esta envolve diversos e relevantes setores industriais, como petróleo e indústria automobilística. .","411",NA
"Nesses e em outros casos se avolumam reclamações de ambos os lados: os possíveis beneficiários se queixam porque os requisitos de produção local não seriam realmente respeitados, enquanto os agentes aos quais cabe seguir os limites de produção nacional alegam a impossibilidade de atendimento das exigências. .","407",NA
"Nunca é demais enfatizar que as políticas de proteção e de conteúdo local só são efetivas enquanto constituírem  casos  especiais,  e  não  a  regra da  política  industrial. .","407",NA
"A maior concorrência é que transformará nossas empresas em corporações inovadoras, mais do que já são. .","401",NA
"Outra  norma  geral  a  ser  adotada  em uma  reedição  da  política  industrial  consiste  fixar  sistemática  de transparência de informações e avaliação de políticas nos casos em que incentivos e mecanismos de proteção estão presentes. Tais políticas devem:","411",NA
"1) estabelecer prazos para seu início e término;","411",NA
"2) ter os custos estimados e devidamente aprovados nos orçamentos públicos;","411",NA
"3) ser objeto de periódicas avaliações de resultados.","411",NA
"Essas recomendações dizem respeito aos incentivos diretos e indiretos, incluindo benefícios implícitos no financiamento público.","411",NA
"A rigor, todos os programas com incentivos públicos, e não apenas os atinentes à política industrial, devem seguir a mesma diretriz, conforme mostramos nas seções anteriores.","401",NA
"Fortalecer o comércio e melhorar os serviços:","H",NA
"a necessidade de pôr ﬁm à dupla tributação e o imperativo de estender aos dois setores os benefícios das políticas de crédito.","402",NA
"Os setores de comércio e serviços respondem pela maior parte do PIB brasileiro.","402",NA
"De acordo com dados do IBGE, somaram no ano passado 69,3% das nossas riquezas.","402",NA
"Quando se excluem os serviços da administração pública, os dois setores juntos ainda respondem por 51,6% do PIB − os serviços representando 38,9%, e o comércio 12,7%.","402",NA
"Quando se observa o emprego que geram, o papel desses setores é ainda maior.","402",NA
"Os dados de PIB em 2012, os dois juntos respondiam por 73,3% do emprego formal, incluindo a administração pública.","402",NA
"Eram 53,51% quando ela era excluída.","402",NA
"Comércios e serviços tendem a crescer quando o país se desenvolve.","402",NA
"Muitos indicadores internacionais mostram essa relação.","402",NA
"O quadro abaixo traz dados para PIB per capita e para participação dos serviços, incluindo comércio, de uma amostra de 137 países para os quais havia dados do Banco Mundial disponíveis nessas per capita são corrigidos pela paridade do poder de compra.","402",NA
"Eles indicam claramente que há uma correlação positiva entre essas duas variáveis.","402",NA
"Quando o PIB per capita aumenta, o mesmo acontece com a participação dos serviços no PIB.","402",NA
"Há duas explicações para essa relação.","410",NA
"A principal é que, quando o PIB per capita aumenta, as pessoas tendem a elevar sua demanda por turismo, lazer e mesmo telecomunicações e serviços bancários.","410",NA
"Outra possível explicação é que a terceirização de atividades leva a maior especialização produtiva, a maior divisão do trabalho e, consequentemente, a maior produtividade das empresas.","401",NA
"Com isso, o próprio crescimento do setor de serviços seria um motor do crescimento do PIB per capita.","410",NA
"Ambas as explicações salientam o papel do comércio e serviços para o bemestar da população.","410",NA
"Mesmo assim, o setor encontra uma série de entraves ao seu desenvolvimento.","401",NA
"Há no Brasil um viés contra a terceirização, e isso se traduz bem no nos-so sistema tributário, que impõe impostos como ISS e ICMS − em cascata ou cumulativos − em transações que envolvem duas ou mais empresas.","401",NA
"A consequência: algumas atividades que poderiam ser terceirizadas por empresas acabam realizadas internamente, em prejuízo da produtividade, porque essa forma de tributação eleva os custos e tira a vantagem da operação.","401",NA
"As parcerias envolvendo empresas de serviços em diferentes localidades esbarram na falta de regras claras e práticas para pagamento do ISS, que fica submetido às diferentes legislações municipais.","402",NA
"Não  há uma  definição  precisa  sobre  quem  tem direito  de  receber  o tributo,  e,  em  alguns casos,  a  empresa prestadora  do  serviço é  instada  a  recolhê-lo em  dois  municípios.","402",NA
"Comércio e serviços respondem pela maior parte do PIB brasileiro.","402",NA
"Segundo o IBGE, somaram 69,3% de nossas riquezas no ano de 2013.","402",NA
"Em caso de disputa judicial, também não há definições, pois a jurisprudência tem oscilado.","403",NA
"Ano após ano se assiste a uma leva de processos chegando aos tribunais, o que amplia ainda mais sua disfuncionalidade.","403",NA
"O mesmo quadro se repete no comércio, que sofre com problemas sérios quando realiza transações que envolvem mais de um estado.","403",NA
"Os procedimentos de controle de recolhimento tributário, particularmente do ICMS, são diferentes.","402",NA
"Consequentemente, é necessário pessoal mais qualificado para evitar erros, e o tempo despendido com as operações reduz a produtividade da mão de obra.","402",NA
"Assim, as atividades adicionam mais custos aos bens comercializados, e prejudica-se o conjunto da sociedade.","402",NA
"Outra restrição ao desenvolvimento do comércio e dos serviços no Brasil advém do fato de que várias políticas governamentais os excluem ou colocam-nos em segundo plano no acesso aos benefícios que promovem.","402",NA
"Empréstimos do BNDES, do Banco do Nordeste do Brasil e do Banco da Amazônia têm maiores limitações quando são direcionados a empresas de comércio e serviços, o que atrasa o desenvolvimento tecnológico desses setores e, como consequência, baixa sua produtividade.","402",NA
"MAIOR EFICIÊNCIA, PRODUTIVIDADE E COMPETITIVIDADE","H",NA
"• Assegurar que demandas legítimas do setor de serviços e comércio sejam contempladas na reforma tributária, como o fim da diversidade de regras entre estados e municípios, da bitributação e dos impostos cumulativos.","402",NA
"• Incluir os setores de comércio e serviços em programas de promoção de desenvolvimento, como nas linhas especiais de crédito do BNDES, do Banco do Nordeste e do Banco da Amazônia.","402",NA
"• Integrar estados, municípios e governo federal na gestão da fiscalização dos recolhimentos tributários de forma que se elimine a possibilidade de cobrança de um mesmo tributo duas vezes para dois entes federativos diferentes a partir de um único fato gerador.","402",NA
"• Disciplinar a terceirização de atividades com regras que a viabilizem, assegurando o equilíbrio entre os objetivos de ganhos de eficiência e os de respeito às regras de proteção ao trabalho.","402",NA
"• Unificar nacionalmente procedimentos de controle e fiscalização tributários para reduzir entraves à comercialização interestadual de produtos.","402",NA
"Existe hoje no Brasil um número elevado de disputas jurídicas sobre a terceirização de serviços com o argumento de que as atividades terceirizadas são atividades fins das empresas.","401",NA
"Isso gera perda de eficiência do setor, reduzindo os ganhos de produtividade e privilegiando segmentos profissionais mais especializados e de maior renda.","401",NA
"O setor de serviços é mais penalizado por esse tipo de problema, ficando mais exposto à consequente alocação ineficiente de recursos com perda de produtividade.","402",NA
"O comércio, particularmente, sofre de um problema operacional sério no país, quando realiza transações que envolvem mais de um estado.","402",NA
"Os procedimentos de controle de recolhimento tributário, particularmente do ICMS, são diferentes.","402",NA
"Consequentemente, é necessária mão de obra mais qualificada para evitar erros de procedimentos.","402",NA
"Além disso, o tempo gasto eles é elevado, o que reduz a produtividade.","402",NA
"Assim, as atividades de comércio ficam menores e adicionam mais custos aos bens comercializados, o que prejudica o bem-estar da população brasileira.","402",NA
"Diante desses problemas, ao lado de propostas mais gerais que vão melhorar o ambiente de negócios no Brasil, a coligação Unidos pelo Brasil se dispõe a adotar algumas medidas específicas para esses setores.","402",NA
"Cadeia produtiva do turismo:","H",NA
"o potencial de geração de emprego e renda do  patrimônio cultural e natural do país;","502",NA
"a qualiﬁcação da mão de obra local como condição para o desenvolvimento sustentável da atividade.","402",NA
"O  turismo  desempenha  hoje  um  importante  papel  na  geração  de  empregos:  de acordo  com  o  relatório  de  2013 do  Fórum Econômico  Mundial,  1  em  cada  11  empregos  no  mundo  era  no  setor de viagens  e  turismo.","402",NA
"O  mesmo  relatório  mostrou  ainda que  o  Brasil  não  tira  muito proveito  dessa potencialidade. // .","305.1",NA
"Chegou  ao  51º  lugar  no Ranking  de  Competitividade em Viagem  e  Turismo,  que  avaliou  140  países,  posição  muito  abaixo  da  que  ocupava  em  2009.","402",NA
"Apesar  das  vantagens  comparativas em  recursos  humanos,  culturais  e  naturais −  figuramos  em  primeiro  lugar  no  quesito de  quantidade  de  espécies  conhecidas,  por exemplo  −,  nosso  país  ficou  entre  os  20  piores  em  indicadores  que  envolvem  a  extensão  e  o  efeito  da  taxação  sobre  a  qualidade da  infraestrutura  portuária,  do  transporte aéreo  e  do  rodoviário.","402",NA
"Também  contribuem para  a  má  avaliação  do  país  as  políticas  e regulamentações,  a  pouca  prioridade  dada ao  turismo  pelo  governo  e  o  baixo  grau  de transparência  nos  processos  de  elaboração das  políticas  públicas  para  o  setor.","305.1",NA
"Por causa de todo o seu potencial gerador de emprego e renda, a cadeia produtiva do turismo demanda redirecionamento estratégico, de forma que se possa articulá-la com os programas e projetos das áreas de educação e cultura, visando a explorar com eficácia as potencialidades econômicas de nossa história, de nossas manifestações culturais, de nossa geografia e da hospitalidade do nosso povo.","502",NA
"É preciso resolver com urgência os gargalos de infraestrutura para o turismo, embora o desenvolvimento contínuo dessa cadeia não se restrinja à atração de grandes investimentos.","502",NA
"Complementa-o o foco no desenvolvimento sustentável, estimulando a reorganização dos processos econômicos","416.2",NA
"e preparando e qualificando a mão de obra para fazer dos agentes locais os atores privilegiados e responsáveis pelo desenvolvimento local, territorial e regional da atividade turística.","411",NA
"A  responsabilidade  social  do  setor  também  abrange  o  cuidado  com  algumas  práticas  negativas.","605.1",NA
"Com  o  fomento  ao  turismo no  Brasil,  será  cada  vez  mais  importante fortalecer  a  política  de  combate  ao  turismo sexual,  especialmente  a  exploração  de  crianças  e  adolescentes.","605.1",NA
"A realização das Olimpíadas 2016 no Brasil também vai requerer grandes esforços de organização e investimentos.","502",NA
"O povo brasileiro demanda transparência nos gastos públicos, assim como exige debate aberto sobre os legados econômico, cultural e social desse e de outros grandes eventos.","304",NA
"MEDIDAS PARA DESENVOLVER O TURISMO","H",NA
"• Valorizar a especificidade de cada localidade e região, promovendo a diversidade cultural, ambiental e social como eixo norteador das políticas de desenvolvimento do turismo no Brasil.","301",NA
"• Estimular a capacitação permanente de mão de obra para a atividade turística.","411",NA
"• Incrementar a articulação entre a cadeia do turismo e outras cadeias produtivas, visando a gerar novos negócios e rotas turísticas locais.","402",NA
"• Fomentar programas de divulgação interna e externa de destinos turísticos.","402",NA
"• Criar parcerias com as municipalidades para conservação e melhorias de equipamentos turísticos.","402",NA
"• Ampliar investimentos em projetos de infraestrutura que tenham impacto positivo para o turismo.","402",NA
"• Estimular o ecoturismo como alternativa de desenvolvimento sustentável.","416.2",NA
"• Ampliar a transparência na prestação de contas dos gastos públicos com grandes eventos.","304",NA
"• Investir na geração de infraestrutura física e de recursos humanos que apoiem as atividades de visitação nos parques nacionais brasileiros.","411",NA
"Não se pode falar em turismo sem considerar ainda o grande potencial de exploração do ecoturismo nos 69 parques nacionais do Brasil. .","416.2",NA
"Embora o país seja um dos líderes em unidades de conservação do mundo, é o  que  menos  arrecada  com  atividades  de visitação  e  turismo  (US$  7,6  milhões). .","305.1",NA
"O baixíssimo  desempenho  brasileiro  é  claramente  verificado  quando  nos  comparamos com  países  como  os  Estados  Unidos,  que arrecadaram  em  2006  US$  200  milhões;  o Canadá,  com  US$  90  milhões;  ou  a  África do  Sul,  com  US$  79,7  milhões. .","305.1",NA
"O país precisa reverter essa situação e viabilizar com urgência um programa de visitação em unidades de conservação,","411",NA
"estimulando a formação de cadeias de serviços de hospedagem, alimentação e locomoção para o atendimento ao turista, bem como a formação de guias-parque locais, gerando emprego e renda de alto significado regional. // .","402",NA
"Para tanto, propomos o desenvolvimento de um plano de investimentos para a geração de infraestrutura física e de recursos humanos que apoiem as atividades de visitação, com o objetivo de fomentar sua implementação no maior número de parques possível. .","411",NA
"O plano deverá especificar as unidades prioritárias a partir de sua viabilidade econômica, priorizando, inicialmente, as que já atraem grande número de visitantes e considerando estratégias de atração de investimentos como o modelo de parceria público-privada (PPP). .","401",NA
"É preciso também implementar esses modelos de gestão nos parques da Amazônia, transformando o turismo sustentável em importante fonte de renda para a região. .","416.2",NA
"GESTÃO SUSTENTÁVEL DOS RECURSOS NATURAIS","H",NA
"Um dos grandes desaﬁos para o Brasil é encontrar as bases para o desenvolvimento sustentável, o que implica rever a noção de progresso, agregando-lhe um sentido mais humano, justo, solidário e respeitoso − tanto para as pessoas quanto para o planeta.","416.2",NA
"A transição para esse novo modelo deve ser planejada, e o governo precisa lançar mão de políticas públicas adequadas a esse objetivo.","416.2",NA
"A sustentabilidade também deve ser um dos vetores do desenvolvimento brasileiro.","416.2",NA
"O Brasil tem amplas condições de ser um dos países líderes no tema, mas nossa política industrial, exceto de forma marginal, o ignora.","416.2",NA
"Tanto a política industrial quanto a política econômica de modo mais geral precisam sinalizar a prioridade para a economia sustentável em termos de tributação e incentivos a economia verde, PD, energias alternativas, políticas de mobilidade urbana, eficiência energética e uso da água.","416.2",NA
"Agropecuária:","H",NA
"a competência dos nossos produtores; os ganhos de produtividade; os mecanismos de ﬁnanciamento; a multiplicação da competitividade se o Brasil avançar nas questões socioambientais.","703.1",NA
"Além de ser fundamental para o desenvolvimento do país, a agricultura brasileira é uma das mais eficientes do mundo.","703.1",NA
"Somos grandes exportadores líquidos de produtos agropecuários.","703.1",NA
"Segundo a Confederação Nacional da Agricultura (CNA), em 2013, nossa balança comercial agrícola teve superávit de US$ 82,9 bilhões, enquanto o agregado de todos os setores ficou em apenas US$ 2,6 bilhões.","703.1",NA
"Ou seja, o setor agropecuário é que sustenta o equilíbrio externo brasileiro.","703.1",NA
"Somos os maiores produtores de proteína animal do mundo e líderes ou vice-líderes em diversos setores como soja, café, cana-de-açúcar e celulose de fibra curta.","703.1",NA
"A pujança de nossa agropecuária tem sido construída sobre a competência de nossos produtores rurais, pois, entre as grandes economias do mundo, temos um dos mais baixos níveis de apoio ao setor em termos de politicas públicas.","703.1",NA
"Segundo dados da Organização para a Cooperação e Desenvolvimento Económico (OCDE), o suporte ao campo no Brasil gerou um Subsídio Equivalente ao Produtor (PSE, do inglês Producer Subsidy Equivalent) de apenas 4,61% do valor da produção em 2012, último ano com dado disponível, ficando acima apenas do verificado em poucos países para os quais há dados calculados pela entidade.","703.1",NA
"Cinco  eixos  constituem  o  apoio  ao  setor agropecuário  no  Brasil:","703.1",NA
"1)  oferta  de  crédito  para  custeio  ou  investimentos  a  taxas  de  juros  abaixo  das disponíveis  no  mercado  brasileiro,  mesmo  que  muitas  vezes  superiores  às  que  se encontram  em  outros  países;","703.1",NA
"2)  políticas  de  aquisição  de  alimentos  e de  preços  mínimos  (importante  no  mercado  interno,  mas  de  pouco  impacto  nos setores  exportadores);","703.1",NA
"3)  seguro  agrícola,  principalmente  por meio  do  Programa  de  Garantia  da  Atividade  Agropecuária  (Proagro),  do  Proagro  Mais  e  do  Programa  de  Subvenção ao  Seguro  Rural  (PSR);","703.1",NA
"4)  pesquisas,  extensão  rural  e  geração de  informações  relevantes  para  o  setor, como  zoneamento  agrícola;","703.1",NA
"5)  formação   de  estoques  reguladores.","703.1",NA
"Todos  essas  iniciativas  deverão  passar por  aprimoramentos  no  futuro  governo.","703.1",NA
"Além do baixo apoio ao campo no Brasil, conforme mostram os dados do PSE mencionados acima, o setor está sujeito a um custo Brasil elevado, que onera nossa agropecuária.","703.1",NA
"Seu desempenho é afetado ainda por um leque amplo de políticas públicas, desde as macroeconômicas – taxa de câmbio, taxa de juros e demanda interna, por exemplo – até as microeconômicas, como as que definem os investimentos e a manutenção dos equipamentos nacionais de logística e a legislação trabalhista, ou as que são direcionadas especificamente ao setor, caso dos controles sanitários, das políticas de compras de alimentos do setor público e dos investimentos em PD voltados à agricultura.","703.1",NA
"As seções anteriores já trataram da agenda macroeconômica relevante para o setor, como a ênfase no controle da inflação e no crescimento econômico por meio de políticas que possam assegurar taxas de juros de longo prazo baixas e demanda de crescimento estável.","414",NA
"Também foram apresentadas políticas que assegurem uma taxa de câmbio compatível com o equilíbrio de longo prazo das transações correntes de nossa balança comercial, o que garante a competividade para o agronegócio.","401",NA
"Ou seja, a agenda macroeconômica proposta contribuirá para a continuidade e até mesmo para a expansão do ritmo de crescimento do setor.","410",NA
"Vamos manter as políticas atuais de juros especiais em níveis abaixo dos de mercado para o setor agropecuário brasileiro comprometido com a sustentabilidade.","416.2",NA
"Há uma agenda microeconômica genérica que também assegurará maior eficiência e competitividade ao setor agropecuário e que foi debatida no Eixo 1 − Estado e Democracia de Alta Intensidade, no qual abordamos as reformas institucionais.","414",NA
"A redução das amarras atuais para expansão e manutenção das estradas por meio de concessões é exemplo de contribuições para a melhoria do ambiente de negócios para o setor.","414",NA
"Devemos destacar ainda a importância de melhorar serviços nos portos, também a partir das concessões, e determinar metas, com definição de prazos e indicadores de desempenho, para os diversos órgãos que se encarregam da fiscalização dos despachos de mercadorias.","411",NA
"Isso reduzirá tremendamente o custo Brasil.","411",NA
"Por fim, é necessário estabelecer uma politica de estoques reguladores que ajude a equalizar flutuações grandes de preços e fortalecer o sistema de armazenagem no país.","703.1",NA
"As simplificações de procedimentos no setor público certamente contribuirão para reduzir custos e imprevisibilidades do setor.","303",NA
"As melhorias na legislação trabalhista vão trazer benefícios para contratados e contratantes. Estes vão lidar com custos mais previsíveis.","414",NA
"Aqueles terão todos os direitos preservados, o que vai contribuir para elevar a produtividade.","203",NA
"O impacto de tais mudanças certamente será positivo para um setor que já sofre tanto com o clima e as pragas.","703.1",NA
"Mesmo sendo beneficiada por todas as mudanças mencionadas acima e em seções anteriores, a agropecuária possui uma agenda própria, que será considerada pelo novo governo, reconhecendo-se a importância desse setor para o país.","703.1",NA
"Dialogando com o setor, a Coligação Unidos  pelo Brasil vai endereçar uma agenda que envolve vários aspectos.","703.1",NA
"Em 2013, nossa balança comercial agrícola teve superávit de US$ 82,9bi enquanto o agregado de todos os setores ficou em apenas US$ 2,6bi","703.1",NA
"A agropecuária brasileira teve importantes ganhos de produtividade nas últimas décadas.","703.1",NA
"A produção cresce mais rápido do que a área cultivada/pastoreada,","703.1",NA
"mas há importantes desafios a enfrentar para torná-la adequada do ponto de vista socioambiental.","416.2",NA
"Isso porque, apesar de o desmatamento para conversão de áreas florestais para uso agropecuário na Amazônia ter caído de forma expressiva na última década, a expansão ainda avança sobre áreas de florestas e outras formações de vegetação natural em todos os biomas brasileiros, especialmente no Cerrado.","416.2",NA
"A competitividade internacional da agropecuária brasileira pode ser potencializada se o país avançar nas questões socio-ambientais e na diversificação da produção.","416.2",NA
"A racionalização do uso de insumos, a promoção de técnicas de melhoria são algumas das medidas ambientais que podem ser adotadas.","416.2",NA
"Quanto ao desmatamento, já existem mais e conservação do solo, o controle biológico de 300 milhões de hectares de áreas desmatadas no Brasil – e menos de 250 milhões de hectares em produção (70 milhões em agricultura, 7 milhões em florestas plantadas e cerca de 170 milhões em pecuária). .","416.2",NA
"AGENDA PARA A AGRICULTURA","H",NA
"• Política comercial: como hoje 40% do comércio mundial de alimentos se dá no âmbito de acordos bilaterais, é imperioso que o Brasil firme acordos dessa natureza com países importantes ou grupos de países como a União Europeia, independentemente do Mercosul, reorientação já debatida no Eixo1 − Estado e Democracia de Alta Intensidade, no item Política Externa. .","407",NA
"• Política de renda: trata-se de implementar o seguro rural, e não apenas um seguro contra catástrofes climáticas (que existe hoje). .","703.1",NA
"O setor precisa de mecanismo que cubra também riscos de mercado, como faz o mundo desenvolvido. .","703.1",NA
"O verdadeiro seguro rural deverá ser articulado com uma nova política de crédito rural e uma real política de preços mínimos. .","703.1",NA
"A política atual de seguro agrícola dispõe de recursos insuficientes para atender às necessidades do país. .","703.1",NA
"Como parte de seu custo deriva do Orçamento da União, há sempre restrições advindas dos limites orçamentários do governo federal.","703.1",NA
"Os recursos para os financiamentos deverão continuar a crescer no volume necessário para assegurar que o setor agropecuário continue a expandir-se no país.","703.1",NA
"A taxa de juros também continuará como atualmente: abaixo das outras taxas de mercado.","406",NA
"Isso significa que a política de crédito deverá ser mantida no próximo governo, mas com mais diálogo com o setor.","703.1",NA
"• Política tecnológica: embora tenhamos a melhor tecnologia tropical do planeta, este é um setor dinâmico, que demanda muito mais recursos do que os atualmente disponíveis para nossas instituições de pesquisa.","411",NA
"O Plano de Agricultura de Baixo Carbono (ABC), base para nossa sustentabilidade, também precisa ser muito mais intensamente divulgado e aperfeiçoado.","416.2",NA
"• Logística e infraestrutura: a ineficiência causada pela precariedade de nossa estrutura de logística é um dos ônus impostos ao agronegócio. .","411",NA
"Há poucas estradas no país e, muitas vezes, são de baixa qualidade.","411",NA
"O transporte por trilhos para produtos agropecuários, por sua vez, é quase inexistente.","411",NA
"Os sistemas de armazenagem são claramente insuficientes, e a maioria dos portos não dispõe de estrutura adequada para receber as cargas, além de apresentar alto custo de desembaraço e carregamento das exportações.","411",NA
"Essas ineficiências vão ser endereças por uma política ativa de investimentos em infraestrutura, calcada em prioridades orçamentárias, como adiantamos mais acima, quando falamos sobre infraestrutura.","411",NA
