Text,Code
"Para acompanhar com detalhe o processo legislativo e coordenar de modo eficaz as relações entre os ministérios e o Congresso, será criada uma estrutura que combine quadros com estabilidade profissional é condução política de peso.",303
"Para perseguir condições propícias de governabilidade será estabelecido um conselho político da Presidência da República, composto pelas forças políticas de sustentação do govemo, enquanto espaço de negociação e consulta referente às decisões políticas relevantes.",202
"O presidente promoverá regularmente reuniões com entidades da sociedade civil (centrais sindicais, OAB, ABI, igrejas, entidades patronais) como fóruns de informação e negociação de temas relevantes em matéria econômica, social e política.",606
"Procedimentos de consulta serão agilizados por meio de teleconferências, utilização de métodos informatizados de comunicação e outros mecanismos.",202
"Para além das reuniões ministeriais, será implantado um sistema de planejamento estratégico governamental, de modo a assegurar a articulação de ações envolvendo ministérios e órgãos da administração indireta.",303
"Este sistema será coordenado por uma estrutura fixa e enxuta, planejando ações concretas de maneira a compatibilizar os programas às reais condições de govemo.",303
"O presidente, seus ministros ou delegados diretos, se deslocarão pelo país, examinando de perto os problemas, realizando consultas à sociedade civil e agilizando os mecanismos de decisão sobre questões regionais de competência da União.",202
Política administrativa,999
"Definição clara de instâncias de coordenação das políticas administrativas (materiais, recursos humanos, informática, qualidade dos serviços), combinando orientações que sejam gerais à implementação descentralizada.",301
"Política salarial transparente, comprometida com a recuperação do poder aquisitivo dos salários, soldos e vencimentos, respeitadas as disponibilidades orçamentárias.",202
"Para tanto, é fundamental estabelecer relações de independência, respeito e diálogo com os sindicatos de servidores enquanto interlocutores legítimos, assim como implementar mecanismos de negociação coletiva.",202
As tabelas de vencimentos e gratificações serão revistas para eliminar distorções existentes.,303
Racionalização da estrutura de cargos e generalização dos planos de carreira nos quais o mérito seja o elemento nuclear.,303
"Implementação de programas de capacitação tanto de nível gerencial quanto operacional, de modo generalizado e contínuo, para transformar a cultura administrativa e elevar a produtividade do serviço público.",303
"Sistemas e rotinas serão mudados, alterando-se os processos de traba lho e integrando as inovações tecnológicas a partir de conceitos como qualidade do serviço, responsabilização e participação dos servidores no processo de trabalho.",303
"Manutenção da estabilidade no emprego como instrumento de estruturação e continuidade de uma administração pública sólida, eficiente e permanente a serviço das demandas da sociedade.",303
"Reafirma- se a necessidade de desenvolver políticas de capacitação de recursos humanos, profissionalizando e qualificando o funcionalismo, acompanhada de processos de avaliação e desempenho.",303
"Deve ser mantida a regra geral de somente demitir servidores por processos judiciais ou administrativos, cercados de ampla defesa.",303
Os processos serão mais ágeis e menos onerosos.,303
Reorganização administrativa,999
"Serão definidos princípios e parâmetros duradouros para a estrutura administrativa e seu funcionamento, de maneira a permitir continuidade de estruturas e de normas na administração federal e flexibilidade ao govemo.",303
"É imperioso começar a transformar as próprias formas de organização estatal, em vez de uma infinidade de regulamentos, frequentemente contraditórios, deve-se simplificá-los e consolidá-los, apoiando-se, tecnicamente, no uso da informática e, politicamente, no controle social que os canais de participação criam.",303
"Serão efetuadas modificações essenciais na estrutura administrativa que incluirão adaptações das estruturas às necessidades colocadas pelo Programa de Governo,",303
"eliminação de superposição de atribuições entre diversos órgãos,",303
"redução de níveis hierárquicos, agilizando a relação entre os vários elos da hierarquia e facilitando a introdução de relações horizontais com o espírito de se contrapor à verticalidade da estrutura administrativa herdada.",303
Universalização do princípio do concurso público como única forma de ingresso no serviço público—ressalvados os cargos de livre provimento.,303
"Redução gradativa destes últimos, em sintonia com o processo de democratização e modernização do Estado.",303
Novo pacto federativo,999
"É necessário distribuir recursos e encargos entre os três níveis da federação com base no princípio da descentralização, isto é, partindo-se da idéia de que, quanto mais perto do local de ocorrência, maiores serão as condições de se encontrar as soluções adequadas e maior a possibilidade de controle dos cidadãos sobre as ações públicas.",301
"Nesse sentido, é preciso afirmar os seguintes pontos:",301
"descentralização em direção aos estados e, sobretudo, aos municípios, de encargos, com atribuição dos recursos necessários e flexibilidade na sua aplicação, conferindo à instância responsável pela implementação de políticas públicas capacidade real de decisão;",301
tal descentralização deverá manter a responsabilidade do governo federal sobre a orientação das políticas públicas estratégicas com os objetivos de: garantir a ampliação da cobertura e da qualidade desses serviços;,301
fomentar a capacitação técnica e econômica das esferas estadual e municipal ;,301
garantir mecanismos de compensação para o combate às desigualdades regionais;,301
e estimular o controle da sociedade sobre a implementação descentralizada das políticas públicas;,301
a descentralização é um processo de longo prazo.,301
"Mas há setores em que ela já avançou mais, como na saúde e assistência social (que já contam com dispositivos constitucionais e legais).",301
"Como esses setores dependem majoritariamente de recursos federais, não tem havido condições para sua implementação integral.",301
"Por isso, um dos compromissos de govemo consistirá em repassar de forma automática e regular os recursos devidos a estados e municípios, decorrentes de encargos já estabelecidos, afirmando concretamente a proposta de descentralização.",301
"O Govemo Democrático e Popular enfatizará a necessidade de alterar o quadro jurídico que aprisiona hoje a administração pública,",301
"ao mesmo tempo em que procurará escalonar no curto, médio e longo prazos as medidas de reforma administrativa antes arroladas.",301
"No curto prazo, como medida preliminar, impõem-se iniciativas como a da realização de um censo do funcionalismo público federal",301
e de um conjunto de ações de desburocratização que venham imediatamente alterar as relações da cidadania com a máquina estatal.,301
A reforma do Judiciário,999
As causas da reconhecida ineficiência do Poder Judiciário são estruturais.,303
Correspondem a fatores que se localizam na própria formação do direito e na sua prática: distorções do processo legislativo,303
e desconhecimento de grande parte dos juizes da função social da lei.,303
As deficiências de infra-estrutura e insuficiente prestação dos serviços auxiliares agravam a situação contribuindo para que não haja no Brasil uma distribuição democrática da justiça.,303
"O acesso à Justiça é um dos pré-requisitos da democracia, na medida em que se constitui em um elemento decisivo para o processo de universalização da cidadania.",303
Ao Poder Judiciário cabe assegurar a aplicação da Constituição e das leis para garantir a distribuição da justiça social.,303
"Esta função é freqüentemente frustrada por uma aplicação formalista—estrita e literal — da lei, sem levar em conta que, em uma sociedade como a brasileira, a legalidade reflete a predominância de pequenos grupos que exercem o domínio sobre o processo legislativo.",303
"O Poder Judiciário, quando desconhece as realidades sociais das quais surge a lei e nas quais ela será aplicada, afasta-se da sociedade e serve como instrumento de reprodução das injustiças.",303
"É fundamental, pois, uma grande reformulação do quadro de leis brasileiras, que na sua maioria refletem realidades ultrapassadas e interesses minoritários,",303
da mesma forma que é fundamental enfrentar o problema da formação da magistratura para que ela seja capaz de refletir (e atuar sobre) os conflitos da sociedade.,303
A atividade do Poder Judiciário é ainda comprometida pela inadequação das leis processuais e de organização judiciária às necessidades impostas pela realidade social brasileira.,303
"Contribuem para a ineficiência e lentidão da Justiça, inviabilizando o acesso de amplos setores a ela, sobretudo os pobres.",303
Os principais fatores são:,303
"a multiplicidade de justiças: federal, estadual, trabalhista, eleitoral, militar, Tribunais de Justiça e de Alçada;",303
a complexidade dos recursos a instâncias superiores;,303
a reserva de mercado para os advogados mesmo em atividades em que eles seriam dispensáveis;,303
a mercantilização absurda dos serviços de perícia;,303
o excesso de despesas judiciais e extrajudiciais.,303
As deficiências agravam-se tendo em vista as falhas de infra-estrutura,303
e na formação da magistratura e do corpo administrativo.,303
O acesso democrático à Justiça exige o aperfeiçoamento dos serviços de Defensoria Pública e do próprio Ministério Público.,303
A Defensoria Pública está insuficientemente desenvolvida nos estados da federação.,303
"Quanto ao Ministério Público, tem enfrentado na maioria dos estados tentativas de tirar-lhe autonomia, ficando à mercê da manipulação por parte de governadores.",303
"Tendo em vista a reiterada preocupação em reverter o quadro econômico e social atual do país, o Govemo Democrático e Popular dará especial atenção às questões de abuso do poder econômico e de proteção aos direitos do consumidor.",303
A idéia de submeter o Poder Judiciário a um controle externo tem sido combatida com a afirmação de que a mesma violaria a autonomia e independência dos juizes.,303
"Não se está propondo, no entanto, qualquer interferência na atividade jurisdicional, que é de competência exclusiva dos magistrados.",303
"O controle externo do Poder Judiciário deve se referir ao estabelecimento e execução de políticas administrativas e dos orçamentos,",303
"bem como à ação disciplinadora dos seus membros sem qualquer vinculação, portanto, com o exercício da função jurisdicional.",303
Ações governamentais não dependentes de reformas institucionais:,303
Investimento na formação de juizes,999
Criação de uma Escola Superior para preparar magistrados para acesso à carreira.,506
"Esta Escola terá estrutura de uma Fundação, sendo pois independente dos Poderes Executivo e Judiciário; formação pluralista;integra- ção com as universidades.",506
Investimentos na infra-estrutura do Poder Judiciário para: racionalização da criação e implantação dos órgãos judiciários;,411
plena informatização do serviço judiciário;,303
preenchimento de cargos de assessoria e fiscalização baseado na isonomia e na publicidade;,202
"descentralização da Justiça, com a criação de mais juízos de primeira instância e com a generalização e aprofundamento de experiência como os Juizados de Pequenas Causas.",301
"Acesso à Justiça, mediante: redução das despesas das demandas judicativas;",303
atuação efetiva de órgãos como a Defensoria Pública e o Ministério Público;,303
"perícias, compatíveis com as possibilidades materiais das partes envolvidas, o que pode ser obtido por meio de convênios dos governos federal e estadual com as universidades.",303
Controle do abuso do poder econômico,999
"Indispensável para a democratização da economia, buscando proteger os setores marginalizados da população, os consumidores e as micro e médias empresas.",202
Para a implementação de uma política global antitruste será necessário:,303
"reestruturar os órgãos administrativos encarregados da fiscalização, denunciar e reprimir o abuso do poder econômico;",303
"fortalecer a fiscalização nos setores privado e público, onde o Estado atua como produtor de bens e serviços;",303
revisar as normas de procedimento dos órgãos administrativos.,303
Política externa,999
"O Brasil não dispõe, há mais de quinze anos, de um projeto nacional de desenvolvimento.",999
Uma das implicações disto foi a impossibilidade de definir uma clara política externa.,107
"Por esta razão, não foi capaz de construir uma alternativa ao “pragmatismo responsável” que orientou o Ministério das Relações Exteriores durante o govemo autoritário de Geísel.",305
"Persiste inercialmente a política extema daquele período, adequada empiricamente às novas realidades de um mundo que sofreu, no entanto, grandes transformações nestes últimos quinze anos.",107
"O fim da Guerra Fria e as mudanças na economia internacional, em curso nos quinze últimos anos, apontam para um mundo em que convivem uma forte hegemonia político-militar dos Estados Unidos com a formação de grandes blocos econômicos—megamercados e megassistemas produtivos— resguardados por medidas protecionistas.",406
"A despeito do acordo da Rodada Uruguai do GATT, que determinará um crescimento do comércio mundial, o protecionismo—aberto ou disfarçado — continuará a existir.",406
A antiga polarização Leste/Oeste cedeu lugar a uma nova polarização Norte/Sul.,107
"Os países ricos são responsáveis pela criação de 80% da riqueza mundial, enquanto que 80% da humanidade produz apenas 20% da riqueza.",103
"Os termos de troca no comércio Norte-Sul continuam, cada vez mais, sendo desfavoráveis aos países do Sul.",103
"A hegemonia política dos países do Norte se exerce através do controle das Nações Unidas, especialmente do Conselho de Segurança,",103
"e de organismos como o FMI, Banco Mundial ou o chamado Grupo dos Sete, que acabam funcionando como formuladores de políticas econômicas mundiais.",103
"Frente a este quadro, o Govemo Democrático e Popular deverá desenvolver uma política extema que permita simultaneamente, uma inserção soberana do Brasil no mundo",107
e a alteração das relações de força internacionais contribuindo para a construção de ordem mundial justa e democrática.,202
"Tal política enfrentará resistências em alguns centros hegemônicos, mas será beneficiada pelo clima favorável à negociação que se verifica em vários pontos do mundo com o fim da Guerra Fria (África do Sul, Oriente Médio).",103
"Será beneficiada, igualmente, pela abertura de alguns espaços resultantes dos conflitos entre os grandes blocos e pela simpatia que possamos atrair em países periféricos e junto a importantes setores da opinião pública dos países desenvolvidos.",107
A nova política externa estará pautada pelas seguintes diretrizes:,107
"inserção soberana do Brasil no mundo por intermédio de uma política externa que coloque como eixos, a defesa da soberania nacional e da autodeterminação,",103
"a luta pela paz,",106
"o respeito aos direitos humanos,",201
"a preservação ambiental,",501
"profundas mudanças na ordem econômica internacional (especialmente em organismos como o FMI, Bird etc)",103
"e democratização de todos os organismos internacionais, em especial as Nações Unidas, eom a ampliação e reforma do Conselho de Segurança, pondo fim ao direito de veto;",202
"o Brasil manterá relações com todos os países do mundo, reforçando o caráter multilateral de sua política externa.",107
A América Latina será sua área prioritária.,107
"Serão definidos programas abrangentes de integração em matérias econômica, política, educacional, científico-tecnológica e cultural.",107
O processo de integração regional — Mercosul —-será privilegiado.,108
"Será preciso, no entanto, uma revisão do Tratado de Assunção, para incorporar as dimensões política (democratização do processo) e social imperioso que esse organismo implemente políticas de promoção de emprego.",108
"O Govemo Democrático e Popular proporá aos signatários do Mercosul tomá-lo um instrumento que a um só tempo favoreça a integração e o desenvolvimento regionais efetivos,",108
como também para que abra melhores possibilidades de relação soberana das economias dos seus países membros com a economia mundial.,108
"Isso exige remover os mecanismos, embutidos pelo chamado “Tratado quatro mais um” (envolvendo Argentina, Brasil, Paraguai e Uruguai, por um lado, e Estados Unidos, por outro), que apontam para tomá-lo uma “área hemisférica de livre comércio” (ahlc) que se estenderia do “Alasca à Terra do Fogo”, naturalmente sob a “égide” do Nafta.",108
"O Mercosul e outros tratados regionais, como o Tratado Amazônico (“Merconorte”) serão entendidos não apenas como simples zonas de livre-comércio",108
"mas, sobretudo, como campos para a articulação de políticas industriais e agrícolas,",108
"de cooperação tecnológica e científica,",108
de colaboração no domínio político e cultural.,108
"O Govemo Democrático e Popular se empenhará para que o processo de integração tenha como eixo a noção de complementaridade e especialização produtiva e comercial das respectivas economias nacionais, para o fortalecimento recíproco face à concorrência.",108
"Nessa linha, o nosso govemo recusará acordos que objetivem a liberação e a redução indiscriminada das taxações e barreiras alfandegárias.",108
"Na perspectiva da luta pela integração da América Latina, serão retomados tratados e organismos multilaterais marginalizados por pressão do hegemonismo norte-americano.",108
"O Govemo Democrático e Popular apoiará as iniciativas do Legislativo brasileiro não deverão ficar restritos apenas às chancelarias e conferências internacionais, devendo ser diretamente consultados os setores sociais que em cada país serão afetados com as novas medidas adotadas.",108
"As políticas de integração latino-americana que o govemo animará buscarão potencializar nossas capacidades econômicas e políticas para relações mais igualitárias com o Nafta, a União Européia e o Japão e seus aliados:",108
"o Brasil desempenhará um papel ativo na busca de soluções negociadas em todos os conflitos internos e entre países, que sacodem principalmente a América Latina: Colômbia, Guatemala, Haiti e Panamá.",101
"Esta intervenção se fará a partir do respeito à soberania, aos direitos humanos, e ao direito dos povos rebelarem- se contra regimes injustos na busca da paz e da democracia.",201
"Mediará ou contribuirá para mediação em conflitos que ameaçam a paz mundial: Israel-OLP, Líbia, Coréia;",106
o Govemo Democrático e Popular lutará em todos os fórus contra o bloqueio a Cuba pela sua plena reintegração à comunidade latino-americana,101
"e fomentará de modo vigoroso o intercâmbio comercial, científico e cultural entre Brasil e esse país irmão;",101
"no marco do multilateralismo que caracterizará a política extema brasileira, e tendo em vista as novas realidades mundiais, dará ênfase especial às relações de cooperação econômica e nos domínios científico e tecnológico, com uma correspondente agenda política, com países como China, índia, Rússia e África do Sul, entre outros;",107
"a política em relação à África dará ênfase especial não só às questões econômicas, mas procurará resgatar afinidades étnicas e culturais",107
"e estabelecer linhas de cooperação, em particular com os povos de língua portuguesa;",101
ênfase nos programas de cooperação cultural e científica na esfera Sul-Sul.,107
"Maior incremento no intercâmbio de universidades, instituições científicas",506
e entidades culturais.,502
O Ministério será um veículo importante na difusão da cultura brasileira no exterior;,502
a luta por uma nova ordem econômica e política internacional levará o Govemo Democrático e Popular a desenvolver inúmeras iniciativas internacionais:,107
rediscussão dos problemas relacionados com as dívidas externas dos países periféricos;,107
"discussão e ações concretas sobre problemas como a fome e a miséria no mundo, propondo à comunidade internacional medidas concretas a respeito;",107
convocação de uma conferência internacional —de porte semelhante ao da ECO-92 — para discutir a situação do trabalho no mundo e medidas efetivas contra o desemprego.,107
"Este evento contará, além da participação de governos, com a presença de sindicatos, intelectuais e ONGs;",107
"o Govemo De mocrático e Popular transformará, através de um debate mais intenso no Parlamento e, especialmente, na sociedade civil, a política extema em um tema central de discussão e decisão de todo o país;",107
"o govemo realizará um processo contínuo de recuperação do Ministério de Relações Exteriores, cuja estrutura foi sucateada nos últimos anos;",303
"o Ministério de Relações Exteriores revisará sua política de apoio à comunidade brasileira no exterior, especialmente os que deixaram o país por razões econômicas, propíciando-lhes toda a proteção necessária;",107
"articulado com os ministérios da Educação, Cultura, CiênciaeTecnologia, o Ministério das Relações Exteriores realizará um mapeamento e estimulará programa de retomo de cientistas, técnicos e artistas que deixaram o Brasil por falta de alternativas profissionais no país.",411
"O Govemo Democrático e Popular terá uma postura ofensiva na defesa e aplicação de uma concepção de desenvolvimento auto-sustentável, ecologicamente responsável, em  que o combate à pobreza e às injustiças sociais caminhe junto com a defesa do meio ambiente.",501
"A questão ambiental, hoje um ponto de vulnerabilização do país no cenário internacional, deve se transformar em um ponto forte e uma alavanca para uma presença ofensiva nas relações internacionais, bem como para catalisar apoio para o processo de transformações que impulsionaremos.",501
Para tanto adotaremos as seguintes medidas:,501
proibir a importação de lixo tóxico de qualquer espécie;,501
"manter posição de firme defesa da Convenção de Proteção à Flora e Fauna,",501
"bem como da Convenção para a Proteção do Patrimônio Mundial Natural e Cultural, incluindo entre tais patrimônios Fernando de Noronha,",501
"o complexo estuarino de Iguape-Paranaguá,",501
o Parcel de Manoel Luís no Maranhão;,501
"cumprir as Convenções para Proteção de Áreas Úmidas, de 1971",501
"e a de Espécies Migratórias de Animais Silvestres, de 1979;",501
"deflagrar política de manutenção da Antártica, como patrimônio da humanidade;",501
"cumprir as Convenções dos Recursos Marinhos vigentes na Antártida, sobre Comércio Internacional de Espécies, Fauna e Flora Silvestres em perigo de extinção, e do Patrimônio Cultural Natural do Mundo;",501
a relação com os países fronteiriços deverá levar em conta o planejamento integrado nas bacias hidrográficas e biomas compartilhados.,501
Em relação ao Mercosul constituir um subgrupo sobre questões ambientais.,501
Defesa e Forças Armadas,999
"As profundas mudanças pelas quais passaram o Brasil e o mundo, nos últimos quinze anos exigem redefinições importantes na política de defesa nacional, com claras repercussões sobre as Forças Armadas (FFAA).",104
"Durante décadas, as FFAA brasileiras definiram como seus inimigos a Argentina, na esfera continental,",104
"a União Soviética e o “campo socialista”, na esfera mundial,",104
e a “subversão” ou inimigo interno no plano nacional.,104
"Com a Argentina e demais países do Cone Sul mantemos há anos uma política de parceria que deverá abranger crescentemente as esferas econômica, política e cultural.",101
Esta tendência se reforçou particularmente depois do fim das ditaduras militares na região,101
e dos avanços obtidos no processo de democratização política de seus países.,101
"Com o fim da Guerra Fria, perdeu significado o conflito Leste/Oeste, que fazia do Brasil um aliado militar dos Estados Unidos na sua cruzada contra o “perigo comunista”, o “império do mal”.",104
"Antes mesmo que ocorressem as cruciais mudanças políticas internacionais no fim dos anos 80 e começo dos 90, já havia indícios de que as tensões internacionais situariam- se em uma perspectiva Norte-Sul, como se explicitou na Guerra das Malvinas e, mais tarde, no conflito do Golfo.",104
O processo de democratização do Brasil derrotou politicamente a tese do inimigo interno.,202
"Por esta razão, a Constituição deverá retirar a “manutenção da ordem interna” das atribuições das FFAA.",104
"É necessário, no entanto, realizar um profundo debate sobre as novas realidades internacionais e seu impacto na política de defesa.",104
A defesa da soberania nacional é uma responsabilidade do conjunto da sociedade e não apenas um atributo das FFAA.,104
"Este princípio não exclui, pelo contrário enfatiza, a necessidade de uma política de defesa, democraticamente definida e, em conseqüência, de Forças Armadas reestruturadas e capacitadas para implementá-la.",104
