"text","cmp_code","eu_code"
"Os pequenos avanços conseguidos nos últimos anos no sentido da eliminação dos entraves regulatórios, tributários e operacionais que bloqueiam a liquidez parecem desproporcionais à ênfase e à convergência de opiniões em relação ao tema.","414",NA
"Nesse sentido, cabe recordar, apenas a título de exemplo, as 21 iniciativas anunciadas pelo Tesouro Nacional e Banco Central em 1999 visando à ampliação da liquidez no mercado de dívida de pública,","414",NA
"ou mesmo a proposta de criação pelo mercado da debênture simplificada, endossada por várias entidades e datada de 2005,","414",NA
"além das inúmeras iniciativas no sentido do aumento da transparência de preços, seja no que se refere aos instrumentos de dívida públicos ou privados.","403",NA
"Ações:",NA,NA
"Rever a tributação que hoje incide sobre o mercado de capitais, de forma a incentivar o alongamento de prazos,","402",NA
"eliminar a dupla tributação","402",NA
"e garantir condições isonômicas entre os investidores nacionais e internacionais;","407",NA
"Reorganizar a legislação sobre debêntures de forma a dar mais flexibilidade ao papel, eliminando entraves burocráticos à expansão de sua utilização pelas empresas como forma de captação de recursos;","414",NA
"Promover maior transparência nas negociações do mercado secundário: garantia de transparência pós-negociação por meio da divulgação das operações e preços dos negócios realizados de forma mais imediata possível, a exemplo do que é feito no TRACE (Trade Reporting and Compliance Engine) americano;","403",NA
"Reforçar a participação do BNDES no desenvolvimento do mercado de renda fixa corporativa, especialmente no que diz respeito ao mercado primário, por meio da alocação de recursos para compra de debêntures, especialmente aquelas com características mais uniformes de forma a aumentar a liquidez destes papéis;","403",NA
"Promover a atuação do BNDES como indutor da formação de preços no mercado secundário de títulos privados.","403",NA
"Proposta 25: Aumento do Salário Mínimo",NA,NA
"Situação: Vários estudos indicam que a formalização do mercado de trabalho observado nos últimos anos paralelamente à manutenção do valor real do salário mínimo","412",NA
"foi a principal causa da redução da pobreza e da desigualdade dos últimos anos.","503",NA
"O salário mínimo surgiu no Brasil em meados da década de 30, estabelecendo o piso para os trabalhadores do mercado formal do país.","412",NA
"Valor atual do Salário Mínimo é de R$ 510,00, de acordo com a Medida Provisória nº 474/2009, que dispõe sobre o salário mínimo a partir de 1o de janeiro de 2010 e estabelece diretrizes para a política de valorização do salário mínimo entre 2011 e 2023.","412",NA
"O estabelecimento do salário mínimo também é um indicador do cálculo da Previdência Social.","412",NA
"Ação:",NA,NA
"Promover o reajuste do Salário Mínimo para R$ 600,00 no início do ano de 2011;","412",NA
"Discutir formas de redução dos tributos e taxas que oneram salários, sem causar perdas nos direitos adquiridos do trabalhador.","701",NA
"Proposta 26: Capacitação de Trabalhadores",NA,NA
"Situação: Nenhuma nação se desenvolveu sem qualificar seus trabalhadores e empreendedores.","411",NA
"Os programas de treinamento no Brasil padecem de três males que precisam ser superados: o primeiro diz respeito à sua falta de identidade, pois não se consegue definir para que fim o treinamento se destina;","411",NA
"o segundo é que o treinamento não se volta para o atendimento da demanda do setor produtivo,","411",NA
"e por fim há uma grande descontinuidade nos gastos.","411",NA
"Segundo dados do IPEA (2010) existe no país um déficit de 320 mil trabalhadores com qualificação.","411",NA
"Entretanto, os recursos do FAT destinados para capacitação de trabalhadores caíram sete vezes de 2002 para 2009.","411",NA
"Essa tendência será revertida rapidamente, recuperando os recursos aplicados em treinamento, visando capacitar, até 2014, um milhão de trabalhadores no País.","411",NA
"Ações:",NA,NA
"Ampliar o investimento na realização de capacitações e treinamentos de trabalhadores com recursos do FAT, retomando os valores investidos antes de 2003, da ordem de R$ 700 milhões;","411",NA
"Implantar o Via Rápida Nacional, constituído por cursos básicos de 80 a 200 horas, que atendam trabalhadores que não apresentam, no momento, tempo para ingressar em cursos profissionalizantes extensos ou com formação universitária para 5 milhões de brasileiros;","411",NA
"Identificar demandas específicas de formação e qualificação profissional por região e setor de atividade;","411",NA
"Criar programas específicos de formação profissional, direcionado para as distintas faixas etárias -jovens, idosos.","411",NA
"Proposta 27: Emprega Brasil",NA,NA
"Situação: A busca por emprego demanda instrumentos capazes de conciliar e intermediar a oferta e a procura por mão-de-obra.","701",NA
"Criar mecanismos via internet viabilizam um sistema de intermediação totalmente gratuito entre cidadãos que buscam oportunidade de trabalho e empregadores que ofertam vagas de trabalho.","411",NA
"O cidadão, empregado ou não, tem a possibilidade de acessar as vagas de trabalho mais adequadas a seu perfil.","411",NA
"Para o empregador, basta cadastrar-se e anunciar suas vagas para visualizar um amplo quadro de profissionais que buscam trabalho.","411",NA
"Ações:",NA,NA
"Criar na internet um Sistema – Emprega Brasil -para intermediar a oferta e a procura de mão-de-obra de forma facilitada e transparente;","411",NA
"Discutir a possibilidade de redução de encargos sociais, visando estimular o emprego sem fragilizar as conquistas trabalhistas;","701",NA
"Articular o seguro desemprego com a intermediação de mão de obra (Emprega Brasil) e com os programas de qualificação profissional.","505",NA
"Proposta 28: Sistema SEBRAE",NA,NA
"Situação: O Serviço Brasileiro de Apoio às Micro e Pequenas Empresas (SEBRAE) é uma entidade privada, sem fins lucrativos, criada em 1972, que visa a promover a competitividade e o desenvolvimento dos empreendimentos de micro e pequeno porte.","403",NA
"Com a aprovação da Lei Geral da Micro e Pequena Empresa, em dezembro de 2006, o marco legal se consolidou,","403",NA
"trazendo estímulos tributários que devem prevalecer para o segmento nas três esferas – federal, estadual e municipal – da administração pública.","402",NA
"Não é fácil a um brasileiro abrir o seu próprio negócio.","402",NA
"As estruturas burocráticas do aparelho do Estado parecem remar contra o empreendedorismo,","303",NA
"dificultando o surgimento das pequenas empresas.","402",NA
"O sistema comandado pelo SEBRAE funciona bem,","403",NA
"mas poderia ser aprimorado com a redução da burocracia nas máquinas públicas","303",NA
"e maiores e mais facilitados financiamentos.","402",NA
"Os pequenos negócios constituem 5,6 milhões de micro e pequenas empresas que oferecem emprego para 31 milhões de pessoas no País.","403",NA
"Representam 53% da mão de obra urbana com carteira assinada no Brasil e movimentam 20% do PIB nacional.","403",NA
"Fora o mercado informal.","403",NA
"A importância dos menores empreendedores é crucial","403",NA
"para o desenvolvimento sustentável.","416.2",NA
"Atrapalhada pela burocracia,","303",NA
"fragilizada pela falta de financiamentos adequados,","402",NA
"sofrida pela tributação,","402",NA
"as micro e pequenas empresas (MPE) lutam no mercado e vencem com sua ousadia e labor.","403",NA
"Mas poderiam estar bem melhor situadas.","403",NA
"Iniciativas pioneiras ocorreram em São Paulo, quando José Serra comandava o governo do estado.","403",NA
"Elas se aglutinam no ""PoupaTempo do Empreendedor"", um site que agiliza o processo de licenciamento para legalização de micros e pequenas empresas.","303",NA
"O sistema simplificado facilita o trabalho do pequeno empresário.","403",NA
"As estruturas burocráticas do aparelho do Estado parecem remar contra o empreendedorismo,","303",NA
"dificultando o surgimento das pequenas empresas.","402",NA
"Por isso, uma agenda mais agressiva de apoio precisa ser formulada.","403",NA
"Ações:",NA,NA
"Fortalecer o Sistema do SEBRAE,","403",NA
"estimulando a capacitação técnica -em gestão, tecnologia e processos -dos pequenos empreendedores","411",NA
"e reforçando seu trabalho na construção dos arranjos produtivos locais (APL's);","403",NA
"Implementar, junto com estados e municípios, medidas de desburocratização,","303",NA
"visando facilitar a abertura e o fechamento de empresas;","402",NA
"Aprimorar o Simples Nacional, com ampliação para o setor de serviços, correção das faixas de tributação, implantando mecanismos para a fase de transição e saída do Simples;","402",NA
"Criar programas e políticas efetivas que ajudem as MPEs a conquistar novos mercados no exterior, principalmente a partir da orientação para a organização de consórcios e a busca de parcerias com médias e grandes empresas.","408",NA
"Proposta 29: BNDES para os Pequenos Negócios",NA,NA
"Situação: A inclusão produtiva e o fortalecimento das micro e pequenas empresas passa, necessariamente, pelo oferecimento de linhas de financiamento e mecanismos de créditos mais facilitados.","403",NA
"Atualmente os elevados juros e a dificuldade de acesso restringem a alavancagem financeira desse segmento produtivo.","403",NA
"Atualmente os elevados juros e a dificuldade de acesso ao financiamento restringem de forma dramática sua atuação e sua competitividade.","403",NA
"Notícias recentes mostraram que o BNDES repassou 57% de seus recursos para apenas 12 grandes empresas, sendo 2 estatais.","403",NA
"Isso precisa mudar.","403",NA
"José Serra se compromete a criar o ""Banco do SEBRAE"", que vai operar com recursos do BNDES um sistema de financiamento diferenciado para micro e pequenas empresas,","403",NA
"vinculando-o à capacitação técnica executada pelo SEBRAE.","411",NA
"O que hoje existe, na prática, pouco funciona.","403",NA
"Ação:",NA,NA
"Aperfeiçoar o sistema de financiamento diferenciado para micro e pequenas empresas, com recursos do BNDES – “Banco do SEBRAE”,","403",NA
"vinculando-o à capacitação técnica executada pelo sistema do SEBRAE.","411",NA
"Proposta 30: Cooperativismo",NA,NA
"Situação: O cooperativismo nacional se distribui em 13 setores da economia, com um total de 7.261 cooperativas, aglutinando 8,25 milhões de associados e 274 mil empregados, de acordo com os dados da Organização das Cooperativas Brasileiras (OCB).","408",NA
"Tais cooperativas, distribuídas em 13 segmentos da economia, são responsáveis por um faturamento total de R$ 88,5 bilhões (2009).","408",NA
"Sua participação no PIB brasileiro chega a 5,39%.","408",NA
"Cabe destacar as cooperativas agropecuárias que formam, hoje, o segmento economicamente mais forte do cooperativismo brasileiro –","703.1",NA
"num modelo que busca unir desenvolvimento econômico e bem-estar social.","416.2",NA
"Geralmente elas cuidam de toda a cadeia produtiva, desde o preparo da terra até a industrialização e comercialização.","703.1",NA
"O número de cooperativas agrícolas chega a 1,6 mil no país, com 940 mil associados e 140 mil empregados.","703.1",NA
"A participação delas no PIB agropecuário alcança 40%.","703.1",NA
"As exportações oriundas das cooperativas agropecuárias atingiram US$ 3,6 bilhões (2009).","703.1",NA
"O cooperativismo agropecuário se fortaleceu no país,","703.1",NA
"mas ainda não dispõe de uma lei geral que regulamente o dispositivo constitucional do Artigo 171 que estabelece: “a lei apoiará e estimulará o cooperativismo”.","203",NA
"Há 15 anos tramitam vários PLs no Congresso, sem definição.","703.1",NA
"Enquanto nada se resolve, continua vigindo a antiga lei do cooperativismo (Lei 5764/1971), que precisa ser modernizada.","703.1",NA
"Da mesma forma, o “ato cooperativo” ainda não mereceu regulamentação legal, visando favorecer os negócios através de um tratamento tributário adequado,","402",NA
"conforme reza a Constituição.","203",NA
"Ações:",NA,NA
"Regulamentar o dispositivo constitucional do Artigo 171,","203",NA
"instituindo um novo marco legal – A Lei Básica do Cooperativismo;","703.1",NA
"Revisão dos tributos que incidem sobre das cooperativas, estimulando o associativismo com a regulamentação e definição legal do “ato cooperativo”.","402",NA
"Regulamentar, em lei (PL 4622/04), o cooperativismo de trabalho, trazendo segurança na prestação de serviços desse segmento.","701",NA
"Tema 6: EDUCAÇÃO",NA,NA
"O Brasil tem hoje cerca de 61 milhões de alunos, distribuídos desde a educação infantil até a pós-graduação.","506",NA
"Mais da metade (33,1 milhões) frequentam o ensino fundamental.","506",NA
"Há que se reconhecer que, mesmo considerando os avanços da educação brasileira, o País ainda não conseguiu vencer o desafio de dar uma educação de qualidade a todos os brasileiros.","506",NA
"A política nacional de educação, liderada pelo governo federal, deverá mobilizar os Estados e Municípios","302",NA
"em torno de um grande pacto pela equidade,","503",NA
"e qualidade da educação básica","506",NA
"fortalecendo o regime de colaboração efetiva entre os três níveis de governo.","303",NA
"A prioridade é investir na qualidade da educação básica para formar cidadãos competentes","506",NA
"e, depois, fazer a educação virar emprego através do ensino profissionalizante, um dever do Estado para com a juventude.","506",NA
"Proposta 31: Educação Básica com Currículos Nacionais",NA,NA
"Situação: Na Avaliação Internacional do PISA/OECD, o Brasil pontuou entre os piores países do mundo: 54º em Matemática (dentre 57 países), 49º em Leitura (dentre 56 países) e 50º em Ciências (dentre 52 países).","506",NA
"De acordo com o Censo Escolar de 2009, o primeiro ano do Ensino Fundamental/EF de 9 anos ainda não está universalizado.","506",NA
"E permanecem índices elevados de atraso escolar.","506",NA
"As elevadas taxas de reprovação e de repetência, especialmente nos anos finais do ensino fundamental, continuam existindo.","506",NA
"E, dos que conseguem concluir o Ensino Médio, apenas 10% apresentam um desempenho considerado adequado ao término da educação básica.","506",NA
"O melhor é sempre usar educação básica para não atrair a raiva dos sindicatos,","702",NA
"é o que está na Constituição.","203",NA
"Ensino é considerado linguagem neoliberal com foco no adestramento tecnicista que não se vincula a aprendizagem.","702",NA
"Ações:",NA,NA
"Instituir currículos mais enxutos e objetivos,","506",NA
"estabelecendo, em parceria com Estados e Municípios, padrões curriculares nacionais obrigatórios com competências e conteúdos básicos a serem ministrados;","302",NA
"Investir na melhoria das condições de infraestrutura das escolas e das redes públicas de ensino,","411",NA
"tais como equipamentos básicos, bibliotecas,","506",NA
"quadras esportivas","502",NA
"e ter como foco a sala de aula e a aprendizagem;","506",NA
"Ampliar o Programa Nacional do Livro Didático","506",NA
"e complementá-lo com materiais didáticos estruturados alinhados aos padrões curriculares nacionais;","506",NA
"Universalizar o Programa Nacional de Informática na Educação com a instalação de laboratórios de informática nas escolas públicas de ensino fundamental e médio, em parceria com Estados e Municípios.","506",NA
"Proposta 32: Programa “Aluno Tempo Integral”",NA,NA
"Situação: Na grande maioria das escolas públicas brasileiras o turno escolar é parcial.","506",NA
"Os alunos ficam em média 4 horas por dia na escola, com aulas oferecidas no periodo da manhã, da tarde ou à noite.","506",NA
"Escolas em áreas mais vulneráveis, como nas regiões metropolitanas,","503",NA
"requerem uma maior atenção aos alunos, pois seus problemas não são apenas de educação,","506",NA
"mas estão também sujeitos a todo tipo de violência.","605.1",NA
"Esses alunos precisam de intervenções mais complexas,","503",NA
"incluindo atividades complementares à escola, como esportes, música, dança,","502",NA
"cursos profissionalizantes,","506",NA
"uma efetiva política de segurança.","605.1",NA
"Ações:",NA,NA
"Criar o programa “Aluno Tempo Integral”,","506",NA
"por meio de ações integradas entre os governos federal, estaduais e municipais e parcerias com organizações da sociedade civil;","606.1",NA
"Instituir programas de apoio aos alunos com atraso escolar e dificuldades de aprendizagem;","506",NA
"Implantar medidas de reforço escolar com atividades de esporte e música;","502",NA
"Vincular os resultados das avaliações externas a programa de incentivos que estimule a maior autonomia das escolas e valorize os diretores e sua equipe pelos resultados apresentados;","506",NA
"Ampliar as oportunidades de formação, oferecendo aos alunos das redes públicas das áreas metropolitanas atividades complementares e extracurriculares,","502",NA
"por meio de parcerias com instituições não governamentais e universidades parceiras, públicas e privadas.","606.1",NA
"Proposta 33: Avaliação para Ciências",NA,NA
"Situação: Atualmente a política nacional de avaliação da educação básica baseia-se no SAEB/Prova Brasil e no Índice de Desenvolvimento da Educação Básica (IDEB) que com base nos resultados da avaliação e nas taxas de aprovação estabelece metas de desempenho para todas as escolas publicas.","506",NA
"A Prova Brasil avalia Português e Matemática, ao final do 5º e 9º anos do ensino fundamental.","506",NA
"Ações:",NA,NA
"Implantar a avaliação da alfabetização em Língua Portuguesa e Matemática dos alunos no final da 2ª série/3º ano do ensino fundamental, na mesma escala de proficiência do SAEB;","506",NA
"Ampliar as fases de aplicação e as referências da avaliação para Ciências da Vida e Sociais, além de Matemática e Língua Portuguesa, para concluintes do ensino fundamental e médio;","506",NA
"Fixar metas e objetivos de melhoria de aprendizagem, coordenada com as políticas atuais de avaliação;","506",NA
"Utilizar resultados das avaliações de ensino para identificar problemas,","506",NA
"apoiar as escolas que mais precisam","506",NA
"e criar incentivos.","506",NA
"Proposta 34: Programa Ler e Escrever",NA,NA
"Situação: As estatísticas e resultados das avaliações nacionais não deixam dúvidas: apesar da melhoria nos anos iniciais da educação fundamental, o Brasil ainda precisa melhorar muito na educação, investindo na qualidade da educação básica.","506",NA
"Uma nova forma de apoio, com recursos vultosos, deve priorizar as ações públicas no reforço ao ensino fundamental.","506",NA
"No Estado de São Paulo foi implantando o Programa Ler e Escrever que incorpora um conjunto de linhas de ação integradas que inclui formação, acompanhamento, elaboração e distribuição de materiais pedagógicos e outros subsídios, constituindo-se dessa forma como uma política pública para os anos iniciais do ensino fundamental, que busca promover a melhoria do ensino em toda a rede estadual.","506",NA
"Ações:",NA,NA
"Implantar o Programa Ler e Escrever em todo o território nacional, tendo por base um Fundo Nacional da Qualidade da Educação Básica, dotando-o de recursos do Tesouro para serem destinados aos Estados e Municípios que executem políticas de:","506",NA
"Remuneração complementar de professores por bônus;","506",NA
"Desenvolvimento de ações continuadas de capacitação de professores;","506",NA
"Aplicação de padrões curriculares nacionais;","302",NA
"Aprimoramento da estrutura física;","411",NA
"Aperfeiçoamento do material pedagógico;","506",NA
"Ampliação do número de horas dentro da escola com aplicação gradual do horário integral;","506",NA
"Sala de aula com um professor e um auxiliar -estudante de pedagogia para o 1º ano do Ensino Fundamental;","506",NA
"Envolvimento de estudantes de cursos de Pedagogia e Letras em experiências e conhecimentos necessários sobre a natureza da função docente;","506",NA
"Adequado sistema de distribuição de uniformes, merenda e transporte escolar;","506",NA
"Distribuição de materiais complementares tais como acervo literário e paradidático para biblioteca de sala de aula, enciclopédias, globos, letras móveis, calculadoras;","506",NA
"Acompanhamento institucional sistemático aos órgãos regionais de ensino responsáveis pela supervisão do sistema;","506",NA
"Implantação de atividades esportivas e culturais.","502",NA
"Canalizar recursos adicionais para provocar mudanças significativas nos indicadores do Fundo Nacional da Qualidade da Educação Básica.","506",NA
"Proposta 35: Programa Valorização do Professor",NA,NA
"Situação: Existem no Brasil quase dois milhões de professores apenas na educação básica, contratados por Estados e Municípios.","704",NA
"A maioria é concursada, sendo, portanto, professores efetivos.","704",NA
"Mas eles precisam ser mais bem valorizados.","704",NA
"Os alunos aprendem mais e melhor quando seus professores são motivados por carreiras mais atraentes e preparados.","506",NA
"Ações:",NA,NA
"Adotar mecanismos de valorização dos professores, em parceria com Estados e Municípios, baseada em três pilares:","704",NA
"Apoiar programas de formação continuada, desenvolvidos por estados e municípios, a partir dos resultados das avaliações nacionais, com prioridade na língua portuguesa, matemática e ciências;","506",NA
"Melhorar a carreira e os salários dos professores, apoiando Estados e Municípios no oferecimento de carreiras com salários iniciais mais atrativos,","704",NA
"valorização por mérito","506",NA
"e consolidação de um piso salarial profissional nacional do magistério;","704",NA
"Desenvolver parâmetros para programa de avaliação e certificação de professores e diretores escolares.","506",NA
"Atuar na qualificação dos cursos de formação dos professores nas instituições de educação do ensino superior;","506",NA
"Implantar programas de formação de professores para o ensino técnico e tecnológico","411",NA
"e definir critérios de seleção de professores das disciplinas profissionalizantes com profissionais com experiência de mercado;","506",NA
"Fomentar a formação e o recrutamento dos professores com mais talento e potencial.","506",NA
"Proposta 36: Universalização da Educação Infantil",NA,NA
"Situação: A expansão da educação infantil é fundamental e necessária.","506",NA
"O processo de expansão deve estar acompanhado de mecanismos e ações que promovam a qualidade do atendimento.","506",NA
"A Emenda Constitucional 59/2009 estabeleceu a obrigatoriedade","203",NA
"da pré-escola para todas as crianças de 4 e 5 anos até 2016.","506",NA
"Ações:",NA,NA
"Antecipar a universalização da Educação Infantil para 2014;","506",NA
"Apoiar a expansão, com qualidade, da pré-escola (4-5 anos), em parceria com Estados e Municípios, com recursos do Fundo Nacional de Desenvolvimento da Educação,","506",NA
"de forma a assegurar a universalização do atendimento antecipando a meta prevista da Emenda Constitucional nº 59/2009;","203",NA
"Apoiar financeiramente Estados e Municípios na construção de creches, com a meta de construção de 10 mil unidades;","506",NA
"Estabelecer padrões de qualidade e sistemas de acompanhamento e avaliação das creches e escolas infantis;","506",NA
"Implantar política de atenção à primeira infância (zero a três anos) a partir de ações integradas de educação, saúde e assistência social.","504",NA
"Proposta 37: Currículo do Ensino Médio",NA,NA
"Situação: Pouco mais da metade dos jovens de 15 a 17 anos (51,2%) estão frequentando o ensino médio, e 20,8% estão fora da escola.","506",NA
"De cada 100 alunos que ingressam no primeiro ano do ensino fundamental, apenas 70 conseguem concluir o nono ano.","506",NA
"E, de cada 100 alunos que ingressam no ensino médio, apenas 65 conseguem concluí-lo, devido às altas taxas de abandono e repetência.","506",NA
"O ensino médio deve ser a etapa final de uma educação de caráter geral, que situe o educando como sujeito produtor de conhecimento e participante do mercado de trabalho,","506",NA
"adotando formas de conectar os conteúdos escolares aos interesses e aspirações do jovem no mundo contemporâneo.","706",NA
"É necessário trabalhar pela universalização do acesso ao ensino médio, possível até o final da década.","506",NA
"Ações:",NA,NA
"Diversificar o currículo e flexibilizá-lo de acordo com as demandas regionais,","301",NA
"estabelecendo, em articulação com os Estados, uma base curricular padrão obrigatória, que assegure a todos os alunos os conhecimentos universais associados com as demandas de mercado e os interesses dos alunos;","506",NA
"Reduzir o número de disciplinas obrigatórias, o excesso de conteúdo e o grau de dificuldade do curso, aumentando a oferta de disciplinas eletivas;","506",NA
"Introduzir disciplinas eletivas mais próximas do mundo real para motivar os alunos, como tecnologias, informática, educação financeira, empreendedorismo e estudo de línguas;","506",NA
"Promover a ampliação da oferta de vagas no período diurno para os alunos que não trabalham;","506",NA
"Oferecer aos alunos com mais de 18 anos do período noturno o EJA, complementado por qualificação profissionalizante e vinculada ao setor produtivo;","506",NA
"Flexibilizar a oferta do ensino médio e do ensino técnico de nível médio, de forma a garantir a articulação entre os dois tipos de formação por meio de modalidades integradas ou concomitantes;","506",NA
