"text","cmp_code","eu_code"
"Criar um Programa de recuperação e apoio à boa gestão das empresas estaduais e municipais de saneamento a ser coordenado pelo Ministério das Cidades que deverá apoiar os governos estaduais e municipais a melhorarem a gestão de suas empresas;","303",NA
"Criar modelos e oferecer consultores a estados e municípios para desenvolver parcerias público-privadas e parcerias societárias;","303",NA
"Fomentar e estimular a atuação dos capitais privados para o setor, tanto por meio de concessão dos serviços de saneamento de um município ou região, quanto de concessões administrativas ou patrocinadas (PPPs) para determinados serviços;","402",NA
"Apoiar e financiar a cooperação e as Parcerias Público-Público entre empresas de saneamento;","402",NA
"Criar instrumentos permanentes de capacitação e assistência técnicas às empresas, nas áreas financeira, administrativa e tecnológica;","402",NA
"Incentivar e financiar a difusão de tecnologias na área de saneamento.","411",NA
"Proposta 96: Água Universalizada",NA,NA
"Situação: Pouco mais de 80% da população tem acesso a água tratada, atingindo 36 milhões de brasileiros.","411",NA
"Sem rede de abastecimento de água não há saúde e qualidade de vida para a população brasileira.","411",NA
"Acrescente-se a elevada perda média de água, na média brasileira próxima de 40%, devido às fraudes ou vazamentos nas redes de abastecimento.","411",NA
"Ações:",NA,NA
"Universalizar o serviço de abastecimento público de água potável nas regiões metropolitanas, até 2014;","411",NA
"Promover a transferência de tecnologia e fomentar a instituição de Programas de Redução de Perdas de Água;","411",NA
"Estimular estados, municípios e entidades da sociedade civil na produção de água de reuso para a irrigação e fins industriais;","501",NA
"no aproveitamento dos resíduos gerados na cadeia do saneamento, como o biogás e o lodo, inclusive como fonte alternativa de energia limpa","501",NA
"e na educação ambiental para conscientização no uso consciente da água,","501",NA
"estabelecendo ações de estímulo à ligação às redes públicas de água e esgoto existentes;","411",NA
"Apoiar campanhas de conscientização do combate ao desperdício do uso de água","501",NA
"e estimular e promover o uso racional de água na irrigação agrícola.","501",NA
"Proposta 97: Coleta e Tratamento de Esgoto",NA,NA
"Situação: Metade da população brasileira não tem acesso a rede de esgoto, atingindo 94 milhões de brasileiros.","411",NA
"Há, ainda, mais de 8 milhões de brasileiros que sequer têm banheiro em casa.","411",NA
"A situação do saneamento nas zonas rurais brasileiras é ainda pior: segundo os dados do PNUD, 76,9% da população rural não têm acesso a esgotamento sanitário adequado.","411",NA
"Pela ótima domiciliar, apenas 44% dos domicílios têm acesso à rede geral de esgoto (2008), sendo que o DF (86,3%), SP (82,1%), e MG (68,9%) são os únicos com mais de 50%.","411",NA
"As menores coberturas são Amapá (3,5%), Pará (1,7%) e Rondônia (1,6%).","411",NA
"Volume tratado representava 68,8% do total coletado no país.","411",NA
"A média anual dos investimentos nos últimos oito anos em saneamento básico foi de R$ 3,9 bilhões.","411",NA
"Neste ritmo somente será possível universalizar os serviços de atendimento básico de 64,8 anos.","411",NA
"A necessidade de reverter este quadro implica um investimento total de R$ 252,9 bilhões para alcançar a universalização.","411",NA
"O volume anual médio de investimentos para universalizar o acesso aos serviços de saneamento básico deve estar em R$ 12,6 bilhões, tendo como meta os próximos 20 anos.","411",NA
"Tal investimento possibilitará atingir a meta de promover a inclusão de 30 milhões de pessoas com rede de coleta e tratamento de esgoto nos próximos quatro anos.","411",NA
"Ações:",NA,NA
"Duplicar a média de investimentos no setor nos próximos quatro anos;","411",NA
"Expandir a coleta de esgoto nas regiões metropolitanas para 80% dos domicílios, com tratamento de 70% do esgoto coletado, até 2014;","411",NA
"Fortalecer as empresas estaduais e municipais de saneamento básico, dando-lhe condição de obter recursos para investir nos sistemas sob sua responsabilidade.","411",NA
"Proposta 98: Política Nacional de Resíduos Sólidos",NA,NA
"Situação: O marco legal que institui a Política Nacional de Resíduos Sólidos foi, finalmente, definido com a Lei n º 12.305, de 2 de agosto de 2010.","000",NA
"Os principais instrumentos instituídos pela Lei são os planos de resíduos sólidos, visando estimular o planejamento das ações nesta temática;","000",NA
"os inventários e o sistema declaratório anual de resíduos sólidos para a melhor compreensão e acompanhamento da situação de geração e disposição de resíduos;","000",NA
"a coleta seletiva;","000",NA
"o incentivo à criação e ao desenvolvimento de cooperativas de catadores de materiais reutilizáveis e recicláveis;","402",NA
"o monitoramento e a fiscalização;","000",NA
"a educação ambiental","501",NA
"e os incentivos financeiros.","402",NA
"Ações:",NA,NA
"Regulamentar e implantar a Política Nacional de Resíduos Sólidos ainda em 2011;","000",NA
"Atuar, em parceria com estados e municípios, no combate aos lixões a céu aberto;","501",NA
"Dar suporte financeiro e técnico aos municípios para (1) elaboração dos planos de resíduos sólidos, (2) para a formação dos consórcios regionais e (3) para a efetiva implantação dos aterros sanitários ou solução aplicável;","000",NA
"Investir na coleta seletiva;","000",NA
"Implantar mecanismos de gerenciamento de resíduos, gestão integrada, reciclagem, rejeitos, responsabilidade compartilhada, reutilização e serviço público de limpeza urbana;","000",NA
"Estimular e criar mecanismos para a reutilização do metano dos aterros sanitários, como uma eficiente fonte energética – o biogás, associando a obtenção dos créditos de carbono das emissões evitadas dos gases causadores do efeito estufa;","501",NA
"Desenvolver modelos de parcerias público-privadas que permitam a participação do setor privado no setor de resíduos sólidos.","000",NA
"Tema 17: SAÚDE",NA,NA
"O Sistema Único de Saúde (SUS) completou duas décadas, desde quando estabelecido na Constituição de 1988 e foi definitivamente consolidado durante a gestão de José Serra à frente do Ministério da Saúde.","504",NA
"Fortaleceuse a integração entre União, Estados e Municípios e maiores recursos foram carreados para o setor.","504",NA
"O Programa Saúde da Família ampliou fortemente a atenção básica em todo o Brasil","504",NA
"e, no setor hospitalar, prestigiou com parcerias as entidades filantrópicas sérias, facilitando o financiamento das Santas Casas.","504",NA
"Junto com a Pastoral da Saúde, o Ministério apoiou o trabalho comunitário e, com as entidades médicas, organizou os mutirões,","504",NA
"ampliou as campanhas de vacinação","504",NA
"e a assistência às pessoas com deficiência.","504",NA
"Caíram os custos dos medicamentos, com a entrada do ‘genérico’ na farmacologia nacional.","504",NA
"O Brasil enfrentou com sucesso a barreira das patentes na Organização Mundial do Comércio,","601.1",NA
"realizando a melhor campanha contra a AIDS do mundo em desenvolvimento.","504",NA
"Com empenho pessoal do então Ministro José Serra, cerceou o abuso do incentivo ao cigarro e ao tabaco em geral, luta que levou adiante no governo de São Paulo, com a exemplar lei de proibição do fumo, seguida posteriormente pela maioria dos Estados.","000",NA
"Mas o atendimento à saúde estagnou, ou pouco avançou, no atual governo federal.","504",NA
"Basta percorrer os vários campos da saúde pública para comprovar que o Brasil pode mais na saúde.","504",NA
"Inexiste um plano estratégico do Ministério da Saúde, reduzindo sua importância como gestor nacional do SUS.","504",NA
"Falta coordenação técnica e administrativa.","303",NA
"Proposta 99: Emenda Constitucional 29",NA,NA
"Situação: O Brasil gasta com saúde 8% do PIB, sendo que as despesas públicas representam cerca de 45% do total, o que equivale a apenas 350 dólares per capita.","504",NA
"Este percentual é menor que o gasto de países como Argentina, Portugal e Espanha e, o que é mais grave, o percentual público na despesa total com saúde no Brasil é inferior àquele observado em países com sistema universal.","504",NA
"Com o empenho político de Serra, foi possível a aprovação da Emenda Constitucional nº 29, em 2000, que representou uma importante conquista da sociedade para a construção do SUS, pois estabeleceu a vinculação de recursos nas três esferas de governo para um processo de financiamento mais estável.","504",NA
"Entretanto, o atual governo não regulamentou a Emenda através de lei específica, impedindo canalizar mais recursos para a saúde no País.","504",NA
"Ações:",NA,NA
"Promover a imediata regulamentação da Emenda Constitucional nº 29/2000, cujo PL está parado no Congresso Nacional;","203",NA
"Elevar o investimento na saúde para cerca de R$ 12 bilhões em quatro anos;","504",NA
"Realizar um decidido projeto de qualificação de gestores da saúde;","504",NA
"Retomar o projeto de profissionalização da gerência hospitalar, dos Centros Colaboradores e as pesquisas de avaliação de qualidade dos hospitais.","504",NA
"Proposta 100: Atenção Primária à Saúde",NA,NA
"Situação: Nos diversos países com sistemas de saúde de caráter universal, a Atenção Primária à Saúde (APS) está na agenda de prioridades dos governos como forma de enfrentar a fragmentação dos sistemas de saúde, a super especialização e o uso abusivo de tecnologias.","504",NA
"Enquanto Ministro da Saúde, José Serra reconheceu a proposta do Programa de Saúde da Família (PSF) e o retirou da condição de projeto piloto, transformando-o em uma política pública prioritária.","504",NA
"Quando Serra assumiu o Ministério da Saúde encontrou apenas 1.843 Equipes de Saúde da Família e quando saiu eram 14 mil equipes.","504",NA
"Na atuação gestão, esta política foi ampliada, mas se preocupando apenas com a ampliação da quantidade de equipes para o programa, deixando de lado a qualidade do atendimento e a composição das equipes, com muitas incompletas, sem médicos e enfermeiros.","504",NA
"Ações: Sempre em parceria com os Estados e Municípios:","301",NA
"Criar a Carreira dos Profissionais da Atenção Primária à Saúde;","506",NA
"Garantir a presença de médico em cada Equipe de Saúde da Família;","504",NA
"Ampliar a equipe com inclusão de psicólogo, farmacêutico, nutricionista e fisioterapeuta ou educador físico;","504",NA
"Garantir que as unidades básicas de saúde sejam bem construídas, equipadas e com instalações adequadas;","411",NA
"Informatizar todas as unidades básicas de saúde, com conexão de internet, possibilitando a marcação de exames e consultas especializados online, em outras unidades da região;","504",NA
"Ampliar o acesso a serviços diagnósticos e atendimentos ambulatoriais especializados marcados pela unidade básica;","504",NA
"Dar atenção adequada às pessoas com distúrbios mentais e aos portadores de doenças crônicas tais como diabetes e/ou hipertensão arterial, inclusive com a busca ativa de casos não diagnosticados, alcançando, até o final do governo, pelo menos 80% de pessoas diagnosticadas e em tratamento;","504",NA
"Ampliar e qualificar o Programa Nacional de Imunização (PNI) com a redução da heterogeneidade de cobertura vacinal e a inclusão de novas vacinas;","504",NA
"Fornecer tratamento adequado a todos os pacientes portadores de tuberculose e hanseníase, alcançando, em quatro anos, menos de 1 caso de hanseníase por 10 mil habitantes em todos os estados;","504",NA
"Detectar, no mínimo, 70% dos casos de tuberculose e curar 85% deles;","504",NA
"Assegurar atenção integral à saúde bucal.","504",NA
"Proposta 101: Policlínicas",NA,NA
"Situação: Um dos mais graves problemas enfrentados pela população é a dificuldade em conseguir uma consulta, exame ou tratamento especializados.","504",NA
"Muitas vezes para conseguir acesso a esses serviços de saúde, a população precisa se deslocar para municípios distantes, com despesas caras e sem apoio da família nem do governo.","504",NA
"A política de implantação de Policlínicas foi executada por José Serra enquanto Governador do Estado de São Paulo, as AME’s – Ambulatório Médico de Especialidades, sendo considerados um novo modelo de assistência ambulatorial com diagnóstico que veio para fortalecer a rede de atendimento à saúde.","504",NA
"Trata-se de um centro ambulatorial com diagnóstico rápido e eficiente, onde o paciente passa por consulta única e exames em modernos equipamentos no mesmo dia, além de orientação terapêutica em especialidades médicas, com ênfase nas necessidades da rede básica.","504",NA
"Até a criação dos AME’s, as pessoas passavam em determinado dia por consulta, agendando exames e retorno para outras datas, nos hospitais gerais e universitários.","504",NA
"O atendimento, na maioria das vezes, era demorado.","504",NA
"Com os AME’s, a tendência é que o atendimento seja acelerado e os hospitais possam priorizar as internações e cirurgias urgentes.","504",NA
"José Serra já entregou 32 e oito estão em fase final de construção, tendo como meta, 40 AMEs.","504",NA
"Ações:",NA,NA
"Construir 154 Policlínicas, as Clínicas Regionais de Especialidades Médicas (CREM), distribuídas em todo o território nacional;","504",NA
"Ofertar serviços especializados em saúde mental, em articulação com a Atenção Primária à Saúde -APS;","504",NA
"Ofertar atenção especializada à população idosa, em articulação com a APS e outras áreas de governo.","504",NA
"Proposta 102: Acesso a Medicamentos",NA,NA
"Situação: Um dos principais desafios do sistema de saúde SUS no Brasil se refere à ampliação do acesso aos serviços de saúde combinados com os avanços tecnológicos na área de produção de medicamentos.","504",NA
"O atual programa federal nesta área é o Farmácia Popular.","504",NA
"A lista de medicamentos do Farmácia Popular 1 contém 106 itens, distribuídos em unidades do SUS.","504",NA
"Entretanto os remédios distribuídos pelo atual Farmácia Popular 2 se restringem a apenas 15 tipos de medicamentos.","504",NA
"E graças a Lei de Genéricos implantada por José Serra, os gastos reais em medicamentos foi reduzido consideravelmente.","504",NA
"Para os produtos mais comumente usados, sem a política de genéricos, o preço seria de R$ 234,00/mês ou R$2.808,00/ano.","504",NA
"Com os genéricos, o gasto com estes mesmos produtos é de R$73,50/mês ou R$882,00/ano, ou seja, uma economia de R$1.926,00/ano.","504",NA
"Ações:",NA,NA
"Ampliar a oferta de medicamentos da Farmácia Popular 2 para contemplar toda a Relação nacional de Medicamentos (RENAME), em especial para atendimento à saúde da mulher, do idoso e da saúde mental;","504",NA
"Atualizar a lista de medicamentos para doenças de alta complexidade em parceria com as sociedades médicas mediante protocolos padronizados para todo o país;","504",NA
"Implantar o desconto integral de imposto de renda das despesas com medicamentos para todos os portadores de doenças crônicas;","504",NA
"Implantar o desconto do imposto de renda das despesas com planos privados de assistência farmacêutica, nos moldes dos planos de saúde;","504",NA
"Aprimorar as políticas de regulação de preços de medicamentos ao consumidor","412",NA
"e reduzir os impostos sobre eles incidentes;","403",NA
"Em parceria com Estados e Municípios, promover a entrega em domicílio dos medicamentos de uso contínuo para o diabetes, hipertensão arterial e para os pacientes idosos;","504",NA
"Retomar a política de produção de medicamentos genéricos de forma a estabelecer mecanismos tecnicamente adequados à produção de produtos biológicos genéricos, em especial para vacinas e produtos para tratamento de câncer;","504",NA
"Apoiar os laboratórios oficiais para a produção de medicamentos genéricos,","413",NA
"como forma de reduzir o custo e aumentar o acesso da população a medicamentos;","504",NA
"Fortalecer e ampliar o complexo produtivo da Saúde no Brasil,","410",NA
"investindo no desenvolvimento de uma política de ciência, tecnologia e inovação","411",NA
"e no fortalecimento da indústria farmacêutica nacional","410",NA
"e dos laboratórios farmacêuticos oficiais;","413",NA
"Adotar as medidas necessárias para propiciar ao Brasil autonomia quanto ao domínio da tecnologia e na produção de hemoderivados.","411",NA
"Proposta 103: Programa Nacional de Combate ao Câncer",NA,NA
"Situação: Em relação ao câncer, assiste-se no cotidiano longas esperas na execução de exames ou mesmo tratamento para o paciente já diagnosticado.","504",NA
"A literatura médica está repleta de trabalhos que sinalizam grave mudança de prognóstico quando o tratamento é postergado.","504",NA
"A espera de 60 (sessenta) ou 90 (noventa) dias, para alguns tumores, pode ocasionar a perda da oportunidade de cura ou mesmo reduzir a sobrevida.","504",NA
"Combate deve ser entendido pela associação de diagnóstico preventivo e tratamento.","504",NA
"O termo câncer é utilizado genericamente para representar um conjunto de mais de 100 doenças, incluindo tumores malignos de diferentes localizações.","000",NA
"Importante causa de doença e morte no Brasil, desde 2003, as neoplasias malignas constituem-se na segunda causa de morte na população, representando quase 17% dos óbitos de causa conhecida, notificados em 2007 no Sistema de Informações sobre Mortalidade.","000",NA
"O câncer de pulmão é o tipo mais comum de câncer no mundo.","000",NA
"Segundo a última estimativa mundial, ocorreram 1.200.000 casos novos no ano de 2000, sendo 52% em países desenvolvidos.","000",NA
"O padrão da ocorrência desse tipo de neoplasia é determinado por um passado de grande exposição ao tabagismo.","000",NA
"Em países ou regiões onde existe uma longa história de consumo de tabaco, cerca de 90% dos casos de câncer de pulmão em homens estão relacionados ao hábito de fumar.","000",NA
"O número de casos novos de câncer de pulmão estimado para o Brasil no ano de 2010 é de 17.800 entre homens e de 9.830 nas mulheres.","000",NA
"Estes valores correspondem a um risco estimado de 18 casos novos a cada 100 mil homens e 10 para cada 100 mil mulheres.","000",NA
"O câncer de estômago também é muito frequente, principalmente em homens.","000",NA
"O número de casos novos de câncer de estômago estimado para o país no ano de 2010 é de 13.820 entre homens e de 7.680 nas mulheres, correspondente a um risco estimado de 14 casos novos a cada 100 mil homens e 8 para cada 100 mil mulheres.","000",NA
"E o número de casos novos de câncer de próstata estimado no ano de 2010 é de 52.350, correspondendo a um risco estimado de 54 casos novos a cada 100 mil homens.","000",NA
"Infelizmente os números para os outros tipos de câncer, como de pele, cólon e reto possuem uma situação tão dramática quanto a descrita acima.","000",NA
"Ações:",NA,NA
"Implantar a Política Nacional de Atenção Oncológica;","504",NA
"Implementar o Plano de Ação para o Controle dos Cânceres do Colo do Útero e da Mama;","504",NA
"Garantir o fim da espera para o diagnóstico e o tratamento do câncer, em especial do colo uterino, de mama, da próstata, de pulmão, do estômago, da pele e de boca;","504",NA
"Garantir o acesso aos métodos diagnósticos e de tratamento, inclusive aos novos medicamentos que se mostrarem efetivos;","504",NA
"Garantir o acesso anual a mamografia para todas as mulheres com mais de 40 anos","504",NA
"e assegurar o exame papanicolau a todas as mulheres com vida sexual ativa;","504",NA
"Investir em hospitais públicos e filantrópicos, com prioridade na superação do déficit de equipamentos de radioterapia, especialmente necessários para tratamento do câncer.","504",NA
"Proposta 104: Saúde Integral da Mulher",NA,NA
"Situação: As mulheres são a maioria da população brasileira e as principais usuárias do Sistema Único de Saúde (SUS).","504",NA
"Verifica-se que as mulheres vivem mais do que os homens, porém adoecem mais frequentemente.","000",NA
"A vulnerabilidade feminina frente a certas doenças e causas de morte está mais relacionada com a situação de discriminação na sociedade do que com fatores biológicos.","503",NA
"Oferecer a melhor assistência à saúde da mulher em todas as fases de sua vida deve ser uma atuação constante do poder público, por meio da excelência dos serviços prestados.","504",NA
"Dados da última Pnad revelam que 25,3% das mulheres com mais de 40 anos, nunca fizeram uma mamografia.","504",NA
"Entre as com renda maior do que cinco salários-mínimos, apenas 18,9% nunca fizeram esse exame, porém, entre as de renda inferior a 1/4 do salário-mínimo, esse percentual atinge 71,2%.","504",NA
"O câncer de mama é o segundo tipo de câncer mais frequente no mundo e o mais comum entre as mulheres.","000",NA
"A cada ano, cerca de 22% dos casos novos de câncer em mulheres são de mama.","000",NA
"Há um risco estimado de 49 casos a cada 100 mil mulheres.","000",NA
"Ações:",NA,NA
"Resgatar e implementar a Política Nacional de Atenção Integral à Saúde da Mulher, que foi construída com a participação do movimento organizado de mulheres, com a incorporação do enfoque de gênero, recorte de raça e etnia;","504",NA
"Estabelecer a Política Nacional de Atenção à Saúde nas Situações de Violência Doméstica e Familiar, cumprindo as atribuições previstas na Lei Federal 11.340/2006 – Lei Maria da Penha;","504",NA
"Garantir acesso aos métodos contraceptivos;","604",NA
"Viabilizar a transferência de tecnologia para a produção na FIOCRUZ ou no Instituto Butantã, da vacina contra HPV","411",NA
"com vistas à sua inclusão no Programa Nacional de Imunização.","504",NA
"Proposta 105: Fila Zero para Internações e Cirurgias",NA,NA
"Situação: Houve nas últimas décadas a obtenção de um grande avanço quanto à universalização da atenção à saúde","504",NA
"alcançada principalmente em função do forte processo de descentralização que promoveu a presença dos municípios na saúde.","301",NA
"No entanto, são amplamente conhecidas, as grandes dificuldades enfrentadas pela população no acesso à internação hospitalar, particularmente em Unidade de Terapia Intensiva e na realização de cirurgias eletivas.","504",NA
"Ações: Em parceria com Estados e Municípios:","301",NA
"Reformar e/ou ampliar e equipar os hospitais públicos e filantrópicos;","504",NA
"Construir 100 novos hospitais regionais, visando eliminar a carência de leitos no País, até 2014;","504",NA
"Ampliar a oferta de leitos de retaguarda para pacientes de longa permanência;","504",NA
"Melhorar a qualidade dos hospitais psiquiátricos","504",NA
"e incentivar leitos de psiquiatria em hospitais gerais;","504",NA
"Apoiar a criação de Centros de Excelência Hospitalar, tendo por referência os hospitais universitários e de ensino, em especial nas Regiões Norte, Nordeste e Centro Oeste;","504",NA
"Realizar investimentos para, ao final de quatro anos, zerar o déficit de leitos de UTI geral, pediátrico e neonatal.","504",NA
"Proposta 106: Mutirões da Saúde",NA,NA
"Situação: Enquanto Ministro da Saúde, José Serra, sabendo das dificuldades da população para ter acesso à realização de cirurgias eletivas inovou, ao propor aos médicos brasileiros a realização, com grande sucesso, de mutirões de cirurgias de catarata, com a participação de diversos parceiros, com um grande contingente de prestadores de serviços e a mobilização de um grande número de oftalmologistas em todo o País, beneficiando mais de 1 milhão e 200 mil pessoas.","504",NA
"A realização de mutirões de cirurgias de varizes, beneficiaram aproximadamente 280 mil pessoas.","504",NA
"Os mutirões de cirurgia de próstata, em quatro anos, beneficiaram mais de 160 mil homens com uma média anual de aproximadamente 40 mil cirurgias e que antes dos mutirões o numero de cirurgias anuais era em média de 28 mil.","504",NA
"Durante a atual gestão os mutirões não fizeram mais parte do escopo de atuação, prejudicando, ainda mais, a população sem atendimento médico.","504",NA
"Em caráter emergencial, os mutirões devem ser retomados, tendo por base aqueles serviços com maior deficiência.","504",NA
"Ações:",NA,NA
"Retomar mutirões da Saúde, em parceria com os estados, municípios, hospitais filantrópicos e as entidades médicas e de enfermagem;","504",NA
"Realizar, no primeiro ano de governo, mutirões de cirurgias eletivas;","504",NA
"Implementar, em caráter de emergência, mutirões para reduzir as filas de espera na realização de exames, consultas e tratamentos especializados.","504",NA
"Proposta 107: Sistema Nacional de Transplantes",NA,NA
"Situação: José Serra, quando Ministro da Saúde, transformou a Lei dos Transplantes, que acabava de ser aprovada, em um Sistema Nacional de Transplantes de sucesso reconhecido por todos.","504",NA
"A política nacional de transplantes de órgãos e tecidos foi instituída pelas Leis nº 9.434/97 e nº 10.211/01, mas após a definição destes marcos legais durante o governo Fernando Henrique Cardoso, pouco se avançou na atual gestão.","504",NA
"Ações:",NA,NA
"Investir no aumento do número de transplantes e de serviços que os realizam;","504",NA
"Investir em treinamento de profissionais,","506",NA
"em campanhas publicitárias para a captação de órgãos,","504",NA
"na qualificação dos serviços hospitalares","504",NA
