"text","cmp_code","eu_code"
"Somente em maio de 2010 a Secretaria Especial de Portos decidiu criar um programa para melhorar o desempenho na entrada e saída dos navios.","303",NA
"Apesar da imensa carência na área de portos, o Mapeamento IPEA de Obras Portuárias de 2009 aponta que das 265 obras identificadas como indispensáveis para acabar com os gargalos no setor, somente 51 estão previstas no PAC.","411",NA
"A maior demanda identificada no estudo do IPEA, em número de obras e também em valor orçado, refere-se à necessidade de construção e manutenção de áreas, retro áreas, berços, pátios, píeres, molhes e cais dos portos.","411",NA
"Dentre estes, o maior valor orçado refere-se às deficiências relativas a pátios e terminais, que, por si só, totalizam R$ 7,35 bilhões em investimentos necessários.","411",NA
"A burocracia ainda coloca o Brasil na 61ª pior posição no ranking do Banco Mundial de tempo para liberação da entrada e saída de navios nos portos, com 5,8 dias, enquanto na China o tempo é de 0,4 dias, na Alemanha 0,7 dias e nos Estados Unidos 1,1 dias.","303",NA
"Hoje, no Porto de Santos, os órgãos brasileiros exigem 935 informações em 116 formulários a ser entregues, para um navio atracar em um porto no país.","303",NA
"Finalmente, as alfândegas e as inspeções sanitárias só em casos especiais funcionam 24 horas por dia, 7 dias por semana.","303",NA
"Ações:",NA,NA
"1. Retomar as reformas portuárias impulsionadas pela ""Lei dos Portos"" a partir de 1993.","411",NA
"Nesse sentido: Descentralizar o processo decisório e fortalecer as respectivas Autoridades Portuárias e Conselhos de Autoridade Portuária.","303",NA
"Harmonizar, nacional e localmente, a atuação dos diversos ministérios e das diversas autoridades com atribuições institucionais sobre os portos; prioritariamente no tocante ao fluxo documental e às normas;","303",NA
"Estabelecer um ambiente transparente e previsível para a retomada dos investimentos da iniciativa privada no sistema portuário brasileiro;","411",NA
"Estimular a concorrência interportuária e, onde cabível, também a intraportuária; sempre em bases isonômicas;","303",NA
"2. Além de um plano nacional com as macro-diretrizes, estabelecer, para cada porto, um Plano Diretor abrangendo todas as funções portuárias, nelas incluindo aquelas da relação porto-cidade e, particularmente os acessos priorizando as ferrovias, dutovias e hidrovias;","303",NA
"3. Modernizar e desburocratizar os portos, reduzindo os gargalos físicos, operacionais e institucionais;","411",NA
"4. Reduzir os trâmites de desembaraço de portos, criando instrumentos para a atuação harmônica;","303",NA
"5. Recuperar a aplicabilidade dos princípios da Lei 8.630/93 (Lei de Modernização Portuária) em especial quanto a descentralização da administração portuária;","411",NA
"6. Despolitizar e atuar no fortalecimento da capacidade de gestão das Companhias Docas;","304",NA
"7. Fortalecer o financiamento de projetos de dragagem dos canais portuários, de modo a torná-los efetivos;","411",NA
"8. Criar instrumentos legais que garantam a profissionalização e meritocracia para os dirigentes das empresas","304",NA
"e rever as relações trabalhistas;","701",NA
"9. Implementar programas de requalificação e de formação de mão de obra, especialmente considerando as novas demandas decorrentes da exploração de petróleo & gás na plataforma continental e do crescimento da cabotagem;","411",NA
"10. Atrair novos recursos e incentivar as parcerias público-privadas.","411",NA
"Proposta 65: Expansão do Setor Aéreo",NA,NA
"Situação: O governo Lula pouco fez para solucionar os problemas estruturais do setor aéreo nacional.","411",NA
"Basta fazer um voo regular para constatar o sofrimento com o tempo gasto no acesso ao aeroporto, extensas filas nos balcões de “check in” e na passagem pelos portais de raio X, atrasos de voos, troca de locais de embarque, desembaraço de bagagem, informações desencontradas.","411",NA
"Qualquer evento não previsto potencializa as deficiências estruturais, prejudicando os usuários.","411",NA
"O crescimento da economia e a popularização do transporte aéreo aguçaram as consequências da atuação desordenada e da falta de investimentos no setor.","411",NA
"Trata-se se um verdadeiro “apagão aéreo”, causado não apenas pela falta de infraestrutura aeroportuária (pistas, pátios e aeroportos)","411",NA
"e aeroviária (sistemas de proteção ao voo e de controle do espaço aéreo),","411",NA
"mas também por sérias deficiências de gestão.","303",NA
"Os aeroportos brasileiros já movimentam mais de 115 milhões de passageiros por ano, e em 2009, 19 dos 20 principais aeroportos do país já apresentavam gargalos, segundo estudos do próprio governo federal.","411",NA
"Este iminente colapso se acentua com a perspectiva de aumento de demanda, inclusive a decorrente da Copa das Confederações, (2013), da Copa do Mundo, (2014) e dos Jogos Olímpicos, (2016).","411",NA
"A atuação improvisada e descoordenada na condução da crise aérea impede que se planeje e implemente soluções estruturais.","303",NA
"Os muitos órgãos de governo que atuam no setor aéreo vivem uma situação de irresponsabilidade e descoordenação, em completa confusão sobre as funções de definir políticas, de regular serviços e contratos e ainda de gerenciar a infraestrutura.","303",NA
"O aparelhamento político da Infraero é um exemplo disso.","304",NA
"Ações:",NA,NA
"Investir imediatamente, com recursos do Tesouro, no equacionamento dos problemas mais urgentes, seja de pistas, terminais ou pátios, especialmente Goiânia, Florianópolis, Cuiabá, Porto Alegre e Brasília, onde a relação entre o número de passageiros e a capacidade dos terminais já foi extrapolada em mais de 20%;","411",NA
"No curto prazo, realizar melhorias de gestão e de organização interna dos aeroportos, definindo metas para a redução do número de atrasos e para a segurança e bem estar dos passageiros.","411",NA
"Para isso, é importante despolitizar a gestão da INFRAERO, dando-lhe capacidade de planejamento e autonomia,","304",NA
"desvinculando-a dos interesses político-partidários imediatos, evitando a dispersão de recursos;","304",NA
"Dinamizar e modernizar os aeroportos para o atendimento da demanda de passageiros e cargas e garantindo instrumentos para sua atuação harmônica;","411",NA
"Estabelecer comando unificado e clara definição de papéis dentro de cada unidade aeroportuária, aonde atuam entidades públicas e privadas com tarefas distintas (Infraero, Polícia Federal, ANVISA, Receita Federal, Aeronáutica, empresas, ANAC);","411",NA
"Promover revisão abrangente do Código Brasileiro de Aeronáutica, transformando-o em Lei Geral da Aviação Civil;","411",NA
"Reforçar o papel do Conselho Nacional de Aviação Civil -CONAC como formulador de políticas públicas e de diretrizes para o setor, superando sua atual condição de regulador ocasional;","411",NA
"Reestruturar a atuação da Agência Nacional de Aviação Civil (ANAC),","411",NA
"com foco na regulação econômica do mercado, impedindo que seja capturada por interesses partidários","304",NA
"e econômicos,","403",NA
"e garanta a implementação das políticas setoriais definidas pelo CONAC;","411",NA
"Desenvolver um sistema articulado de planejamento para o setor aéreo, abrangendo a Secretaria de Aviação Civil, o Comando da Aeronáutica, DECEA, INFRAERO, ANAC e empresas aéreas;","411",NA
"Envolver os estados no planejamento do setor,","301",NA
"uma vez que as infraestruturas aeroportuárias são indutoras do desenvolvimento regional;","411",NA
"Definir políticas visando o reequilíbrio da participação da bandeira nacional nos voos internacionais;","411",NA
"Definir claramente as prioridades para os aeroportos aglutinadores – garantindo polos (hubs) para a América do Sul e para voos domésticos: Guarulhos, Congonhas, Brasília e Manaus (este especialmente para cargas);","411",NA
"Garantir condições de controle do tráfego aéreo, inclusive cuidando das condições de trabalho","701",NA
"e da formação de recursos humanos;","411",NA
"Estabelecer política abrangente de suporte a aviação regional, para atendimento tanto às fronteiras econômicas, como às regiões remotas e carentes.","411",NA
"Proposta 66: Rodovias da Vida",NA,NA
"Situação: O número de acidentes em rodovias federais cresceu entre 2004 e 2008, 23,4%, chegando a 138.802.","000",NA
"No Carnaval de 2010, no período de 5 dias, foram 1912 feridos e 143 mortos, uma média de quase 29 mortos por dia.","000",NA
"O número de vítimas fatais subiu em 13% se comparado com o Carnaval de 2009.","000",NA
"Segundo o DNIT já morreram 3329 pessoas nas rodovias federais, no primeiro semestre de 2010; 22% a mais que o mesmo período de 2009.","000",NA
"Muitas rodovias se transformaram em “rodovias da morte”.","000",NA
"Os dados comprovam que 77% das rodovias federais estão em estado regular, ruim ou péssimo.","411",NA
"Ações:",NA,NA
"Investir e restaurar estradas federais como um todo, considerando que atualmente são poucas as que estão em condições sequer razoáveis;","411",NA
"Garantir que receitas auferidas com as concessões das estradas sejam reinvestidas na melhoria de estradas secundárias ou não pedagiadas;","411",NA
"Incentivar as parcerias público privadas (PPP), em regiões onde haja um baixo fluxo de veículos, para reduzir custos de frete ou facilitar a mobilidade de pessoas;","411",NA
"Apoiar financeiramente a adequação e recuperação das estradas rurais de terra,","411",NA
"principalmente aquelas responsáveis pelo escoamento da produção agrícola;","703.1",NA
"Cessar o desvio de recursos da CIDE Combustível","304",NA
"e investi-los na infraestrutura de rodovias;","411",NA
"Retomar a capacidade do DNIT de planejar","303",NA
"e despolitizá-lo.","304",NA
"Proposta 67: Trens para o Brasil",NA,NA
"Situação: O transporte ferroviário exige alta intensidade de inversão de capital fixo representado pelo arrendamento da malha e dos terminais – quando eles são operados pelo setor privado, como no Brasil – e elevado volume de capital imobilizado, com a compra de material rodante.","408",NA
"Sua importância econômica na competição com outros modos, especialmente com o rodoviário está associada aos custos variáveis (mão de obra, combustível e energia) que são relativamente baixos, tornando-o adequado para o transporte de mercadorias de baixo valor agregado e com grande peso e volume específico.","408",NA
"O atual marco regulatório do setor ferroviário brasileiro surgiu com a extinção da RFFSA e consolidou-se com a concessão das principais ferrovias nacionais às empresas privadas.","401",NA
"As concessões de ferrovias à iniciativa privada, que ocorreram na segunda metade da década de 1990, apresentaram resultados positivos em termos de investimentos e produção ferroviária.","401",NA
"Os investimentos realizados pelas concessionárias somaram R$ 14,6 bilhões, a valores constantes de 2008, entre os anos de 2000 e 2008.","401",NA
"A produção ferroviária cresceu 92,7%, passando de 138,9 bilhões de tonelada-quilômetro-útil (TKU) para 267,7 bilhões de TKU, nesse mesmo período.","401",NA
"O volume transportado teve um incremento de 79,6%: em 1999 foram transportadas 256,0 milhões de toneladas úteis (TU) e em 2008 este volume atingiu 459,7 milhões de TU.","401",NA
"O governo federal não enfrentou um dos maiores problemas de logística do país, que é a necessidade da predominância absoluta do modal ferroviário para carga.","411",NA
"A política de transportes do país deve ser tal que oriente o uso do melhor modal para cada carga e cada distancia.","411",NA
"Durante os últimos oito anos o governo federal investiu muito pouco na malha ferroviária,","411",NA
"enfraqueceu as Agências, que têm a obrigação de controlar e regular as concessões,","303",NA
"não criou condições para o investimento privado que pode e deve ampliar o mercado.","402",NA
"Permitiu que as empresas concessionárias agissem como quisessem, sem se preocupar com as necessidades do país.","403",NA
"O resultado é o caos no transporte de cargas por via férrea, com baixíssimos índices de aproveitamento da malha implantada.","411",NA
"O transporte de passageiros por trens praticamente deixou de existir no país.","411",NA
"A construção dos novos trechos da Ferrovia Transnordestina, na área de influência da malha Nordeste concedida à CFN deverá ligar a malha existente aos portos de Suape (PE) e Pecém (CE), para transporte de grãos, fertilizantes e minérios do Oeste Baiano, do Sul do Maranhão e do Sudoeste do Piauí, para os Portos localizados no Ceará e em Pernambuco.","411",NA
"As obras, embora incluídas no PAC, estão muito atrasadas.","411",NA
"Foram iniciados apenas os trechos entre Salgueiro e Missão Velha, Salgueiro e Trindade e metade do trecho até Caruaru, além do trecho de Cabo ate Porto Real do Colégio.","411",NA
"Os demais ainda estão apenas em projeto.","411",NA
"Ações:",NA,NA
"1. Instituir um Plano Nacional de Transporte Ferroviário: Logística e Transporte para Cargas e Passageiros, visando garantir e articular investimentos públicos e privados que mudarão a matriz nacional de transportes.","411",NA
"Este plano deverá incluir: Uma escolha de tecnologia e de padrão de trens que permita o uso compartilhado da mesma infraestrutura para passageiros e para carga geral.","411",NA
"Não se trata das cargas mais pesadas (minérios, aço, etc.), mas de carga de abastecimento e de serviços das cidades e suas regiões;","411",NA
"Otimizar os percursos já existentes, reativadas linhas abandonadas, utilizadas faixas ferroviárias já disponíveis,","411",NA
"mas, principalmente criadas novas linhas;","411",NA
"Eliminar os gargalos tributários e concorrenciais entre as empresas concessionadas;","402",NA
"No que se refere ao transporte de carga, os contratos existentes serão respeitados buscando, em entendimento com as concessionárias, a melhoria expressiva do que hoje vem sendo praticado.","411",NA
"Será aperfeiçoado o mecanismo de “direito de passagem” nas ferrovias, de tal forma que se possa intensificar o uso da infraestrutura instalada e a se instalar;","411",NA
"Promover investimentos em áreas já concessionadas.","402",NA
"2. Avançar na regulamentação da integração da malha ferroviária, tornando esta forma de transporte a predominante no escoamento das principais commodities para exportação;","411",NA
"3. Aumentar a concorrência intramodal no setor de ferrovias","411",NA
"e estudar concessões para operadoras ferroviárias,","402",NA
"que sejam autorizadas a utilizar a infraestrutura de trilhos já existentes, para o oferecimento de melhores serviços e atendendo as demandas e fluxos;","411",NA
"4. Destinar recursos para a implantação e ampliação de novos ramais ferroviários e novas linhas;","411",NA
"5. Finalizar as obras da Ferrovia Transnordestina até 2014;","411",NA
"6. Incluir no traçado da Ferrovia Transnordestina dois novos trechos: a) a ligação de Eliseu Martins (PI), passando pelo estado do Piauí, até encontrar a EF Norte-Sul, e por consequência a EF Carajás;","411",NA
"b) a Ligação de Salgueiro (PE) até Petrolina (PE).","411",NA
"7. Ampliar a Ferrovia Norte – Sul, projetada com uma extensão de 1.550 km, entre Açailândia (MA) e Anápolis (GO).","411",NA
"Essa ferrovia fará importante para ligação ao norte, em Açailândia, com a Estrada de Ferro Carajás (EFC), permitindo acesso ao Porto de Itaqui, em São Luis (MA), em bitola larga, e faz ligação ao sul, em Anápolis (GO), com a Ferrovia Centro Atlântica (FCA), esta em bitola métrica;","411",NA
"8. Implantar novo trecho Variante Litorânea Sul, que ligará Vitória a Cachoeiro de Itapemirim, passando por Guarapari (Porto de Ubu) e Anchieta.","411",NA
"Este trecho permitirá um aumento no transporte de carga superior a 13 milhões de toneladas por ano, pois o atual trajeto, por passar pela região serrana do Estado, tem limitada capacidade de cargas (0,6 toneladas por ano).","411",NA
"Os benefícios imediatos esperados dessa ampliação serão sentidos em Guarapari, já que o aumento de carga possibilitará o Porto Ubu se tornar um novo polo industrial capixaba.","411",NA
"Tema 12: MEIO AMBIENTE",NA,NA
"A agenda ambiental não representa uma ameaça ao crescimento da economia.","416.2",NA
"Pelo contrário.","416.2",NA
"Contando com o ativismo do Estado, e graças ao enorme potencial das energias renováveis do País, excelentes oportunidades surgem para o desenvolvimento sustentável brasileiro.","416.2",NA
"Abrese a chance para se construir uma nova economia verde, erigida sob novos conceitos de produção e consumo.","501",NA
"O Brasil só tem a ganhar nesse processo, tornando-se uma potência ambiental mundial.","601.1",NA
"A Política Nacional do Meio Ambiente é instituída pela Lei Federal nº 6.938/1981, que tem por objetivo a preservação, a melhoria e a recuperação da qualidade de vida,","501",NA
"visando assegurar, no país, condições ao desenvolvimento socioeconômico,","416.2",NA
"aos interesses da segurança nacional","000",NA
"e à proteção da dignidade da vida humana.","503",NA
"Proposta 68: Código Florestal",NA,NA
"Situação: O Código Florestal foi instituído em 1965","501",NA
"e, de lá para cá, a tecnologia da agropecuária se modernizou,","411",NA
"permitindo o aprimoramento da legislação.","501",NA
"O assunto do novo Código Florestal, porém, se tornou altamente polêmico, em decorrência da inépcia governamental.","305.1",NA
"Há como avançar na proteção ambiental","501",NA
"respeitando os produtores rurais, sem atrapalhar a produção no campo.","703.1",NA
"Ações:",NA,NA
"Modernizar o Código Florestal para facilitar a recuperação das áreas degradadas","501",NA
"e consolidar a agricultura já existente, desde que com critérios socioambientais;","703.1",NA
"Permitir a utilização de sistemas agroflorestais que combinem culturas com espécies arbóreas, inclusive exóticas, para facilitar a recuperação de áreas degradadas;","501",NA
"Realizar a compensação de passivo ambiental noutro local, fora da propriedade, mesmo ultrapassando o território do Estado quando houver identidade de bioma, na mesma bacia hidrográfica;","501",NA
"Incluir a área de preservação permanente (APP) no cômputo da reserva legal (RL) para os agricultores familiares, desde que se firme compromisso de recuperação ambiental com prazo máximo de dez anos;","703.1",NA
"Oferecer aos estados maior capacidade de normatização e execução prática da lei florestal,","301",NA
"estimulando o fortalecimento dos órgãos estaduais e municipais de meio ambiente.","501",NA
"Proposta 69: Moratória do Desmatamento",NA,NA
"Situação: O bioma da Amazônia representa aproximadamente 30% de todas as florestas tropicais remanescentes do mundo e nele se concentra a maioria das florestas tropicais brasileiras.","501",NA
"Mas as ameaças de destruição e degradação ambiental avançam em ritmo acelerado.","501",NA
"Em 1980, o desmatamento na região totalizava cerca de 300 mil km2, o equivalente a 6,0% do território amazônico.","501",NA
"Esse ritmo se intensificou nas décadas seguintes, atingindo 700 mil km2 em agosto de 2005, o que representa 14% da área total da Amazônia legal.","501",NA
"Entretanto, as formações florestais e ecossistemas associados que integram a Mata Atlântica são os mais ameaçados de destruição do Brasil.","501",NA
"Estudos recentes do Ministério do Meio Ambiente apontam a existência de apenas 26,97% de áreas remanescentes com cobertura vegetal nativa no bioma Mata Atlântica, em relação à sua área original.","501",NA
"O Cerrado é o segundo maior bioma da América do Sul, ocupando uma área de 2.036.448 km2 , cerca de 22% do território do país.","501",NA
"Depois da Mata Atlântica, o Cerrado é o bioma brasileiro que mais sofreu alterações com a ocupação humana.","501",NA
"A redução recente no ritmo do desmatamento na Amazônia, que contou com a participação decidida dos municípios, como Paragominas, das entidades ambientalistas e das próprias cadeias produtivas da agropecuária, como o gado de corte e a soja, mostra que o caminho a seguir mistura repressão e fiscalização ambiental com ações parceiras afirmativas de preservação da biodiversidade.","501",NA
"Ações:",NA,NA
"Articular com o setor produtivo rural um prazo de 5 anos para suspensão das licenças de desmatamento, principalmente nos biomas mais críticos, como Amazônia, Cerrado, Mata Atlântica;","501",NA
"Combater o desmatamento","501",NA
"e ampliar a fiscalização ambiental sobre todos os biomas, incluindo a caatinga;","501",NA
"Proteger áreas prioritárias de conservação da biodiversidade da flora e da fauna.","501",NA
"Proposta 70: Pagamento por Serviços Ambientais",NA,NA
"Situação: O pagamento por serviços ambientais representa uma nova e positiva agenda em defesa da biodiversidade.","501",NA
"Milhares de pequenos agricultores poderiam cumprir sua “lição de casa” na recuperação das matas ciliares, especialmente protegendo nascentes,","501",NA
"se pudessem contar com apoio financeiro do Estado.","703.1",NA
"Afinal, se o benefício da preservação ecológica se reparte para toda a sociedade, parece justo que os custos também sejam assumidos pela coletividade.","503",NA
"No Brasil, o uso de instrumentos econômicos como incentivo à proteção e ao uso sustentável dos recursos naturais é ainda bastante incipiente.","501",NA
"Dentre os principais instrumentos existentes, cabe destacar a proposta do REDD, que prevê o pagamento pela redução voluntária do desmatamento,","501",NA
"e o Pagamento por Serviços Ambientais (PSA), um mecanismo que valoriza o ecossistema conservado, remunerando proprietários de terras pelas práticas sustentáveis e de preservação.","501",NA
"Os serviços ambientais são aqueles serviços úteis oferecidos pelos ecossistemas para o homem, como a regulação de gases (produção de oxigênio e sequestro de carbono), belezas cênicas, conservação da biodiversidade, proteção de solos e regulação das funções hídricas.","501",NA
"Ações:",NA,NA
"Promover a definição de um marco legal na política de Pagamento Por Serviços Ambientais-PSA;","501",NA
"Implantar, em parceria com estados e municípios, o PSA com prioridade nas principais microbacias hidrográficas que servem à captação de água;","501",NA
"Apoiar a implantação de mecanismos de Redução de Emissão por Desmatamento e Degradação -REDD;","501",NA
"Realizar campanha de conscientização sobre arborização e permeabilização em áreas urbanas.","501",NA
"Proposta 71: Comitês de Bacias Hidrográficas",NA,NA
"Situação: O Brasil detém 12% da disponibilidade mundial de águas superficiais, sendo 73,6% advinda dos rios da Amazônia.","000",NA
"Nas regiões mais habitadas e industrializadas, todavia, a fartura de água limpa acabou faz tempo.","000",NA
"Para não falar do Nordeste, onde o fenômeno da seca afeta milhões de pessoas.","000",NA
"Há que se preocupar, igualmente, com os aquíferos subterrâneos.","000",NA
"Cerca de 15% dos domicílios nacionais são servidos exclusivamente pelas águas subterrâneas, estimando-se existir 400 mil poços perfurados, muitos deles clandestinamente.","000",NA
"Pela Política Nacional de Recursos Hídricos a gestão dos recursos hídricos deve ser descentralizada,","301",NA
"contando com a participação do Poder Público, dos usuários e das comunidades, por meio dos Comitês de Bacias Hidrográficas.","202.1",NA
"Ações:",NA,NA
"Estimular a constituição dos Comitês de Bacias Hidrográficas Federais","202.1",NA
"e apoiar os Estados na implementação dos Comitês de Bacia dos rios sob sua jurisdição;","301",NA
"Implantar os instrumentos de gestão, cobrança pelo uso da água, outorga do uso, planos de bacias hidrográficas das federais","501",NA
"e estimular a atuação dos entes estaduais;","301",NA
"Promover, em parceria com Estados, Municípios e entes da sociedade civil, a proteção e o uso sustentável dos recursos hídricos e o combate aos desperdícios.","501",NA
"Proposta 72: Rio São Francisco",NA,NA
"Situação: O Rio São Francisco tem 2.700 km de extensão, possuindo 504 municípios em sua Bacia Hidrográfica.","000",NA
"Nasce em Minas Gerais e faz a divisa entre a Bahia e Pernambuco e também entre Alagoas e Sergipe.","000",NA
"As obras da transposição do Rio S Francisco pressupõem a construção de dois grandes eixos de distribuição de águas: o Eixo Norte (Canal do Sertão), que vai ao Ceará, e o Eixo Leste (Ramal do Agreste) que vai à Paraíba, ambos cortando o estado de Pernambuco.","411",NA
"O Canal do Sertão terá 500 km, levando água da barragem de Sobradinho ao Araripe, atravessando 17 municípios.","411",NA
"O Ramal do Agreste levará água ao sertão Pernambucano, a partir do futuro reservatório Barro Branco.","411",NA
"Suas obras tiveram início em junho de 2007, mediante convênio com o Exército Nacional, dois de seus batalhões iniciaram as obras no Eixo Norte (captação de água no rio São Francisco, canal de adução e construção da barragem de Tucutu) e no Eixo Leste (captação de água no reservatório de Itaparica, canal de adução e construção da barragem de Areias).","000",NA
"Hoje, estão contratados 13 lotes de obras dentre os 14 licitados, sendo que haverá nova licitação para as obras do lote 8 (estações de bombeamento do eixo norte) e 5 lote, por rescisão dos contratos anteriores.","000",NA
"As obras dos 14 lotes estão orçadas em cerca de R$ 3,2 bilhões.","000",NA
