Text,Code
"Em paralelo, criar condições para ampliar o mercado de resseguros visando a ampliação do seguro rural para todas as atividades rurais, com consistente operação do ""Fundo de Estabilidade do Seguro Rural"".",413
"../ Dinamizar os incentivos ao aumento da produtividade, dos avanços tecnológicos, da pesquisa, da inovação, da biotecnologia e da necessidade de processos e produtos limpos .",411
../ Construir um eficiente Sistema de Defesa Sanitária e lnocuidade de Alimentos.,403
"./ Consolidar um Sistema Agropecuário de Inovação, através de uma nova Embrapa.",411
A Embrapa cresceu e se firmou resolvendo problemas da agropecuária brasileira sendo conhecida e respeitada em todo o mundo.,411
Não é segredo que a Embrapa está passando por dificuldades.,411
"Por falta de investimento, muitas unidades estão com infra-estrutura desatualizada e precária, prejudicando seu trabalho pioneiro.",411
"Pior, a empresa vem sofrendo sérios prejuízos com o forte viés ideológico que tem norteado a composição dos seus quadros gerenciais.",411
"No governo Geraldo Alckmin, a Embrapa será revitalizada, reforçando ainda mais sua posição fundamental na área de tecnologia.",411
"Com visão estratégica e modelos de gestão adequados à realidade, a Embrapa terá orçamentos compatíveis, laboratórios modernos e equipados, equipes motivadas e lideranças proativas e empreendedoras.",411
"../ Reforçar o Zoneamento Ecológico-Econômico, que é uma importante ferramenta para a definição das áreas de ocupação, exploração, preservação e recomposição em cada unidade agroecológica do país.",703
"../ Garantir a segurança dos alimentos, com a normatização e padronização dos produtos e dos processos produtivos, capazes de embasar um sistema de certificação de origem adequado às normas internacionais em vigor, sem criar obstáculos desnecessários à produção.",403
"../ Incentivar a conquista e manutenção de novos mercados, com eficiente promoção comercial no exterior .",410
REFORMA AGRARIA,999
A PAZ NO CAMPO GARANTIRA MAIS TRABALHO EINCLUSÃO SOCIAL,999
Falta um modelo adequado de intervenção e ação que corrija os rumos da politica fundiária brasileira,999
REFORMA AGRARIA,999
"A reforma agraria, como politica permanente de Estado, e essencial para promover a inclusão social de uma parcela significativa da população pobre, pela geração sustentável de ocupação e renda e para solucionar conflitos nas áreas rurais garantindo o necessário clima de paz para trabalhar e produzir.",703
"A reforma agraria tem de ser feita em ordem, com integral respeito as leis",605
"e acompanhada de acoes efetivas de educação, saúde, credito e assistência técnica para promover a sustentabilidade econômica das famílias assentadas.",416
"Atualmente, a reforma agraria tem um contingente de 1 milhão de famílias assentadas em cerca de 8 mil projetos de assentamento que ocupam aproximadamente 20 milhões de hectares – produto de desapropriações – e cerca de 30 milhões de hectares obtidos através de regularização fundiária e outras modalidades, ao longo de toda historia.",703
"Entretanto, esse trabalho feito ao longo de décadas não tem evitado que os conflitos no campo continuem presentes na difícil relação entre posseiros, pretendentes de terras nos assentamentos e proprietários rurais com índices de mortalidade inaceitáveis sob qual quer analise.",703
"Nos ditimos cinco anos, cerca de 250 brasileiros foram mortos em disputas pela posse da terra.",703
Este numero retrata dramaticamente a ineficiência da politica agraria adotada ate agora.,703
Ha recursos financeiros materiais suficientes para resolver o problema.,703
"O que falta e um modelo adequado de intervenção e ação, que corrija os rumos da politica fundiária brasileira e passe a buscar resultados práticos a partir da execução de projetos de qualidade.",703
PROPOSTAS,999
"./ Consolidar os assentamentos existentes, melhorando as condições de infraestrutura social e produtiva",411
e desenvolver sistemas produtivos integrados às agroindústrias locais e ao agronegócio.,703
"./ Inserir os assentamentos nos ""arranjos produtivos locais"", como forma de integrar os agricultores familiares em cadeias produtivas locais de agronegócio,",703
"garantindo a eles melhores condições de acessos a mercados e, conseqüentemente, melhores preços para seus produtos.",403
./ Definir metas de assentamentos em conjunto com os estados e municípios .,703
"./ Fazer parcerias com estados e municipios para execução das ações de educação, saúde, assistência técnica, capacitação, comercialização, crédito e infra-estrutura dos assentamentos.",504
Tais parcerias serão acompanhadas do aporte de dotações orçamentárias federais.,504
"./ Priorizar o atendimento de famílias de produtores e trabalhadores rurais sem ou com pouca terra, com comprovada experiência profissional.",703
./ Integrar as políticas de reforma agrária e agricultura familiar .,703
"./ Priorizar a regularização da posse e a propriedade das terras na região Norte e agilizar os processos de titulação e registro para eliminar a insegurança jurídica, que gera focos de conflitos fundiários .",401
./ Revisar e simplificar o sistema de cobrança do ITR.,303
./ Reformular o PRONAF dando prioridade ao crédito de investimento .,410
"./ Implantar as Casas de Agricultura Familiar, onde o agricultor terá o suporte para aquisição de insumos, implementas agrícolas e assessoramento técnico na produção.",410
"./ Apoiar a reestruturação das áreas dominadas por minifúndios, simplificando procedimentos para registros e oferecendo apoio financeiro para aquisição de parcelas e integração de lotes.",703
SANEAMENTO BASICO,999
"TRATAR ÁGUA, ESGOTO E LIXO E GARANTIR SAUDE",999
Milhões de brasileiros não sabem oque é ter águo tratado e coleta de esgoto e lixo,999
SANEAMENTO BASICO,999
"Em pleno seculo XXI, grande parcela dos brasileiros ainda não conta com um serviço essencial: ter na torneira de casa água tratada com qualidade e o recolhimento e tratamento do esgoto.",504
"São 3,1 milhões de residencias e 11 milhões de pessoas que vivem sem sanitários em casa.",504
"Em relação a água tratada, cerca de 95,4% da zona urbana e atendida mas nem sempre com água de qualidade, conforme o Ministério das Cidades.",504
Quanto a coleta e tratamento de esgotas a realidade e gravíssima: apenas metade dos municípios brasileiros (2.875( contra com este serviço.,504
"Esta realidade se reflete na incidência de diversas doenças como tifo, disenteria, diarreias e esquistossomose a que são expostas 30 milhões de pessoas, com gastos enormes para o sistema de saúde.",504
Outro grave problema diz respeito ao saneamento ambiental.,504
O governo Geraldo Alckmin vai criar legislação nacional sobre tratamento de resíduos sólidos.,504
"O governo atual não tem um plano ou modelo para mudar esta dura realidade do saneamento básico no pais, um plano que leve em conta as características e problemas de cada região.",504
"As regiões mais pobres, principalmente do Norte e Nordeste, são as mais atingidas.",504
"O saneamento básico precário esta diretamente ligado a pobreza, miséria, falta de renda e de emprego e a consequente habitação sem as menores condições de higiene.",504
"No Brasil, na década de BO, investiu-se em saneamento básico 0,28% do PIB; de 1990 a 1994, 0,13%; de 1995 a 2000, 0,25% e de 2001 a 2004, 0,18%.",504
A necessidade de investimento era multo maior.,504
"Segundo estudo do Ministério das Cidades, de 2004, para que em 2020 todos os brasileiros tenham água de qualidade e coleta e tratamento de esgoto a disposição, seria necessário que se investisse, ate la R$ 67,8 bilhões em tratamento de água, R$ 77,3 bilhões em coleta de esgoto e R$ 33,2 bilhões de reais, já teria que estar sendo feito ha dois anos, o que ainda não aconteceu.",504
"Nesse ritmo, água e esgoto recolhido e tratado de todas as casas só acontecera em 2065: Para recuperar o atraso provocado pelo atual governo e cumprir as metas para 2020, o novo governo viabilizara investimentos públicos e provados de R$ 12 bilhões por ano, em moeda de 2006, ou seja, o equivalente a 0,6% do PIB.",504
"Depois de longo tempo de tramitação, foi aprovado peio Senado Federal e retornou para apreciação da Camará de Deputados, um importante marco regulatório do setor de saneamento no Brasil, o Projeto de Lei do Senado 219/2006, lei fundamental para a atracão de Investimentos que Já deveria estar em vigor desde 2004.",504
PROPOSTAS,999
/ Criar condições para levar água tratada com qualidade e coleta e tratamento de esgoto a toda a população brasileira até 2020.,504
"/ Estabelecer condições para levar água tratada com qualidade para 100% da população urbana do país (estimada em 175 milhões de habitantes) em 2015. Em 2004, 95,4% da população urbana tinham acesso a água tratada.",504
"/ Criar condições para implantar e/ou estender a rede de coleta de esgoto sanitário para 75% da população urbana brasileira (154 milhões de habitantes) até 2015 (50,3% em 2004).",504
"/ Estabelecer condições para tratar 50% do esgoto sanitário urbano coletado no país até 2015 (31 ,3% em 2004).",504
/ Garantir a liberação de recursos públicos adequados ao cumprimento das metas.,504
"/ Utilizar novos mecanismos de financiamento, como mercado de capitais",414
e as PPPs -Parcerias Público-Privadas.,504
/ Desenvolver programa de saneamento rural com os estados.,504
/ Fazer parcerias com os estados para facilitar o atendimento de grande parte da necessidade nos próximos quatro anos.,504
/ Reformar e modernizar a estrutura de prestação de serviços.,303
/ Reduzir a carga tributária direta federal (especialmente PIS e Cofins) e indireta (como o IPI).,408
/ Garantir recursos dos Fundos de Saúde e de Combate e Erradicação da Pobreza para aplicação em saneamento.,504
/ Aproveitar a estrutura do Programa de Saúde da Família e incluir o procedimento sanitário no acompanhamento das visitas realizadas.,504
"/ Criar o programa Vale-Água, que incluirá o pagamento das contas de água (tarifa social) nos programas de transferência dirigidos à população mais pobre e que não tem condições de pagar pelo serviço.",503
HABITACAO,999
GARANTIR RECURSOS PARA A CASA PROPRIA,999
"Faltam 7,9 milhões de moradias no Brasil",999
HABITACAO,999
"Um dos tracos marcantes da pobreza no Brasil e a precariedade das moradias, nas cidades e no meio rural.",504
"Faltam hoje, no pais, 7,9 milhões de moradias, sendo 6 milhões na área urbana e 1.9 milhão na área rural.",504
"Entre as famílias com renda de ate três salários mínimos, 84% não possuem sua casa própria.",504
"Pelo menos quarenta milhões de brasileiros vivem em habitações sem infra-estrutura adequada, sem banheiro, água, esgoto, iluminação e, a cada ano, um milhão de novas famílias demandam moradias.",504
"Cerca de 80% da população residente nas favelas concentra-se em nove regiões metropolitanas, sendo mais da metade nas regiões metropolitanas do Rio de Janeiro, Belo Horizonte e São Paulo.",504
Ha uma desorganização no setor habitacional do atual governo.,303
"Atualmente ha quatro Ministérios e seis Fundos Federais, som seus respectivos conselhos e suas ramificações em estados e municípios, que tentam, de forma desarticulada, executar uma politica de habitação.",303
Falta sintonia entre es três níveis de governo.,303
"Temos execução mais de 40 programas habitacionais similares entre si, disputando as mesmas fontes de financiamento.",303
"De 2003 a 2005, cerca de R$ 4 bilhões, do total de R$ 11 bilhões do FGTS destinados para habitação, deixaram de ser aplicados.",303
"Em saneamento básico, embora houvessem recursos, só 16% do orçamento de 5,7 bilhões foram desembolsados.",303
PROPOSTAS,999
"Construir mais habitações com preços e características adequadas as necessidades da população,",504
além de disponibilizar lotes urbanizados com financiamento do material e da construção.,504
"Articular e integrar as acoes da politica de habitação as politicas de desenvolvimento urbano, saneamento, transporte urbano, e demais politicas sociais e de desenvolvimento econômico.",504
"Construir um cadastro integrado de famílias que demandam moradia, definindo critérios de prioridade no atendimento e cadastrando as beneficiadas.",504
"Garantir fontes permanentes de recursos que possibilitem a continuidade das acoes no setor habitacional, em especial o subsidio as famílias de baixa renda, com recursos da União, estados e municípios.",504
"Regularizar os assentamentos, loteamentos clandestinos e favelas,",408
"dotando-os de adequada infra-estrutura, saneamento e equipamentos essenciais",411
e reduzindo ao minimo impactos ambientais.,501
"Conceder títulos aos moradores para regularizar a posse da terra, o que significa poder fazer melhorias com tranquilidade e ter o registro da sua moradia.",408
"Estabelecer indicatores de dimensionamento e avaliação do deficit habitacional, das metas de benefícios a serem gerados pelos programas habitacionais, em âmbito nacional, regional e local, divulgando os resultados.",504
"Desburocratizar o aceso aos recursos do RGTS, especialmente para a parcela de trabalhadores que ganham menos.",303
"Construir em maior escala casas e apartamentos a custos menores que os hoje praticados, com medição de água e energia individualizados.",504
TRANSPORTE E LOGISTICA,999
TRANSPORTE PARA O DESENVOLVIMENTO,999
Programo vai investir R$ 37 bilhões para eliminar entraves ao crescimento,999
TRANSPORTE E LOGISTICA,999
"O transporte de carga e toda a sua infra-estrutura de suporte logistico representam cerca de 4,4% do PIB e são um componente decisivo para a competitividade da economia brasileira e para a redução das desigualidades regionais.",411
"E preciso criar mecanismos de melhorias para todos os modos de transporte de passageiros e cargas (rodovias, ferrovias, hidrovias, dutovias, portos e aeroportos)",411
e para os centros de logística.,411
"Os custos econômicos e sociais dos transportes estão, contudo, travando o desenvolvimento do pais.",411
A redução desses custos representa forte apoio as exportações.,411
"Esses custos resultam da falta de conservação e manutenção da intra-estrutura de transportes federal, dos estados e municípios; da baixa capacidade dessa infra-estrutura em diversas regiões;",411
da estrutura da carga tributaria incidente sobre a exploração dos serviços de transporte de passageiros;,411
"dos riscos de roubos de carga e acidentes de transito, que elevam os valores dos seguros embutidos nos fretes das empresas de carga e nas tarifas de Ônibus interestadual;",411
"e da pratica frequente de sobrepeso ilegal dos caminhões, que traz sérios prejuízos ao pavimento e, consequentemente, aumenta os custos operacionais de transporte.",605
PROPOSTAS,999
./ Assegurar a recuperação e preservação da infra-estrutura existente e reduzir o número de vítimas de acidentes nas rodovias.,411
"./ Descentralizar a manutenção e a conservação da infra-estrutura de transportes, ficando o governo federal concentrado nos programas e ações de caráter estratégico, para consolidar os Eixos de Desenvolvimento, por meio do transporte.",301
"./ Ajustar a infra-estrutura, através de investimentos dirigidos, para as necessidades visualizadas no cenário de longo prazo.",411
"./ Criar, para atingir essas metas, o programa ""Transporte para o Desenvolvimento"", para o periodo 2007/2010, no valor total de R$ 37 bilhões, assim distribuidos:",411
"recuperação de 22 mil quilômetros de rodovias, R$ 4,4 bilhões;",411
"manutenção e preservação da infra-estrutura existente, R$ 2,2 bilhões;",411
"conclusão de projetos estratégicos já iniciados e melhorias e expansão da infra-estrutura de transporte dos Eixos de Desenvolvimento, R$ 30 bilhões;",411
"e investimentos em obras de engenharia em locais de maior ocorrência de acidentes com vítimas, R$ 0,4 bilhão.",411
"O governo federal coordenará a execução desse programa, mobilizando recursos da União (50%), dos estados (5%), da iniciativa privada (25%) e de organismos internacionais e nacionais de financiamento (20%).",411
"./ Priorizar a restauração do equivalente a cerca de 40% dos 56 mil quilômetros (22.000 Km) das rodovias federais pavimentadas, que se encontram em péssimo estado,",411
a conservação e manutenção da malha federal existente,411
e melhorias e expansão da infra-estrutura de transporte.,411
"./ Viabilizar recursos públicos dos governos federal e estaduais e de fontes privadas, diretamente ou por meio de Parcerias Público-Privadas, para criar as bases do desenvolvimento econômico do país,",410
"por meio de projetos de infra-estrutura dos transportes, por Eixo de Desenvolvimento,",411
retomando os planos de desenvolvimento regional abandonados nos últimos anos.,301
"./ Investir nos seguintes projetos principais, por eixo: Eixo Amazônico: pavimentação da BR-163 -Cuiabá {MS) a Santarém (PA);",411
adequação do Rio Madeira à navegação.,411
Eixo Centro-Oeste: ferrovia Norte-Sul Estreito/Colina a Gurupi;,411
eclusa de Tucuruí;,411
e ampliação do porto de ltaqui.,411
Eixos Nordestino e Centro-Nordeste: ferrovia Transnordestina-PetrolinaParnamirim;,411
ferrovia Luis Eduardo-Brumado;,411
nova ferrovia NordestinaEliseu Martins-Parnamirim e Parnamirim -Suape/Pecém;,411
duplicação da BR-101;,411
duplicação da BR-116 e da BR-304 (Fortaleza/Natal),411
"e melhorias da BR-222, Fortaleza-Teresina-São Luiz que, reunidas, formarão a rodovia Costa Dourada, interligando com segurança as capitais nordestinas.",411
Eixo Centro-Oeste-Leste: travessia ferroviária de Belo Horizonte;,411
"ligação ferroviária Rio Verde-Goiandira; e ampliação da capacidade do sistema portuário do estado do Espírito Santo (Vitória, Barra do Riacho, Tubarão e Ubu};",411
ferrovia Alto Araguaia-Rondonópolis-Cuiabá.,411
Eixo Centro-Oeste-Sudeste: adequação dos acessos ao porto de Santos;,411
rodoanel de contorno da região metropolitana de São Paulo;,411
e ferrovia Norte-Sul de Anápolis a Gurupi.,411
Eixo Sul: adequação do porto de S. Francisco do Sul;,411
"terminar a duplicação da rodovia do Mercosu I BR-1 01 e da BR-116,",411
e a extensão da BR-290 de Porto Alegre a Uruguaiana.,411
Melhoria nos postos de fronteira do Mercosul.,411
./ Investir na navegabilidade do rio Araguaia;,411
implantação da ferrovia Patrocínio-Prudente de Morais;,411
ligação ferroviária ltaobim-Teófilo Otoni -Gov. Vaiadares;,411
revitalização da ferrovia Corinto-Pirapora;,411
ferroanel Norte e ferroanel Sul de contorno da cidade de São Paulo;,411
acesso rodoviário exclusivo ao porto de Sepetiba;,411
acesso em bitola estreita de Barra MansaSepetiba;,411
porto de Espadarte (PA);,411
ramal ferroviário Cascavel-Foz do Iguaçu.,411
"./ Reduzir, com o Programa Transporte para o Desenvolvimento, os custos do transporte de carga em cerca de 5%, ate 2010.",411
"./ Reduzir, ate 2010, as tarifas dos transportes de pessoas em ate 15%",403
"./ Reduzir, ate 2014, ate 20% das vitimas (mortos e feridos) dos acidentes de transito nas rodovias.",411
"./ Capacitar trabalhadores dos organismos públicos responsáveis pela regulação e controle do transporte terrestre, aquaviário e aéreo, e pela operação dos portos públicos.",411
TRANSPORTE COLETIVO URBANO,999
A SOLUCÃO E O TRANSPORTE DE MASSA,999
"Com melhoria da qualidade, Ônibus, trem e metro são prioridade",999
TRANSPORTE COLETIVO URBANO,999
O transporte e um dos fatores mais importantes para se medir a qualidade de vida nas cidades.,411
"Por esse referencial, pode-se dizer que metade da população das cidades com mais de 100 mil habitantes tem baixa qualidade de vida.",411
A razão disso e simples: os veículos são mais valorizados do que as pessoas.,411
"O automóvel, transporte individual tipico, e mais valorizado do que os sistemas de transporte de massa, como o ônibus, trem e metro.",411
"As viagens a pê e por bicicleta crescem multo, atribuindo-se este quado ao preço proibitivo da tarifa do transporte coletivo, especialmente nos trechos curtos, pois a maioria das cidades adota a tarifa única.",403
"No caso das grandes cidades e regiões metropolitanas, a quantidade de passageiros de ônibus, trens e metro aumenta quando ha benefícios tarifários e gratuidades.",403
"Os congestionamentos, que estão cada vez maiores, em tamanho e duração, afetam a regularidade do transporte por ônibus, responsável por mais de 90% dos deslocamentos por transporte coletivo no Brasil, e que na grande maioria das cidades tem que dividir o espaço das visas com os carros e motos.",411
"Ha uma quantidade significativa de cidades com velocidades inferiores a 20 km/h (cerca de 49%), com destaque para 13% delas, cuja população tem que se submeter a velocidades inferiores a 18 km/h.",411
"O aumento dos custos e os congestionamentos provocaram uma queda de 35% na demanda pelo transporte por ônibus urbano, de 1995 para 2004.",411
"Por conseguinte, a produtividade (passageiros transportados por veiculo/dia) também caiu e ficou 63% abaixo dos resultados observados em 1995, quando foi registrado o melhor desempenho setorial no período pas-real.",411
"O grande desafio do governo federal sera introduzir melhorias no transporte das cidades, para reduzir os custos,",411
respeitando as competendas definidas pela Constituição Federal.,203
PROPOSTAS,999
"./ Executar planos de investimento combinados entre os três níveis de governo: União estados e municípios, principalmente nas regiões metropolitanas.",404
./ Implantar e/ou aperfeiçoar (também de maneira combinada) projetos de trens e metros e de corredores de ônibus.,411
./ Acelerar a implantação de bilhetagem eletrônica e de outros sistemas que permitam reduzir o tempo de permanência nas estacões e aumentar a eficiência da arrecadação.,411
"./ Estimular os governos estaduais e municipais a realizarem obras de recuperação de calcadas e construção de ciclovias,",411
bem como obras para pessoas portadoras de dificuldades de locomoção.,411
./ Estimular a criação de agencias reguladoras de transportes nas cidades medias e grandes.,411
"Para tanto o governo Geraldo Alckmin implantara o programa “Facilitando o Transporte nas Cidades"", que terá três subprogramas e investimento total de R$ 32,54 bilhões, publico e privado, em quatro anos, nas seguintes areas:",411
"./ Desenvolvimento de redes eficientes e transporte coletivo (ônibus, trens urbanos e metros): R$ 30,60 bilhões.",411
"./ Melhoria da circulação dos pedestres, ciclistas pessoas com dificuldade de locomoção: R$ 1,29 bilhão.",411
./ Capacitação do setor publico local para gerir o transporte e o transito das cidades: R$ 653 milhões.,411
"O governo federal coordenara esse programa, que contara com recursos da União, dos estados, dos municípios, da iniciativa provada e de organismos de financiamento.",411
POÚTICA ENERGETICA,999
POÚTICA ENERGETICA,999
O Brasil tem todas as condições para se tomar referencia mundial na utilização de fontes alternativas de energia.,416
Exatamente como já acontece com o álcool.,416
"Energias solar, eólica, biodiesel, gás natural, além do petróleo e da fonte hidrelétrica fazem deste um pais privilegiado.",416
"Mas, para que essas potencialidades se desenvolvam, e preciso que o governo disponha de uma politica energética integrada e apoiada num solido planejamento.",416
Esse processo se define em duas palavras: desenvolvimento sustentável.,416
"Quer dizer: integrar investimentos públicos e provados,",410
garantir igualdade de direitos das empresas particulares frente as estatais,403
e evitar a todo custo a agressão a natureza.,501
"Cumprindo esses princípios, sera possível afastar o fantasma da falta de energia, que ameaça atingir o pais ate 2010.",408
"E também manter a auto-suficiencia em petróleo, conseguida gracas as politicas implementadas nos últimos cinquenta anos.",408
"A nova politica energética deve levar em conta ainda a inclusão social da população, de todos os níveis, nos benefícios do desenvolvimento econômico que ela propiciara.",416
Pois sua meta sera sempre o crescimento e a geração de novos postos de trabalho.,701
"Para atingir as metas de crescimento econômico do país, o governo Geraldo Alckmin vai:",999
"./ Assegurar que haverá energia suficiente para o crescimento sustentado do pais, com qualidade adequada e incluindo a parcela de menor faixa de renda no consumo de energia.",416
"./ Consolidar o mercado de energia com regras claras e estáveis,",403
de modo a dar segurança aos investidores privados.,402
./ Estabelecer parcerias com a iniciativa privada para o crescimento do setor.,410
"./ Assegurar a autonomia das agências reguladoras, capacitando-as e fortalecendo seu poder decisório, de normatização e de fiscalização.",403
"Hoje, elas sofrem forte pressão do governo, que limita sua autonomia e contingencia suas verbas.",403
"./ Fortalecer a engenharia nacional e a indústria nacional de bens e serviços voltados para energia, tendo como diretriz o aumento de competitividade.",410
"./ Investir fortemente na pesquisa, exploração, produção e distribuição de petróleo e derivados, gás natural, álcool, biodiesel e energia hidrelétrica, estimulando a exportação de excedentes.",410
./ Incentivar a produção nacional de gás natural.,402
./ Incentivar a participação da iniciativa privada em companhias de distribuição de gás natural.,402
"./ Definir plano estratégico de avaliação ambiental, especialmente na área da energia elétrica, para agilizar a aprovação de construção de novas usinas, sem abrir mão do necessário rigor.",303
