Text,Code
"A raiz dos conflitos em boa parte da Região Norte está na diversidade das estratégias e meios utilizados na exploração dos recursos naturais, sobretudo a disputa pela posse da terra, por jazidas minerais, reservas de madeiras nobres e acesso à pesca, entre outros.",0
As estratégias de ação para buscar solucionar os conflitos devem envolver diversos fatores.,0
"Entre eles destacamos o aumento da escala e da qualidade da presença do Estado nas áreas de litígio aberto e potencial, assegurando acesso a serviços essenciais como educação, segurança, saúde, habitação, transportes, energia e saneamento.",504
"/ Política de defesa de fronteiras, com o compartilhamento do uso do SIVAM e do SIPAM, equipando melhor e promovendo uma estreita colaboração entre as Forças Armadas e a Polícia Federal.",605
/ Expansão do conhecimento e da inovação tecnológica com vistas ao uso inteligente da biodiversidade e dos recursos naturais.,999
"Estimular a melhoria da atual estrutura produtiva da região, com a inclusão de novos segmentos industriais de produção de bens mais elaborados, o que envolve necessariamente o adensamento das cadeias produtivas.",410
"Devem ser considerados em especial os setores mais bem estruturados e de grande penetração nos mercados nacionais e internacionais, como alumínio, ferro, cobre e sua metalurgia, além de madeira e sua industrialização.",410
Incentivar a produção e disseminação de tecnologias que otimizem o uso sustentável da biodiversidade local.,411
"Da mesma forma, o parque industrial a ser implantado deve considerar a produção de bens de alto valor tecnológico, mas explorando a potencialidade de recursos naturais e culturais da região.",410
/ Sistema amaz6nico de ciência e tecnologia,999
Consolidação de uma rede de universidades e escolas técnicas com foco na pesquisa aplicada direcionada aos problemas da região.,411
Atração de pesquisadores e alunos de pós-graduação a partir da oferta de bônus de salários e de bolsas.,411
"Fortalecimento das instituições de pesquisa da região, com enfoque especial no Museu Emílio Goeldi, INPA e Embrapa.",411
../ Meio Ambiente,999
Implementar medidas efetivas para aumento da presença do poder público na Amazônia.,305
-Implementar políticas de incentivos às atividades de desenvolvimento compatíveis com as realidades ambientais e regionais.,416
-Elaborar o Zoneamento Ecológico-Econômico (ZEE}.,416
"Investir em infra-estrutura educacional, de saúde e de transportes que garanta à população rural acesso a estes serviços básicos nas áreas delimitadas pelo Zoneamento Ecológico-Econômico.",504
Avaliar a utilização de uma compensação financeira aos municípios que possuam unidades de conservação.,501
Implementar política agro-silvo-pastoril para as áreas já desmatadas.,703
PROJETOS PRIORITÁRIOS,999
Os projetos prioritários não trarão novas intervenções na região amazônica esim a complementação de empreendimentos estratégicos que estão em diversos estágios e serão implementados considerando o desenvolvimento regional e respeito ao meio ambiente.,416
/ Concluir o asfaltamento da Cuiabá-Santarém-BR 163.,411
/ Concluir as eclusas de Tucuruí.,411
/ Viabilizar a hidrovia Araguaia-Tocantins.,411
/ Viabilizar a implantação da usina hidrelétrica de Belo Monte no rio Xingu.,411
"/ Viabilizar a implantação das usinas hidrelétricas de Jirau e Santo Antônio, no rio Madeira.",411
/ Implantar os gasodutos Urucu-Coari-Manaus e Urucu-Porto Velho.,411
/ Recuperar a estrada Cuiabá-Porto Velho-Rio Branco (BR 364}.,411
"/ Viabilizar o asfaltamento da Transamazônica-BR 230, entre as cidades de Marabá e Itaituba, no Pará, em parceria com o estado.",411
/ Recuperar o trecho Manaus-Caracaraí-Boa Vista-BR 174.,411
/ Duplicar o trecho Castanhal – Santa Maria do Para (BR 316),411
/ Modernizar e ampliar o porto de Vila do Conde – Barcarena – PA.,411
/ Apolar o estado para viabilizar a hidrovia do Marajó.,411
/ Viabilizar a interligação rodoviária Macapá – Calçoene – Guiana Francesa.,411
/ Implantar a ferrovia Estreito/Colina a Gurupi.,411
Gerenciamento do programa Novo Norte,999
O Plano de Ação do Programa Novo Norte estará concluído 180 dias apês o inicio do governo Geraldo Alckmin.,404
"Ele detalhara as diversas acoes previstas e possibilitara o gerenciamento da sua implantação, bem como o seu acompanhamento perla sociedade.",404
CIENCIA E TECNOLOGIA,999
APOIO AO AVANÇO DO CONHECIMENTO,999
"Promover a articulação entre agentes públicos e privados, planejar e viabilizar projetos estratégicos de longo prazo",999
CIENCIA E TECNOLOGIA,999
A ciência e essencial ã civilização.,411
As nações reconhecem que mais conhecimento as tornam mais livres e senhoras de seu destino.,103
"No século XXI, mais conhecimento também gera riqueza e desenvolvimento.",410
"Integrar o esforço internacional para o avanço do conhecimento humano através do progresso da ciência e por isso, tarefa da qual nenhum Estado pode abdicar para o pleno exercício da soberania e cidadania.",411
"O Brasil construiu,ao longo dos últimos 60 anos, uma base acadêmica relevante para a atividade de pesquisa.",411
"A base do sistema esta nas universidades públicas e gratuitas, federais e estaduais.",411
"A Universidade pode e deve contribuir para um ambiente de estímulo ã geração de riqueza e à promoção da inovação na industria,",411
sem perder de vista que o avanço do conhecimento e a educação são insumos essenciais para o desenvolvimento.,506
"Um sistema de excelentes universidades e condição essencial para um futuro melhor, construído a partir de ideias, baseado na atividade intelectual autônoma e original, que afaste a sociedade do obscurantismo e da visão acrítica do mundo e da sociedade.",506
"A experiência internacional mostra que a autonomia, a liberdade acadêmica e o mérito são essenciais ao funcionamento do sistema e imprescindíveis para que a Universidade cumpra seu papel de ser o centro do debate aberto e da crítica das ideias para formar as novas gerações no espirito científico.",506
"Mostra também a necessidade da presença de um Sistema Nacional de Ciência e Tecnologia forte, com capacidade para promover a articulação entre os vários atores, propor e coordenar ações e iniciativas com ministérios, estados e municípios. planejar e viabilizar projetos estratégicos de longo prazo.",411
PROPOSTAS,999
"/ Fortalecer a autonomia universitária, negociando metas e objetivos anuais e plurianuais para as universidades,.",506
"/ Fortalecer as atividades de fomento do CNPq, atuando de forma coordenada com o Fundo de Infra-Estrutura, bem como fortalecer os Fundos Setoriais e o papel dos Comitês Gestores na definição das diretrizes de fomento.",411
"/ Criar Faculdades Tecnológicas, abrindo novas vagas em ensino superior tecnológico de excelente qualidade e com oportunidades profissionais.",411
"/ Atuar de forma coordenada com as agências de fomento estaduais, fortalecendo suas estruturas e descentralizando para elas ações federais.",301
"/ Definir um amplo programa de pós-doutorado no país e no exterior, para manter e consolidar o intercâmbio com os principais centros de pesquisa internacionais e entre os principais centros nacionais.",411
/ Fortalecer o papel do Conselho de Ciência e Tecnologia.,411
"/ Estruturar ações de fomento à ciência de forma diversificada, contemplando auxílios individuais e a pequenos grupos de pesquisa sistemática contínua.",411
"/ Fortalecer o fomento a projeto de pesquisa de grandes redes e temáticos, nos termos do Programa do Milenium e resgatar a concepção original do Pronex.",411
/ Criar um Programa de Parques Tecnológicos consolidando centros de inovação e de estímulos à interação universidade-empresa.,411
"/ Coordenar no CQ as ações das agências federais (CNPq, FINEP e CAPES) de pesquisa e dos demais parceiros do plano federal (ministérios, agências e bancos de fomento) para atuação conjunta e convergente nos programas mobilizadores e demais ações de fomento.",411
/ Definir projetos mobilizadores nas áreas científicas relacionadas às grandes prioridades nacionais.,411
/ Equilibrar o incentivo e apoio à pesquisa fundamental espontanea e à pesquisa aplicada por meio de editais e interesses sociais e econômicos.,411
"/ Garantir, de forma articulada com as iniciativas locais, apoio à pesquisa fundamental nos grupos já estabelecidos, bem como aumentar a visibilidade da pesquisa feita no Brasil",411
e incentivar a cooperação internacional e a produção científica de classe mundial.,107
"/ Articular a pesquisa acadêmica e a formação de recursos humanos com os desafios econômicos e sociais, mediante uma efetiva política industrial baseada em conhecimento, competitividade e exposição mundiais.",411
INOVACAO TECNOLOGICA,999
O MOTOR DAS SOCIEDADES MODERNAS,999
Criar ambiente favorável e condições adequadas para o desenvolvimento da inovação tecnológica,999
INOVACAO TECNOLOGICA,999
A inovação é o motor das sociedades modernas.,411
"O governo de Geraldo Alckmin tem uma visão clara do que precisa ser feito no Brasil, nos próximos anos, no campo da inovação e da competitividade: criar um ambiente favorável e condições adequadas para as empresas nacionais desenvolverem tecnologia",411
e comercializar produtos no mercado brasileiro e internacional.,410
"O grande desafio é articular a política científica, tecnológica e de inovação para promover a competitividade empresarial.",411
"Significa transformar as ideias e pesquisas realizadas no pais em renda, empregos, exportações e lucro para as empresas e em soluções para o Brasil.",411
"É preciso remover obstáculos de natureza macroeconômica, em particular o juro elevado,",402
"e as incertezas nas relações jurídicas que impedem as empresas de investir mais em pesquisa e desenvolvimento, indispensáveis para a qualidade e atratividade de seus produtos.",411
"Os investimentos em Pesquisa e Desenvolvimento no Brasil não estão crescendo e o país vai ficando cada vez mais atrasado em relação às nações desenvolvidas e aos nossos principais competidores, como a China e Índia.",411
"Apesar dessas evidências, pouco de concreto se fez nos últimos três anos para mudar este quadro.",411
"O governo Geraldo Alckmin propõe uma nova agenda de competitividade baseada na inovação,",411
"para a qual devem convergir todos os instrumentos de política industrial, agrícola e ambiental.",404
Uma política conseqüente deve construir uma estratégia em que o dispêndio público em P&D,411
"viabilize o aumento do investimento empresarial, reduzindo riscos e estimulando a inovação.",402
"Para isso, a meta do governo Geraldo Alckmin é transformara inovação em propulsor do crescimento econômico e das soluções para o desenvolvimento do país.",411
"É necessário elevaro gasto nacional em Pesquisa e Desenvolvimento de 0,9%do PIB para 1,3%do PIB nos próximos quatro anos.",411
PROPOSTAS,999
/ Introduzir e ampliar mecanismos de apoio à P&D empresarial.,411
"/ Utilizar as encomendas tecnológicas, instrumento previsto na Lei de Inovação, para alavancar os setores prioritários da política industrial.",411
/ Estimular o uso de créditos tributários para aplicações em P&D.,402
/ Atrair centros mundiais de P&D e de atividades baseadas em conhecimento.,411
"/ Desenvolver o mercado de capitais para apoio à inovação,",414
em particular incentivar a ação dos Fundos de Investimentos,411
e valorizar mais os ativos intangíveis.,414
"/ Atuar de forma efetiva junto às empresas para ampliar o acesso aos mecanismos de financiamento disponíveis, incentivando-as a trabalhar com as agências de fomento federal e facilitando a vida dos empresários.",402
/ Aperfeiçoar a gestão das agências de fomento,303
e assegurar a transparência dos processos e critérios de alocação de recursos.,304
/ Definir uma fonte permanente de recursos para a FINEP que viabilize a retomada do seu papel de fomento tecnológico e de inovação.,411
/ Fortalecer a inovação nas micro e pequenas empresas,403
e facilitar o acesso à tecnologia pela ampliação dos programas de extensão tecnológica,411
"e de apoio para aquisição de máquinas, equipamentos e acesso a serviços tecnológicos.",403
"/ Reforçar os programas de extensão tecnológica para micro e pequenas empresas, mobilizando os institutos tecnológicos e os fornecedores de bens de capital,",411
no sentido de atender adequadamente às necessidades daquelas empresas.,403
"/ Consolidar o Sistema Brasileiro de Inovação (SBI), atualmente incompleto e desarticulado.",303
Neste sentido o governo Alckmin vai: Articular as agências federais.,303
Intensificar a cooperação entre empresas e instituições de pesquisa.,411
Modernizar a infra-estrutura de serviços tecnológicos.,411
Reforçar a infra-estrutura de suporte à propriedade intelectual,411
"e assegurar a redução de tempo e custo que hoje restringem a proteção,",303
em particular às pequenas e médias empresas brasileiras.,403
/ Combater a pirataria e a concorrência desleal.,605
/ Estimular estratégias ativas de licenciamento de tecnologia para facilitar a absorção pelas empresas brasileiras de tecnologias avançadas e que têm grande impado no processo produtivo e na competitividade empresarial.,411
/ Investir na educação de nível médio e superior com ênfase no ensino tecnológico para reduzir gargalos para o desenvolvimento do Brasil.,506
"/ Adotar medidas para incrementar a produção industrial a partir da privilegiada disponibilidade de recursos minerais em nosso país, visando à máxima agregação de valor, com altos índices de inovação.",410
"/ Desenvolver ações para criar Ambientes de Inovação, tais como: A formação de Parques Tecnológicos por meio de novos esquemas de financiamento e com o aporte de recursos estáveis e crescentes, na forma de apoio para empreendedores privados e estruturação de ações do tipo projedjinance, ao lado da mobilização de fundos de investimentos privados.",410
Consolidar uma Rede de Incubadoras em complemento à formação de um sistema de Parques Tecnológicos.,410
Integrar os Parques Tecnológicos e as Incubadoras com os Arranjos Produtivos Locais-APL.,410
"- Fortalecer o ambiente de negócios e a segurança jurídica como base na competitividade,",402
"reduzindo a burocracia,",303
"fortalecendo as agências reguladoras, reduzindo a instabilidade das políticas públicas e completando uma reforma regulatória",303
e de infraestrutura.,411
"Estruturar um programa prioritário de reforço da engenharia nacional apoiando as empresas de engenharia e consultoria, com financiamento de serviços e encomendas de projeto",402
"e fomentando a expansão do ensino de engenharia em todo o país, através do apoio à expansão da oferta de vagas em todos os níveis.",506
TECNOLOGIA INFORMACAO E COMUNICACAO,999
IMPULSIONANDO O PAIS PARA O SÉCULO XXI,999
"Democratizando a acesso aos serviços públicos, facilitando a vida e integrando o cidadão à sociedade da informação",999
TECNOLOGIA INFORMACAO E COMUNICACAO,999
"Os setores de Tecnologia, Informação e Comunicação são estratégicos para o desenvolvimento nas sociedades contemporâneas.",411
"A qualidade da infra-estrutura e dos serviços afeta toda a economia e o dia-a-dia dos cidadãos,",411
"Entretanto, esses setores pouco evoluíram desde o início de 2003",411
Superar a estagnação e recuperar o tempo perdido nos anos recentes exigirá ação determinada e pragmática do Governo Alckmin.,411
As Tecnologias de Informação e Comunicação (TI&C) são determinantes para propiciar o desenvolvimento e a competitividade das economias modernas.,411
"Devem também ser empregadas de forma maciça, com vistas ã produção e disseminação dos serviços do governo ofertados aos cidadãos.",411
É necessário universalizar o uso dos meios de comunicações,411
"para toda a população, independentemente de sua localização geográfica ou de sua condição socioeconômica, e promover a inclusão social por meio dos serviços de comunicação: radiodifusão, telefonia e acesso ã internet.",503
"Em termos de governo eletrônico, existem ainda grandes distâncias na relação entre o Estado e o cidadão,",202
uma vez que o uso de TI&C tem sido mais efetivo na gestão das obrigaçõ es do que na dos direitos do cidadão com o Estado.,411
As políticas públicas deverão ter em conta a importância do setor de comunicações como infra-estrutura essencial para a consolidação da Sociedade da Informação no Brasil.,411
"Para isso, elas deverão propiciar condições para que as empresas aqui estabelecidas possam, com segurança, atrair capital",402
"e aportar novos investimentos para alavancar o crescimento e a modernização do setor, preferencialmente com suporte na indústria instalada no país,",411
e promovera pesquisa e o desenvolvimento de produtos e serviços com tecnologias avançadas.,411
PROPOSTAS,999
• Promover a inclusão digital da população hoje excluída.,503
"O projeto de inclusão social do Governo Geraldo Alckmin será executado com ampla utilização de TI&C, sobre as plataformas de comunicações, com o apoio e a parceria dos estados, municípios e iniciativa privada.",411
O Programa de Inclusão Digital deverá: ../ Garantir a disponibilidade de Banda Larga (alta velocidade de acesso à internet) a todos os municípios brasileiros.,411
"../ Viabilizar a criação de novos centros de informática, em parceria com a iniciativa privada,",411
criando incentivos fiscais para doações direcionadas a este objetivo.,402
"../ Disponibilizar espaços, pontos de acesso e equipamentos para uso da comunidade nos Correios, Banco do Brasil, CEF e demais órgãos federais.",503
"../ Promover a 'Universalização do Acesso à internet' usando recursos previstos no FUST (estimados em 5 bilhões de reais, com 700 milhões anuais adicionais).",503
../ Facilitar a aquisição de microcomputadores e outros equipamentos de TI&C pela população com financiamento incentivado e acesso à internet.,503
• Desenvolver o Governo Digital.,202
"Utilizar as TI&C para aprimorar a prestação de serviços e informações aos cidadãos, suprimindo filas e burocracias, como as que se observam nos órgãos de Saúde, Previdência, Fazenda, Indústria e Comércio.",303
"O governo modernizará seus processos de gestão, retomando os programas de digitalização da gestão do governo federal, suspenso desde 2003, tornando mais eficazes os serviços prestados à sociedade.",303
"Para tanto, o novo governo deverá: ../ Modernizar os processos de gestão, intensificando o uso de TI&C para todos os níveis gerenciais de governo e nos veículos de comunicação oficial.",303
"../ Estimular política de certificação digital,",411
"a validade de documento digital,",411
"a expansão dos serviços de e-governo,",303
"as licitações públicas via web, tornando-as mandatórias dentro do próprio governo.",303
"../ Criação de conteúdo educacional de alto nível pedagógico e desenvolvido para o ambiente internet, com maciço investimento na formação de professores.",506
../ Implementar políticas de compras governamentais que possam ser adotadas nos três níveis de governo.,303
"• Desenvolver arcabouço regulatório para restabelecer a confiança no país e atrair novos investimentos necessários para a geração de emprego qualificado, tanto de nível médio como superior.",304
Para tanto será necessário: ../ Fortalecer a independência e a competência técnica do Órgão Regulador.,304
"../ Conduzir o processo de atualização da legislação setorial, tornando-a compatível com a evolução da tecnologia e dos serviços.",303
../ Fortalecer os princípios da livre iniciativa em ambiente de justa competição.,401
../ Reduzir a carga tributária,402
e eliminar a desburocratização dos processos para elevar a competitividade no setor.,303
"../ Estabelecer política de incentivos à produção e à exportação de conteúdos, inclusive softwares e bens e serviços culturais.",410
../ Estabelecer com estados e municípios medidas que possam permitir uma maior adequação da carga tributária incidente sobre os serviços de comunicações.,402
"Promover a estruturação de pólos de exportação de software e serviços a partir de pólos regionais, visando a construção de PPPs-Parcerias Público-Privadas-e a atração de investimentos de grande porte .",410
Fortalecer a Empresa Brasileira de Correios e Telégrafos com a adoção de uma nova postura de gestão que privilegie sua condução por profissionais da área e sua utilização como vetor para implementação de políticas públicas.,303
Estruturar telecentros nas instalações da EBCT que permitam à população acesso à internet em banda larga.,411
Programas Especiais,999
O Governo a Serviço do Cidadão,999
Universalização do uso dos meios de comunicação para toda a população.,503
"Os serviços prestados pelo Estado e educação, saúde, previdência e segurança - experimentarão um salto de modernização na sua oferta,",504
"e poderão ser utilizados por toda a sociedade com maior transparência,",304
"Haverá um grande estímulo ã contratação de serviços técnicos para especificação, implantação e operação dessas ferramentas, o que demandará a formação e a capacitação de profissionais com impacto direto no nível e qualidade de empregos, assim como na atividade econômica em geral.",411
O Cidadão na Rede,999
"Oferta de conexão em banda larga ã internet em todos os municípios brasileiros, mediante a participação integrada do poder público, de empresas estatais e de agentes privados",411
"Em paralelo, serão promovidas medidas para formação de multiplicadores para capacitar a população a utilizar e se beneficiar efetivamente dos serviços disponíveis na internet, tanto os de atendimento ao cidadão, informação, cultura e entretenimento, como também os relacionados à inserção no moderno mercado de trabalho.",411
Recursos Humanos,999
"Investir, de forma intensa e acelerada, para a capacitação de novos profissionais para os setores de tecnologia, informação e comunicação, de acordo com a demanda do setor, melhorando sua qualidade e produtividade.",411
POLITICA EXTERNA,999
ACABAR COM A RETÓRICA VAZIA E BUSCAR RESULTADOS CONCRETOS,999
Governo Alckmin vai estabelecer uma Politica que coloque os interesses nacionais acima das visões conjunturais e ideológicos,999
POLITICA EXTERNA,999
"A política externa brasileira, que historicamente teve um carater consensual e suprapartidárío, deve ser vista como uma política de Estado, dentro de uma perspectiva de médio e longo prazos, onde o interesse nacional esteja acima de visões conjunturais, ideológicas ou de governos que passam.",606
"Na era global, a política externa é cada vez mais relevante para o desenvolvimento.",0
"Em lugar de uma retórica vazia, precisamos de resultados concretos, em consonância com os interesses do Brasil.",305
"A política externa opera simultaneamente nos campos da economia, dos valores e da segurança.",0
"Estes campos não se opõem; antes, se complementam e se articulam.",0
"Assim como não e possível, hoje, como já foi no passado, formular no Brasil uma política externa que se defina como pragmática e que abandone os valores democráticos em nome de interesses econômicos e comerciais, também já não e' possível uma diplomacia exclusivamente ideológica, a serviço de uma visão particular do mundo, que as critique interesses concretos e legítimos.",0
"O Brasil - por sua escala e peso - é, ao mesmo tempo, um país com interesses gerais no mundo e com interesses específicos,",601
"Realismo de objetivos e prioridades no tratamento dos temas de interesse concreto para o Brasil, sem ideologizar sua execução, caracterizarão a política externa do governo Geraldo Alckmin, nessa fase de inserção cada vez mais competitiva no mundo globalizado.",305
PROPOSTAS,999
"/ Ampliar as relações com todos os países de nosso entorno geográfico e recompor as relações do Brasil no âmbito da América do Sul, com base em interesses recíprocos.",107
"Priorizar as iniciativas de integração física, energética e comercial.",108
"/ Impulsionar as negociações comerciais multilaterais, regionais e bilaterais, sem ideologizá-las e levando em conta o interesse do setor produtivo industrial, comercial, de serviços e do agronegócio.",406
"/ Dotar os consulados do Brasil no exterior de recursos e condições adequadas à prestação de assistência aos brasileiros, inclusive nas situações de emergência.",0
/ Revigorar o Tratado de Cooperação Amazônica.,107
/ Intensificar a vigilância de nossas fronteiras.,104
"/ Intensificar as relações com os centros mais dinâmicos da economia global, sem descuidar de nossas ligações, interesses e obrigações históricas com os países menos desenvolvidos.",107
"/ Ampliar o relacionamento com os países de escala continental, como a China, a Índia, a Rússia, com base na reciprocidade de interesses e não na ilusão ideológica de que são ""aliados naturais"".",107
/ Dar prioridade ao nosso tradicional relacionamento com o Japão e não perder de vista as oportunidades com a Coréia do Sul.,107
"/ Ampliar o relacionamento com países da África, em especial os países de língua portuguesa.",107
"/ Explorar, na Oceania, as oportunidades de comércio e investimentos, tendo em vista o vínculo derivado da presença do Brasil no Grupo de cairns.",107
"/ É legitimo e razoável que o Brasil possa almejar um assento permanente no Conselho de Segurança da ONU,",601
em eventual processo de ampliação daquele organismo.,107
