Text,Code
CAMINHOS PARA O DESENVOLVIMENTO,999
O Brasil no contexto mundial,999
O Brasil venceu duas batalhas decisivas na década passada: a da consolidação da democracia,202
e a da estabilidade econômica.,408
O grande desafio que temos pela frente hoje é o do desenvolvimento.,410
"Nos últimos quase quatro anos, não só aumentou a distancia que nos separa dos países altamente desenvolvidos, como estamos crescendo menos do que quase todas as nações em desenvolvimento.",410
"E o que é pior, muito menos do que poderíamos e precisaríamos para dar empregos e oportunidades aos nossos filhos.",410
"Vários países, que na década de 1950 eram mais pobres do que somos hoje, deram o salto do subdesenvolvimento para o desenvolvimento no prazo de uma geração.",410
China e Índia estão caminhando a passos largos na mesma direção.,410
Por que estaríamos condenados a ser retardatários nessa corrida?,410
"Respondo que o Brasil, com seus excepcionais recursos humanos,",701
"com seus riquíssimos recursos naturais-destacando-se, por exemplo, como uma das maiores reservas de biodiversidade, de água doce e uma das principais províncias de mineração do planeta-,",601
com a base industrial e a capacidade científica e tecnológica que construiu no século passado,411
e a estabilidade política,305
"e econômica que conquistou recentemente,",408
está pronto para ser vitorioso na corrida do desenvolvimento.,601
"Tudo o que precisamos é coragem para enfrentar o desafio, clareza para escolher os caminhos certos e perseverança para seguir por eles superando os obstáculos que sempre se apresentam.",601
"Ser vitorioso, neste caso, significa nos incorporarmos ao grupo das nações que têm um projeto claro de futuro e avançam decididamente em sua direção.",601
"Acima de tudo, significa cada brasileira e cada brasileiro poder sentir na sua vida, na da sua família e na da sua comunidade que está progredindo junto com o país.",410
Unir o Brasil em torno de um projeto nacional de desenvolvimento,606
que conjugue de uma vez por todas democracia,202
"com ética,",304
"estabilidade com crescimento,",416
justiça social,503
"com boa gestão,",303
"esperança com mudança, é o sonho que inspirou minha geração.",410
É ele que me motiva a concorrer à Presidência.,0
Reforma política e garantia das instituições democráticas,999
"A crise ética e política do PT e do governo atual - evidenciada nos episódios do ""mensalão"", dos ""sanguessugas"", do ""cuecão"", entre tantos outros - obriga-nos a retomar a questão da reforma política por um novo ângulo e com um redobrado senso de urgência.",304
"O aparelhamento, hoje verificado, das instâncias estatais pelos partidos governistas e a corrupção entranhada na máquina Politica mais próxima à Presidência da República tratada como algo normal pelo atual governo-são fenômenos que representam, com enorme gravidade, potencial comprometimento das instituições democráticas.",304
"Impõe-se, como estratégia para reforçar a consolidação de nossa democracia, implementar novos e fundamentais passos de uma reforma Politica, centrada em dois pontos-chave: fidelidade partidária e voto distrital.",202
A fidelidade partidária é instrumento essencial para a garantia da prevalência da soberania da vontade popular.,202
"Em nosso sistema eleitoral, as ideologias e as propostas de ação submetidas ao julgamento do eleitor formam-se por meio dos partidos.",202
As candidaturas devem guardar coerência com as ideologias partidárias.,202
A divisão das cadeiras dos parlamentos também se baseia na votação dos partidos.,202
"Nada mais natural, portanto, que, uma vez eleito, o parlamentar mantenha-se fiel à legenda que o consagrou.",202
"Sendo assim, a mudança voluntária de partido, por um parlamentar (salvo no caso excepcional da criação de um novo partido), constitui verdadeira fraude contra a vontade democraticamente expressa pelo eleitor e deve acarretar conseqüências punitivas.",202
"Meu governo trabalhará com todo empenho pela adoção de regra de fidelidade partidária que imponha aos parlamentares, que voluntariamente se desliguem do partido pelo qual foram eleitos, a inelegibilidade pelos quatro anos subseqüentes.",202
Igualmente empenhado meu governo atuará pela adoção de mecanismo que contemple o voto distrital para as eleições pariamentares.,202
"O voto distrital, muito bem experimentado em tradicionais regimes democráticos, possui virtudes de grande relevância para o atual momento da vida democrática brasileira.",202
"Em primeiro lugar, porque é um sistema de simples compreensão pelo eleitorado-e de fácil implantação.",202
"Nas eleições para a Câmara Federal, cada estado seria dividido em tantos distritos quantas as vagas a preencher. cada partido apresenta um candidato (e um candidato a suplente) por distrito, cabendo a vaga àquele que obtivera maioria dos votos.",202
"Em segundo lugar, o sistema distrital incentiva a participação do eleitorado",202
"e facilita a transmissão de informações sobre os candidatos e, futuramente, sobre os parlamentares, para o eleitor.",202
O candidato e o eleitor residem no mesmo distrito.,202
"O voto distrital estimula, portanto, uma participação mais intensa do eleitor, que exercerá maior vigilância e fiscalização sobre o representante eleito do seu distrito.",202
"Em terceiro lugar, o sistema distrital permite diminuir o custo das campanhas eleitorais, tornando-as mais acessíveis-o que é altamente desejável em uma democracia.",202
"O candidato concentrará sua campanha no distrito no qual concorre, tendo fim as campanhas eleitorais milionárias em que os candidatos, como no sistema atual, se vêem obrigados a fazer campanha em todo o estado.",202
"Em quarto lugar, o voto distrital dá muito mais poder ao eleitor, que passa a contar com a possibilidade de agir CONTRA um candidato.",202
"No atual sistema brasileiro, essa possibilidade não existe: um político condenado pela opinião pública hoje dispõe de vários caminhos para contornar resistências e obter uma votação diluída por todo um estado.",202
"Já no sistema distrital, que é um sistema majoritário, a eleição de um deputado no distrito automaticamente exclui o(s) outro(s) candidato(s) que a população queira rejeitar.",202
Um novo modelo de desenvolvimento,999
A batalha do desenvolvimento se trava em varias frentes.,416
"Para vencê-la, o Brasil precisa crescer mais e de maneira mais equilibria,",416
incluindo os mais pobres e diminuindo as desigualdades regionais.,503
"Crescer apenas não basta, mas é condição indispensável para distribuir renda,",416
"garantir, direitos sociais e ampliar as oportunidades de desenvolvimento pessoal para todos.",503
Sabemos o que precisa ser feito para o país crescer e sabemos como fazê-lo.,305
"Tudo começa com trabalho, seriedade e competencia, sem discursos vazios nem mistificaçao.",305
Crescimento económico se faz com investimento.,410
Investir ao mesmo tempo nas pessoas,506
e na infra-estrutura do país é o fio da meada que vamos puxar para tirar a economía da estagnaçao.,411
"Criar um ambiente favorável para que as pessoas e empresas exercitem sua criatividade e empreendedorismo, transformando conhecimento em inovação a serviço da sociedade: esta é a idéa fundamental da política de desenvolvimento que defendo e que se desdobra nas inúmeras propostas específicas apresentadas neste Programa de Governo.",402
Essas propostas serão viabilizadas financeiramente através da melhora do gasto público – hoje o governo gasta muito e gasta mal -,303
e de parcerias com estados e municipios,301
e com a iniciativa privada.,401
JUSTIÇA E DIREITOS HUMANOS,999
"UM GOVERNO EM DEFESA DA VIDA, DA LIBERDADE E DA IGUALDADE",999
JUSTIÇA E DIREITOS HUMANOS,999
"O tema da Justiça, em especial abordado sob o ângulo da “reforma do Poder Judiciário”, vem ocupando nos últimos anos não apenas o pensamento das áreas jurídicas, mas também dos meios políticos de nossa sociedade.",0
"Esse fato se explica por uma tendencia relativamente recente, sobretudo a partir da abertura democrática marcada pela Constituiçao de 1988,",202
"de, por um lado, assegurarem-se novos mecanismos de controle judicial das ações governamentais (alargamento da ação civil pública,",202
"lei de improbidade administrativa,",304
"apliação dos instrumentos de controle de constitucionalidade, etc.)",202
"e, por outro lado, garantirem-se instrumentos pelos quais a população pode reivindicar ao Poder Judiciário o cumprimento de seus direitos fundamentais.",201
"A Justiça merece especial atenção, pois é a destinatária de demandas populares pelo cumprimento de previsões legais e detén novos mecanismos de controle das ações governamentais,",202
"tendo ampliada sua relação direta com a garantía dos direitos e da segurança dos individuos,",201
"bem como com a eficiencia das políticas públicas, o que confere importância renovada ao tema da sua modernização e acesso facilitado.",303
"O Governo Geraldo Alckmin, com absoluto respeito ao principio da independência e harmonia dos Poderes, atuará em sintonía com o Poder Judiciário e igualmente com o Ministério Público e a Advocacia, em busca da adoção das medidas de aperfeiçoamento da prestação jurisdicional,",202
"com vistas à celeridade processual e maior efectividade das decisões,",303
sempre respeitando a Constituição,203
e pautado pelo propósito harmônico que debe nortear o relacionamento entre instituições independentes.,202
"Nosso Governo asumirá a tarefa de intensificar o vínculo de fraternidade do povo brasileiro,",606
"promovendo inclusão social e desenvolvimento com justiça,",416
"para pôr fim a privilégios e preconceitos, a desigualdades e injustiças,",503
lançando as bases para uma redução sensível e duradoura da violência.,605
"Missão desafiadora, que precisará contar com a participação efetiva da sociedade.",606
"A defesa e promoção dos direitos humanos será a permanente busca da concretização das necessidades básicas de todo cidadão, tomadas como expressão dos direitos civis, políticos, econômicos, sociais, culturais e ambientais,",201
aliada ao intransigente combate à impunidade.,304
PROPOSTAS,999
"./ Reforçar as estruturas governamentais que formulam, implementam e monitoram as políticas públicas de defesa e promoção dos direitos humanos,",201
"com transparência,",304
"participação, pluralismo, seriedade e conseqüência.",202
"./ Garantir a promoção da igualdade entre os gêneros, afastando os obstáculos ao tratamento equânime que deve ser dispensado às mulheres, do ambiente profissional ao doméstico.",503
"./ Adotar medidas concretas para garantir às diferentes etnias que contribuíram para a formação de nosso país - em especial os negros, que padeceram com a escravidão - chances e oportunidades pautadas pela igualdade de condições.",503
"./ Impulsionar políticas de ação afirmativa para inclusão social, econômica, cultural e política dos negros e indígenas.",503
"./ Apoiar a população indígena na preservação das suas tradições, culturas",607
"e reservas ambientais,",607
"bem como na facilitação da integração ao convívio urbano, quando assim desejado.",503
./ Adotar medidas para permitir a pessoas portadoras de necessidades especiais ampla possibilidade de acesso ao mercado de trabalho e de circulação por espaços públicos e privados.,503
"./ Implementar ações visando à plena integração social e completo atendimento das necessidades dos idosos, com ações integradas à luz do Estatuto dos Idosos.",701
"./ Conceder especial atenção à juventude, garantindo um futuro melhor às novas gerações, mediante programas e projetos multidisciplinares e convergentes.",706
"./ Impor medidas de respeito ao exercício da livre opção de comportamento individual,",201
"corolário da convivência democrática,",202
que conduz à plena aceitação da diversidade de orientação sexual.,503
o/ Valorizar o Conselho de Defesa dos Direitos da Pessoa Humana.,201
"./ Ampliar o Programa de Combate ao Tráfico de Seres Humanos,",605
"em parceria com a ONU,",107
"contemplando como redes criminosas as vertentes tráfico de órgãos, exploração sexual e trabalho escravo.",605
"./ Articular-se com estados, municípios e entidades não governamentais para descentralizar o atendimento aos adolescentes em conflito com a lei,",301
"através da implantação das medidas socioeducativas previstas no Estatuto da Criança e do Adolescente, com ampliação da liberdade assistida e da semiliberdade",506
e investimentos na construção de pequenos centros para internação e ressocialização.,0
"./ Atuar junto com a sociedade civil, estimulando ações conjuntas para maior comprometimento, continuidade e controle social das políticas públicas, valorizando o 3° setor, os movimentos sociais e as organizações não governamentais.",606
"./ Fortalecer o programa de proteção a testemunhas e expansão dos centros de atendimento a vítimas de crimes, necessários ao aumento de eficácia da atuação policial e judicial, colaborando para o esclarecimento de crimes graves.",605
"./ Fortalecer as Ouvidorias, como espaços institucionais para críticas, sugestões e aprimoramento da qualidade do serviço público, permitindo a identificação de falhas e abusos dos servidores.",303
"./ Apoiar a ampliação da presença física do Poder Judiciário, com a criação de novas varas, especialmente de juizados Especiais, experiência muito bemsucedida no sentido de celeridade, eficiência e redução de custos para o Estado e para os cidadãos usuários.",303
"./ Simplificar e acelerar processos judiciais referentes a necessidades fundamentais da pessoa,",303
"e estimular a solução pacífica de conflitos pela conciliação e mediação, aproveitando as experiências bem-sucedidas dos Juizados Especiais, Itinerantes e dos Centros de Integração da Cidadania .",0
"./ Propor a alteração da legislação processual, visando à simplificação de procedimentos e à redução da possibilidade de recursos intermediários nos processos, sem prejuízo da garantia de ampla defesa.",303
". / Ampliar e regionalizar a Defensoria Pública, fundamental para o acceso da população mais carente à Justiça.",503
. / Apoiar a ampliaçao da informatização dos serviços judiciais.,303
POLÍTICA ECONOMICA,999
CRESCER PARA GERAR EMPREGO E RENDA,999
É perfeitamente possível crescer de 5 a 6% ao ano sem comprometer a estabilidade: basta escolher o caminho certo.,999
POLÍTICA ECONOMICA,999
O programa de política econômica do governo Geraldo Alckmin é um compromisso com a sociedade brasileira para criar as condições que permitirão ao país ter prosperidade prolongada.,416
"Ele define objetivos e estratégias claros que possibilitarão construir o consenso entre os diferentes setores da sociedade sobre o caminho a seguir rumo ao bem-estar da coletividade,",606
que se dará através da aceleração do crescimento econômico.,410
"As propostas fundamentam-se na idéa de que o processo de desenvolvimento é expressão da vontade política de inúmeros atores com interesses distintos, que necessitam ser conciliados e minimamente atendidos.",606
É preciso construir um caminho comum.,606
"Esse caminho é o do crescimento,",410
"da geração de emprego, da expansão da renda.",701
São esses os denominadores comuns a todos os brasileiros.,606
São esses os objetivos da política econômica de Geraldo Alckmin.,410
Um rumo para o Brasil: retomar o crescimento acelerado,999
É preciso recuperar o tempo perdido.,410
"Entre 1930 e 1980, o Brasil conseguiu reduzir, significativamente, a diferença na renda per capita em relação aos países desenvolvidos.",410
Poucos países no mundo cresceram tanto quanto a Braisl.,410
Crescer parecia ser nosso destino.,410
"Entretando, desde 1980, o país perdeu o rumo do crescimento.",410
"No último quarto de século a renda per capita do brasileiro aumentou apenas 9%, enquanto nos países desenvolvidos cresceu 60%, dobrou no Chile, quadruplicou na Coréia e se multilplicu por sete na China.",410
"Se o Brasil tivesse crescido, entre 1939 e 1980, no mesmo ritmo dos últimos 25 anos, a renda per capita do brasileiro seria comparável à dos países mais pobres da África, reconhecidamente o continente de menor expansão econômica no mundo.",410
Não é possível se conformar com desempenho tão modesto.,410
É preciso retomar o crescimento acelerado.,410
É perfeitamente possível resgatar taxas de crescimento da ordem de 5 a 6% sem comprometer a estabilidade doméstica.,410
"Estudo recente do Banco Mundial acerca do crescimento dos países da América Latina mostra que, com políticas econômicas adequadas, o Brasil poderá reencontrar a trajetória de crescimento do passado, de 7% ao ano.",410
Diagnóstico: as origens do problema,999
Por que o Brasil parou de crescer?,410
./ Porque a taxa de investimento sofreu forte redução;,410
./ Porque o custo do investimento subiu e,410
./ Porque a produtividade não tem aumentado devidamente.,410
"Portanto, os principais problemas a serem resolvidos são: ./ resgatar a capacidade de investir;",410
./ reduzir o custo do investimento e,410
./ aumentar a produtividade da economia.,410
A retomada do investimento,999
A retomada da capacidade de investir do país dependerá do ajuste das contas públicas.,303
O Estado brasileiro é grande demais e ineficiente.,303
"./ Hoje se apropria de quase 43% de tudo o que o país produz, sendo 39% oriundo da carga tributária e 4% de outras receitas.",414
É uma cifra muito elevada para os padrões internacionais.,414
Economias com a mesma renda per capita brasileira apresentam carga tributária significativamente inferior.,414
"./ Os governos (federal, estaduais e municipais, exceto estatais) apresentam déficit nominal de cerca de 4,4% do PIB.",414
Esse déficit traz as seguintes conseqüências: Rouba poupança privada.,414
Eleva a taxa de juro.,414
Inibe o investimento privado.,414
"A alta taxa de juro mantém a dívida elevada, a qual acaba por drenar recursos da sociedade.",414
"O Estado brasileiro gasta hoje cerca de 8,0% do PIB somente com pagamento de juros.",414
"Note-se, portanto, que em 2005 o Estado se apropriou de cerca de 43% de toda a produção do país.",414
"A despeito da alta arrecadação, o investimento público correspondeu a apenas 2,3% do PIB nas três esferas de governo.",414
"O investimento federal em infraestrutura correspondeu a apenas 0,4% do produto interno.",411
"O baixo investimento público é sentido diariamente por todos os brasileiros na infra-estrutura deficitária; na falta de melhorias e expansões em estradas, portos, ferrovias, hidrovias, serviços de saúde, segurança, educação.",411
A escassez de investimento eleva o risco privado e reduz a renda dos setores produtivos.,410
"Nos últimos anos, o Brasil entrou em um círculo vicioso de baixo crescimento, como abaixo descrito.",410
"./ A estrutura fiscal do Estado amarra a economia, prendendo-a em um equilíbrio de baixo crescimento.",410
../ A necessidade de financiamento do Estado mantém a taxa de juro elevada.,414
./ A taxa de juro alta inibe o investimento privado,414
"e, como conseqüência, restringe o crescimento da economia.",410
"./ O juro alto estimula também o ingresso de capital estrangeiro, o que acaba por valorizar o câmbio.",414
./ A valorização cambial desestimula os setores exportadores da economia,414
"o que, novamente, reforça o baixo dinamismo da economia.",410
"./ O pequeno crescimento que caracteriza o país hoje não permite expansão da arrecadação em níveis suficientes para zerar o déficit público,",410
"o que, por sua vez, mantém o juro alto .",414
"./ O Estado tem, então, que elevar tributos para compensar o aumento dos gastos.",410
"./ A elevação da arrecadação através do aumento de impostos inibe o investimento e, assim, fecham-se as possibilidades de expansão da economia.",410
Mas o círculo vicioso não termina aí.,410
./ O aumento da arrecadação por meio da elevação dos impostos gera profunda ineficiência na economia ao estimular a informalidade.,410
Parcela significativa da produção no pais se dá à margem do Estado.,410
/ Esse fato cria desequilíbrio nas contas públicas pela redução da arrecadação potencial.,410
"/ O que força o Estado a tentar aumentar a carga dos setores que não podem escapar da fiscalização, reforçando o movimento de informalidade da economia brasileira.",410
Faz-se necessário acabar com essa armadilha que desorganiza a estrutura produtiva e desestimulao investimento privado.,410
A informalidade não implica apenas na redução das transferências de recursos para o Estado.,410
"Sua disseminação, nos diversos mercados, acarreta perdas sistêmicas diversas, que ultrapassam a concorrência desleal entre empresas formalizadas e clandestinas.",410
Quatro outras perdas econômicas decorrentes da informalidade merecem destaque: / impossibilidade de garantia dos direitos de propriedade;,401
/ impossibilidade de formalizar contratos públicos e privados;,410
/ impossibilidade de acesso a financiamentos e ao mercado de capitais;,410
/ maior dificuldade na utilização de serviços e benefícios públicos.,410
Essas perdas econômicas sugerem que a informalidade representa redução expressiva na produção potencial.,410
É preciso sair dessa trajetória perversa.,414
"Para tanto, torna-se fundamental mudar a estrutura fiscal brasileira.",414
"A regra básica que norteará a política fiscal do governo Geraldo Alckmin é bastante simples: ""O governo não pode gastar mais do que arrecada"".",414
"Assim, o objetivo central consiste em estabelecer metas fiscais claras.",414
"Esse programa visa a criar condições para zerar o déficit nominal com corte de despesas correntes dos governos, incluindo juros, da ordem de 4,4% do PIB no decorrer do próximo mandato.",414
O modelo a ser perseguido reproduz os casos bem-sucedidos de ajuste fiscal em diferentes estados do país.,414
PROPOSTAS,999
"As diretrizes centrais para o ajuste fiscal definitivo envolvem os seguintes aspectos: / Evitar desperdícios, eliminando a sobreposição de projetos e despesas.",303
/ Introdução dos princípios de racionalidade e eficiência na utilização de recursos e cobrança de resultados.,303
/ Seguir princípios éticos de gestão.,304
"O ajuste das contas públicas permitirá forte redução na dívida pública e, com ela, a diminuição permanente da taxa de juro, alcançando patamares semelhantes aos internacionais.",414
A redução da taxa de juro constituirá o elemento central de indução ao crescimento da economia brasileira,414
através da elevação do investimento.,410
Inúmeros novos projetos surgirão.,410
"Com eles, a demanda aumentará, o que gerará estímulo aos novos investimentos.",410
"A criação conjunta e simultânea de demanda dilui o risco do investimento de cada empresário individual, reforçando o ciclo virtuoso de expansão.",410
O setor público participará da expansão nos investimentos no país.,410
"Na medida em que o ajuste fiscal for concretizado, a elevação da poupança pública deve atingir de 4 a 5% do PIB, possibilitando a expansão da participação do Estado na formação de capital da economia,",410
especialmente em infra-estrutura básica.,411
"Os investimentos públicos estarão integrados a esse ciclo de expansão privada, conferindo segurança e harmonizando o crescimento.",410
"É sabido que o investimento estimula a poupança na medida em que gera oportunidades a inúmeros poupadores, que constituem a maioria da população brasileira.",410
"Caberá ao setor financeiro papel central na articulação entre poupadores e investidores, desenvolvendo mecanismos de capitalização e crédito que permitam impulsionar a economia do país.",414
Fundamental também é o desenvolvimento de um sólido mercado de capitais que proporcione recursos para empresas ampliarem sua base produtiva.,414
"Esse mercado constitui excelente opção de diversificação de investimento para os poupadores, além de servir como fonte de captação de recursos estáveis pelas empresas.",414
"É igualmente importante a elevação do volume de crédito para o setor privado, especialmente para investimentos, que continua abaixo dos padrões mundiais.",414
"A redução da taxa de juro induzirá a desvalorização da taxa de câmbio, permitindo elevar a competitividade das exportações brasileiras.",414
A integração à economia global é elemento central da estratégia de expansão da economia brasileira.,406
Por quê?,406
Porque o comércio internacional: .,406
"estimula a adoção e desenvolvimento de novas tecnologias, de modernização permanente, de transformação da estrutura produtiva;",411
"./ impõe a disciplina do mercado, gerando eficiência alocativa;",406
"./ torna obrigatório, para as empresas exportadoras, o desenvolvimento da capacidade de inovação tecnológica",411
e de adoção de melhores práticas de gestão como condição de sobrevivência;,406
./ permite ainda manter os preços internos estáveis.,406
Criação de um ambiente favorável aos negócios,999
Diversos estudos de economistas brasileiros atestam para a baixa produtividade da economia brasileira.,410
As distorções institucionais existentes no país reduzem significativamente o produto potencial.,410
"Sociedades que se desenvolvem são aquelas que apresentam instituições que estimulam e premiam aqueles que produzem, que inovam.",410
"O empresário requer regras claras para investir, para assumir risco.",410
"O investimento privado exige que o marco regulatório que envolve sua atividade seja estável, seguro, permanente.",410
