"text","cmp_code","eu_code"
"que garanta ao povo português o direito de se pronunciar sobre o processo de integração europeia,","110",NA
"e que promova a construção na Europa de um verdadeiro processo de cooperação entre Estados soberanos e iguais em direitos e deveres.","110",NA
"Uma política externa que rejeite o unilateralismo,","109",NA
"que respeite a Constituição","203",NA
"e defenda o direito dos povos à soberania, auto-determinação e integridade territorial, rejeitando a instrumentalização da ONU.","109",NA
"Uma política externa e de defesa que, no respeito pelos direitos e dignidade dos militares portugueses, tenha como missão fundamental estar ao serviço de Portugal e da sua soberania, opondo-se a qualquer acto de ingerência e agressão externa,","109",NA
"e que decida do regresso de todos os militares em missões militares no estrangeiro.","105",NA
"Uma política assente na diversificação das relações económicas e financeiras com o maior número de países do Mundo,","403",NA
"que rejeite a liberalização do comércio mundial,","403",NA
"defenda relações de cooperação e apoio económico mutuamente vantajosas,","403",NA
"lute pela efectiva regulação dos mercados financeiros,","403",NA
"pela taxação de todas as transacções financeiras,","403",NA
"pelo fim dos paraísos fiscais,","403",NA
"pela penalização de deslocalizações de empresas","403",NA
"e pelo direito de todos os povos ao seu desenvolvimento económico e social.","403",NA
"Uma política que, no respeito pela Carta das Nações Unidas, defenda a dissolução dos blocos político-militares e","105",NA
"decida da desvinculação de Portugal da estrutura militar da NATO,","109",NA
"que oponha ao militarismo um projecto de cooperação internacional para a paz e o desarmamento.","105",NA
"6. Defender a Constituição e o regime democrático",NA,NA
"Neste período de ano e meio que decorre entre as eleições de 2009 e as próximas legislativas de 5 de Junho, os cidadãos, o povo português, viram agravar-se todos os aspectos da situação económica e social do País, com reflexos profundamente negativos na evolução da situação política.","203",NA
"À revelia e, na maioria dos casos, contra a Constituição da República, acentuaram-se traços e linhas de actuação que, vindos de trás, correspondem a novos patamares na ofensiva contra o regime democrático, sujeito a novos e acrescidos perigos e ameaças.","203",NA
"Perante a gravidade da situação do País e da vida dos portugueses, acentuam-se linhas de descredibilização das instituições do regime democrático, e designadamente da Assembleia da República, procurando esconder as verdadeiras razões, responsáveis e beneficiários da crise – apolítica de direita e os seus executores, ao serviço do capital monopolista –,","202",NA
"acentuando uma linha de igualização dos «políticos» e dos partidos, que visa ocultar a distinção entre os que aplicam e apoiam as medidas negativas e os que as contestam, propondo alternativas, como faz o PCP.","202",NA
"Assim, a situação actual pode ser caracterizada nos seguintes aspectos, mais relevantes:","304",NA
"Degradação da democracia política, com o alastramento da corrupção e do tráfico de influências, as promessas incumpridas, a falta de transparência, a chantagem, a mentira e o vale tudo na vida política, atingindo níveis nunca vistos, inaceitáveis e incompatíveis com o regime democrático.","304",NA
"Total subordinação dos responsáveis da política de direita aos interesses da alta finança e do poder económico, bem patente na actuação, despudorada e inaceitável, dos mandantes da Banca relativamente ao Orçamento do Estado e à intervenção do FMI/UE no nosso País.","304",NA
"Ofensiva crescente contra os direitos, liberdades e garantias dos cidadãos,","201",NA
"liquidação de direitos dos trabalhadores,","701",NA
"limitações e violações antidemocráticas do pluralismo e da liberdade de expressão política,","202",NA
"com acentuação de políticas, métodos e actuações de cariz securitário e repressivo.","201",NA
"Insistência em medidas legislativas, a par de continuadas pressões e ingerências no poder judicial, que põem em causa não apenas a independência dos tribunais e magistrados e o princípio da separação de poderes, como comprometem a realização da justiça, sobretudo nos casos da criminalidade mais grave.","605",NA
"Persistência de elevados índices de criminalidade e crescente sentimento de insegurança das populações, causados pela diminuição de políticas públicas de prevenção da delinquência e do crime.","605",NA
"Medidas economicistas, ditadas pela obsessão do défice, que atingem áreas nucleares do Estado, como a justiça e a segurança pública,","605",NA
"e que, a par do desrespeito pelo estatuto e justas reclamações dos seus profissionais, põem em causa o normal funcionamento dos tribunais e das forças e serviços de segurança, e atingem o direito de acesso à justiça, à segurança e tranquilidade públicas.","605",NA
"Constante incumprimento e desrespeito pela Constituição, acompanhados de nova ofensiva, com a abertura de mais um processo de revisão, que visa a destruição de conquistas históricas de Abril, como a escola pública,","203",NA
"o serviço nacional de saúde e os despedimentos sem justa causa.","504",NA
"Para o PCP, a defesa da democracia e das liberdades, baseadas nos princípios do regime democrático conquistado com Abril, são parte integrante da construção de uma política alternativa, patriótica e de esquerda.","201",NA
"Uma política de defesa e reforço da democracia de Abril passa pelo respeito e cumprimento da Constituição da República,","203",NA
"pelo aprofundamento dos direitos, liberdades e garantias fundamentais","201",NA
"e o reforço da intervenção dos cidadãos na vida política;","202",NA
"o respeito pela separação dos poderes e a autonomia de organização e funcionamento dos partidos políticos;","202",NA
"a democraticidade e proporcionalidade dos sistemas eleitorais;","202",NA
"uma justiça independente, democrática e acessível a todos;","202",NA
"o combate e punição da corrupção, crime económico e tráfico de influências;","304",NA
"uma política de segurança que defenda os direitos dos cidadãos e a tranquilidade pública;","605",NA
"uma política de defesa nacional e Forças Armadas ao serviço do País.","202",NA
"Questão crucial para a defesa do regime democrático é a efectiva subordinação do poder económico ao poder político.","202",NA
"Um governo patriótico e de esquerda",NA,NA
"A concretização da política necessária à resolução dos problemas nacionais exige a formação de um governo patriótico e de esquerda, capaz de assegurar uma nova fase da vida do País, marcada pelo desenvolvimento, a justiça e o progresso social.","305",NA
"Um governo para salvar o País, orientado por uma política patriótica e de esquerda que, correspondendo ao conteúdo e valor próprios da Constituição da República e dos ideais de Abril,","202",NA
"permita responder aos problemas nacionais, ao contrário de um governo dito de «salvação nacional», juntando precisamente aqueles que têm enterrado e querem continuar a enterrar o País.","305",NA
"Um governo cuja viabilidade está nas mãos do povo português, constituído com base nas forças e sectores políticos, democratas e personalidades independentes, que se identificam com a política patriótica e de esquerda, apoiado pelas organizações e movimentos de massas dos sectores sociais anti-monopolistas.","305",NA
"Um governo que constitua uma solução política necessária e urgente, que tem de ser inscrita como um objectivo incontornável para o futuro do País, e cuja concretização só é possível com o significativo reforço da influência do PCP e dos seus aliados na CDU nas eleições de 5 de Junho.","305",NA
