Text,Code
Por uma politica de esquerda,H
Mudas para melhor,H
Lagislativas 2002,H
Programma Eleitoral do PCP,H
1ª PARTE,H
AS GRANDES QUESTÕES NACIONAIS,H
PRINCIPAIS OBJECTIVOS E MEDIDAS URGENTES,H
PARA UMA POLÍTICA DE ESQUERDA.,H
– A situação do País no actual contexto comunitário e global.,H
– A acção do Governo.,H
– Dez grandes objectivos para uma política de esquerda.,H
– Medidas urgentes.,H
"– Em 17 de Março, CDU mais forte - mudar para melhor.",H
A SITUAÇÃO DO PAÍS NO ACTUAL CONTEXTO GLOBAL E COMUNITÁRIO.,H
"Num quadro internacional caracterizado, por um lado, pela crescente expansão da globalização capitalista, dominado pela chamada Tríade (Estados Unidos da América, União Europeia/Alemanha, Japão), mas no essencial conduzida pelos Estados Unidos da América e, por outro lado,",415
"pelo rumo da construção de uma União Europeia que é consequência, parte e expressão dessa globalização",415
- são grandes e evidentes os riscos e problemas que se colocam a Portugal.,415
"Neste contexto, a definição e aplicação de uma política nacional capaz de os enfrentar assume uma importância crescente e representa um desafio a que é necessário responder.",415
"A globalização capitalista constitui um complexo processo de domínio económico, social, político, militar, comunicacional e cultural.",415
É vasta a rede de caminhos pelos quais tem vindo a desenvolver-se e implantar-se,415
e são dramáticas as suas consequências para a maioria da Humanidade:,415
– Crescente concentração e centralização de capitais.,415
crescente financeirização do capital.,415
"concentração da imensa maioria das riquezas e capacidades de desenvolvimento num pequeno número de potências, que representam uma reduzida minoria, em detrimento da imensa maioria da Humanidade.",415
"reforço efectivo, nas grandes potências mundiais, do papel do Estado",415
ao serviço dos grandes grupos transnacionais e do capital financeiro.,415
"– Agravamento da exploração dos trabalhadores,",701
aumento do desemprego e da precarização do trabalho.,701
aprofundamento do fosso entre ricos e pobres,503
"e crescimento das desigualdades económicas e sociais, da pobreza e da exclusão em todos os países do Planeta.",503
"– Empobrecimento acentuado da democracia, amputada das suas componentes económica, social e cultural",202
e em acentuado e célere processo de desvirtuamento da sua vertente política.,202
subalternização e subversão da ONU,415
e adaptação dos preceitos de «direito internacional» perante os interesses dos EUA.,415
"– Recurso crescente à força das armas, disfarçada de «ingerência humanitária» ou de «combate ao terrorismo»,",104
"com o objectivo de alargar e reforçar o domínio imperialista do Mundo,",104
"o seu controlo sobre os recursos nacionais e mercado, e visando afastar obstáculos às suas ambições expansionistas, liquidar resistências, sufocar explosões sociais e revolucionárias.",103
"– Instrumentalização, pelos grandes interesses económicos e pelos critérios da ideologia dominante,",415
"dos progressos no domínio da educação, da cultura, da ciência, da tecnologia.",415
É neste quadro que se desenvolve o processo de construção da União Europeia.,108
"Delimitada pelas vertentes institucionais, económicas e políticas do Tratado de Maastricht.",108
pelas pesadas condicionantes do chamado «Pacto da Estabilidade» de Amesterdão.,108
"por uma perspectiva de alargamento em que os países mais poderosos e desenvolvidos pretendem reduzir as suas contribuições e levar a cabo alterações institucionais desfavoráveis aos países mais pequenos,",108
"como Portugal (regras de votação, número de comissários, línguas de trabalho, rotação das presidências),",108
"e em que Portugal terá ainda que contar com o aumento da concorrência intracomunitária, desfavorável ao País,",108
dado o perfil produtivo dos países candidatos ser semelhante ao português.,108
"pela assunção de um papel central nas negociações económicas, e em particular comerciais, no plano mundial,",108
substituindo-se total ou parcialmente aos Estados que a integram,108
"e de que avultam, pelos seus efeitos negativos para Portugal, as da OMC (Organização Mundial do Comércio),",108
o PET (partenariato económico transatlântico da UE com os EUA),108
"e outras negociações bilaterais e com blocos económicos decorrentes de processos de integração regional (MERCOSUL, NAFTA).",108
"pelos avanços da federalização da Política Externa e de Segurança Comum (PESC),",108
"e em articulação com a NATO, numa acelerada militarização com a elaboração de uma «Política Europeia Comum de Segurança e Defesa»",104
e a criação de uma força militar de intervenção para actuar quando e onde os interesses das grandes potências da UE o entenderem.,104
"Este rumo e os problemas e as consequências mais gravosas dele decorrentes, não são, contudo, uma fatalidade.",108
"O PCP considera que há uma alternativa, com um rumo diferente, para a União Europeia, de que Portugal deverá ser um activo protagonista, e outra política interna para Portugal.",108
À política de compromisso e submissão face à implementação de uma integração desigual,108
"e de políticas e orientações comunitárias que penalizam claramente Portugal e, de forma particular, os trabalhadores e outras camadas laboriosas.",108
"à política que quer transformar Portugal numa região europeia de um Estado federal europeu,",108
parceiro menor de um bloco económico-político-militar mais ou menos dependente dos Estados Unidos da América.,108
"à política que, não obstante ter conseguido alguns progressos em algumas áreas, remeteu Portugal para uma situação de gritantes desigualdades e assimetrias",108
e de índices sócio-económicos que o colocam no fim da lista dos países da União Europeia –,108
o PCP apresenta uma política alternativa e um rumo diferente e aponta três direcções de luta fundamentais:,305
"– A luta para que o Governo português e os representantes de Portugal na União Europeia defendam com coragem os interesses portugueses,",108
"invocando, além do mais, princípios ainda constantes nos Tratados,",108
nomeadamente,503
"«a coesão económica»,",503
"«a coesão social», «os interesses vitais»,",108
"as «características específicas»,",108
o princípio da unanimidade em decisões fundamentais para o País.,108
"– A luta do povo português e dos seus movimentos e organizações sociais e políticas e a sua convergência em complementaridade com outras forças progressistas da União Europeia,",108
na constante defesa de interesses concretos atingidos pela política do Governo ou por decisões supranacionais que atentam contra a soberania e a independência nacional.,108
"– A luta por uma profunda modificação da União Europeia, por u ma União Europeia de povos e Estados soberanos e iguais em direitos,",108
"renovada e com um rumo económico, social e político distinto das orientações neoliberais que têm sido dominantes.",108
"É uma evidência que a política de direita, praticada quer pelo PS quer pelo PSD, não resolveu (nem resolverá) os principais problemas do País e do povo.",503
Bem pelo contrário:,503
"pelo seu conteúdo marcadamente de classe,",415
"pela sua subordinação às exigências e aos interesses do grande capital internacional e nacional,",415
pela sua submissão aos ditames do imperialismo norte-americano e dos países mais poderosos da União Europeia,107
"– a política de direita tem vindo a agravar, em alguns casos significativamente, esses problemas.",503
"As eleições de 17 de Março constituem uma oportunidade de mudança,",305
"uma possibilidade de pôr termo à alternância entre o PS e o PSD em governos que, no essencial, praticam a mesma política.",305
"A realização de eleições legislativas antecipadas é, em si mesma, a confirmação do fracasso dessa política",305
"e, portanto, da necessidade de uma política alternativa,",305
"de uma política de esquerda,",305
para a concretização da qual é indispensável o reforço e a participação do PCP.,305
A ACÇÃO DO GOVERNO.,H
A política do PS e do Governo não se alterou no fundamental após as eleições de 1999.,305
"Tendo visto frustrado o objectivo da maioria absoluta,",305
"mas obtendo metade dos deputados da Assembleia da República,",305
o PS e o Governo beneficiaram de uma situação na prática mais confortável para a aprovação das suas propostas e para a rejeição das alheias.,305
A manutenção de uma política lesiva dos interesses do povo e do País rapidamente se traduziu numa crescente e acentuada erosão da base de apoio do Governo e do PS.,305
"Acentuou-se igualmente o carácter incoerente, contraditório e avulso de muitas medidas,",305
"tentando minimizar os efeitos da contestação popular,",305
preservar os seus interesses partidários,305
e decidindo em função dos grupos de interesse e de pressão que em cada momento mais força tinham junto do Governo.,305
"A política do Governo beneficiou nos momentos fundamentais, não obstante a pública divergência em questões acessórias, do apoio e da viabilização quer do PSD quer do CDS-PP.",305
"Foi possível ainda assim a aprovação de algumas medidas positivas,",305
sempre sob o impulso e a iniciativa do PCP e fruto da reclamação popular e dos trabalhadores.,305
Merecem destaque a aprovação da nova Lei de Bases da Segurança Social,504
e das alterações fiscais no sentido de uma maior justiça fiscal.,503
"Tais alterações positivas, não constituindo uma modificação fundamental no rumo e na orientação geral seguida pelo PS, foram repetidamente invocadas quer pelo PSD e CDS-PP, quer pelo próprio PS como estandartes de uma suposta viragem à esquerda da política do Governo.",305
Estas melhorias concretas rapidamente se tornaram num alvo preferencial dos ataques do grande patronato e do capital financeiro tentando impor recuos e concretizações mais favoráveis aos seus interesses.,415
"No caso das alterações fiscais o Governo e o PS acabaram por ceder estrondosamente a estas reivindicações,",305
"suspendendo e revogando muitas das novas regras,",305
designadamente no que dizia respeito à tributação das actividades especulativas.,305
A política orçamental pautou-se pela submissão aos critérios monetaristas do Pacto de Estabilidade e Crescimento,414
"e pela entronização do chamado rigor orçamental (bem expresso no famoso Programa de Redução da Despesa),",414
"que na prática se traduziu na limitação e congelamento do crescimento dos salários da função pública,",704
na insuficiência dos orçamentos dos sectores sociais e em graves situações de ruptura nalguns sectores do Estado.,503
"Enquanto isso mantiveram-se intocados os benefícios fiscais e outras benesses aos grandes grupos económicos, designadamente nas actividades especulativas.",305
"Os documentos orçamentais pecaram igualmente por uma manifesta falta de credibilidade nos indicadores económicos apresentados,",305
"quer com o intuito de minorar artificialmente a divergência com as orientações da União Europeia,",305
quer para condicionar as negociações salariais.,305
"No âmbito da União Europeia manteve-se a aceitação pelo Governo de um caminho de construção europeia ao serviço dos grandes grupos económicos e das grandes potências, que acentuaram a sua hegemonia.",108
"Acentuou-se a institucionalização da convergência nominal em detrimento da real,",108
a comunitarização de importantes políticas (como a política externa e de segurança comum),108
e a militarização da União Europeia.,108
"As reformas institucionais em preparação, designadamente na Convenção Europeia em curso, avançam no sentido de um federalismo político,",108
"da menor intervenção e capacidade de defesa dos seus interesses dos países mais pequenos (designadamente com o aumento das decisões por maioria e a diminuição do direito de veto),",108
e da institucionalização de um directório de grandes países que na prática já tem funcionado.,108
"Não tem faltado ao PS o apoio do PSD e do CDS-PP na sustentação deste caminho nas instâncias europeias e nas decisões nacionais, como aconteceu com a aprovação do tratado de Nice.",305
"Acentuaram-se as desigualdades sociais,",503
mantendo-se o agravamento do fosso entre os mais ricos e os mais pobres e níveis de pobreza de parte significativa da população.,503
"O Governo manteve uma política de rendimentos em que as benesses atribuídas aos grandes interesses económicos, designadamente nas actividades especulativas,",415
contrastam com a manutenção de uma orientação de baixos salários e pensões,415
a par de sucessivos ataques aos direitos dos trabalhadores,701
e de um aumento da precariedade das relações laborais.,701
Aumentou a debilidade e a dependência da nossa economia designadamente pela fragilização e desmantelamento de boa parte do nosso aparelho produtivo.,413
O Governo e o PS deram continuidade ao processo de privatizações com a entrega a grandes grupos económicos sectores chave da economia,413
colocando-os muitas vezes na dependência de centros de decisão no estrangeiro.,413
"A par disto acentuou-se a desresponsabilização do Estado em muitas das suas funções, designadamente na área das políticas sociais",413
"e dos serviços públicos,",413
"entregando-os ao sector privado ou a outros sectores não públicos,",413
"por vezes até transferindo o seu controle a grupos estrangeiros,",413
com comprovados prejuízos para a qualidade dos serviços prestados e uma maior desprotecção da população.,413
O Governo e o PS utilizaram o aparelho de Estado para a satisfação de clientelas partidárias ou outras e para fins eleitorais.,304
"Registam-se notícias públicas de favorecimentos, abusos de poder, irregularidades ou actuações pouco transparentes que o poder tenta por todos os meios encobrir.",304
"PS, PSD e CDS-PP consumaram mais uma revisão constitucional, inicialmente apenas para remover entraves à recepção do Tribunal Penal Internacional (TPI),",605
"mas que acabou por se traduzir, nas mais importantes alterações aprovadas, numa orientação de pendor securitário e de ataque a direitos e garantias,",605
"reintroduzindo entre nós, mesmo que indirectamente, a possibilidade de aplicação da prisão perpétua,",605
"afastando a regra da inviolabilidade do domicílio à noite,",605
"e consagrando a possibilidade de transferir para o nível europeu poderes,",108
"nas áreas da justiça e segurança interna, até aqui deixados à soberania nacional.",108
"O Governo e o PS mantiveram a submissão do País e da sua política externa aos ditames da NATO e dos EUA,",107
secundando todas as suas posições e dando cobertura à sua ofensiva militarista e agressiva.,104
DEZ GRANDES OBJECTIVOS,H
PARA UMA POLÍTICA DE ESQUERDA,H
O povo português está confrontado nas eleições de 17 de Março com a questão central da natureza e conteúdo da política necessária para o País.,305
"Trata-se de mudar de política,",305
"de pôr fim à política de direita levada a cabo,",305
"com poucas diferenças nas questões mais estruturantes, pelos governos do PSD e do PS nos últimos 16 anos.",305
A política de esquerda que o PCP propõe ao povo português assume-se em clara ruptura com essa política.,305
"Distingue-se pelo seu firme compromisso para com os trabalhadores, o povo e o País.",305
Distingue-se pelo conteúdo dos seus objectivos centrais e estratégicos.,305
"No sentido de uma clara diferenciação estratégica e uma clara afirmação de ruptura com a política de direita prosseguida pelos governos do PSD e do PS,",305
"enunciamos dez grandes objectivos políticos que, no horizonte dos 4 anos da próxima legislatura possam consubstanciar os eixos estruturantes da necessária mudança de política,",305
da necessária política de esquerda.,305
"Dez grande objectivos orientadores de um programa que responda aos défices e estrangulamentos económicos, sociais, culturais e políticos a que a política de direita conduziu o País.",305
Um programa para responder aos anseios e aspirações dos portugueses hoje.,305
"Um programa que prepare e assegure, neste início do 3º milénio, o futuro de Portugal como País soberano e independente.",305
São esses dez objectivos:,410
1º - Uma economia que defenda a produção nacional e desenvolva Portugal.,410
"Uma política que promova um crescimento económico acelerado e sustentado,",410
"liberto das peias do Pacto de Estabilidade e outras imposições externas,",108
"na base de um tecido económico de perfil produtivo valorizado,",410
"regionalmente equilibrado,",503
e fazendo um uso racional da energia e dos recursos naturais.,501
"Uma política que defenda a produção nacional e valorize o trabalho,",415
"e que, recusando a continuação da privatização e liberalização de serviços, empresas e mercados públicos,",415
"defenda um sector público forte, dinâmico e eficiente,",413
a preservação pública de alavancas fundamentais da economia,403
"e serviços públicos de qualidade,",303
"e assegure a manutenção de centros de decisão e de soberania económica nacionais, no quadro da União Europeia e da necessária cooperação internacional.",108
"Uma política que defenda e incentive o desenvolvimento das micro, pequenas e médias empresas,",402
"do movimento cooperativo e social,",402
combatendo a predação económica destas estruturas e dos sectores produtivos pelos grandes grupos da distribuição e da finança.,415
"2º - Mais justiça fiscal,",503
racionalização da despesa,303
e combate ao desperdício dos dinheiros públicos.,303
O volume da despesa pública do Estado português está ao nível da maioria dos países da União Europeia.,303
Mas o atraso relativo do País (na generalidade dos indicadores sociais e infra-estruturas) exige um esforço de investimento acrescido.,303
"O problema das finanças públicas é essencialmente o da racional afectação dos recursos orçamentais disponíveis,",303
o da qualidade da sua gestão,303
e o da obtenção das receitas necessárias para a despesa pública.,303
"O PCP propõe uma política de rigor, transparência e verdade nas finanças públicas,",303
"com o fim da desorçamentação e suborçamentação,",303
com a eliminação do desperdício e o combate ao laxismo nas despesas não essenciais ou injustificáveis,303
"e à multiplicação de instituições e serviços públicos,",303
"a disciplina rigorosa na concessão de ajudas públicas (em particular das comunitárias),",303
"e nos contratos e parcerias público-privado,",303
"a travagem das sistemáticas derrapagens de custos das obras públicas,",303
"o controlo dos processos de reestruturação orgânica,",303
a racionalização financeira dos serviços da administração pública.,303
"Uma política que dê prioridade à afectação eficiente dos recursos orçamentais na concretização das funções sociais do Estado (Saúde, Educação, Segurança Social e Segurança Pública).",303
"A obtenção dos recursos necessários exige o aprofundamento e desenvolvimento da reforma fiscal de 2000,",303
"visando o alargamento da base tributária,",503
"uma mais justa repartição da carga fiscal,",503
"a luta contra a fraude e evasão fiscais,",304
e a reorganização e reforço da administração fiscal.,303
"São elementos essenciais dessa reforma o princípio do englobamento de todos os rendimentos (incluindo mais valias),",503
"a revisão do estatuto dos benefícios fiscais,",503
"o desagravamento dos rendimentos do trabalho e da actividade produtiva,",503
o aprofundamento da tributação das empresas financeiras e seguradoras,503
"e das operações de títulos e cambiais não suportadas em transacções comerciais,",503
"a revisão dos privilégios dos offshores, ponto de partida para pôr fim aos paraísos fiscais,",304
"a tributação justa dos patrimónios mobiliário e imobiliário (imposto sobre a riqueza), isentando pequenos patrimónios,",503
e a eliminação da sisa e da contribuição autárquica.,503
3º - Valorização do trabalho,701
com direitos,701
e promoção do emprego de qualidade.,701
"Uma política de revalorização dos salários, em particular dos mais degradados,",701
"com um crescimento dos salários reais que garanta o aumento do peso da massa salarial no rendimento nacional,",701
e a crescente e faseada valorização do salário mínimo nacional.,701
A concretização progressiva das 35 horas de trabalho semanal.,701
"O combate à precariedade,",701
assegurando-se que os contratos a prazo ou a tempo parcial se verifiquem em condições de excepcionalidade justificada e conforme a vontade dos trabalhadores.,701
"A garantia de condições de higiene e segurança no trabalho,",701
"combatendo-se e reduzindo-se de forma eficaz a crescente e mortífera sinistralidade laboral,",701
e o número de trabalhadores atingidos por doenças profissionais.,701
"Uma política social e laboral com reconhecimento dos direitos colectivos,",701
"nomeadamente de negociação e contratação colectivas,",701
"liberdade sindical e direitos das comissões de trabalhadores,",701
o direito à greve e à participação na elaboração da legislação laboral.,701
O combate ao trabalho infantil,701
e às discriminações dos jovens e mulheres nos locais de trabalho.,503
Uma política de formação profissional que promova a qualificação e a realização dos trabalhadores.,411
"4º - Um País desenvolvido em todo o seu território,",410
com salvaguarda do ambiente.,501
"Um País desenvolvido, equilibrado e saudável exige uma política de persistente e efectiva resposta às assimetrias regionais,",410
um firme combate às agressões ambientais,501
e a uma decidida opção pelo ordenamento do território.,503
"Uma política de investimentos públicos e políticas ajustadas ao combate à desertificação económica e humana do interior e do mundo rural,",503
ao desordenamento do litoral,503
e às aglomerações urbanas sem qualidade de vida.,503
Impõe a descentralização administrativa,301
e o relançamento do processo de regionalização.,301
"Uma política de envolvimento e direcção do Estado e da Administração Central numa responsabilidade partilhada pelos cidadãos, autarquias, entidades públicas e privadas, na defesa e preservação do ambiente e dos recursos naturais,",501
na racional ordenação e ocupação do território nacional,503
e adequada gestão das bacias hidrográficas e orla costeira.,501
5º - Um Serviço Nacional de Saúde público,504
e de qualidade.,303
Uma política de defesa e desenvolvimento de um Serviço Nacional de Saúde público,504
e de qualidade.,303
"O PCP combate decididamente a redução, privatização e gestão privada de áreas e sectores do serviço público e a sua subordinação a interesses privados.",413
"O PCP defende um Serviço Nacional de Saúde que assente em estruturas regionalizadas e autónomas,",301
"na articulação dos diversos níveis de cuidados de saúde,",504
"numa gestão pública democrática,",202
mais eficiente,303
"e cuja escolha seja feita por concurso, num financiamento suficiente e que fomente uma maior produtividade, na separação clara entre o que é público e o que é privado.",303
"Defendemos uma política que dê resposta prioritária e urgente às carências de médicos, designadamente de médicos de família, enfermeiros e outros técnicos de saúde,",504
que valorize os cuidados primários de saúde e promova a qualidade,504
e a humanização dos serviços e os direitos dos utentes.,303
"Reclamamos a garantia do acesso imediato às consultas nos centros de saúde e em tempo útil às consultas, tratamentos e internamentos hospitalares e aos meios complementares de diagnóstico,",504
"bem como à assistência domiciliária ou internamento para convalescentes, doenças crónicas ou prolongadas.",504
Propomos uma política que diminua os gastos com medicamentos da população,303
"e racionalize os gastos do Estado,",303
"instituindo a prescrição pelo princípio activo,",303
"a generalização dos genéricos,",303
e que revitalize a farmácia pública hospitalar.,303
"Uma política de reforço das medidas de prevenção, tratamento e reinserção dos toxicodependentes.",504
"6º - Um decisivo combate às desigualdades sociais,",503
garantia de uma segurança social pública e para todos.,504
"Combater as desigualdades sociais, na sociedade mais desigual da União Europeia, exige uma política de mais justa repartição do rendimento nacional,",503
uma política que assegure o direito ao trabalho,701
"e a revalorização dos salários e das pensões, especialmente das mais baixas,",504
e a promoção da justiça fiscal.,503
"Uma política que fortaleça o sistema público da Segurança Social,",504
"que recuse o plafonamento,",504
aposte na diversificação das fontes de financiamento visando consolidar sustentabilidade financeira do sistema,504
"e assegure uma profunda melhoria do conjunto das pensões, das reformas e das prestações sociais.",504
"Uma política de reforço das medidas de prevenção, tratamento e reinserção social dos toxicodependentes.",504
Uma política de integração das comunidades imigrantes e o combate ao racismo e à xenofobia.,607
"7º - A promoção da educação,",506
da cultura e,502
"da ciência, como objectivos centrais da sociedade portuguesa.",411
"Uma política educativa que tenha como principais orientações, em todos os níveis de ensino, a defesa e aperfeiçoamento de uma escola pública e gratuita.",506
"Escola democratizada no acesso, frequência, sucesso e saídas profissionais.",506
Uma escola pública de qualidade e para todos.,506
