Text,Code
"– Divulgação das competências e do funcionamento dos julgados de paz de forma a facilitar o acesso dos consumidores à justiça,",303
"permitindo a resolução de conflitos de consumo de uma forma mais simples e mais célere,",303
"conflitos que a serem resolvidos judicialmente, levariam a custos muito elevados, prazos excessivamente longos e utilização de procedimentos complexos.",303
"Propostas para o Desenvolvimento Educativo, Científico e Cultural.",H
– Educação,H
– Ensino Superior,H
– Ensino e formação profissional,H
– Desporto,H
– Ciência e tecnologia,H
– Sociedade da informação,H
– Cultura,H
– Comunicação Social,H
EDUCAÇÃO.,H
"O País precisa, especialmente na conjuntura internacional presente, de um ensino de alta qualidade,",506
que cubra o objectivo de democratização e as necessidades educativas e da economia que o PCP propõe.,506
"Isso só é compatível com uma coerente linha de construção de uma escola pública, de qualidade e para todos",506
que deve mobilizar as vontades dos diferentes intervenientes no processo educativo.,506
Educação entre as grandes prioridades da política nacional.,H
"Vencer os atrasos na educação, ensino e formação continua a ser uma das grandes prioridades nacionais.",506
"Este objectivo implica, entre outras medidas:",506
"um crescente esforço financeiro, o alargamento da escolaridade obrigatória para 12 anos,",506
"uma outra reestruturação curricular, democrática e cientificamente sustentada,",506
"a dignificação dos primeiros anos de escolaridade,",506
a contínua expansão do ensino superior público,506
"e da rede pública do pré-escolar,",506
"a racionalização do parque escolar, procurando largos consensos na sua concretização,",506
"a escola inclusiva e a resposta a necessidades educativas especiais,",506
"a qualidade do ensino que viabilize o pensamento crítico e criativo e o exercício de uma cidadania activa,",506
"a cooperação entre todos os participantes no processo educativo, no respeito das respectivas especificidades.",506
A escola pública num quadro de autonomia e participação.,H
"O justo equilíbrio entre a autonomia da escola, participada pela respectiva comunidade,",301
e a não desresponsabilização do Estado,302
tem que ser o suporte da modernização do sistema educativo.,506
"Isso implica, nomeadamente:",506
a definição de metas de cada escola no quadro de projectos educativos locais,301
e das escolas e no respeito das orientações educativas nacionais.,302
a coordenação dos diferentes intervenientes no processo educativo,303
"e criação de Conselhos Municipais de Educação, que não substituem a necessidade de estruturas regionais e locais do sistema.",301
"a revogação do decreto-lei 115-A/98,",302
e a aprovação de legislação que aprofunde a experiência de gestão democrática das escolas,202
"e permita a diversificação na gestão curricular,",506
uma atitude que acabe com a governamentalização e dirigismo nalguns aspectos,301
e a desresponsabilização do Estado noutros.,302
"um sistema de funcionamento das escolas auto-regulado democraticamente e assente em níveis local, regional",301
e nacional.,302
"aprovação de uma lei de financiamento do ensino não superior que consagre as responsabilidades do Estado,",506
"a definição dos critérios em que se exerçam as medidas para vencer as desigualdades entre escolas e níveis de ensino,",506
"orçamentos próprios no 1º ciclo, com auscultação dos docentes e outros intervenientes.",506
"diálogo com sindicatos, organizações profissionais, de juventude e de pais e com o Conselho Nacional de Educação que se traduza em propostas para a melhoria do funcionamento do sistema.",506
Acesso e sucesso escolares mais democráticos.,H
"A igualdade de oportunidades, quer no acesso quer no sucesso escolares,",503
"subjacente ao projecto constitucional,",203
exige uma complexa rede de apoios sociais educativos que discriminem positivamente muitas crianças e jovens.,503
Isso implica:,503
a gratuitidade da componente educativa,503
"e a garantia de acesso a refeições, complementos educativos e outras actividades,",503
"no quadro de uma acção social escolar com valores mais elevados,",504
assegurando uma escola a tempo inteiro.,506
o acesso mais justo ao ensino superior e abolição do numerus clausus.,503
a formação permanente e recorrente que vença a iliteracia e permita outros níveis de qualificação.,506
o desenvolvimento dos serviços de psicologia e orientação.,506
"outra revisão curricular mais correspondente, às necessidades actuais e de formação integral,",506
de uma educação multicultural,607
"e que preveja as componentes curriculares locais,",301
"o estímulo à criação de projectos educativos locais,",301
"o aperfeiçoamento da avaliação externa e a auto-avaliação, evitando os efeitos perversos dos rankings simplificadamente estabelecidos, construídos e deliberadamente divulgados pelo Governo.",506
"redefinição das funções e objectivos do ensino secundário (cursos gerais e cursos tecnológicos),",506
do ensino e da formação profissionais.,411
melhoria da formação inicial,506
"e contínua dos professores e outros profissionais,",411
"aperfeiçoamento e definição de carreiras de outros técnicos,",411
"incentivos à fixação de professores no interior,",506
"aumento do pessoal técnico, administrativo e auxiliar e promoção de qualificação de todos os participantes no processo educativo.",411
ENSINO SUPERIOR.,H
"O ensino superior é indispensável ao desenvolvimento do País e à sua elevação cultural, técnica, científica que constituem direitos individuais e colectivos inalienáveis.",506
"Ensino superior público, gratuito e de qualidade",506
são objectivos para concretizar a democratização do acesso e da frequência do ensino superior pelas várias camadas sociais e etárias do País.,503
"O País carece de uma verdadeira política de esquerda nesta matéria, capaz de resistir às pressões da OMC para a liberalização dos serviços, incluindo a Educação, que pretendem levar ao seu tratamento como mercadoria.",506
"O País carece de uma política que defina como prioridade a afectação de recursos para a educação, possibilitando assim a recuperação de atrasos diversos e graves na qualificação e formação da população portuguesa.",506
"O País carece de um sistema único de ensino superior público, integrado e diversificado em que as instituições se distingam pelos seus objectivos e capacidades de concretização e não por visarem um estatuto social diferenciado.",506
"O País carece de uma verdadeira política integradora dos diferentes graus de ensino, em que se identifiquem objectivos de articulação entre os mesmos seja garantido o acesso generalizado da população portuguesa à educação",506
"e cultura,",502
bem como aos benefícios da ciência e da investigação.,411
"A criação do espaço europeu do ensino superior, na sequência da declaração de Bolonha, aponta para a criação de um grau único de formação inicial, o que sendo positivo não deverá derivar em tentativas mais ou menos explícitas de economicismo, nem na uniformização e redução da duração da formação inicial no ensino superior com o objectivo central da rápida empregabilidade das formações, aumentando a desresponsabilização do Estado pelo financiamento do sistema à custa de «pós-graduações» custeadas pelos estudantes.",506
Assim o sistema público de ensino superior que o PCP preconiza baseia-se:,506
"– Na programação prospectiva da evolução do sistema de ensino, estabelecendo orientações e objectivos que aproximem a qualificação e as competências da população portuguesa a padrões europeus.",506
"– Na garantia do acesso a níveis de formação superior essenciais ao progresso do País a todos os portugueses que mostrem capacidade e motivação para tal, proporcionando as necessárias vagas de acesso e eliminando o sistema de restrições quantitativas globais (numerus clausus).",506
"– Na autonomia das instituições, na cooperação entre elas e, enquanto subsistir o sistema binário, na não discriminação relativamente ao subsistema em que se encontrem.",301
"– Na insubstituível responsabilização do Estado pelo financiamento do funcionamento com qualidade das instituições e do desenvolvimento dos respectivos projectos, com referência a critérios objectivos, baseados em resultados, que assegurem ensino e investigação de nível elevado, bem como a gratuitidade da formação, tornando-a independente do poder económico e resistindo às crescentes pressões para a mercantilização dos saberes.",506
"– Na gestão transparente e na participação democrática de todos os agentes da comunidade académica na vida das instituições, na colegialidade das decisões,",202
na prestação de contas à sociedade pela boa utilização dos dinheiros públicos e na constante preocupação com a eficiência e a eficácia de todas as actividades.,303
"– No apoio activo à inovação pedagógica, à qualificação dos recursos humanos e à dotação de condições de trabalho que viabilizem essa inovação e motivem a aprendizagem atacando, assim, as causas explícitas e implícitas que estão na origem do elevado insucesso escolar registado, para enfrentar, enfim, o carácter profundamente negativo que esta questão tem na sociedade portuguesa.",506
"– Na fixação de condições objectivas, comuns a todas as instituições, para aquisição e reconhecimento da faculdade de atribuição de cada um dos graus académicos.",506
"– Na garantia dos apoios de acção social aos estudantes,",506
"necessários ao aumento da democratização do acesso e da frequência do ensino superior,",202
promovendo a igualdade de oportunidades,503
e prestando particular atenção aos trabalhadores estudantes e aos estudantes deslocados.,503
"– Nos incentivos à crescente qualificação dos corpos docente e não docente,",506
"bem como à prática da investigação em todas as instituições do ensino superior, designadamente assegurando em quadros de dotação global lugares, em número suficiente para professores, investigadores e técnicos,",506
"combatendo as situações de precariedade e de desmotivação,",704
"reconhecendo o bom desempenho dos docentes,",704
e criando paralelamente incentivos à mobilidade.,402
"– Na dignificação das carreiras, criando condições de trabalho e níveis salariais correspondentes ao importante papel social dos profissionais do ensino superior",704
"e garantindo o concurso dos melhores para este sector estratégico para o desenvolvimento cultural, económico e social do nosso País.",411
"Por fim, o reconhecimento de instituições privadas deve ser assumido no quadro de uma opção individual e implicar:",506
avaliações que as certifiquem ou não.,506
regras essenciais comuns aos sistemas público e privado para a contratação de docentes e respectivas carreiras.,506
"a garantia aos estudantes do cumprimento de uma relação contratual com a instituição, incluindo as condições financeiras da frequência do curso e a garantia das condições para a conclusão do mesmo, bem como o acesso a prestações sociais do Estado enquanto o numerus clausus se mantiver no sistema de acesso ao ensino superior.",506
ENSINO E FORMAÇÃO PROFISSIONAL.,H
"O ensino e a formação profissional são essenciais para as necessidades da economia, a especialização dos seus perfis produtivos, as vocações dos jovens e a actualização dos trabalhadores menos jovens.",411
"Esse reconhecimento passa pela adopção de linhas estratégicas que melhor aproveitem os recursos disponíveis, criem as formas de acesso de todos à formação permanente,",411
valorizem o ensino público e maior autonomia das escolas secundárias na definição dos currículos e da sua localização regional.,301
Essa atitude implica:,411
"a desburocratização dos centros de emprego,",411
"a elaboração de referências profissionais reconhecidas no espaço da União Europeia,",411
uma regulação da aplicação dos quadros comunitários ainda disponíveis.,403
"um maior rigor das candidaturas e da sua fiscalização,",303
"a elaboração de curricula e cargas horárias adequadas mas no quadro de uma formação equilibrada,",411
a criação de uma rede de estágios profissionais em empresas públicas e privadas,411
e a valorização das aprendizagens informais para efeitos profissionais.,411
DESPORTO.,H
"O PCP propõe, como orientação essenciais para uma política de desenvolvimento do desporto nacional:",502
"- Conceber o desporto como um factor de desenvolvimento cultural e de integração social, de realização do Homem e dos seus direito e de aproximação entre os povos",502
"garantindo a democratização do desporto,",202
alargando a prática desportiva a todos,502
"e envolvendo os praticantes na concepção, organização, gestão e avaliação das actividades.",202
- Garantir a educação física e o desporto escolar em todos os níveis e graus de ensino.,506
"- Apoiar o associativismo, reconhecendo o papel fundamental do clube como célula base do desenvolvimento desportivo",502
e promover uma política de descentralização e de cooperação entre os diferentes níveis da administração e o associativismo.,301
"- Atribuir meios financeiros adequados à importância que o desporto assume na saúde, na qualidade de vida e bem-estar da população.",502
Para uma verdadeira política de desenvolvimento,502
"e democratização da cultura física e do desporto, o PCP propõe:",202
"- Um Plano Nacional de Desenvolvimento Desportivo, com a participação da Administração Central e Local, do movimento associativo, das escolas e de outros agentes e instituições desportivas.",502
- Um Plano Integrado de Infra-estruturas Desportivas que permita dotar o País das infra-estruturas necessárias para a prática generalizada da população e para o desporto de alto nível.,502
"- O aumento do financiamento do desporto, apontando progressivamente durante a próxima legislatura para o valor de 1% do Orçamento do Estado, como dotação básica, com o correspondente aumento decisivo do apoio da Administração Central ao movimento associativo desportivo popular, aos clubes desportivos, às associações e federações desportivas.",502
"- Assegurar a educação física como disciplina obrigatória em todos os graus do Ensino Básico e Secundário, dotando as escolas de instalações adequadas e de professores qualificados, tomando medidas de emergência no que se refere ao 1º Ciclo do Ensino Básico.",502
"- Assegurar uma prática desportiva escolar extracurricular a todos os rapazes e raparigas das escolas, até ao nível universitário,",506
"envolvendo na concepção, preparação, organização, gestão e avaliação desta actividade, os estudantes, os professores e os pais, procurando dar-lhe uma expressão organizativa com larga autonomia.",502
"- Articulação da actividade desportiva escolar com o associativismo desportivo, federado ou não e a comunidade local em geral, com o objectivo de criar um espaço de acolhimento e de prática desportiva dos jovens, ainda, durante e após a escolaridade.",502
- Dinamizar o desporto no trabalho designadamente através do apoio aos clubes de empresa e às estruturas representativas dos trabalhadores.,502
"- A introdução de medidas que promovam a igualdade de oportunidades entre mulheres e homens em todos os Planos Nacionais e políticas desportivas, de forma a promover o acesso das mulheres a todos os níveis de funções e esferas de competências.",503
- Promoção do desporto para a população deficiente,705
"e para a população idosa,",706
através de programas específicos e do apoio às suas associações.,502
- Alargar as medidas de conforto e segurança nos recintos desportivos aos clubes de desporto não profissional e garantir o policiamento gratuito das actividades desportivas amadoras e populares.,502
"- Apoio mais substancial à alta competição através das federações e a nível da representação olímpica, definindo planos de desenvolvimento para esta área a curto, médio e longo prazos.",502
"- Garantia aos atletas de alto nível da dignificação da sua função social, do desenvolvimento das suas capacidades em condições de preparação adequadas, dos meios exigíveis de preparação e trabalho para os técnicos e apoio à medicina desportiva",502
e à investigação científica,411
"e valorização do atleta, desde a detecção do seu valor até ao fim da carreira.",502
"- Estimular no seio do movimento associativo desportivo popular novas formas e soluções competitivas para o desporto amador e a prática desportiva generalizada dos cidadãos e das cidadãs, incluindo as novas práticas de contacto com a natureza e os chamados desportos radicais.",502
- Reconhecer o papel social das mulheres e homens dirigentes associativos desportivos garantindo-lhe um estatuto que consigne apoios à forma benévola como exerce a sua actividade.,502
"- Valorizar e apoiar as organizações representativas de atletas, treinadores e outras associações, cujo papel é indispensável à necessária intervenção e autonomia destes agentes desportivos.",502
"- Adoptar um plano nacional de formação de técnicos e outros agentes quer a nível superior, quer a níveis intermédios e do voluntariado, estabelecendo os mecanismos de progressão e as carreiras profissionais respectivas.",502
"- Promover a reforma da medicina desportiva revogando a legislação actual e criando condições de acompanhamento médico geral e gratuito aos praticantes desportivos, ao nível da prevenção e do tratamento, no quadro do Serviço Nacional de Saúde.",502
"- Incentivar a investigação científica em desporto, articulando o sistema desportivo e as instituições universitárias e de investigação existentes e criar um centro de investigação especializado e um Observatório do Desporto.",502
"- Articular as políticas desportiva e de saúde com o objectivo de promover estilos de vida saudáveis e atingir mais elevados padrões de qualidade de vida, de bem-estar, saúde e prevenção da doença.",502
"- Apoiar e estimular a recolha, preservação e dinamização da prática dos jogos populares tradicionais.",502
"- Rever a Lei de Bases do Sistema Desportivo e toda a legislação complementar que a regulamenta, elaborando a legislação em falta, designadamente sobre desporto dos trabalhadores e das federações multidesportivas e rever a legislação das SAD.",502
- Acompanhar e garantir a fiscalização dos processos dos Estádios de Futebol para o Euro 2004.,502
"- Constituição, junto da Assembleia da República, de um órgão realmente representativo do movimento desportivo que substitua o actual e ineficaz Conselho Superior do Desporto.",502
CIÊNCIA E TECNOLOGIA.,H
"Deve ser objectivo da acção governativa no domínio da C&T, promover a aplicação do conhecimento científico e técnico e do método científico,",411
"na procura e concretização de soluções eficazes e socialmente adequadas à resolução dos problemas que se colocam aos cidadãos e à comunidade,",411
"tendo como preocupação metas de desenvolvimento sustentável, que compreendam a melhoria das condições de vida da população",416
e a preservação do meio ambiente.,501
Para tanto é indispensável consolidar e desenvolver os recursos humanos,411
"e as infraestruturas materiais afectos às actividades de investigação,",411
"incentivar a participação do sector produtivo no desenvolvimento dessas actividades,",411
promover a generalização e o rendimento da aprendizagem das ciências e das técnicas e a difusão da cultura científica.,411
— Uma política e um orçamento de C&T à medida das necessidades do País.,411
"É necessário elaborar, de forma participada, uma política de C&T, a submeter ao Parlamento,",411
"contendo orientações, prioridades e metas plurianuais.",404
Para a definição de orientações e prioridades importa criar ou reactivar estruturas consultivas e de participação da comunidade científica e da sociedade em geral.,411
Há que reforçar significativamente o Orçamento de C&T,411
"e pôr em prática mecanismos de financiamento eficazes,",411
"garantindo a transparência dos critérios de atribuição de fundos,",303
"a adequação dos montantes às reais necessidades de execução dos projectos,",303
bem como procurar esquemas adequados de descentralização parcial da atribuição de fundos para a investigação livre,301
"e uma repartição adequada dos recursos, entre orçamentos-base, financiamentos por contrato e financiamentos por concurso.",411
"Importa definir os programas de I&D a contratar por cada área de tutela ministerial com unidades e laboratórios de investigação,",411
"respectiva quantificação e inclusão no Orçamento de C&T,",411
"sem excluir a adjudicação a empresas, da execução de projectos de interesse público, eventualmente em parceria com centros ou laboratórios do Estado.",411
Importa também criar um fundo de emergência para a recuperação de instalações degradadas e a renovação e actualização de equipamentos.,411
— Valorização dos recursos humanos de C&T.,411
"Os recursos humanos, que são a principal valia dos organismos de investigação, devem merecer especial atenção.",411
"Entre outras medidas, e para além da revisão do Estatuto da Carreira de Investigação Científica, importa proceder à criação, nas instituições universitárias e laboratórios do Estado, das carreiras técnicas de investigação, incluindo a de técnico superior de investigação e de operário prototipista.",411
"Deve ser revisto o quadro normativo definido no estatuto do Bolseiro, contemplando a equiparação progressiva dos direitos dos bolseiros em matéria de segurança social, assistência e serviços sociais, férias e remunerações, aos trabalhadores da função pública com habilitações equiparadas, ao mesmo tempo garantindo que a sua aplicação se confina a situações de formação pós-graduada e especializada e não à satisfação em regime precário de necessidades permanentes das unidades de acolhimento.",411
Devem ser rejuvenescidos os quadros de investigação dos organismos de investigação e criados quadros de pessoal investigador nos organismos de investigação que ainda os não possuem.,411
— Dinamização das instituições de investigação.,411
"Importa garantir a existência no sector público de uma rede de laboratórios de investigação científica e tecnológica e de prestação de serviços especializados, em áreas de importância estratégica para o desenvolvimento do País, com organização e regras de gestão adequadas, não excluindo a criação de novas unidades em domínios a descoberto.",411
"As regras de gestão financeira e patrimonial deverão ser flexibilizadas de acordo com as exigências de funcionamento das unidades de investigação, e as respectivas dotações",411
"orçamentais deverão ser suficientes, tornando dispensável o recurso a instituições virtuais, ""fundações"" e outras, com custos invisíveis e efeitos perversos.",411
Importa estabelecer as missões de interesse público dos laboratórios e as modalidades de financiamento por contrato plurianual com o Estado para a prossecução dos respectivos fins.,411
"rever, actualizar e rejuvenescer os respectivos quadros de pessoal, mediante o estabelecimento de prioridades de recrutamento.",411
Os lugares de direcção máxima dos organismos de investigação do Estado deverão ser providos por concurso público.,303
"Em matéria de recursos financeiros, institucionalizar o ""orçamento-base de I&D"" nas universidades e garantir em todas as instituições a cobertura integral das despesas com o pessoal permanente com dotações do Orçamento de Estado.",411
SOCIEDADE DA INFORMAÇÃO.,H
"O PCP considera que a sociedade da informação pode representar uma transformação prenhe de consequências positivas,",411
e que os perigos reais referidos poderão ser minimizados se forem assumidas as políticas democráticas adequadas.,202
"Para atingir estes objectivos, o PCP defende sete orientações fundamentais:",411
"– Desenvolvimento das respostas adequadas aos desafios da universalidade de acesso colocados pela sociedade da informação, por forma a que esta venha a ser uma realidade para todos os estratos da sociedade",506
"e a incluir eficazmente as áreas da Educação, da Cultura, da Saúde",502
e da Assistência às Pessoas com Necessidades Especiais.,705
"– Observação e avaliação permanentes dos impactes da prática do teletrabalho, e tomada oportuna das medidas, nomeadamente legislativas, que se venham a revelar necessárias a uma equilibrada transição para um tipo diferente de organização dos processos laborais, nomeadamente no que respeita à defesa dos direitos e garantias dos trabalhadores afectados.",701
"– Observação e avaliação permanentes dos impactes das actividades de comércio electrónico (nomeadamente a nível de estruturas de intermediação em geral e, em particular, do sistema monetário, em face da criação de dinheiro electrónico), tendo em conta o facto de que este também se processa a nível internacional (questões da taxação das transacções, diferentes legislações aplicáveis).",403
"– Promoção da participação das pessoas e das organizações na definição das suas necessidades em serviços e aplicações, tendo em conta as possibilidades crescentes de oferta de soluções diversificadas.",202
"– Efectivação generalizada do armazenamento, transporte e processamento digital da informação existente e a criar",411
