Text,Code
Indústria transformadora.,H
A indústria transformadora continua a desempenhar um papel ímpar e fundamental no desenvolvimento coerente da economia portuguesa.,410
"Para estancar a eliminação de actividades produtivas essenciais,",410
"para assegurar a existência de uma indústria transformadora criadora de riqueza,",410
torna-se necessário adoptar um conjunto de medidas integradas que implicam uma política oposta à actual.,410
"A existência de uma indústria transformadora moderna, tão forte e integrada quanto possível, é uma das condições indispensáveis para alterar o papel periférico da economia portuguesa no quadro da União Europeia,",410
"isto é, permitir o crescimento quantitativo e qualitativo da produção industrial de base nacional e em território nacional é condição indispensável ao desenvolvimento.",410
"Torna-se portanto necessário obter de forma sustentável uma melhoria da competitividade da nossa indústria transformadora,",410
dispondo de uma força de trabalho crescentemente valorizada,411
"e que permita obter melhorias em termos de produtividade-qualidade,",410
perfil de especialização e rendimentos energéticos e de matérias-primas.,410
"Para a concretização de tais objectivos estratégicos, o PCP propõe a adopção do seguinte conjunto de medidas, base fundamental de uma política industrial alternativa:",410
"– modernização organizacional e tecnológica da indústria, incluindo os chamados sectores produtivos tradicionais.",411
– dinamização e diversificação da actividade industrial em sectores complementares de fileiras em que Portugal apresenta vantagens comparativas no comércio internacional.,410
"– dinamização da actividade industrial em sectores com capacidade de gerar maior valor acrescentado, independentemente do carácter público ou privado da titularidade das empresas envolvidas.",410
– criação e/ou melhoria dos laços de cooperação entre a indústria e as instituições do sistema nacional de ciência e tecnologia.,411
"– aperfeiçoamento estruturante e especializado da força – de - trabalho ligada à indústria em todos os planos e níveis - operários, técnicos, gestores e empresários.",411
– reestruturação dos centros tecnológicos no sentido de conseguir a sua eficaz capacidade de apoio á indústria.,411
"– adopção de soluções associativas/cooperativas para melhoria, designadamente, da competitividade comercial nos mercados internos e externos.",403
"– suster a liquidação do sector público e proceder ao seu claro reforço e reorganização em áreas estratégicas, isoladamente ou em alianças com o sector privado.",303
"– revisão das condições de atracção do IDE, de molde a que este não seja um mero instrumento conjuntural, antes possa constituir uma contribuição válida para a estruturação da nossa indústria.",411
Indústria extractiva.,H
"Quer em termos de potencialidades, quer em termos económicos, a indústria extractiva nacional continua a apresentar uma posição de relevo no quadro europeu,",501
embora muito marcada pelas cotações internacionais dos metais,501
"e pela ausência de uma política de fileiras alicerçada na abundante existência de alguns metais básicos, o que lhe tem dado uma expressão muito conjunturalizada.",501
"Com vista a um melhor aproveitamento de tais potencialidades, considera-se fundamental e urgente a adopção das seguintes medidas:",501
"– Definir uma estratégia de longo prazo para a exploração dos recursos geológicos nacionais já identificados,",501
"e elaborar um Plano Nacional para o sector numa perspectiva de fileira – casos do cobre, zinco e chumbo",501
"– que, inclusive, contemple os trabalhos de cartografia geológica, prospecção e pesquisa a desenvolver prioritariamente.",501
"– Defender a utilização preferencial dos produtos mineiros portugueses por parte das economias comunitárias, face a produtos de países terceiros.",406
"– Promover o melhor aproveitamento dos recursos hidrominerais nacionais, particularmente das águas com propriedades medicinais,",501
"através da criação de estâncias termais em regiões carentes destas estruturas,",501
e no quadro de uma política de saúde pública e desenvolvimento turístico.,501
"– Intensificar a fiscalização da actividade das empresas do sector,",501
"designadamente quanto à correcção das técnicas de exploração em uso,",501
"ao respeito pelos planos de exploração aprovados pela tutela,",501
às normas de higiene e segurança dos trabalhadores,501
e à sua responsabilidade nos processos de recuperação ambiental e paisagístico de áreas ou minas desactivadas.,501
– Redimensionar e reestruturar o Instituto Geológico e Mineiro.,303
Incrementar a actividade de I&DE dos laboratórios do Estado relacionada com a indústria extractiva.,411
– Reforçar o papel do Sector Empresarial do Estado (SEE) na fileira Indústria Extractiva-Indústria Transformadora,412
"e fomentar a exploração integrada de pequenos jazigos, através da sua intervenção e/ou de associativismo empresarial.",402
"– Proceder à modernização tecnológica das empresas do sector,",411
e estimular a exploração dos recursos geológicos das regiões em processo de despovoamento.,402
CONSTRUÇÃO CIVIL E OBRAS PÚBLICAS.,H
"Na resposta aos actuais problemas, estrangulamentos e distorções presentes nos sectores da construção civil e das obras públicas, o PCP propõe o seguinte conjunto de medidas:",403
"– Avaliação rigorosa do conjunto de vectores – legislativos, económico-financeiros, tecnológicos, fiscais, de mercados públicos que hoje enquadram e condicionam os dois sectores",303
"e a promoção das consequentes medidas que permitam o embaratecimento da construção civil no País,",403
uma maior eficiência dos dinheiros públicos (e em particular dos fundos comunitários),303
investidos e uma acrescida competitividade das empresas nacionais.,410
"– Reforço profundo das políticas de reabilitação e requalificação do edificado já estabilizado, fundamentalmente dos grandes centros urbanos,",408
"contrariando as políticas de abandono e demolições, base de espirais especulativas,",408
em particular com a reorientação das políticas de planeamento urbano,408
e da actual política de financiamento à aquisição de habitação.,402
"– Desenvolvimento da investigação aplicada aos materiais, aos componentes construtivos e a novas técnicas construtivas,",411
"com o objectivo de, sem diminuição de qualidade, antes pelo contrário, permitir baixar os prazos e os custos de construção",403
com inevitáveis reflexos sobre os preços da habitação.,403
"– Promoção pelas entidades públicas, junto de promotores imobiliários, construtores e sectores da indústria transformadora a jusante da construção civil, da adopção de normas que conduzam a uma maior «industrialização» do processo construtivo,",411
"isto é, de incorporação crescente de componentes pré-fabricados com vista à obtenção de melhorias de qualidade, prazos e custos.",403
– Melhoria profunda das condições de segurança em que se desenvolvem os processos construtivos,701
"com envolvimento eficaz das entidades públicas competentes, dos sindicatos e das empresas e associações empresariais.",405
– Acreditação e controlo da actividade produtiva mais rigorosos das empresas de construção nas suas diversas vertentes por parte das autoridades públicas competentes.,403
"– Melhoria das qualificações dos trabalhadores a todos os níveis,",411
"através, designadamente, da formação profissional intensiva e continuada",411
"como condição para a melhoria do desempenho nos planos da qualidade, da segurança, dos custos e dos prazos.",411
"– Aperfeiçoamento da legislação aplicável aos concursos públicos de construção civil,",303
com vista à obtenção de adequados compromissos entre a transparência dos processos de concurso,303
e a agilidade dos prazos no respeito pelos direitos e deveres das partes.,303
"– Promoção de adequadas orientações no domínio do planeamento dos investimentos públicos em termos sectoriais e temporais,",303
com vista a adequá-los a um desenvolvimento e ordenamento territorial do País.,303
TURISMO.,H
"O direito a férias e outras importantes conquistas sociais têm contribuído para que um número crescente de pessoas satisfaça o legitimo anseio de conhecer outras Regiões, Países e Povos.",502
Por outro lado a crescente interdependência das economias à escala mundial e a necessidade de permuta de conhecimentos tecnológicos e científicos entre os países gera importantes fluxos de pessoas constituindo já outro importante segmento da actividade turística.,107
"O Turismo deve afirmar-se cada vez mais respeitando e integrando-se no meio envolvente, social, cultural",502
"e ambiental,",501
"evitando e combatendo concepções da actividade turística isolacionistas (ilhas turísticas em caos urbanísticos e sociais),",501
"segregadoras (zonas exclusivas e acessos restritos e de privilégio),",503
ou atentatórias da dignidade humano (como por exemplo o chamado «turismo sexual»).,201
Uma política nacional do turismo deverá ter por base:,H
"– Uma Lei de Bases do Turismo, elaborada com base num grande consenso nacional que não só é desejável como também se afigura possível, e que aponte os grandes objectivos e vias do seu desenvolvimento sustentável:",416
"crescimento equilibrado das diferentes Regiões, respeito pelo meio ambiente",501
"e diversidade cultural,",607
"requalificação e dignificação dos recursos humanos,",411
"respeito pela solidariedade na relação do poder Central com os Órgãos regionais e Locais de Turismo, estratégia da organização e planeamento da promoção turística.",606
"– Planos Regionais de Turismo em todas as Regiões-plano, elaborados em estreita articulação com as entidades regionais e locais interessadas no progresso das suas Regiões,",404
"e com audição plena de todos os interessados, por forma a viabilizar o racional aproveitamento e optimização dos recursos disponíveis.",202
"– O enquadramento da oferta paralela com vista à sua integração progressiva no mercado legal,",304
"combatendo a evasão fiscal,",304
"trabalhando para o aumento das receitas do Estado,",303
"para a igualdade de deveres de todos os empresários,",304
e a melhoria da qualidade oferecida.,303
"– O reforço do financiamento à disposição do sector,",402
"e maior rapidez e simplicidade dos processos de atribuição aos respectivos agentes,",303
"por forma a melhorar e diversificar a oferta e, em paralelo, desenvolver programas de requalificação urbana de zonas degradadas,",502
"suprindo carências em infra-estruturas culturais, desportivas, e congressuais.",502
– Uma política de emprego,701
e formação,411
"assente na valorização dos salários,",701
"na consolidação dos vínculos laborais,",701
no reconhecimento de que uma mão-de-obra qualificada é indispensável a um destino turístico que se tem de afirmar pela qualidade.,411
"– A alteração e reforço das estruturas centrais de promoção interna e externa,",303
"de modo a autonomizar o seu funcionamento nos planos financeiro e operacional,",303
"em cooperação estreita com as estruturas regionais e locais de turismo, de forma a obter o maior retorno possível dos recursos aplicados na promoção do nosso turismo.",303
– A elaboração de uma nova Lei Quadro das Regiões de Turismo enquadrando experiências inovadoras em curso,411
"e assente numa efectiva descentralização de competências, meios financeiros, e poderes,",301
a par da racionalização resultante da revisão e alargamento das respectivas zonas de intervenção.,303
COMÉRCIO E DISTRIBUIÇÃO.,H
O PCP propõe:,H
– Estabelecimento de uma política de ordenamento dos espaços comerciais.,403
manter suspensos os licenciamentos de novas Unidade Comerciais de Dimensão Relevante (UCDR) até uma avaliação rigorosa do seu peso nas quotas dos mercados nacional e regionais.,403
"avançar com nova regulamentação para a gestão dos Centros Comerciais mais adequada à sua realidade específica, pondo cobro às inúmeras situações de degradação existente em alguns.",403
"– Reformulação da legislação de licenciamento das UCDR, a qual deve vir a incluir a realização obrigatória de estudos de avaliação dos impactos económico, ambiental e urbana, como condição prévia para autorização para o licenciamento de novas grandes superfícies e o estabelecimento de grandes cadeias comerciais.",403
"relativamente aos horários, concretizar pela Administração Central o encerramento todo o Domingo, criando as coimas e a fiscalização adequada ao seu cumprimento.",403
– Acesso ao crédito bancário com custos semelhantes aos auferidos pelos grandes grupos,402
"e a criação de linhas de crédito bonificado e de financiamento destinadas a promover a modernização e a adaptação do pequeno comércio aos requisitos actuais e aos interesses dos consumidores,",402
bem como a adopção de um quadro fiscal com o mesmo fim.,402
"– Garantia de estabilidade profissional,",403
"que estimule o investimento e a qualidade de serviço,",403
garantindo uma Lei de Arrendamento Comercial justa.,403
"– Avaliação rigorosa do quadro económico, social, jurídico em que se processa o comércio à distância e em particular o comércio electrónico,",403
e criação de legislação que impeça o monopólio e/ou a concorrência desleal nesses novos segmentos comerciais.,403
– Reformular a legislação e regulamentação da Lei da Concorrência.,403
"dotar dos meios humanos e técnicos, agilizar processos de fiscalização e instrução das violações da Lei da Concorrência,",403
rever coimas e outras penalizações para responder com eficácia e em tempo útil a múltiplas situações de concorrência desleal.,403
– Separar ao nível do aparelho do Estado os serviços que tutelam e acompanham os problemas da distribuição e do comércio daqueles que intervêm em matéria de concorrência.,303
"– Promoção e incentivo jurídico e financeiro pelo Estado de formas de associação, designadamente cooperativa, parcerias, centrais de compras e outras",402
"que diminuam os custos e promovam a qualidade,",402
assegurem a defesa dos interesses dos consumidores,403
e privilegiem a produção nacional.,403
"– Implementação de mercados abastecedores, rede de frio e outras infra-estruturas de distribuição,",411
com a participação na sua gestão de todos os interessados e a aproximação entre o produtor e o consumidor.,202
– Criação de um quadro nacional único para o exercício do comércio,403
e a adopção de mecanismos de controlo e fiscalidade simplificados para o exercício de certas formas de comércio como as feiras e mercados.,403
"– Garantia de acessibilidade aos fundos comunitários,",402
"com a diminuição dos patamares financeiros e das peias burocráticas,",402
fornecendo apoio técnico para a apresentação de candidaturas.,402
criação no III QCA de um sistema de apoio à modernização do comércio em meio rural e na periferia dos centros urbanos.,402
cumprimento rigoroso dos critérios e prazos na aprovação dos projectos e pagamento dos incentivos.,402
"– Apoio à revitalização das estruturas representativas dos pequenos e médios comerciantes, por forma a proverem a defesa dos seus interesses específicos,",202
assegurando a sua participação na definição das normas de exercício da actividade.,202
SISTEMA FINANCEIRO.,H
O PCP considera necessária e urgente uma mudança profunda na política até agora prosseguida no sector financeiro e a adopção de uma nova política assente nas seguintes orientações e medidas:,414
"– Reforço do sector público bancário,",414
"tornando-o capaz de exercer um papel de liderança e equilíbrio do sistema financeiro, bem como de responder às necessidades da economia nacional",414
e do desenvolvimento equilibrado e harmonioso do território nacional.,414
"– Recomposição da presença do Estado no sector segurador,",413
viabilizando a implementação de uma política de seguros susceptível de responder às necessidades da agricultura e das pequenas e médias empresas,413
e de complementar os esquemas de protecção social do Estado.,504
– Estabelecimento de regras que impeçam o crescimento excessivo dos grupos financeiros privados.,415
"– Clarificação das competências das entidades de supervisão bancária e seguradora, nomeadamente em áreas de sobreposição,",403
"a par do reforço dos seus poderes e capacidade de intervenção, de forma a assegurar uma fiscalização eficaz de todas as empresas do sector,",403
"incluindo as sociedades auxiliares e instrumentais, bem como as que nelas detenham participações relevantes.",403
"– Definição e fomento de políticas de crédito dirigidas aos investimentos produtivos, às pequenas e médias empresa e às cooperativas.",402
– Penalização pela via fiscal dos investimentos especulativos,403
e regulamentação rigorosa dos investimentos em produtos financeiros derivados.,403
– Garantia do exercício efectivo do controlo de gestão pelas Comissões de Trabalhadores.,202
– Respeito pelos direitos individuais e colectivos dos trabalhadores do sector.,701
ENERGIA.,H
"Na última década, os traços dominantes da evolução do sector energético português foram:",413
o assalto sustentado do grande capital financeiro às empresas públicas do sector.,413
a inexistência de uma política energética coerente a nível nacional.,413
o aumento dos consumos de energia a taxas superiores ao aumento do PIB.,413
No caso da electricidade o Governo desmembrou a EDP,415
enquanto no caso do petróleo e do gás natural efectuou uma absurda mega-fusão Petrogal/Transgás/GDP - negócios gigantescos para beneficio do grande capital financeiro.,415
"Estas operações geraram permanente instabilidade, enquanto o desenvolvimento e a manutenção das redes de transporte e distribuição e a incorporação de tecnologia endógena são descurados.",413
"A fúria privatizadora reflecte-se em despedimentos colectivos e no recurso sistemático a outsourcíng,",413
"prejudicando as empresas de energia e os utentes, pois trabalhadores qualificados são substituídos por empreiteiros que utilizam trabalhadores mal pagos, frequentemente inexperientes.",413
"e assim, a qualidade dos serviços diminui",413
e agravam-se os riscos de acidentes.,413
"Analisados este panorama do quadro energético português e o seu contexto internacional, propõem-se as seguintes orientações e medidas:",402
"– As políticas fiscal, de incentivos e de preços devem estimular o consumo das formas de energia mais eficientes e menos poluentes,",402
"substituindo progressivamente, sempre que possível, fontes e combustíveis convencionais.",501
"– Acabar com o conluio entre o grande capital financeiro e o Governo central,",413
traduzido numa escandalosa política de privatizações e de mega-fusões que ferem o interesse público.,413
Suspender a privatização da Galp Energia e promover o retorno dessas empresas ao Sector Empresarial do Estado.,413
"Coordenar e regular eficazmente os sectores eléctrico, do petróleo e gasista.",403
– O substituto do Programa Energia (POE) deve ter gestão desburocratizada e transparente.,303
a sua execução financeira deve ser regularmente divulgada.,303
Projectos de pequena e média dimensão devem ter acesso a financiamento facilitado.,402
– A Rede Eléctrica Nacional deve reforçar as ligações às congéneres espanholas permitindo fluxos de energia para segurança do abastecimento.,411
O investimento anual em centrais e na rede eléctrica deve ser reforçado.,411
A construção e o arranque dos empreendimentos programados não devem ser atrasados.,411
Desburocratizar os procedimentos na interligação dos produtores independentes à rede.,303
– Diversificar as fontes de abastecimento de petróleo e de gás natural.,501
"Alargar a rede de oleodutos de transporte de combustíveis entre centros produtores e de armazenagem e distribuição, substituindo o transporte rodoviário.",501
Completar o Plano de Investimentos em cumprimento das normas ambientais.,501
"Instalar Unidades Autónomas de Gás, com gás liquefeito, nos pontos ainda não servidos pela rede.",411
Converter as frotas de transporte urbano para gás natural e instalar postos de gás para abastecimento de veículos.,501
"– Viabilizar a continuidade das 20 Agências Locais e Regionais de Energia,",413
dotando-as de recursos e promovendo a aquisição dos seus serviços pela a administração pública.,413
Divulgar o acesso,503
e promover a certificação de qualidade dos serviços.,303
– Actualizar e aplicar os Regulamentos existentes.,403
"elaborar normas e guias técnicos para equipamentos, instalações e exploração de sistemas, ainda não regulamentados, tendo em vista melhorar a eficiência energética",403
e a redução de emissões poluentes.,501
"– Promover a utilização de conceitos de arquitectura solar, condicionamento ambiental passivo e iluminação natural no projecto de edifícios.",501
A especialidade solar térmica deve tornar-se obrigatória para o licenciamento de projectos de edifícios.,501
"– Incentivar o investimento privado no aproveitamentos de fontes de energia renováveis bem como de efluentes e subprodutos,",501
tendo como objectivo a valorização de fontes endógenas de energia e a redução de impactos ambientais.,501
– Incorporação nos planos de estudo dos ensinos superior e profissional de matérias relevantes para acelerar a utilização racional de energia,501
e nos programas do ensino obrigatório de objectivos que promovam a compreensão das fontes e fluxos de bens naturais,501
e estimulem as atitudes de conservação e comportamentos críticos.,501
COMUNICAÇÕES E TELECOMUNICAÇÕES.,H
Sector postal.,H
O sector dos Correios é de grande importância no desenvolvimento do País:,410
"emprega mais de 20. 000 trabalhadores, contribui para a atenuação do isolamento de populações,",410
"transporta e distribui mensagens e materiais, gera receitas anuais de mais de 150 milhões de contos.",410
"Na linha coerente das suas posições ao longo dos tempos, o PCP propõe uma nova política para o Sector dos Correios, que pode ser sintetizada por:",410
"– Afirmação do papel estratégico dos correios ao serviço do País, da economia nacional e das populações.",410
– Defesa de um serviço público de qualidade.,303
– Defesa dos interesses nacionais nas instancias comunitárias.,107
– Garantia do sigilo e inviolabilidade das correspondências.,403
– Defesa dos níveis e qualidade do emprego no sector.,701
"– Defesa e ampliação dos direitos dos trabalhadores,",701
com vigilância reforçada sobre a situação nas novas empresas,701
e a recusa da privatização de serviços.,413
– Responsabilização e actuação do Estado em matéria de normalização e fiscalização das condições de prestação dos serviços e dos regimes laborais em todas as empresas do sector.,403
– Recusa da privatização total ou parcial do capital dos CTT,413
e combate ao desenvolvimento do processo de liberalização.,413
"A importância do papel dos CTT, num sector em mudança acelerada, coloca novas exigências e aponta como necessário:",303
"– Aumento da capacidade e eficiência dos CTT,",303
por forma a corresponder ao aumento da importância que tem hoje a velocidade na prestação dos serviços:,303
"atendimento mais rápido,",303
"acesso telemático a toda a informação relevante para a prestação de serviços,",303
"simplificação dos processos de tratamento,",303
com vista a aumentar progressivamente a percentagem de correio entregue em D+1.,303
"– Introdução, nos serviços prestados e na definição dos produtos, de formas de controle que aumentem a respectiva credibilidade e segurança",303
e protejam os próprios trabalhadores de insinuações e desconfianças sempre que há problemas de qualidade e segurança (os registos são um bom exemplo).,303
"– Participação activa em instituições que acreditem meios de pagamento electrónico, cada vez mais presentes em todos os sectores de actividade.",303
"– Aproveitamento de todas as potencialidades das novas tecnologias,",303
"modernizando e criando um número diversificado de produtos de qualidade, com informação associada,",303
"que permita, como componente essencial da Qualidade de Serviço, informar os expedidores (através da Internet, de preferência), da entrega ou do ponto em que se encontra cada objecto individualmente considerado na cadeia produtiva.",303
"– Criação de condições para adequar o atendimento e a distribuição a novas necessidades e hábitos dos clientes (neste caso sobretudo os individuais),",303
com respeito pelos direitos dos trabalhadores em matéria de horários de trabalho.,701
"– Dinamização e afirmação do Banco Postal como veículo para oferta de serviços bancários em zonas onde não os há,",303
"assumindo um papel fundamental, não apenas para gerar novas receitas que equilibrem financeiramente os CTT,",303
"mas para possibilitar a modernização dos produtos financeiros, tão necessária e urgente,",303
e a simplificação e aumento da produtividade nas relações comerciais com fornecedores e clientes.,303
– Estabelecimento de alianças estratégicas que permitam à empresa afirmar-se nas áreas do correio internacional e salvaguardar o mercado nacional.,406
"– Estabelecimento de parcerias em áreas envolvendo processos de compra por via electrónica, sobretudo na Internet, para que os CTT possam vir a assumir-se como uma das maiores empresas de logística do País,",303
