Text,Code
"- Aumentar em média 20% e no mais curto prazo, o número de vagas dos cursos do ensino superior mais procurados.",506
"- Simplificar o sistema de acesso ao ensino superior, reduzindo o número de exames a realizar e tornando mais transparente e justo o sistema de classificações.",506
"- Profissionalizar a gestão escolar, através de um programa de apoio à formação de gestores.",506
"- Aumentar o investimento em recursos educativos (bibliotecas, laboratórios, centros multimédia, etc.) e instalações, nomeadamente desportivas.",506
- Aumentar o número de professores e de escolas de educação especial.,506
"- Incrementar o ritmo de instalação de novos estabelecimentos de ensino pré­ escolar de forma a que, no prazo da legislatura, sejam atingidos, pelo menos, os 90% de taxa de frequência.",506
"- Apostar, como meio do combate à desertificação do interior, na implementação de uma linha de Universidades nas cidades capital de distrito, recorrendo nomeadamente à criação de Universidades Públicas em Viseu e Bragança.",506
- Profissionalizar a gestão dos estabelecimentos de ensino superior público.,506
- Promover e institucionalizar a cooperação entre estabelecimentos do ensino superior (Universidades e Politécnicos) e o mundo empresarial.,411
"- Criar escolas de excelência no ensino secundário, com a cooperação de entidades privadas e da sociedade civil, para obter centros pilotos de vanguarda do ensino de novas tecnologias e de novos métodos pedagógicos.",506
"- Incrementar a integração de instituições do ensino superior portuguesas nas redes internacionais do conhecimento, nomeadamente em contacto com instituições norte­americanas, de modo a transformar progressivamente Portugal numa placa giratória dos contactos universitários e da comunidade científica mundial.",107
"- Recorrer, quando necessário, à colaboração de docentes e investigadores estrangeiros de elevada craveira, no quadro de programas visando a elevação do valor da comunidade cientifica internacional .",107
- Disponibilizar um computador por cada professor do ensino básico e secundário.,411
- Apostar na formação informática do corpo docente.,411
- Equipar as escolas com o objectivo de atingir o ``ratio'' de um computador por cada três alunos.,411
- Estender a todas as escolas (do ensino básico e secundário) a acessibilidade gratuita à Internet.,411
"- Criar um programa de financiamento para a aquisição de computadores por todos os estudantes do ensino superior, com juro à taxa zero e pagamento em cinco anos.",411
"Após duas décadas de crescimento acentuado do sistema educativo, o desafio que se coloca à sociedade portuguesa é o de qualificar a formação das novas gerações em torno de competências que as preparem para uma inserção dinâmica no mercado de trabalho",411
"e, acima de tudo, na estruturação de uma nova cidadania, assente em valores e condutas abertas à inovação, à mudança e à defesa dos princípios do humanismo universalizante, da liberdade e da democracia representativa.",202
"Cada vez mais, as políticas educativas devem orientar­se pela preocupação de fazer melhor, pela responsabilização perante a sociedade de cumprir objectivos e pela mobilização de todos os agentes educativos para ganhar os desafios que o mundo actual nos coloca.",506
"Neste sentido, pouco significado terá o aumento da despesa pública em educação.",506
"Mais importante do que gastar mais, é gastar melhor e de forma mais racionalizada, com efeitos multiplicados.",506
A nossa preocupação relativamente ao sistema de ensino centra­se nos primeiros anos do trajecto educativo:,506
o pré­primário e o 1º ciclo do ensino básico.,506
"Estamos conscientes de que muito há a fazer, desde o alargamento da rede pré­escolar",506
"à formação de professores,",506
"do combate ao abandono à inovação pedagógica e didáctica,",506
"da estruturação uma cultura de exigência e de rigor à promoção do mérito entre alunos, professores e escolas.",506
"Preocupa­nos o desenvolvimento de uma cultura científica, base indispensável para enfrentar os desafios da sociedade de informação, da complexificação tecnológica e da mutabilidade permanente dos sistemas sociais e culturais.",506
Fiscalidade.,999
"- Baixar em 10% o IRS através de um alargamento de escalões, a fim de assegurar maior justiça fiscal.",503
"- Reduzir o IRC para a generalidade das empresas, concomitantemente com a revisão dos benefícios fiscais existentes.",503
- Reformar a contribuição autárquica de modo a torná­la mais equitativa.,503
- Abolir a Sisa e o Imposto sobre Sucessões e Doações.,503
- Abolir o Imposto de selo sobre operações bancárias.,414
"-Dar mais poderes e melhores meios à Administração Fiscal, de modo a permitir um efectivo combate à evasão e fraude, assim contribuindo para uma maior equidade do esforço fiscal.",304
"-Aumentar as deduções à colecta associadas a formas de poupança de longo prazo ou ligadas a fins socialmente prioritários, como é o caso dos PPR, dos PPA, das contas Poupança­Habitação e das contas Poupança­Educação.",504
-Permitir o desconto em IRS de parte dos vencimentos e impostos pagos pelas famílias a pessoas ao seu serviço.,504
"As medidas propostas têm como pano de fundo o facto de se pensar que a evolução das finanças públicas portuguesas deve assentar numa diminuição da despesa pública, a qual só deverá crescer na exacta medida do crescimento nominal do PIB,",414
"o que, naturalmente, implica reformas estruturais em diversos sectores da Administração do Estado.",303
"Neste contexto, afigura­ se perfeitamente plausível propor um significativo desagravamento fiscal, de preferência nas áreas acima citadas.",504
"Tal conjunto de medidas e este enquadramento deve separar claramente a linha de rumo do PSD face ao actual Governo que,",305
"nos objectivos apresentados perante as instâncias comunitárias, para cumprimento do Pacto de Estabilidade, faz assentar a redução do défice no aumento muito significativo da receita fiscal, pressagiando um agravamento da carga fiscal nos próximos anos.",414
"Além disso, dever­se­ão privilegiar as acções conducentes a reforçar os meios de actuação da Administração Fiscal,",303
mormente apostando no desenvolvimento informático,411
"e na melhoria qualitativa dos meios humanos,",411
agilizando as estruturas operativas e dotando­a de quadros adequadamente preparados e remunerados,411
"em vez do que faz o actual Governo, que pretende uma tributação cada vez mais assente em métodos indirectos e com base em presunções, que conduzem ao aumento das injustiças fiscais e desprotegem os contribuintes.",503
Justiça.,999
"- Lançar um Programa de Emergência para o combate à morosidade dos Tribunais, através nomeadamente:",303
"-Da informatização completa e actualizada dos Tribunais e Secretarias Judiciais, esforço a ser acompanhado de uma permanente formação dos juizes e funcionários, permitindo a interconexão de dados e o contacto à distância.",303
"-Da criação de brigadas de recuperação, que poderão integrar magistrados e funcionários aposentados que o requeiram, e que serão afectos aos tribunais com grandes atrasos.",303
"-Alterar a composição e o funcionamento do Conselho Superior de Magistratura e o estatuto do Procurador Geral da República, estabelecendo mecanismos acrescidos de responsabilização e fiscalização.",303
"- Reestruturar a divisão judicial do país, atendendo às estatísticas relativas ao número de processos, apostando na agregação e na criação de novas comarcas.",303
"- Dotar a Polícia Judiciária de meios científicos, técnicos, materiais e humanos modernos, actualizados e suficientes para um efectivo combate à criminalidade e à corrupção.",605
- Criar um processo judicial urgente para todos os crimes que possam pôr em causa o bom nome e a honorabilidade das pessoas.,605
"- Reformar o sistema prisional com a construção de novas cadeias especialmente concebidas para esse fim,",504
"a modernização das existentes,",504
a formação dos guardas prisionais,504
"e a separação dos detidos tendo em conta a natureza do crime, a idade e o seu estado de saúde, propiciando um verdadeiro acompanhamento dos detidos tendo em vista a sua reinserção social.",504
"- Criar Tribunais Permanentes de Arbitragem, que propiciem uma real alternativa aos Tribunais Judiciais.",303
"- Criar um Instituto do Defensor Público, em colaboração com a Ordem dos Advogados, que passe a assegurar o apoio judiciário de todos os que não possuam meios para contratarem um advogado.",503
"- Tornar obrigatório o início de carreira dos magistrados judiciais pelo Ministério Público, como forma de permitir aos futuros juizes a aquisição de maior experiência antes de assumirem as responsabilidades da função.",303
"- Conferir prioridade máxima para apoios especiais às crianças, com a consequente adopção de medidas exemplares contra os abusos sexuais, os maus tratos familiares e o abandono.",706
- Simplificar os processos de adopção.,504
- Alargar os casos de obrigatoriedade de registo e restringir a obrigatoriedade de reconhecimentos notariais ou escrituras públicas a casos excepcionais.,303
- Liberalizar os serviços de notariado.,303
"- Criar a figura de Notário­Conservador que, dotado dos meios informáticos necessários, possa realizar a escritura e registá­la imediatamente.",303
- Criar condições para que as decisões da 1ª instância sejam concluídas no prazo médio de 6 meses.,303
"A Justiça tem que se ser justa, o que significa também ser eficaz e célere. Hoje não o é!",303
"A Justiça em Portugal perdeu o seu significado material, tornando­se num permanente conflito entre corporações.",303
É urgente reposicionar a questão.,303
"São necessários mais meios financeiros para novos Tribunais, novos instrumentos de polícia criminal, novas prisões, mais magistrados.",303
Mas o dinheiro não é a única solução.,303
"Importa privilegiar a resolução dos litígios de forma extrajudicial pelas vias da conciliação e da arbitragem, atribuindo aos advogados e a associações económicas e de consumidores um papel reforçado nestas áreas.",303
"É necessário atacar de frente o problema do acesso à justiça e do apoio judiciário de pessoas carenciadas, criando um corpo de advogados em colaboração com a Ordem com essa exclusiva função, evitando­se assim conflitos de interesses e situações menos próprias que o actual sistema potencia.",503
"Impõe­se valorizar as magistraturas pelo seu papel essencial na aplicação da Justiça, prevendo, no entanto, medidas proporcionais de autocontrole.",704
Em Democracia é essencial que todos os poderes se encontrem legitimados e fiscalizados.,202
Estado e Organização do Poder Político.,999
"- Alterar a Lei Eleitoral para a Assembleia da República, de forma a aproximar os eleitores dos eleitos, através nomeadamente da consagração de círculos uninominais.",202
"- Afirmar plenamente o princípio da subsidiaridade entre o Estado e as Autarquias Locais, transferindo para estas todas as competências que possam ser melhor desempenhadas por elas do que pelo Estado.",301
"- Rever a Lei das Finanças Locais, de forma a permitir acompanhar as transferências de competências com os meios financeiros correspondentes, aumentando progressivamente de 8% para 18% da despesa pública as transferências para as autarquias.",301
"- Rever a lei eleitoral para as Autarquias Locais, de forma a criar Câmaras Municipais homogéneas e politicamente responsáveis perante as respectivas Assembleias Municipais.",202
"- Abrir o poder legislativo aos cidadãos, atribuindo­lhes directamente a iniciativa de lei junto da Assembleia da República.",202
"- Potenciar a utilização dos referendos nacionais e locais, alargando a autonomia de intervenção dos cidadãos.",202
"- Alterar o papel das Freguesias nos grandes centros urbanos, conferindo­lhes maiores competências e meios financeiros, incentivando as associações entre Freguesias e permitindo­lhes intervir em apoio de associações de moradores e dos condomínios.",301
"- Alterar a legislação sobre Partidos Políticos, nomeadamente no que toca ao respectivo processo de financiamento, introduzindo soluções que aumentem a transparência no seu funcionamento.",304
"- Alterar a legislação sobre os titulares dos cargos políticos de forma a valorizar o seu estatuto,",303
mas também a reforçar os mecanismos de controle sobre a sua actuação.,304
O desenvolvimento económico e social acelerado de Portugal nos últimos quinze anos potenciou uma maior intervenção social dos portugueses e a reivindicação legítima de uma maior participação na direcção da coisa pública.,202
"A este incremento de intervenção dos cidadãos, os Partidos Políticos e o Sistema de Governo não souberam ou puderam responder, criando ou propiciando intervenções marginais ao sistema, frustrando os cidadãos e potenciando o seu afastamento de uma vida política mais activa.",304
"A evidente desconexão entre os cidadãos e o sistema que os governa propiciou suspeitas de falta de transparência da vida pública, destruidoras da confiança que deveria existir entre os representados e os seus representantes.",304
"O PSD deve assumir as suas responsabilidades como partido que tem sabido defender uma maior aproximação entre os eleitores e os eleitos e que logrou introduzir na Constituição, na sua última revisão, os princípios essenciais para uma verdadeira reforma.",203
"É necessário rever as nossas leis eleitorais, criando uma relação mais estreita e uma maior responsabilização entre os eleitores e os eleitos.",202
"É necessário abrir o poder legislativo directamente aos cidadãos, como se abriu o poder referendário.",202
"É necessário potenciar as consultas directas a nível local e nacional, fazendo intervir grupos de cidadãos para além dos partidos.",202
"É necessário reforçar a intervenção do poder local com novas competências e novas receitas, fazendo apelo ao princípio da subsidariedade em relação ao poder central",301
"e, ao mesmo tempo, criando melhores meios para a sua actuação, desde logo pela alteração da composição e forma de designação das Câmaras Municipais, permitindo executivos homogéneos e responsabilizáveis perante as Assembleias Municipais e a população.",301
Administração Pública.,999
"- Cingir a Administração Pública essencialmente a funções de regulação, controle e fiscalização, concessionando ou privatizando as restantes tarefas.",303
"- Eliminar drasticamente a exigência de licenças e autorizações, responsabilizando as empresas e os cidadãos e privilegiando os processos de controle ``a posteriori''.",303
"- Profissionalizar a gestão dos diversos níveis, tornando­a mais independente do poder politico",303
e valorizando as carreiras dos trabalhadores da função pública.,701
- Garantir que todos os serviços com contactos com os cidadãos estejam abertos 10 horas por dia.,303
"- Desconcentrar e deslocalizar serviços da Administração Pública, distribuindo­ os por todo o território e colocando­os mais próximos das populações e com maior capacidade de decisão.",301
"- Revogar toda a legislação desnecessária e reunir, codificando, a legislação dispersa.",303
"- Responsabilizar os decisores, introduzindo a lógica da gestão por objectivos e atribuindo prémios de gestão aos mais eficazes.",303
"- Criar, sempre que possível, o gestor do utente, responsável pelo acompanhamento de cada processo.",303
- Elaborar um Código do Contencioso Administrativo que reforce as garantias dos cidadãos face à Administração.,303
- Elaborar uma nova lei de Responsabilidade da Administração que responsabilize efectivamente as entidades públicas pelos danos que a sua acção provoque nos direitos e interesses legalmente protegidos dos cidadãos:,201
"Numa economia de mercado, a Administração Pública existe essencialmente para suprir ou minimizar as falhas do mercado e tem de estar ao serviço das Empresas e dos Cidadãos.",303
"Num mercado global, as Empresas, para se manterem competitivas, necessitam de possuir capacidade de resposta imediata às situações com que se deparam todos os dias.",303
"Tem, pois, a Administração Pública de estar em permanente actualização, devendo acompanhar a evolução das entidades privadas a quem presta serviços.",303
Estas exigências não se compadecem com uma Administração Pública centralizada e que funcione a um ritmo e grau de modernização diferente dos daqueles a quem pretende servir ­ os Cidadãos e as Empresas.,301
"O PSD considera que se impõe mudar de política, assumindo a Administração Pública uma nova postura e mentalidade perante os Cidadãos, pelo que o seu principal objectivo será desburocratizar e profissionalizar os serviços, aligeirando consequentemente as competências dos Ministérios.",303
O Estado Ao Serviço das Pessoas.,999
Acessibilidades.,999
Nas Estradas:,999
- Concluir as vias rodoviárias principais:,411
auto­estradas: Lisboa­Algarve. Aveiro­Vilar Formoso. Via do Infante. Porto­ Bragança.,411
"IP's: IP2, IP 3, IP6, IP7 e IP8.",411
- Concluir a rede de IC's.,411
- Apoiar as autarquias na melhoria da rede rodoviária.,411
Nos Caminhos de Ferro:,999
- Privatizar os serviços ferroviários.,401
- Estabelecer a Linha de grande velocidade Porto­Santiago de Compostela­ Corunha (com paragem no aeroporto Sá Carneiro).,411
- Estabelecer o TGV Porto ­ Lisboa ­ Madrid.,411
- Modernizar e electrificar as linhas Porto ­ Braga e Porto ­ Viana ­ Vigo.,411
No Transporte marítimo e portos:,999
"- Implantar um registo de navios simplificado, que se torne atractivo para os armadores.",411
- Privatizar as actividades portuárias.,401
No transporte aéreo:,999
"- Privatizar a TAP, mantendo o Estado uma participação do tipo ``golden share''",401
- Privatizar a gestão dos aeroportos.,401
"Garantir a ligação às Regiões Autónomas, com imposição de serviço público.",411
Na logística:,999
"- Privatizar as Empresas urbanas de transporte, recorrendo depois a contratos­programa com o Estado.",401
- Apostar nas plataformas multimodais enquadradas nas redes já existentes.,411
A aposta do PSD na área dos transportes é clara ­ acessibilidade total e ajustada às necessidades do mercado.,411
"No entanto, a maior mobilidade que se consegue deste modo deve trazer aos cidadãos uma maior segurança e um menor custo das deslocações.",411
As infra­estruturas de transporte são fundamentais para o desenvolvimento de Portugal.,411
O que observamos ao nível da Europa é uma enorme capacidade instalada ao nível das infra­ estruturas e uma grande facilidade de acesso a elas por parte da população.,411
E o nível de infra­ estruturas tem muito que ver com a qualidade de vida do cidadão.,411
"As novas tecnologias ligadas às comunicações ­ a telemática ­ deverão constituir instrumento essencial ao serviço das mais diversas soluções, desde a escolha de percurso à obtenção do título de transporte, passando pela permanente informação ao passageiro ou ao utilizador das infraestruturas.",411
"O transporte multimodal será incentivado, quer pela construção de infraestruturas quer garantindo a acessibilidade a menor custo e com maior competitividade.",411
"Agricultura, Pescas e Mundo Rural.",999
"Assegurar, através do recurso preferencial a fundos comunitários, uma ajuda directa mínima aos pequenos agricultores no valor de 300 contos.",703
"Desburocratizar a atribuição de apoios, de modo a facilitar as condições de acesso por parte de todos os agricultores.",703
"Demonstrar, junto da U E, a especificidade da agricultura portuguesa, conseguindo por essa via melhores apoios, designadamente no que toca ao aumento das quotas existentes e à criação de novas quotas.",703
Erradicar a BSE em Portugal.,703
Acelerar as obras da barragem do Alqueva.,703
Aumentar a área de regadio.,703
"Adoptar medidas de estímulo ao investimento financeiro na floresta, articulando a política de incentivo à poupança dos particulares e a política de desenvolvimento florestal.",703
"Promover a revisão das normas técnicas aplicáveis ao seguro de colheitas, de modo a que possa funcionar como verdadeiro substituto das perdas de rendimento.",703
"Aperfeiçoar os mecanismos de fiscalização da qualidade dos alimentos, em especial os de origem animal, sem esquecer os produtos directamente importados.",501
"Promover em grande escala a imagem dos nossos produtos de qualidade como o vinho, a cortiça, o azeite, o tomate, a fruta etc..",703
Estimular as fusões e concentrações de empresas como reforço à competitividade agrícola.,703
Criar agências de desenvolvimento agrícolas apoiadas pelo Estado mas geridas por agricultores.,703
"Apoiar as actividades do mundo rural que combatam a desertificação do interior tais como o turismo, a caça e o artesanato.",504
Bonificar o combustivel utilizado pelas embarcações da pesca em termos equivalentes ao que ocorre com o gasóleo agricola.,703
"Defender intransigentemente, no seio da União Europeia, os interesses dos agentes económicos nacionais do sector das pescas.",703
"Diversificar as actividades de pesca, promovendo a complementaridade com a aquacultura,",703
"as actividades náuticas, turísticas e de artesanato,",502
por forma a assegurar uma actividade económica rentável e emprego ao longo de todo o ano.,504
Reforçar as medidas de apoio à competitividade internacional da indústria conserveira portuguesa.,703
Reforçar as medidas de apoio à comercialização e ao consumo dos produtos da pesca.,703
"Reestruturar e modernizar o funcionamento das lotas, por forma a dar melhor resposta às necessidades dos produtores",703
e a conferir condições de maior competitividade a todos os agentes económicos do sector.,403
Aumentar a eficiência da fiscalização de modo a assegurar o funcionamento do mercado em condições de justa concorrência internacional.,406
"Reestruturar os regimes de protecção social à actividade da pesca, promovendo a participação dos representantes dos diversos agentes económicos, com vista à melhoria das condições de vida e de segurança dos pescadores.",703
Reforçar os incentivos à criação de sociedades mistas com agentes económicos de outros países onde as potencialidades existentes no domínio das pescas permitam reforçar a capacidade empresarial dos agentes económicos nacionais.,402
"Criar medidas de garantia do investimentos dos agentes económicos nacionais em sociedades mistas internacionais, por forma a conferir confiança e segurança nas operações de internacionalização das empresas pesqueiras portuguesas.",410
"Reforçar as medidas de modernização da frota artesanal e costeira, apoiando a instalação de frio e as condições de armazenamento a bordo, bem como a melhoria da higiene e da segurança.",703
O PSD propõe­se fazer uma forte aposta no investimento produtivo.,703
"Promoverá por isso uma política de pagamento de apoios atempada, de modo a que os agricultores não sejam prejudicados pelos atrasos na sua atribuição.",703
Os apoios para reinstalação de pinhal e montada de sobro e azinho serão uma prioridade do Governo PSD.,703
"É fundamental que Portugal consiga o aumento das suas quotas nos produtos competitivos como tomate, arroz e vinho e a criação de quotas em produtos emergentes.",703
"As apostas em projectos de regadio devem ser reforçadas, de modo a maximizar a nossa produção agrícola e aumentar a nossa produtividade.",703
Far­se­á um Plano Hidrológico Nacional que dê especial importância a pequenas obras de adaptação de águas superficiais.,703
O atraso verificado nas obras da Barragem do Alqueva não é aceitável e o PSD recuperará esse atraso e terminará a obra.,703
"A realização imediata de um Plano de Ordenamento Agrário que distinga as zonas agrícolas consoante o seu potencial agrícola, impedindo que as zonas de alto potencial sejam utilizadas para outros fins, é igualmente um objectivo que o PSD se propõe realizar na próxima legislatura.",703
O PSD reconhece e apoiará as especificidades do Mundo Rural.,703
"O sector das pescas é, no nosso país, um dos sectores económicos com maior relevância em determinadas zonas.",703
Importa por isso tomar as medidas necessárias e eficazes para garantir a sua rentabilidade e promover a melhoria das condições de vida dos seus agentes.,703
"Não esquecendo que se trata de uma política comum, da exclusiva competência da União Europeia, o PSD está bem consciente de que os Estados membros são responsáveis e competentes para adoptar medidas internas de aplicação do quadro comunitário e, nesse contexto, para salvaguardar os interesses dos agentes económicos do sector.",703
Ambiente.,999
"Criar o Ministério do Ambiente e o do Ordenamento do Território, juntando assim dois âmbitos de actuação que devem ser tratados em conjunto e de forma coerente.",501
"Criar a Agência Nacional do Ambiente, entidade do tipo Provedoria e independente do Governo, onde estejam representados os diferentes sectores da sociedade.",501
Realizar a cobertura integral do país em saneamento básico.,501
Fazer aprovar um programa rigoroso de utilização de água.,501
"Elaborar planos sectoriais em matéria ambiental urbana consagrando, à escala nacional, as principais redes de abastecimento de água, de saneamento básico e de tratamento de resíduos.",501
"Imprimir grande rigor à fiscalização ambiental, com a colaboração das associações ambientalistas.",501
