Text,Code
É tempo de Governar Portugal.,999
Uma Ideia para Portugal.,999
"Não me conformo com um Portugal remetido, na Europa, a um estatuto de segunda classe.",999
De um Estado que abusa e que atrapalha a sua vida.,999
Acredito que importa antes de mais contrapôr a este estado de coisas uma ideia para Portugal.,999
Que é necessário e indispensável uma linha de condução estratégica.,999
Porque Portugal não pode resignar­se a um estatuto de inferioridade.,999
"Portugal pode atingir os 80% da média europeia em termos de PIB/per capita, no decurso da próxima legislatura.",999
Em cerca de 15 anos deveremos alcançar a média dos nossos parceiros europeus.,999
Portugal também pode e deve vencer na sociedade da informação.,999
Acredito que a política é importante e deve fazer a diferença.,999
Porque acredito na necessidade de promover uma efectiva igualdade de oportunidades.,999
Acredito que é importante a capacidade e a vontade reformadora da política.,999
Acima de tudo não me conformo porque acredito nos portugueses e em Portugal.,999
José Manuel Durão Barroso.,999
Introdução.,999
1­ Um Programa Diferente.,999
"Existe entre nós a ideia, mais ou menos generalizada, de que os programas eleitorais de governo são normalmente documentos que ninguém lê a não ser quando por algum motivo a isso se vê obrigado, repositórios algo burocráticos de medidas ou intenções tantas vezes óbvias, pior ou melhor embrulhadas em longos e aborrecidos considerandos políticos.",305
E a verdade é que esses catálogos de políticas quase sempre conseguem deixar o eleitor desorientado quanto àquilo que afinal constitui a linha de rumo ou a orientação geral de uma determinada força partidária.,305
"Correndo embora o risco de incompreensão, por parte daqueles que há muito definiram os limites da aceitabilidade daquilo que deve ser um programa ``politicamente correcto'', o PSD optou por seguir outro caminho: formular de um modo tão directo quanto possível os compromissos com que nos apresentamos ao eleitorado.",305
"O que este programa contém, por decisão assumida, é apenas o núcleo essencial das nossas propostas, aquilo que caracteriza a nossa ideia para Portugal, aquilo que nos separa dos nossos adversários políticos.",305
"O texto do programa é, naturalmente, o resultado de complexos e demorados estudos, elaborados a partir da própria experiência governativa do PSD (em especial da década decorrida entre 1985 e 1995)",305
e também da análise crítica da actuação do actual executivo socialista.,305
"Ao apresentar apenas a súmula das conclusões de todos os estudos e análises feitos, estamos a dar provas de que nos queremos dirigir a um auditório tão vasto quanto possível.",305
"Mas a opção pela apresentação sistemática e simplificada das medidas que propomos tem ainda subjacente uma preocupação de responsabilização política, porquanto permite a cada eleitor acompanhar a respectiva execução e fiscalizar de modo efectivo o seu grau de cumprimento.",305
É essa mesma lógica que explica que o programa se inicie com a enumeração de um conjunto de cinco medidas a que chamámos emblemáticas e a cuja implementação atribuimos carácter prioritário.,305
"Medidas nas áreas da segurança social,",504
"da saúde,",504
"da fiscalidade,",503
da agricultura,703
e da educação,506
"e que respondem a preocupações de dignidade, de equidade e de justiça, mas que traduzem também um sentido de futuro.",503
"Medidas que são, além disso, a concretização prática das nossas orientações políticas fundamentais.",305
"Desde logo a definição de uma forte prioridade pelo domínio social, nomeadamente nas áreas da saúde e da solidariedade.",504
"Porque se trata, antes do mais, de uma exigência de justiça.",503
"De garantir, a amplos e esquecidos sectores da nossa sociedade, um conjunto mínimo de condições de vida compatíveis com a dignidade de todo o ser humano.",503
"De combater a pobreza e a exclusão que, para além de eticamente intoleráveis, têm contribuído para gerar desequilíbrios sociais perturbadores da nossa vida colectiva.",503
"No capítulo fiscal, conduzidos igualmente por uma preocupação de equidade, apresentamos uma proposta concreta de desagravamento dos impostos, cujos benefícios mais directos se farão sentir nas chamadas classes médias.",503
"De facto, este importante sector da nossa sociedade e, muito em particular, os trabalhadores por conta de outrém, têm visto os seus legítimos interesses sistematicamente preteridos face aos privilégios intocados de uma minoria cúmplice de um Estado fiscalmente arbitrário.",701
"E, se essa é uma situação que só uma profunda reforma tributária e uma genuína vontade política podem resolver,",303
não é menos verdade que uma intervenção no domínio fiscal como aquela que propomos é já um passo importante no sentido de recompensar quem o merece.,503
"Apresentamos também uma medida emblemática na área da agricultura, por considerarmos que este é, sem dúvida, um dos sectores mais penalizados com a integração de Portugal na União Europeia e com a incompetência negocial do actual governo, tornando­se assim imprescindível dar um sinal inequívoco da nossa confiança no futuro do mundo rural português.",703
Enquanto comunidade nacional temos vindo a testemunhar um aprofundamento do fosso que separa a chamada ``província'' de alguns pólos urbanos mais desenvolvidos.,504
"Mas muitas vezes esquece­se que a progressiva desertificação do interior também se reflecte de forma directa no agravamento das condições nas áreas urbanas e suburbanas onde problemas como a pobreza,",504
a falta de qualidade de vida,504
ou o consumo de droga atingem níveis cada vez mais preocupantes.,504
"Daí a preocupação ­presente ao longo de todo o programa­ de adoptar medidas de equilíbrio entre as diversas regiões do país,",504
numa lógica capaz de garantir uma adequada harmonização entre uma perspectiva dinâmica de desenvolvimento e o respeito por certos elementos essenciais que definem os traços mais profundos da nossa identidade enquanto Nação secular.,601
"Preocupa­nos de igual forma a preparação do futuro, razão que explica o porquê de uma medida emblemática na área da educação,",506
um sector reconhecidamente de importância estratégica para o desenvolvimento das capacidades nacionais num mundo cada vez mais globalizado.,411
O nosso país tem vindo a perder a sua capacidade competitiva e isso decorre também da incapacidade demonstrada pelo sector educativo em dar resposta à exigência de qualidade e à emergência e generalização da sociedade de informação.,411
"Os jovens portugueses não estão de facto a ser preparados para os desafios radicalmente diversos deste novo tempo e a medida que propomos insere­se justamente numa lógica de inversão dessa tendência, visando pôr fim às situações gritantes de analfabetismo funcional em áreas fundamentais de cultura científica.",411
Mas estas medidas emblemáticas não são importantes apenas por combaterem intoleráveis males endémicos da sociedade ou por serem a tradução mais apreensível de uma certa orientação política.,305
"Têm igualmente uma componente simbólica, nova no nosso país, pois não se trata de meras promessas mas de verdadeiros compromissos que o PSD assume, de forma quantificada e calendarizada.",305
Compromissos formais e não meras declarações vagas ou de carácter genérico.,305
Compromissos cuja implementação os cidadãos poderão facilmente verificar.,305
Compromissos cujo incumprimento traduziria uma quebra da relação de confiança com os eleitores da qual o PSD não poderia deixar de retirar a única consequência possível.,305
"Hoje, quando se fala cada vez mais da necessidade de os políticos prestarem contas das suas atitudes perante aqueles que os elegeram, queremos contribuir para introduzir na política portuguesa um novo conceito de ética de responsabilidade em que os políticos tomem a iniciativa de assumir os seus erros e incapacidades, não esperando pelo veredicto popular agarrados aos seus lugares.",305
2 ­ A coragem das reformas.,999
Os quatro anos da legislatura que agora chega ao seu termo foram indiscutivelmente os anos da oportunidade perdida.,305
O nosso país está cada vez menos preparado para enfrentar os desafios que o início do novo milénio vai trazer.,305
"Mais preocupado em gerir o viver habitualmente do que em preparar as mudanças requeridas pela nova conjuntura internacional, o actual governo está a hipotecar o futuro de Portugal.",305
"Sacrificando os desígnios nacionais ao seu desejo de perpetuação no poder, o Partido Socialista adiou sistematicamente, com receio da impopularidade, a implementação das medidas indispensáveis, recorrendo para isso aos expedientes mais diversos.",303
Todas as reformas estruturais foram adiadas.,303
"Da fiscalidade à saúde, passando pela Administração Pública ou pela segurança social, praticamente tudo ficou por fazer.",303
Só que os problemas não desaparecem pelo simples facto de os ignorarmos.,305
"Ao contrário, adensam­se e agravam­se.",305
"Nos últimos anos o governo português gozou de uma rara conjugação favorável de condições, tanto no plano internacional quanto a nível interno.",305
Perdeu­se uma oportunidade única para empreender as mudanças de que o país carece.,305
"Agora as mudanças continuam a ser indispensáveis, mas os seus custos serão maiores.",305
"O que está hoje em causa, diferentemente do que ocorreu num passado não muito distante, já não é sequer a natureza das reformas.",305
Foram produzidos múltiplos estudos e análises.,305
Tudo ou quase tudo foi já estudado.,305
O que tem faltado é a coragem política para as levar a cabo.,305
"Queremos por isso dar de novo aos portugueses um Governo capaz de agir com determinação, convicto dos princípios porque se rege e dos valores que o norteiam.",305
"Um governo capaz de definir as melhores soluções, de decidir com eficácia, de não fugir quando é confrontado com questões difíceis.",303
Um governo cuja acção seja norteada pela intransigente defesa do interesse nacional.,305
"Um governo que dialogue e explique, com transparência, os motivos das suas decisões, mas que não adie as reformas de que o país carece.",303
"O PSD deu provas bastantes, ao longo da história da nossa democracia, da sua capacidade para empreender as rupturas necessárias, para enfrentar os interesses instalados, para combater os estrangulamentos que punham em causa o desenvolvimento do país.",303
A capacidade de decidir e a coragem de empreender são valores firmes do ideário e da prática dos governos do PSD.,305
Os portugueses sabem por isso que podem confiar no cumprimento de outro compromisso firme que aqui se assume: o de levar a cabo as reformas estruturais de que o país carece em áreas fundamentais e que o actual governo não quis ou não foi capaz de fazer.,303
3 ­ Um Estado ao serviço das pessoas.,999
Temos uma ideia para Portugal.,305
"Por isso queremos, nos próximos quatro anos, iniciar um novo ciclo político em cuja definição todos os Portugueses sejam chamados a participar, dando o melhor da sua inteligência, do seu querer, da sua capacidade, da sua vontade, da sua determinação.",202
"Queremos uma sociedade de iniciativa, confiante em si própria, que acredite na realização de um futuro melhor, assente na dinâmica e na capacidade de empreender dos cidadãos.",606
Acreditamos que a autonomia da sociedade é a solução mais capaz de produzir desenvolvimento e riqueza.,503
"Mas reputamos indispensável a existência de mecanismos de correcção das desigualdades e de redistribuição da riqueza que assegurem o bem­estar de todos os cidadãos, eliminem espaços de segregação e exclusão",503
e garantam a coesão dessa mesma sociedade.,606
"Mas também não defendemos a generalização de um clima de assistência social, porque ele reduz a dignidade do indivíduo.",504
"Queremos afirmar a cidadania, não queremos encorajar o conformismo.",202
"Queremos incentivar a iniciativa, não queremos recompensar a dependência.",504
"Temos assim de ser capazes de encontrar uma forma diferente de governar, que desperte as energias da sociedade.",305
"Uma maneira de governar que compreenda quando é que o Estado deve estar presente e quando deve abandonar o palco, deixando o caminho livre aos cidadãos e às suas organizações e empresas.",305
"Fala­se hoje muito, por todo o Mundo, de uma inelutável e omnipresente confluência entre o discurso ideológico das principais formações partidárias, fruto em grande medida das características estruturais das sociedades contemporâneas e do apaziguamento ideológico subsequente à queda do comunismo e ao final da Guerra Fria.",305
"A distinção far­se­ia assim mais por via do estilo de intervenção política, do que propriamente pela natureza da mensagem transmitida.",305
"O nosso país não seria, naturalmente, excepção a essa tendência generalizada.",305
Um programa eleitoral de Governo não é de todo o local indicado para proceder a uma análise teórica sobre esta questão.,305
"Mas, por nós, recusamo­nos a aceitar que a política se tenha transformado no império da forma.",305
"Consideramos, ao invés, que os dois únicos partidos que podem aspirar a ser governo ­o Partido Social­Democrata e o Partido Socialista­ apresentam ideias diferentes para Portugal.",305
E essa diferença decorre de um modo radicalmente diverso de encarar a relação entre o Estado e a Sociedade.,305
"Para o PSD o Estado é uma entidade de carácter instrumental, um meio para a realização de certos fins.",305
"Para os socialistas a sociedade surge como objecto da acção do Estado, a cujos desígnios é, em consequência, subalternizada.",305
Entre a sociedade e o Estado nós preferimos a primeira.,305
O PS privilegia o segundo.,305
"Não esquecemos, nem nós nem os portugueses, como o PS foi cúmplice de tantas medidas colectivizadoras que prejudicaram o nosso país e cujos efeitos negativos ainda se fazem actualmente sentir",401
"ou como se opôs, até ao limite do possível, às privatizações e à abertura de diversos sectores da nossa economia à iniciativa privada.",401
Mais por força dos acontecimentos do que por genuína convicção o PS foi forçado a mudar o posicionamento e a alterar o seu discurso.,305
"Conforta­nos aliás registar como o Partido Socialista hoje reclama como sendo seus princípios, ideias, valores, propostas, medidas que constituiram, desde a primeira hora, bandeiras do PPD/PSD.",305
Mas se o PS abandonou a sua ortodoxia estatizante não perdeu a sua orientação estatista.,303
"A sua obsessão em garantir, a todo o custo, a manutenção intocada de aparelhos administrativos que já demonstraram a sua perversidade e a total incapacidade para resolver os problemas dos respectivos utentes é disso prova evidente.",303
"Como o é igualmente a tentativa mais ou menos dissimulada de promover uma verdadeira gestão política da economia, a começar pelas empresas privatizadas, mas que continuam em boa verdade com uma lógica de empresas públicas a partir das posições que o Estado nelas conserva.",401
"O PSD, por seu lado, coloca­se na posição inversa.",305
"O que nos preocupa são as pessoas, não é o sistema.",303
E se os sistemas públicos não funcionam há que ter a coragem de os reformar profundamente.,401
"Há que submetê­los à lógica da concorrência, condição indispensável ao acréscimo da sua eficácia.",401
"Há que garantir, em todos os domínios, a efectivação do direito à livre escolha entre o público e o privado, seja na saúde, na segurança social ou na educação.",401
"Defendemos a aplicação, nas relações entre o Estado e a sociedade, do princípio da subsidiariedade.",401
"Não queremos um Estado que intervenha demais, atrapalhando a vida das pessoas ou questionando a sua autonomia.",401
Não somos socialistas.,403
"Também não queremos um Estado ``mínimo'', que se demita das suas responsabilidades de regulação da vida colectiva, que tolere os abusos dos poderosos e subalternize as necessidades dos mais desprotegidos.",403
Não somos liberais­individualistas.,403
"Porque somos social­democratas, queremos o Estado na sua justa medida.",403
Um Estado que intervenha para corrigir os desequílibrios e as injustiças.,403
"Devolver poder aos cidadãos e às instituições sociais mais espontâneas, como é o caso da família.",603
Apoiar as suas iniciativas.,603
Incentivar a sua intervenção.,603
Facilitar a sua actuação.,603
Guardar para o Estado aquilo que por natureza lhe compete ou aquilo que reconhecidamente é capaz de fazer melhor.,303
Esta é a ideia primária que influencia as políticas definidas ao longo deste programa.,303
Um conjunto de políticas cujo objectivo estratégico é o de realizar a convergência real com os nossos parceiros europeus.,108
Portugal não pode resignar­se a um estatuto de segunda classe na Europa.,108
"Portugal pode e deve, com coragem e capacidade de decidir, atingir os 80% da média europeia em termos de PIB/per capita, no decurso da próxima legislatura.",108
Em cerca de 15 anos deveremos alcançar a média dos nossos parceiros europeus.,108
Visar abaixo disto é continuar a pensar de modo pequeno e medíocre.,303
É alimentar o conformismo actualmente dominante.,303
É remeter o nosso progresso para as calendas gregas e desmoralizar as forças com maior capacidade para empreender a mudança.,303
"Este objectivo estratégico nacional encontra­se presente no desenho das diversas políticas e, embora estas se refiram, naturalmente, a múltiplos sectores, é importante que não se perca a imagem de conjunto e a ideia do Portugal que queremos construir:",503
"um Portugal mais justo,",503
cada vez mais capaz de assegurar uma real igualdade de oportunidades a todos os cidadãos.,503
"Um Portugal desenvolvido e prestigiado, capaz de ocupar o lugar que lhe cabe no concerto das nações.",108
Cinco Compromissos Urgentes.,999
Na Segurança Social.,999
Criar uma Pensão Mínima Nacional de valor igual a 40 contos.,504
Na Saúde.,999
Acabar com as listas de espera em consultas e cirurgias no prazo de 2 anos.,504
Na Fiscalidade.,999
Reduzir em 10% o IRS procedendo a um alargamento dos escalões.,503
Na Agricultura.,999
Criar uma ajuda directa mínima aos pequenos agricultores no valor de 300 contos.,703
Na Educação.,999
Implementar um Plano Nacional de Ensino da matemática e das ciências.,506
O Futuro não pode esperar. A Coragem das Reformas.,999
Saúde.,999
- Acabar no prazo de 2 anos com as listas de espera nas consultas e nas cirurgias.,504
- Aumentar em 10% a comparticipação no preço de medicamentos utilizados pelas pessoas mais carenciadas.,504
- Lançar um Programa visando a humanização dos serviços e a melhoria do acolhimento dos doentes hospitalares.,504
"- Comparticipar pelo Serviço Nacional de Saúde as análises clínicas, exames radiológicos e outros meios complementares requisitados pelos médicos em actividade privada, eliminando­se assim o actual mecanismo de transcrição.",504
- Dar ao doente a liberdade de escolha entre o sector público e privado na prestação de cuidados de saúde.,504
"- Dar maior protecção a doentes crónicos e a doentes idosos, através da instalação de rede de unidades de acolhimento hospitalar e de cuidados domiciliários.",504
"- Implementar a receita médica renovável, especialmente para doentes crónicos.",504
- Possibilitar a marcação de consulta pelo telefone em todos os centros de saúde e hospitais.,504
- Desenvolver programas de prevenção das doenças evitáveis.,504
"- Promover a gestão privada de hospitais públicos, a qual já evidenciou maior eficiência.",504
"- Fazer uma Lei de Gestão de Serviços de Saúde que consagre a autonomia e a responsabilidade dos serviços e dê incentivos à qualidade, à produtividade e à satisfação dos utentes.",504
"- Desenvolver o plano integrado de acesso aos serviços em situação de urgência, separando as situações de acidentados e emergentes das situações de urgência efectiva, estabelecendo para estas uma diversidade de soluções que não passem só pelo recurso aos serviços de urgência dos hospitais.",504
"- Incentivar os seguros de saúde, aumentando a respectiva dedução fiscal.",504
- Privilegiar o desenvolvimento das carreiras com subordinação à qualificação técnica e técnico­científica.,411
- Estabelecer diversidade contratual para os profissionais de saúde: a par da existência de um quadro haverá lugar a outras formas contratuais previstas na lei.,504
- Promover a separação progressiva entre actividade pública e privada por parte dos profissionais do sector.,504
"Caberá ao Estado, em exclusivo, a função reguladora da actividade dos serviços públicos e privados, impondo, designadamente, critérios de qualidade e de desempenho, sob forma preferencialmente contratualizada.",504
O financiamento será assegurado fundamentalmente por impostos e taxas moderadoras.,504
"No entanto, com o objectivo de reduzir a pressão financeira que os gastos com a Saúde exercem directamente sobre os orçamentos familiares, será incentivada a contratação de seguros de saúde, aumentando as respectivas deduções em IRS.",504
"Será implementada a identificação inequívoca do cidadão perante o Sistema de Saúde, quer em relação à envolvente de protecção de que beneficia (SNS, subsistemas, seguros de saúde, etc.) quer em relação à especificidade das suas necessidades de cuidados de saúde e a coordenação entre serviços de saúde, eliminando as barreiras burocráticas entre Centros de Saúde e Hospitais.",504
Será também estabelecida separação entre entidades financiadoras e entidades prestadoras de cuidados de saúde.,504
"assegurar­se­à a prestação plural, pública e privada, introduzindo­se gradualmente uma lógica de concorrencialidade e contratualização, orientada para a melhoria da qualidade, para o aumento da satisfação dos utentes e para a eficiência do sistema.",504
"Com este enquadramento e obedecendo a valores de equidade, solidariedade e melhoria continuada da acessibilidade, desenvolver­se­á com carácter prioritário um conjunto de medidas tendo como centro o cidadão e orientadas por objectivos de maior satisfação do utente, redução dos encargos familiares por aumento da eficiência e controlo eficaz dos gastos públicos.",504
Segurança Social.,999
- Aumentar as pensões mínimas de modo a que a Pensão Mínima Nacional seja de 40 contos.,503
"- Reformar a Segurança Social, utilizando para isso receitas provenientes das privatizações e designadamente abrindo o capital social da Caixa Geral de Depósitos a pequenos investidores (incluindo emigrantes), mas mantendo o Estado a maioria do capital.",504
"- Introduzir um sistema de limitação de contribuições, favorecendo a conjugação com um sistema baseado na capitalização gerido por entidades privadas.",503
"- Alterar os mecanismos de financiamento da Segurança Social, de modo a diversificar as suas fontes de receita.",503
- Contratar com entidades privadas a cobrança de dívidas à Segurança Social.,503
Deve existir por parte do Estado uma clara consciência que um dos seus grandes objectivos é o de assegurar a continuidade do sistema de Segurança Social.,504
"Nessa medida, o PSD defendê­la­á no presente e, contrariamente ao que acontece hoje, prepará­la­á para o futuro.",305
Devemos proceder às reformas salvaguardando os direitos dos cidadãos.,503
"No entanto, estas reformas não devem ser feitas à custa dos trabalhadores e por essa razão se propõe a canalização das receitas das privatizações.",503
"O PSD criará uma nova maneira de pensar a Segurança Social que permita torná­la mais independente do poder político, designadamente criando um quadro legal de atribuição de subsídios.",504
O Rendimento Mínimo Garantido deverá ser mantido e melhorado no sentido de servir efectivamente como um instrumento de inserção social.,503
As relações entre os serviços e os utentes serão alteradas de modo a que qualquer cidadão possa ter imediato acesso aos seus direitos e conhecer em qualquer momento a sua situação perante a Segurança Social.,504
Educação.,999
"- Implementar, no prazo de um ano, um Plano Nacional de emergência para o ensino da matemática e das ciências.",506
"- Instituir faseadamente o aumento da escolaridade obrigatória para onze anos possibilitando simultaneamente a todos os que o desejem, a frequência nos dois últimos anos de um ensino profissional que lhes garanta, no final do seu percurso escolar, uma formação adequada à inserção no mercado de trabalho.",411
"- Criar condições que garantam, em todos os níveis do ensino, uma efectiva igualdade de oportunidades, através da concretização do direito de livre escolha entre o ensino público e o ensino privado.",503
"- Cindir, ao nível governamental, a área da educação, em dois departamentos: o Ministério da Educação e o Ministério do Ensino Superior e da Ciência.",506
"- Criar um programa de desenvolvimento do ensino da língua e cultura portuguesas, que permita aumentar os desempenhos na leitura e na escrita, logo a partir do 1º ciclo do ensino básico.",506
"- Introduzir a obrigatoriedade do ensino de uma língua estrangeira, nomeadamente o Inglês, logo a partir do primeiro ciclo do ensino básico.",506
- Instituir as Contas Poupança Educação com benefícios fiscais idênticos aos das restantes Contas Poupança.,506
- Regulamentar o Mecenato Educativo previsto na lei de financiamento do ensino superior e torná­lo extensivo aos diferentes níveis de ensino.,506
