Text,Code
"Conceder incentivos financeiros à instalação de equipamentos que evitem a poluição, benefícios fiscais para o cumprimento dessa meta e agravamento das penas para poluidores industriais.",501
"Optar, sempre que necessário, pela construção de incineradoras de raiz, rejeitando por completo a ideia da co­incineração de resíduos industriais.",501
Proceder ao armazenamento e posterior eliminação dos resíduos tóxicos pesados.,501
Privatizar as empresas ligadas ao ambiente que ainda se encontram no sector público estatal.,501
"Valorizar os Parques e Áreas Protegidas, melhorando as infra­estrururas de apoio, divulgando a sua utilidade como espaço de laser",501
"e dando às suas direcções maiores poderes, de forma a impedir a delapidação do Património Ambiental.",501
"Incentivar o uso de energias alternativas (eólica, solar, etc.).",501
Criar um fundo especial destinado à Conservação da Natureza.,501
Privatizar a EPAL.,401
Preservar para as gerações vindouras um Ambiente pelo menos de qualidade igual à do presente constitui um imperativo que estamos prontos a observar e a fazer observar.,501
"Por isso, o PSD entende que o ambiente deve ser ``uma política de políticas'', querendo com isto significar­se que a política de ambiente deve influenciar a definição da generalidade das outras políticas.",501
"É necessário contudo que não se caia em excessos nem fundamentalismos, sob pena de gerar o imobilismo do País e a incompreensão dos Portugueses.",501
"Por estas razões adoptaremos medidas para que o desenvolvimento económico e social não colida com direitos de primeira grandeza como o direito ao ar puro, à água ou à redução do ruído.",501
Apostaremos em acções de sensibilização e de informação para que os jovens e o conjunto dos cidadãos saibam quais as acções de defesa do ambiente que estão ao seu alcance.,501
Interviremos em matéria de ambiente de três formas distintas:,501
"prevenção, tratamento e reposição, dando mais poderes aos órgãos zeladores do ambiente",501
"e aumentando a colaboração com as Associações Ambientais, canalizando mais meios financeiros",501
e obrigando as entidades poluidoras a alterar e repor a situação de que forem responsáveis .,501
"O futuro Governo deve explorar todas as virtualidades das parcerias público­privadas, com vista à prestação de serviços ambientais que até agora têm ficado no domínio da esfera pública.",401
"Os sectores prioritários serão os do abastecimento de água, da drenagem de águas residuais, da recolha e tratamento de resíduos sólidos, da gestão dos aproveitamentos hidráulicos, etc.",501
"Este tipo de parcerias traz vantagens no que respeita à qualidade, à eficácia e à facilidade de financiamento.",303
"Neste particular, a percentagem da cobertura de Fundos Comunitários poderia ser menor, o que quer dizer que com o mesmo montante se podem realizar mais obras.",303
Apoio às PME's.,999
"Reduzir a taxa de IRC, para empresas com volume de negócios anual não superior a 100 mil contos, de 34% para 20%.",402
As empresas localizadas fora das Áreas Metropolitanas de Lisboa e Porto beneficiarão de uma redução adicional para 15%.,402
"Isentar no primeiro ano e ajustar progressivamente nos quatro anos seguintes, o IRC aplicável às empresas que vierem a criar­se.",402
Isentar de tributação os lucros reinvestidos.,402
"Transformar o IPE numa empresa de capital de risco para apoio a novos projectos, com especial destaque para a internacionalização.",414
Lançar um programa de ``Cidades Empreendedoras''.,410
Estimular o aparecimento de ``Business Angels'' (pessoas com recursos financeiros e experiência dispostas a apoiar empreendedores).,411
"Rever os programas de apoio à formação profissional, de modo a atribuir apoios a fundo perdido, assegurando a sua articulação com objectivos de profissionalização do ensino básico e secundário.",411
"Apoiar e incentivar a utilização das novas tecnologias de informação, nomeadamente a Internet, alargando o âmbito do benefício fiscal existente.",411
"Promover a reforma das relações entre a Administração Pública e as Empresas, de maneira a atingir os seguintes objectivos:",402
"- Realizar, em 24 horas, a inscrição de uma empresa no Registo Nacional de Pessoas Colectivas.",402
"- Em menos de 15 dias dar cumprimento a todas as restantes formalidades necessárias para o início de actividade de uma empresa, incluindo as relações com a Administração Fiscal, a Segurança Social, e outras entidades dependentes da Administração Central, Regional e Câmaras Municipais.",402
A intenção do PSD é transformar o meio empresarial português num forte concorrente de outros países.,410
"Deverá ser proporcionado às empresas um apoio e atenção redobrados, em particular porque a conjuntura económica se apresenta menos favorável nos próximos anos e a competitividade ameaçada face aos parceiros do euro, devido à subida da inflação.",402
"Com a constituição do espaço do Euro, as PMEs estão a sofrer os efeitos da concorrência de empresas equipadas com recursos humanos e materiais muito mais especializados e avançados.",411
"É, assim, necessário introduzir no meio empresarial novos meios de formação e treino que permitam às empresas manter os seus quadros com um grau de qualificação superior, permitindo­lhes aumentar a competitividade.",411
"A aposta na formação profissional mais adequada, isto é, na actualização técnica permanente dos recursos humanos, é essencial.",411
"nos últimos anos, a utilização das novas tecnologias de informação (sobretudo na área da informática, com preponderância para a pesquisa, a obtenção e divulgação de informação na Internet), tem crescido de forma extraordinária, constituindo­se como uma necessidade vital para dinamizar e tornar competitivas as PMEs.",411
"Por isso, neste campo, o PSD propõe ainda:",411
"- a atribuição de subsídios a fundo perdido à formação profissional, de acordo com legislação específica.",411
"- o apoio ao desenvolvimento de estratégias de mercado, introduzindo novas tecnologias de telecomunicação, sistemas de formação e comércio electrónico.",411
"- facilitar a comunicação entre PMEs através do desenvolvimento de redes locais e transnacionais, o que permitirá usufruir dos benefícios resultantes da partilha e disponibilização de informação em rede, para além da aproximação com outras empresas do país e da UE.",411
Combate à Desertificação.,999
"Duplicar os actuais limites do período de isenção de Contribuição Autárquica na compra de habitação permanente de valor não superior a 30 mil contos, por pessoas não residentes nas regiões do Interior, que aí passem a residir.",301
"Aumentar os incentivos à fixação de funcionários públicos, designadamente através de um regime especial mais favorável de progressão nas suas carreiras e de contagem de tempo de reforma.",301
"Apoiar a instalação de micro e pequenas empresas, através de uma linha de crédito com bonificação de juros, criando um Fundo de Capital de Risco Especial, gerido sob contrato por sociedades de capital de risco.",402
"Incentivar fiscalmente as PME que se instalem de raiz nas regiões do interior ou aí realizem aumentos de capital e investimentos produtivos, através de:",402
- Isenção de IRC durante os primeiros 5 anos.,402
"- Crédito fiscal para investimentos até 100 mil contos, majorado para 130% para efeitos de IRC.",402
- Apoio à criação de empregos estáveis através da majoração para 150% durante os primeiros 5 anos dos encargos com a criação dos postos de trabalho fiscalmente dedutíveis.,402
"- Isenção do pagamento de contribuições patronais para a Segurança Social durante 3 anos pela criação de postos de trabalho estáveis, estendendo­se o período de isenção para 5 anos no caso de empresas criadas por jovens empresários.",402
"Criar um Fundo Especial para a Implantação de Empresas em Municípios do Interior, para bonificação em 75% dos juros decorrentes do endividamento das Autarquias ou por estas perdidos pela utilização dos seus fundos próprios na criação ou desenvolvimento de Parques Industriais ou facilidades afins.",402
O combate à desertificação do interior do País é um imperativo nacional.,504
Todos o reconhecem.,504
"O interior está cada vez mais despovoado, a migração de pessoas para os grandes centros urbanos não tem parado, são poucas as empresas que decidem instalar­se nas cidades e vilas do interior de Portugal e em muitos sectores sociais ­ como é o caso da Saúde ­ há falta de equipamentos sociais e de apoio humano nas zonas do interior.",504
Esta situação não é aceitável.,503
Somos pela igualdade de oportunidades.,503
E a garantia da igualdade de oportunidades entre os Portugueses exige que se criem condições para que o interior do País não continue secundarizado em relação ao litoral.,503
"Exige a aplicação, em todos os domínios, do princípio da discriminação positiva em favor do Interior.",503
Comunidades Portuguesas.,999
"Atribuir o direito de voto para todos nas eleições presidenciais, nas eleições para o Parlamento Europeu e em todos os referendos nacionais.",202
Criar um terceiro círculo eleitoral para os países lusófonos.,202
"Instituir a possibilidade de voto em urna nos Consulados, mantendo­se a possibilidade de voto por correspondência.",202
Atribuir plenos direitos políticos nos casos de dupla cidadania.,202
Atribuir aos cidadãos que residam no exterior do país e que se encontrem no limiar da pobreza o rendimento mínimo garantido.,503
"Atribuir aos idosos pensões sociais, em condições de igualdade com os reidentes em Portugal.",503
Celebrar e implementar protocolos visando o ensino do português no estrangeiro.,502
"Redefinir o papel da RTP­I, valorizando a respectiva programação, abrindo a possibilidade de emissão de produções das televisões privadas e garantindo a transmissão, em directo, dos eventos desportivos nacionais de maior relevância.",502
Utilizar os recursos da RTP­I para a difusão cultural e o ensino à distância.,502
"Garantir aos jovens livre acesso ao ensino superior, com a atribuição de bolsas de estudo.",506
Atribuir às associações e instituições subsídios e comparticipações similares às concedidas em Portugal pelo Governo e pelas Autarquias.,502
"Instituir, na Assembleia da República, uma Comissão Parlamentar para os Assuntos da Emigração e das Comunidades Portuguesas.",706
Rever a legislação sobre a importação de veículos automóveis.,706
A preocupação essencial do PSD é a de que os portugueses residentes no estrangeiro deixem em definitivo de ser apenas encarados pelo Estado como uma fonte de divisas.,706
"Ao contrário, temos bem presente o quanto o país deve aos seus emigrantes, tanto pelo contributo essencial que têm dado ao nosso desenvolvimento como pela dignificação da nossa imagem em todo o mundo.",706
"O nosso objectivo é uma democracia que reconheça a todos igual dignidade, não prejudicando, em nenhum domínio, aqueles que por circunstâncias da vida se viram forçados a procurar um futuro melhor fora do território nacional.",202
"Compromete­se por isso o PSD a implementar, nas suas múltiplas dimensões, o princípio da discriminação positiva, apoiando os nossos compatriotas e as suas associações no exercício dos seus direitos e em todas as acções que tenham por objectivo o reforço dos seus laços com Portugal",503
"e, muito em particular, em tudo o que se relacione com a defesa e propagação da língua e cultura nacionais.",502
Cultura.,999
Elaborar um inventário rigoroso do património cultural nacional.,502
Criar programas especiais de ensino da música no pré­escolar.,502
Realizar contratos entre os museus portugueses e estrangeiros que organizam grandes exposições temáticas.,502
"Celebrar protocolos entre as escolas e entidades culturais da respectiva área com vista à frequência destas por parte dos alunos, em regime curricular ou extra­curricular.",502
"Dar benefícios financeiros às entidades culturais ligadas à música, ao teatro e à literatura que procedam à recolha e tratamento da informação sobre a nossa identidade como Nação.",502
Estabelecer um programa de preservação do património escrito português.,502
Apostar na recuperação do património nacional com a sua afectação a fins de interesse público ou da natureza social.,502
"Redefinir a natureza do canal 2 da RTP, de modo a garantir um serviço público de Televisão que difunda o que se faz em Portugal no campo do teatro, do cinema, das letras e da música, e que seja ainda um instrumento ao serviço da educação para a cultura em geral.",502
"Criar o Conselho Consultivo das Artes para apoio às instâncias de carácter decisório e político, em especial no que respeita à distribuição das verbas do Estado.",502
Articular a política cultural externa com as acções de promoção geral da imagem do país no exterior.,502
Desenvolver programas de incentivo à utilização turística e de lazer dos espaços culturais.,502
Apostar nos cursos de formação de gestor das artes.,502
"Apoiar financeira e tecnicamente, de forma selectiva, os programas editoriais com especial relevância cultural.",502
"Reforçar o apoio ao envio de livros, literários ou técnicos, para os Países Africanos de Língua Oficial Portuguesa.",101
Apoiar financeira e tecnicamente a tradução e edição de autores portugueses em países estrangeiros.,502
Apoiar a presença de autores e artistas portugueses em eventos culturais internacionais.,502
"Atribuir prémios e bolsas de especialização aos portugueses, em especial aos jovens, que se distingam em certames culturais, nacionais ou estrangeiros.",502
"Dar prioridade às acções relacionadas com a iniciativa ``Porto, Capital Europeia da Cultura -- 2001''.",502
Promover o pleno aproveitamento das possibilidades abertas pela participação nos programas culturais financiados pela União Europeia.,502
O PSD acredita que o ensino é um vector fundamental de formação e de divulgação cultural.,502
Por isso se deve começar desde muito cedo a preparar as pessoas para a qualificação intelectual como fazendo parte da realização pessoal.,502
A televisão representa o veículo mais importante do ``consumo da cultura''.,502
Mas a concorrência tem tido um efeito da deterioração da qualidade.,502
Daí que seja necessário definir com rigor quais são as atribuições do serviço público.,502
Apostar na defesa do nosso património é essencial para manter viva a identidade nacional e preservar o nosso passado histórico.,502
Nessa medida o património constituirá uma das nossas principais prioridades.,502
Defesa Nacional.,999
Actualizar o Conceito Estratégico de Defesa Nacional.,104
Implementar o modelo organizacional de Forças Armadas profissionalizadas.,104
"Participar activamente nas operações multinacionais humanitárias e de paz que resultem de compromissos internacionais assumidos no âmbito da ONU, OSCE, NATO e UEO.",104
Reforçar os projectos de cooperação técnico­militar com os Países Africanos de Língua Oficial Portuguesa.,101
"Reorientar as Leis de Programação Militar, reforçando a capacidade de patrulhamento da nossa Zona Económica Exclusiva (ZEE) e a capacidade de intervenção rápida em regiões onde os interesses portugueses possam ser directamente afectados.",104
Simplificar os concursos de aquisição de equipamento militar e uniformizar o material utilizado de modo a obter uma redução de custos.,104
Flexibilizar a gestão da programação militar que implique contrapartidas para a indústria nacional.,104
Estimular o acesso de empresas privadas ao exercício das actividades de indústria e comércio de armamento.,104
"Reestruturar o Serviço de Informações Estratégicas de Defesa e Militares (SIEDM), encarando­o como uma prioridade necessária ao planeamento estratégico­militar.",104
"Intensificar a acção das Forças Armadas nas missões de interesse público, nomeadamente na fiscalização da ZEE,",104
"na prevenção e combate a incêndios,",501
"em evacuações aero­médicas,",504
"em obras de engenharia militar,",104
na defesa do ambiente,501
e na protecção civil.,504
Reformular o Sistema de Autoridade Marítima.,104
"Actualizar, em conformidade com os novos conceitos, o Estatuto da Condição Militar tornando­o mais atraente para as novas gerações.",104
"Corrigir as actuais distorções do sistema retributivo dos militares, através de um sistema equilibrado que adeque a formação, a carreira e as funções.",104
Ampliar os mecanismos de apoio aos deficientes das Forças Armadas.,705
Acelerar o plano de alienações de infra­estruturas militares destinadas a financiar o Fundo de Pensão dos Militares das Forças Armadas.,504
Valorizar a política de Investigação e Desenvolvimento na área da Defesa.,104
"As questões de Defesa Nacional, pelos valores cívicos que encerram, devem assentar num amplo consenso nacional.",606
"Estão em causa a garantia da independência nacional, a integridade territorial, a liberdade e segurança dos portugueses e a afirmação externa de Portugal.",104
"Novos conceitos e novos factores, aliados à tradicional dimensão da defesa, remetem­nos para uma visão alargada da Segurança no século XXI.",104
"A evolução do ambiente estratégico, no pós­Guerra Fria, afastou a ameaça de um conflito generalizado, mas faz despontar novos riscos resultantes de conflitos étnicos, de violação dos direitos do Homem, de instabilidade política e de fragilidades económicas.",104
A actual configuração das crises internacionais demonstra que a Defesa Nacional se projecta para além das fronteiras físicas do país.,104
"Neste contexto, o PSD entende ser decisivo para Portugal a assumpção clara dos seus compromissos no quadro das organizações internacionais a que pertence.",104
"Na nossa perspectiva estratégica importa, ainda, o reforço da cooperação com os países de língua oficial portuguesa,",101
"o desenvolvimento da Identidade Europeia de Segurança e Defesa,",104
o aprofundamento do processo do ``Diálogo Mediterrânico'',104
e o reforço da ``Parceira para a Paz''.,106
Novas missões e novas responsabilidades tornaram as Forças Armadas portuguesas um instrumento da política externa e um elemento essencial de projecção política na cena internacional.,104
O PSD tem uma visão estratégica para as Forças Armadas do próximo século.,104
Uma visão coerente com o modelo de desenvolvimento do país.,104
"Uma visão integrada da utilização dos recursos humanos, materiais e financeiros.",104
"Esta visão traduz­se na valorização e dignificação da carreira militar, na modernização do equipamento e no redimensionamento do dispositivo.",104
"Subordinadas que estão ao poder político, as Forças Armadas, são uma instituição fundamental num Estado de Direito democrático.",104
Para o PSD elas são um elemento constituinte da nossa soberania e garantia da nossa independência e liberdade.,107
Desporto.,999
"Lançar um programa de edificação e de modernização de infraestruturas para as associações desportivas, culturais e recreativas, possibilitando a sua comparticipação através de um processo específico de candidaturas.",502
"Garantir a construção de pavilhões desportivos, de forma a que todas as escolas do 2º e 3º ciclo do ensino básico e do ensino secundário, disponham de infraestruturas desportivas cobertas.",502
Lançar um programa de construção de polidesportivos descobertos junto das escolas do 1º ciclo.,502
Apoiar técnica e financeiramente os investimentos dos clubes em infra­estruturas desportivas consideradas de interesse público.,502
"Financiar, através de bolsas, jovens atletas e técnicos interessados em estágios certificados, em países estrangeiros.",502
"Criar programas de formação de dirigentes, treinadores e demais técnicos.",502
Promover e apoiar a participação das Autarquias na realização de actividades e no desenvolvimento de infra­estruturas desportivas.,502
Assegurar a construção de uma piscina Olímpica na Área Metropolitana do Porto.,502
"Apoiar técnica e financeiramente as iniciativas autárquicas para a construção de piscinas na proximidade das escolas, bem como a construção de infra­estruturas desportivas para a modalidade de atletismo.",502
"Criar um programa específico de apoio à alta competição que envolva os atletas, técnicos, clubes e associações ou federações.",502
Reforçar a cooperação desportiva com os Países de Língua Oficial Portuguesa.,101
"O Desporto é um instrumento de formação e desenvolvimento integral da pessoa humana, uma manifestação cultural e social profundamente enraizada e um elemento dinamizador da actividade económica e de emprego cada vez mais importante.",502
O Estado deve por isso dar todas as condições possíveis para a prática do desporto escolar e para a formação de técnicos e atletas.,502
Deve ainda comparticipar financeiramente as entidades que queiram investir em infra­estruturas desportivas de utilidade pública.,502
Emprego e Formação Profissional.,999
"Lançar um Programa integrado de combate aos acidentes de trabalho, de modo a conseguir reduzir o seu número pelo menos para metade, no decurso da proxima legislatura.",701
"Criar incentivos fiscais (IRC) e parafiscais (Segurança Social) para a contratação de mulheres, de forma a aproximar a taxa de emprego feminina à masculina.",706
"Criar, em colaboração com as Associações Empresariais, um Observatório de Sectores em Risco, que vise detectar a tempo os sectores e empresas em restruturação que impliquem despedimento de trabalhadores.",701
"Incentivar capital de risco e apoio técnico na criação de empresas nos sectores económicos e sociais emergentes, potenciadoras da criação de postos de trabalho.",701
"Dinamizar a formação profissional cooperativa, privilegiando as acções com resultados em termos de acréscimo de empregabilidade e de readaptação dos trabalhadores.",701
"Reforçar a autonomia da Inspecção Geral do Trabalho e dotá­la dos meios humanos e materiais necessários à sua actividade, com especial reorientação para uma visão preventiva e de atenção no cumprimento das medidas de higiene, saúde e segurança, alargando a sua actuação também à Administração Pública.",701
"Lançar um Plano Nacional de combate ao Trabalho Infantil, valorizando especialmente as vertentes preventiva e repressiva, de modo a conseguir, no quadro da próxima legislatura, uma drástica redução do número de crianças nessa situação.",706
Reforçar a liberdade de contratação colectiva.,701
"Apoiar a introdução de novos métodos e formas de trabalho, como o trabalho a tempo parcial e no domicílio, potenciadores de uma melhor realização pessoal, profissional e familiar dos trabalhadores, adequando­os às novas necessidades das empresas, designadamente das PME e Micro­empresas.",701
"Incentivar as iniciativas locais de emprego, em colaboração com as IPSS e Misericórdias, em apoio às Comunidades.",504
"Um dos maiores problemas sociais é o desemprego, considerando o que acarreta de perda de rendimentos necessários à sobrevivência, de destruição da confiança no futuro, de marginalização social, a par de consequências inevitáveis e irremediáveis para o agregado familiar, que podem levar à sua destruição.",504
"A este panorama acrescem os problemas de desadaptação tecnológica do desempregado, sempre crescentes com o avanço da idade.",411
"OPSD tem de defender a permanente formação profissional dos trabalhadores, incentivando as empresas a realizá­la individualmente ou através de associações empresariais,",411
bem como exigir um sistema de educação de alta qualidade e exigência que permita uma maior flexibilidade e adaptabilidade do trabalhador aos seus postos de trabalho e às novas exigências.,411
"O Governo do PSD terá em especial linha de conta os jovens à procura do primeiro emprego e os jovens trabalhadores em geral, garantindo que nenhum dele permaneça no desemprego por mais que três meses sem uma medida activa de inserção profissional.",701
De igual modo é necessário apoiar activamente os desempregados de longa duração pela sua dificuldade de encontrar um novo posto de trabalho.,701
"É necessário ainda criar condições de discriminação positiva em relação às mulheres, o que poderá passar por bonificações no acesso a contratos e subsídios públicos.",706
Juventude.,999
"Criar um Contrato Jovem, que garanta a todos os jovens até aos 25 anos, licenciados ou não, uma possibilidade de emprego nos primeiros 3 meses de inscrição em centro de emprego.",706
"Rever o actual sistema de ingresso no Ensino Superior, de modo a permitir um aumento de oferta nos cursos mais procurados.",506
"Desenvolver acções de promoção e valorização da iniciativa e de revelação dos novos valores na área dos jovens empresários, cientistas, investigadores, inventores e artistas.",706
"Incentivar o envolvimento dos jovens no movimento associativo, como espaço de socialização e participação cívica.",706
"Reforçar a oferta de cursos técnicos e profissionais, promovendo a sua ligação às actividades económicas das regiões onde se inserem.",411
"Dinamizar o mercado de arrendamento, de forma a facilitar o acesso à primeira habitação por parte dos jovens.",706
"Promover a fixação dos jovens nos centros urbanos, através de incentivos financeiros para aquisição de habitação.",706
"Aperfeiçoar o actual sistema de incentivos aos jovens empresários, melhorando­ o e dotando­o de mais verbas.",402
